Source,ArticleID,ArticleLink,Title,Author,DatePublished,DateRetrieved,ArticleText,NumberComments,NumberSocialMedia,TheShitBetween,Notes
Boston,boston1,http://archive.boston.com/bigpicture/2014/08/ferguson_protests.html,Ferguson Protests,Lloyd Young ,08/16/14,04/07/16,"There have been a week of protests, some peaceful and some violent, since the shooting death of Michael Brown, an unarmed black teenager by a white police officer in Ferguson, Mo. The unrest prompted Governor Jay Nixon to declare a state of emergency on Saturday an implement a curfew in the St. Louis suburb. Tensions had flared Friday after police released the name of the officer who fatally shot Brown and named the teen as a suspect in a convenience store robbery that occurred shortly before he was shot.",12,355,NA,NA
Boston,boston2,https://www.boston.com/news/national-news/2014/08/12/heres-what-you-need-to-know-about-the-killing-of-an-unarmed-black-teen-in-ferguson-missouri,"Here’s What You Need to Know About the Killing of an Unarmed Black Teen in Ferguson, Missouri",Bruce Wright,08/12/14,04/07/16,"Washington Post reporter Wesley Lowery and Huffington Post reporter Ryan Reilly were briefly arrested by St. Louis County Sheriff’s Officers in Ferguson, Missouri Wednesday night {as clashes between police and protesters}<hyperlink=”http://www.boston.com/news/national-news/2014/08/13/live-blog-police-use-tear-gas-as-they-try-to-clear-ferguson-of-protesters”> entered its fourth night.

The two reporters said they were working in a McDonald’s when SWAT officers entered the restaurant and encouraged customers to leave.

Lowery said that request quickly turned to a demand, and that {he was placed in restraints}<hyperlink=”https://twitter.com/WesleyLowery/statuses/499717284122730497”> after he stopped to straighten a backpack that had fallen from his back while exiting the scene. Reilly {said police told them}<hyperlink=”https://twitter.com/ryanjreilly/statuses/499717252380631040”> they were arrested for “not packing their bags quick enough’’ when leaving the restaurant.

Both were later released after a request from the Ferguson police chief to the sheriff’s department.

Lowery, a former Boston Globe reporter, told Boston.com that readers following this story should remain focused on the residents of Ferguson.

“For those not in Ferguson, the arrest of Ryan and I should shed light on the state of things here,’’ Lowery told Boston.com “If two reporters can be arrested and manhandled for doing their jobs then imagine the way the residents are being treated. This story should be about the people of Ferguson. The Washington Post will stand up for me, Huffington Post has Ryan’s back. But who is looking out for the residents dealing with this every single day?’’

St. Louis Post-Dispatch photojournalist Robert Cohen snapped this photo of Reilly’s arrest: [tweetbegin 499728023500107776  tweetend]

Ferguson’s police chief {told LA Times reporter Matt Pearce}<hyperlink=”http://www.latimes.com/nation/nationnow/la-na-nn-ferguson-reporter-arrests-20140813-story.html”> that St. Louis County Sheriff’s deputies were handling the protests in the city Wednesday night.  [tweetbegin 499714719318835201 tweetend]

Shortly after his release, {Reilly told MSNBC’s Chris Hayes}<hyperlink=”https://soundcloud.com/producermatthew/ryan-reilly-describes-ferguson-arrest-to-msnbc”> he believed his arresting officers — who allegedly {refused}<hyperlink=”https://www.washingtonpost.com/news/post-nation/wp/2014/08/12/ferguson-police-wont-identify-officer-who-shot-and-killed-michael-brown/”> to identify themselves — were angry that he did not provide an ID when asked.

“Which is my right to refuse, since I wasn’t doing anything wrong,’’ he said.

Lowery {later told Rachel Maddow}<hyperlink=”https://soundcloud.com/producermatthew/wesley-lowery-describes-ferguson-arrest-to-msnbc”> that police officers did not give him an opportunity to peacefully leave the restaurant.

“I don’t believe Ryan and I did anything that warranted being taken into custody,’’ he said, noting his press credentials were always visible around his neck. “Frankly, I’d rather be on the streets talking to protesters, not sitting here on this chair talking on the phone about me.’’ [tweetbegin 499737373694255104 tweetend]

“We are appalled by the conduct of the officers involved. That behavior was wholly unwarranted and an assault on the freedom of the press to cover the news,’’ Washington Post Executive Editor Marty Baron said in a statement. “We are relieved that Wesley is going to be OK.’’
Earlier on Wednesday night, Lowery had this exchange on Twitter:  [tweetbegin 499737373694255104 tweetend]

On Thursday morning, Lowery was back on Twitter to discuss some of the media coverage surrounding his arrest. He tagged NBC’s Joe Scarborough and conservative talk radio host Dana Loesch while requesting that anyone with questions or speculation about what happened during his arrest contact him before speaking about it. [tweetbegin 499703999927300098  tweetend] [tweetbegin 499864118170374144 tweetend]

Lowery called out Loesch a second time, embedding one of her tweets about the arrest and said she was “wildly speculating’’ about the incident. [tweetbegin 499866722514792449 tweetend]

Also on Thursday morning, the Associated Press {reported}<hyperlink=”http://archive.boston.com/news/local/massachusetts/2014/08/14/obama-briefed-violence-louis-suburb/dQ3SS1PsHUcKPjBdDGWZDL/story.html”> that President Barack Obama had been briefed on the protests late Wednesday night and had scheduled another briefing for Thursday.

",NA,NA,NA,NA
Boston,boston3,http://www.boston.com/news/national-news/2014/08/13/wash-post-huff-post-reporters-arrested-in-ferguson,"Wash. Post, Huff Post Reporters Arrested in Ferguson",Roberto Scalese,08/13/14,04/07/16,"Washington Post reporter Wesley Lowery and Huffington Post reporter Ryan Reilly were briefly arrested by St. Louis County Sheriff’s Officers in Ferguson, Missouri Wednesday night {as clashes between police and protesters}<hyperlink=”http://www.boston.com/news/national-news/2014/08/13/live-blog-police-use-tear-gas-as-they-try-to-clear-ferguson-of-protesters”> entered its fourth night.

The two reporters said they were working in a McDonald’s when SWAT officers entered the restaurant and encouraged customers to leave.

Lowery said that request quickly turned to a demand, and that {he was placed in restraints}<hyperlink=”https://twitter.com/WesleyLowery/statuses/499717284122730497”> after he stopped to straighten a backpack that had fallen from his back while exiting the scene. Reilly {said police told them}<hyperlink=”https://twitter.com/ryanjreilly/statuses/499717252380631040”> they were arrested for “not packing their bags quick enough’’ when leaving the restaurant.

Both were later released after a request from the Ferguson police chief to the sheriff’s department.

Lowery, a former Boston Globe reporter, told Boston.com that readers following this story should remain focused on the residents of Ferguson.

“For those not in Ferguson, the arrest of Ryan and I should shed light on the state of things here,’’ Lowery told Boston.com “If two reporters can be arrested and manhandled for doing their jobs then imagine the way the residents are being treated. This story should be about the people of Ferguson. The Washington Post will stand up for me, Huffington Post has Ryan’s back. But who is looking out for the residents dealing with this every single day?’’

St. Louis Post-Dispatch photojournalist Robert Cohen snapped this photo of Reilly’s arrest: [tweetbegin 499728023500107776  tweetend]

Ferguson’s police chief {told LA Times reporter Matt Pearce}<hyperlink=”http://www.latimes.com/nation/nationnow/la-na-nn-ferguson-reporter-arrests-20140813-story.html”> that St. Louis County Sheriff’s deputies were handling the protests in the city Wednesday night.  [tweetbegin 499714719318835201 tweetend]

Shortly after his release, {Reilly told MSNBC’s Chris Hayes}<hyperlink=”https://soundcloud.com/producermatthew/ryan-reilly-describes-ferguson-arrest-to-msnbc”> he believed his arresting officers — who allegedly refused to identify themselves — were angry that he did not provide an ID when asked.

“Which is my right to refuse, since I wasn’t doing anything wrong,’’ he said.

Lowery {later told Rachel Maddow}<hyperlink=”https://soundcloud.com/producermatthew/wesley-lowery-describes-ferguson-arrest-to-msnbc”> that police officers did not give him an opportunity to peacefully leave the restaurant.

“I don’t believe Ryan and I did anything that warranted being taken into custody,’’ he said, noting his press credentials were always visible around his neck. “Frankly, I’d rather be on the streets talking to protesters, not sitting here on this chair talking on the phone about me.’’ [tweetbegin 499737373694255104 tweetend]

“We are appalled by the conduct of the officers involved. That behavior was wholly unwarranted and an assault on the freedom of the press to cover the news,’’ Washington Post Executive Editor Marty Baron said in a statement. “We are relieved that Wesley is going to be OK.’’
Earlier on Wednesday night, Lowery had this exchange on Twitter:  [tweetbegin 499737373694255104 tweetend]

On Thursday morning, Lowery was back on Twitter to discuss some of the media coverage surrounding his arrest. He tagged NBC’s Joe Scarborough and conservative talk radio host Dana Loesch while requesting that anyone with questions or speculation about what happened during his arrest contact him before speaking about it. [tweetbegin 499703999927300098  tweetend] [tweetbegin 499864118170374144 tweetend]

Lowery called out Loesch a second time, embedding one of her tweets about the arrest and said she was “wildly speculating’’ about the incident. [tweetbegin 499866722514792449 tweetend]

Also on Thursday morning, the Associated Press {reported}<hyperlink=”http://archive.boston.com/news/local/massachusetts/2014/08/14/obama-briefed-violence-louis-suburb/dQ3SS1PsHUcKPjBdDGWZDL/story.html”> that President Barack Obama had been briefed on the protests late Wednesday night and had scheduled another briefing for Thursday.
",NA,NA,NA,NA
Boston,boston4,https://www.boston.com/news/national-news/2014/08/12/faa-bans-flights-over-ferguson-as-tensions-flare-between-police-residents,"FAA Bans Flights Over Ferguson as Tensions Flare Between Police, Residents",Roberto Scalese,08/12/14,04/11/16,"The Federal Aviation Agency has declared a no-fly zone over Ferguson, Missouri as tensions between police and protesters continued after last weekend’s police shooting of Michael Brown.
The FAA {issued a temporary flight restriction}<hyperlink=”http://tfr.faa.gov/save_pages/detail_4_2599.html”> on Tuesday, prohibiting aircraft — including news helicopters — from entering the area. The agency listed the reason as “to provide a safe environment for law enforcement activities.’’
The extraordinary move comes days after the {shooting of Michael Brown}<hyperlink=”http://www.boston.com/news/national-news/2014/08/12/heres-what-you-need-to-know-about-the-killing-of-an-unarmed-black-teen-in-ferguson-missouri”>. The 18-year-old was shot multiple times and killed by police Aug. 9. Witnesses to the shooting said Brown had his hands up and was surrendering to police. Law enforcement officials, meanwhile, said the shooting occurred after a physical confrontation with Brown and a friend.
The shooting and ensuing controversy has led to {protests, looting and a strong police response}<hyperlink=”http://www.boston.com/bdc_gallery/photos-arrests-protests-persist-in-ferguson”> in the St. Louis-area community.
Here’s what’s being reported from the ground in Ferguson Tuesday night: [tweetbegin 499710557566803968  tweetend] [tweetbegin 499390074791133186 tweetend] [tweetbegin 499387559815176192 tweetend] [tweetbegin 499383178369695745 tweetend] [tweetbegin 499378768583331840 tweetend] [tweetbegin 499375401538711552 tweetend] [tweetbegin 499375765323284480 tweetend] [tweetbegin 499376277993050112 tweetend] [tweetbegin 499378650043924480 tweetend] [tweetbegin 499363683580260353 tweetend] [tweetbegin 499360963381178368 tweetend] [tweetbegin 499363646775234561 tweetend] [tweetbegin 499361204343541760 tweetend] [tweetbegin 499363612260315136 tweetend] [tweetbegin 499354851227074560 tweetend] [tweetbegin 499359396942471168 tweetend] [tweetbegin 499252318328860672 tweetend] [tweetbegin 499355231520432129 tweetend] [tweetbegin 499350559871479809 tweetend] [tweetbegin 499349740861931521 tweetend] [tweetbegin 499340259252273152 tweetend] [tweetbegin 499340259252273152 tweetend] [tweetbegin 499341873853763584 tweetend] [tweetbegin 499343266262056960 tweetend] [tweetbegin 499318859305082880 tweetend] [tweetbegin 499328545114439680 tweetend] [tweetbegin 499335039298322432 tweetend] [tweetbegin 499329006517620736 tweetend] [tweetbegin 499323276888260608 tweetend] [tweetbegin 499329549935841280 tweetend] [tweetbegin 499328757128499200 tweetend] [tweetbegin 499310092790288384 tweetend] [tweetbegin 499324816634429441 tweetend]
",NA,NA,NA,what to do with  a dead tweet?
Boston,boston5,http://www.boston.com/news/national-news/2014/08/18/ferguson-youth-shot-6-times-autopsy-shows,"Ferguson Youth Shot 6 Times, Autopsy Shows",Frances Robles; Julie Bosman,08/18/14,04/11/16,"FERGUSON, Mo. — Michael Brown, the unarmed black teenager who was killed by a police officer, sparking protests around the nation, was shot at least six times, including twice in the head, a preliminary private autopsy performed Sunday found.

One of the bullets entered the top of Brown’s skull, suggesting his head was bent forward when it struck him and caused a fatal injury, according to Dr. Michael M. Baden, the former chief medical examiner for New York City, who flew to Missouri on Sunday at the family’s request to conduct the separate autopsy. It was likely the last of bullets to hit him, he said.

Brown, 18, was also shot four times in the right arm, he said, adding that all the bullets were fired into his front.

The bullets did not appear to have been shot from very close range because no gunpowder was present on his body. However, that determination could change if it turns out that there is gunshot residue on Brown’s clothing, to which Baden did not have access.

Attorney General Eric H. Holder Jr. said Sunday that the Justice Department would conduct its own autopsy, in addition to the one performed by local officials and this private one because, a department spokesman said, of “the extraordinary circumstances involved in this case and at the request of the Brown family.’’

The preliminary autopsy results are the first time that some of the critical information resulting in Brown’s death has been made public. Thousands of protesters demanding information and justice for what was widely viewed as a reckless shooting took to the streets here in rallies that ranged from peaceful to violent.

Brown died last week in a confrontation with a police officer in this suburb of St. Louis. The police department has come under harsh criticism for refusing to clarify the circumstances of the shooting and for responding to protests with military-style operational gear.

 “People have been asking: How many times was he shot? This information could have been released on Day One,’’ Baden said in an interview after performing the autopsy. “They don’t do that, even as feelings built up among the citizenry that there was a cover-up. We are hoping to alleviate that.’’

Baden said that while Brown was shot at least six times, only three bullets were recovered from his body. But he has not yet seen the X-rays showing where the bullets were found, which would clarify the autopsy results. Nor has he had access to witness and police statements.

Baden provided a diagram of the entry wounds, and noted that the six shots produced numerous wounds. Some of the bullets entered and exited several times, including one that left at least five wounds.

“This one here looks like his head was bent downward,’’ he said, indicating the wound at the very top of Brown’s head. “It can be because he’s giving up, or because he’s charging forward at the officer.’’

He stressed that his information does not assign blame or justify the shooting.

“We need more information; for example the police should be examining the automobile to see if there is gunshot residue in the police car,’’ he said.

Baden, 80, is a well-known New York-based medical examiner, who is one of only about 400 board-certified forensic pathologists in the nation. He reviewed the autopsies of President John F. Kennedy and the Rev. Martin Luther King Jr., and has performed more than 20,000 autopsies himself.

He is best known for having hosted the HBO show “Autopsy,’’ but he rankles when he is called a “celebrity medical examiner,’’ saying that the vast majority of what he does has nothing to do with celebrities.
Baden said that because of the tremendous attention to the case, he waived his $10,000 fee.

Professor Shawn L. Parcells, a pathologist assistant based in Kansas, assisted Baden.

“You do this for the families,’’ Parcells said. The two medical experts conducted the four-hour examination Sunday at the Austin A. Layne Mortuary in St. Louis. Benjamin L. Crump, a lawyer for Brown’s family who paid their travel expenses, hired them.

“The sheer number of bullets and the way they were scattered all over his body showed this police officer had a brazen disregard for the very people he was supposed to protect in that community,’’ Crump said. “We want to make sure people understand what this case is about: This case is about a police officer executing a young unarmed man in broad daylight.’’

A spokesman for the Ferguson Police Department, Tim Zoll, said the police had not seen a report of the autopsy and therefore had no comment on it.

Baden said he consulted with the St. Louis County medical examiner before conducting the autopsy.

One of the bullets shattered Brown’s right eye, traveled through his face, exited his jaw and re-entered his collarbone. The last two shots in the head would have stopped him in his tracks and were likely the last fired.

Brown, he said, would not have survived the shooting even if he had been taken to a hospital right away. The autopsy indicated that he was otherwise healthy.

Baden said it was unusual for the federal government to conduct a third autopsy, but dueling examinations often occur when there is so much distrust of the authorities. The county of St. Louis has conducted an autopsy, and the results have not yet been released.

He stressed that his examination was not to determine whether the shooting was justified.

“In my capacity as the forensic examiner for the New York State Police, I would say, ‘You’re not supposed to shoot so many times,’’’ said Baden, who retired from the state police in 2011. “Right now there is too little information to forensically reconstruct the shooting.’’

No matter what conclusions can be drawn from Baden’s work, Brown’s death remains marked by shifting and contradictory accounts more than a week after it occurred. The shooting is under investigation by St. Louis County and by the FBI, working with the Justice Department’s civil rights division and Holder’s office.

According to what has emerged so far, on Aug. 9, Brown, along with a companion, Dorian Johnson, was walking in the middle of Canfield Drive, a fistful of cigarillos in Brown’s hand, police say, which a videotape shows he stole from a liquor store on West Florissant Avenue.

At 12:01 p.m., they were stopped by Darren Wilson, a police officer, who ordered them off the road and onto the sidewalk, Johnson, who is 22, later said.

The police have said that what happened next was a physical struggle between Brown and Wilson that left the officer with a swollen face. Johnson and others have said that it was a case of racial profiling and police aggression from a white officer toward a black man. Within minutes, Brown, who was unarmed, was dead of gunshot wounds.

The sequence of events provided by law enforcement officials places Brown and Johnson at Ferguson Market and Liquors, a store several blocks away on West Florissant Avenue, at about 11:50 a.m.

After leaving the store with the cigarillos, the two walked north on West Florissant, a busy commercial thoroughfare, toward Canfield Drive, a clerk reported to the police.

Brown was 6-foot-4 and 292 pounds, though his family and friends described him as quiet and shy, a homebody who lived with his grandmother.

It is about a 10-minute walk from Ferguson Market to the spot where Wilson, 28, an officer with six years’ experience, approached Brown and Johnson.

The police tell of an officer who was enforcing the minor violation of jaywalking, as Brown and Johnson ignored the sidewalk and strolled down the middle of the road instead.

The morning after the shooting, Chief Jon Belmar of the St. Louis County police said that Wilson was leaving his police car when Brown “allegedly pushed the police officer back into the car,’’ where he “physically assaulted the police officer.’’

“Within the police car there was a struggle over the officer’s weapon,’’ Belmar said. “There was at least one shot fired in the car.’’

At that point, the police said, Wilson left his vehicle and fatally shot Brown. “More than a few’’ shell casings were recovered from the scene.

Johnson, who declined to be interviewed, has described the events differently in television interviews. While he and Brown walked, he said, Wilson stopped his vehicle and told them to get on the sidewalk. When they refused, Wilson slammed on his brakes and drove in reverse to get closer.

When the officer opened his door, it hit Brown. With his left hand, Wilson reached out and grabbed Brown by the neck, Johnson said.

“It’s like tug of war,’’ Johnson said. “He’s trying to pull him in. He’s pulling away, that’s when I heard, ‘I’m gonna shoot you.’’’

A neighbor, Tiffany Mitchell, said in an interview with MSNBC that she heard tires squeal, then saw Brown and Wilson “wrestling’’ through the open car window. A shot went off from within the car, Johnson said, and the two began to run away from the officer.

According to Mitchell, “The officer gets out of his vehicle,’’ she said, pursuing Brown, then continued to shoot.

Johnson said that he hid behind a parked car and that Brown was struck by a bullet in his back as he ran away, an account that Baden’s autopsy appears to contradict.

“Michael’s body jerks as if he was hit,’’ Mitchell said, “and then he put his hands up.’’

Brown turned, Johnson said, raised his hands, and said, “I don’t have a gun, stop shooting!’’

Wilson continued to fire and Brown crumpled to the ground, Johnson said.

Within seconds, confusion and horror swept through Canfield Drive. On that Saturday afternoon, dozens of neighbors were at home and rushed out of their apartments when they heard gunshots.

One person who claimed to witness the shooting began posting frantic messages on Twitter, written hastily with shorthand and grammatical errors, only two minutes after Wilson approached Brown. At 12:03 p.m., the person, identified as {@TheePharoah}<hyperlink=” https://twitter.com/TheePharoah,”>, a St. Louis-area rapper, wrote on Twitter that he had just seen someone die.

That same minute, he wrote, “Im about to hyperventilate.’’

At 12:23 p.m., he wrote, “dude was running and the cops just saw him. I saw him die bruh.’’

A 10-minute video posted on YouTube appeared to be taken on a cellphone by someone who identified himself as a neighbor. The video, which has collected more than 225,000 views, captures Brown’s body, the yellow police tape that marked off the crime scene and the residents standing behind it.

“They shot that boy cause they wanted to,’’ said one woman who can be heard on the video.

“They said he had his hands up and everything,’’ said the man taking the video, speaking to a neighbor.

Brown’s body remained in the street for several hours, a delay that Jackson said last week made him “uncomfortable.’’ Antonio French, a St. Louis alderman who has been active in this case, said on ABC on Sunday that the body had remained in the street for nearly five hours.

At one point, a woman can be heard shouting, “Where is the ambulance? Where is the ambulance?’’

The man taking the video, who remained off-camera, said, “God rest his soul. He’s gone.’’
",NA,NA,NA,NA
