Source,ArticleID,ArticleLink,Title,Author,DatePublished,DateRetrieved,ArticleText,NumberComments,NumberSocialMedia,TheShitBetween,Notes
Boston,boston6,http://www.boston.com/news/national-news/2014/08/13/live-blog-police-use-tear-gas-as-they-try-to-clear-ferguson-of-protesters,Live Blog: Police Use Tear Gas as They Try To Clear Ferguson of Protesters,Roberto Scalese,08/13/14,04/11/16,"Police and residents clashed for a fourth night in Ferguson, Missouri, as protesters and {at least two reporters were arrested}<hyperlink=”http://www.boston.com/news/national-news/2014/08/13/wash-post-huff-post-reporters-arrested-in-ferguson”> during a crackdown in a McDonald’s.
During a Wednesday afternoon press conference, police insisted that there was no curfew in Ferguson, but {strongly urged protesters to limit their demonstrations to daylight hours.}<hyperlink=”http://www.boston.com/news/national-news/2014/08/13/chief-more-than-40-arrested-in-ferguson-missouri-unrest”> As the sun sets in Missouri, however, the streets remain lined with both protesters and police in military vehicles, sporting fatigues and “less-than-lethal’’ weaponry.
The four days of protests followed {Saturday’s shooting of Michael Brown.}<hyperlink=”http://www.boston.com/news/national-news/2014/08/12/heres-what-you-need-to-know-about-the-killing-of-an-unarmed-black-teen-in-ferguson-missouri”> Brown was unarmed when he was shot multiple times by police. Witnesses insist Brown had his hands up and was trying to surrender to police when he was shot. Police, meanwhile, claim they were assaulted while trying to arrest brown and an associate.
Here are updates by media on the site in Ferguson, MO. [tweetbegin 499818258519048192 tweetend] [tweetbegin 499817848257396736 tweetend] [tweetbegin 499817179349807105 tweetend] [tweetbegin 499816686628130816 tweetend] [tweetbegin 499815590606155776 tweetend] [tweetbegin 499815129375313920 tweetend] [tweetbegin 499814320134688768 tweetend] [tweetbegin 499811119620689921 tweetend] [tweetbegin 499809707574714368 tweetend] [tweetbegin 499808540908068864 tweetend] [tweetbegin 499809297430503424 tweetend] [tweetbegin 499808645199052801 tweetend] [tweetbegin 499808321768288256 tweetend] [tweetbegin 499807493091246080 tweetend] [tweetbegin 499807042895642625 tweetend] [tweetbegin 499803685665665025 tweetend]
",NA,NA,NA,NA
Boston,boston7,http://www.boston.com/news/national-news/2014/08/16/missouri-gov-declares-state-of-emergency-in-ferguson,Missouri Gov. Declares State of Emergency in Ferguson,Bruce Wright ,08/16/14,04/11/16,"Missouri Governor Jay Nixon has declared state of emergency and a curfew in the St. Louis suburb of Ferguson, where an unarmed black teenager was {shot and killed}<hyperlink=”http://www.boston.com/news/national-news/2014/08/12/heres-what-you-need-to-know-about-the-killing-of-an-unarmed-black-teen-in-ferguson-missouri”> last week by police officer Darren Wilson.

Gov. Nixon made the announcement Saturday afternoon after he formally signed the order.

The curfew will last from midnight through 5 a.m. local time, according to Missouri Highway Patrol Capt. {Ron Johnson}<hyperlink=”http://archive.boston.com/news/nation/2014/08/16/state-trooper-tries-keep-peace-ferguson/nnKzu6RFYbE6obZTaJZRPP/story.html”>, the Ferguson native who has been tasked with keeping the peace there. The curfew goes into effect starting Saturday night.

The governor’s declaration comes after the latest night of {looting and confrontations}<hyperlink=”http://archive.boston.com/news/nation/2014/08/16/police-protesters-clash-again-ferguson/96iVIbBuDzdy1MRD5IACWJ/story.html”> with police in Ferguson, including one group of protesters that broke into the store that the slain teenager, Michael Brown, was alleged by police to have robbed before he was shot dead.

Capt. Johnson told the crowd assembled in a Ferguson church that dozens of FBI agents had arrived in the town Saturday morning to talk to any witnesses.

Gov. Nixon during the press conference was many times drowned out by cries from the audience demanding justice, including the arrest of the officer who shot Brown.

‘‘We must first have and maintain peace. This is a test. The eyes of the world are watching,’’ Nixon said. ‘‘We cannot allow the ill will of the few to undermine the good will of the many.’’
",NA,NA,NA,NA
Boston,boston8,http://www.boston.com/news/untagged/2014/08/18/watch-live-obama-to-speak-on-situations-in-iraq-and-ferguson-mo,"Watch Live: Obama to Speak on Situations in Iraq and Ferguson, Mo.",Boston.com Staff ,08/18/14,04/11/16,"President Obama will deliver a statement on the on going situations in Iraq and Ferguson, Missouri.",NA,NA,NA,NA
Boston,boston9,http://www.boston.com/news/national-news/2014/08/18/john-oliver-pulls-keene-n-h-into-police-militarization-debate,"John Oliver Pulls Keene, N.H. Into Police Militarization Debate",Doug Saffir ,08/18/14,04/11/16,"On Sunday night, John Oliver, a comedian and the host of HBO’s Last Week Tonight, addressed the issue of police militarization, particularly in Ferguson, Missouri. But a small town in New Hampshire and its mine-resistant ambush-protected vehicle did not escape criticism.

Oliver spent 15 minutes addressing the ongoing clashes between police and protesters in Missouri. But during that stretch, he took 60 seconds to address the fact that, amid the United States’ police militarization, the local law enforcement in Keene, New Hampshire is now in possession of a military-grade armored personnel vehicle known as a Bearcat.

Of course, Oliver says it’s laughable that a small town in New Hampshire would need such a high-powered vehicle, and the reason they requested it might shed some light on why he thinks it’s so funny. Oliver says that in their application for the vehicle, Keene cited a need to protect their annual pumpkin festival from “the terrorism threat’’ described as “far-reaching and often unforeseen.’’",NA,NA,NA,NA
Boston,boston10,http://www.boston.com/news/national-news/2014/08/13/iftheygunnedmedown-questions-media-portrayal-of-black-crime-victims,#IfTheyGunnedMeDown Questions Media Portrayal of Black Crime Victims,Larah Salahi,08/13/14,04/11/16,"In the wake of the shooting death of unarmed black teen {Michael Brown}<hypertext=”http://www.boston.com/news/national-news/2014/08/13/ferguson-seeks-answers-after-fatal-police-shooting”> by a police officer Saturday afternoon in Ferguson, Mo., a new Twitter hashtag has emerged that’s critiquing the way black crime victims are portrayed in the media.

Using the hashtag, {#IfIWereGunnedDown}<hypertext=”https://twitter.com/search?src=typd&q=%23IfTheyGunnedMeDown%E2%80%AC”>, Twitter users are posting photos of themselves to answer the following question: “If I were gunned down, which images would the media use to portray me?’’

Twitter user {@CJ_Musick_Lawya}<hypertext=”https://twitter.com/CJ_Musick_Lawya”> reportedly {started the hashtag}<hypertext=”http://www.theroot.com/blogs/the_grapevine/2014/08/_iftheygunnedmedown_shows_how_black_people_are_portrayed_in_mainstream_media.html”> after some media reports used a {photo of Brown}<hypertext=”https://twitter.com/NBCNews/statuses/498526729728565250”> holding up a hand signal that was interpreted as a “gang sign,’’ while other reports displayed his high school graduation photo. Twitter users have been using split images to illustrate the same message — that a person can be portrayed as innocent and accomplished or thuggish and delinquent based on a single photo chosen of the victim.

One of the images shows them fulfilling a milestone or serving society: they are surrounded by family, reading to children, dressed in a suit or military uniform or suit, or receiving a degree. The other image shows them in a suggestive pose, a fierce gaze, holding up a hand sign, or drinking alcohol. [tweetbegin 498625226133868544 tweetend] [tweetbegin 499592496092315649 tweetend] [tweetbegin 499595683415216129 tweetend]

{#IfTheyGunnedMeDown}<hypertext=”https://twitter.com/hashtag/IfTheyGunnedMeDown?src=hash”> Would they use the one of me pretending to be hard, or me getting a Ph.D.? {pic.twitter.com/CIOS5ry4bm}<hypertext=”https://twitter.com/SPchronvitae/status/499378748555550720/photo/1”>

— Stacey Patton (@SPchronvitae) {August 13, 2014}<hypertext=”https://twitter.com/SPchronvitae/statuses/499576233634828288”> [tweetbegin 498551458363883520 tweetend] [tweetbegin 498584169065091072 tweetend] [tweetbegin 499603510707494912 tweetend] [tweetbegin 499603320630415360 tweetend]",NA,NA,NA,NA
