Source,ArticleID,ArticleLink,Title,Author,DatePublished,DateRetrieved,ArticleText,NumberComments,NumberSocialMedia,TheShitBetween,Notes
Mirror,mirror1,http://www.mirror.co.uk/news/world-news/ferguson-riots-mirrorman-tear-gassed-seized-4076087,Ferguson riots: Mirrorman is tear-gassed and seized by armed police,Christopher Bucktin ,08/19/2014,02/17/2016,"Daily Mirror US Editor Christopher Bucktin found himself staring down the business end of a police rifle as he was caught up in the Missouri protests. Crying in pain from tear gas that police used on protesters, I am taken aback as an officer barks: “Walk towards the sound of my voice. Get your hands up. Up. Let me see them.”

He was quickly joined by a dozen other armed police, all shouting similar orders at me before they manhandled me, patting me down in the search for weapons.

Thankfully, their lieutenant stepped in, saying: “He doesn’t look like a looter or a criminal. Common-sense, guys.

“He’s in a suit, for Christ’s sake. How many protest in a suit? Let him go.”

I found myself in this {volatile chaos}<hyperlink=”http://www.mirror.co.uk/news/world-news/ferguson-riots-police-come-under-4073379”> in the early hours yesterday during the mayhem on the streets of Ferguson.

There have been angry protests in the city in Missouri since unarmed black teenager Michael Brown was shot dead by a white police officer on August 9.

For nine nights, the crowds – sometimes up to 400 strong – were confronted by police armed with smoke bombs, tear gas, stun grenades, rifles and rubber bullets.The National Guard – America’s part-time civilian army – took to Ferguson’s streets for the first time on Monday night, but rather than calming tensions, there was another torrent of violence.

I had 25 armed officers training their assault rifles on my chest as one of them yelled, “Who the f*** are you?”

But we managed to circumnavigate the armoured barricades to see at first-hand the violence that has erupted.

As gun shots from the protesters pierced the night air – leaving one man suffering serious wounds – we stood a few feet away as more than 300 heavily armed officers kept looters and thugs at bay.

Looking menacingly through his gas mask, holding a gun and a 4ft-long baton, a 6ft 7in officer screamed at me: “I saw a man with a gun down there. Are you f****** stupid? Get out of here now. You understand me? NOW.”

It was quickly apparent why there was such an urgent need to clear the area.

The time was 12.50am on Tuesday and a group of 40 bandanna-clad men had made their way towards the police blockade. The mob held their hands aloft to mimic the pose Michael is said to have adopted before he was shot.

The crowd taunted officers with cries of: “Indict, convict, throw dirty cops in jail! The whole damn system is guilty as hell!” As the crowd edged closer, the order was given for officers in riot gear to put on their protective masks.

What followed was the booming voice of a commanding officer who yelled: “We’re going to go and gas the f*** out of them. Get ready. Get prepared.”Two heavily armoured trucks, with riot police mounted on top, broke free from the blockade to drive at speed towards the crowd. I counted 18 canisters of CS gas being fired among protesters who fled the Maline Creek stronghold close to Cranfield Drive where Michael, 18, was killed.

Within minutes, the smoke filled the air, leaving one officer bent double as he struggled to cope with the pain in his eyes and throat. Quickly, his colleagues came to his aid and poured water on his face. But as we watched on, the tear gas took hold of my colleague and I.The fumes made us almost sick. As we stumbled away, we walked into a another barricade of armed police.

This is when the officer ordered me to put my hands up. Despite the tension in the air, the lieutenant who then pointed out that I was not a looter played down the night’s violence.

He told me: “It was fairly peaceful. This has been the pattern – once it gets dark, the crowd seems to turn over.

“It becomes younger, more rambunctious if you will, more agitated.”

The officer said there were around 300 police on patrol, working 12-hour shifts with all leave cancelled.

“One man was shot tonight and gunfire has been heard throughout the night,” he added as me and my colleague made our way to safety.

In total, two were injured and 31 were arrested during the tense stand-offs.

Police have said Darren Wilson – the 28-year-old officer who shot Michael – was pushed into his car by the teenager before being physically assaulted in a struggle over his weapon.

At least one shot was fired inside the vehicle before the furious altercation spilled on to the street where Michael was blasted six times.Michael’s friend Dorian Johnson, 22, who says he was with the “gentle giant” at the time, claimed the officer had tried to grab Michael while attempting to pull him into his car.

Dorian said that as the teenager escaped from the vehicle, the officer gave chase and kept firing.

News of the killing quickly engulfed the tight-knit community.

Within hours what had been a simmering cauldron of racial tensions in the city boiled over into violence, as looters and vandals robbed and burnt down properties.

Now, standing on these ravaged streets with hundreds of police and soldiers on patrol, this could easily be mistaken for war-torn Iraq or Ukraine.",NA,237,NA,NA
Mirror,mirror2,http://www.mirror.co.uk/news/world-news/ferguson-riots-police-come-under-4073379,Ferguson riots: Police come under heavy fire as officers arrest journalists and Holocaust survivor,Richard Hartley-Parkinson,08/19/2014,02/17/2016,"Trouble continued for a ninth night following the death of black teenager Michael Brown who was shot by a white police officer. 

Police have come under 'heavy fire' as trouble continued in Ferguson, Missouri, last night, more than a week after a black teenager was shot dead by a white police officer.

As the National Guard was called in to help restore calm, it was also revealed that a photographer and a Holocaust survivor were among {31 people arrested in continuing protests over the incident.}<hyperlink=""http://www.mirror.co.uk/news/world-news/michael-brown-shooting-blacks-twice-4073013"">

""Not a single bullet was fired by officers despite coming under heavy attack,"" State Highway Patrol Captain Ron Johnson told a news conference.

""Our officers came under heavy gunfire,"" in one area, he said, and riot police had confiscated two guns from protesters and what looked like a petrol bomb.

The latest disturbances came at the end of a day in which a pathologist hired by Michael Brown's family said the unarmed {18-year-old suffered a bullet wound to his right arm}<hyperlink=""http://www.mirror.co.uk/news/world-news/michael-brown-shooting-harrowing-video-4072685""> that may indicate his hands were up or his back was turned.

But the pathologist said the team that examined Mr Brown cannot be sure yet exactly how the wounds were inflicted until they have more information.

An independent post-mortem examination determined that Mr Brown was shot at least six times, including twice in the head, the family's lawyers and hired pathologists said.

Witnesses have said the teenager's hands were above his head when he was repeatedly shot by an officer in Ferguson on August 9.

Protesters filled the streets after nightfall, and officers used bullhorns to order them to disperse.

Among those arrested was Getty photographer Scott Olson despite Barrack Obama saying: ""Police should not be arresting journalists for doing their jobs.""

Last week two journalists from Buzzfeed were also detained briefly while filing reports in a McDonalds.

Elsewhere 90-year-old Holocaust survivor Hedy Epstein was arrested during a protest in St Louis after blocking the office of Missouri Governor Jay Nixon.

Police deployed noisemakers and armoured vehicles to push demonstrators back. During one confrontation, officers fired tear gas and flash grenades. There were no reports of serious injuries.

After the streets had been mostly cleared, authorities ordered reporters to leave as well, citing the risk from gunfire that had been reported.

Crowd control remained the responsibility of police, with most of the National Guard units that had been summoned by Governor Jay Nixon keeping their distance from the protests and protecting a police staging area.

In Washington, President Barack Obama said the vast majority of protesters in Ferguson were peaceful, but warned that a small minority was undermining justice.

During a brief pause in his summer holiday, Mr Obama said overcoming the mistrust endemic between many communities and their local police would require Americans to ""listen and not just shout"".

The president also weighed in for the first time publicly on the militarisation of some local police departments, saying it would probably be useful to examine how federal grants had been used to allow local police to purchase military-style equipment.

Attorney General Eric Holder was due to travel to Ferguson later this week to meet FBI and other officials carrying out an independent federal investigation into Mr Brown's death.

Mr Obama said he also spoke to Mr Nixon about his deployment of the National Guard in Ferguson and urged the governor to ensure the Guard was used in a limited way. 

Forensic pathologist Shawn Parcells, who assisted former New York City chief medical examiner Dr Michael Baden during the private post-mortem, said a bullet grazed Mr Brown's right arm. He said the wound indicated that the teenager may have had his back to the gunman, or he could have been facing the officer with his hands above his head or in a defensive position across his chest or face.

""We don't know,"" Mr Parcells said. ""We still have to look at the other (elements) of this investigation before we start piecing things together.""

A third and final post-mortem examination was performed yesterday for the Justice Department by one of the military's most experienced medical examiners, the attorney general said.

Also yesterday, Governor Nixon lifted the neighbourhood's midnight-to-5am curfew two days after it went into effect when he declared a state of emergency.

He said the National Guard troops would be under the direction of the Missouri State Highway Patrol, which is overseeing security during protests.

Police told protesters yesterday that they could not assemble in a single spot, saying they had to keep moving. In federal court, a judge denied a request from the American Civil Liberties Union for a restraining order that would have prevented authorities from enforcing the rule.

Two men were arrested for disorderly conduct and failure to disperse, police said. A photographer from the Getty photo agency was arrested while covering the demonstrations and later released.

Authorities were also establishing a designated protest zone for nightly demonstrations. The plan was announced yesterday by St Louis County police. It was not clear what would happen to those who refuse to use the area along the avenue where the majority of protests have occurred.

A grand jury could begin hearing evidence tomorrow to determine whether the officer, Darren Wilson, should be charged over Mr Brown's death, said Ed Magee, spokesman for St Louis County's prosecuting attorney.

The St Louis County medical examiner's post-mortem found that Mr Brown was shot six to eight times in the head and chest, office administrator Suzanne McCune said yesterday. But she declined to comment further, saying the full findings were not expected for about two weeks.
 

Family lawyer Benjamin Crump said Mr Brown's parents wanted the additional post-mortem because they feared results of the county's examination could be biased. Mr Crump declined to release copies of the report.""They could not trust what was going to be put in the reports about the tragic execution of their child,"" he said during a news conference with Mr Parcells and Dr Baden, who has given evidence in several high-profile cases, including the OJ Simpson murder trial.

The second post-mortem, Mr Crump said, ""verifies that the witness accounts were true: that he was shot multiple times"".

Dr Baden said one of the bullets entered the top of Mr Brown's skull, suggesting his head was bent forward when he suffered that fatal injury. The hired pathologists said the teenager, who also was shot four times in the right arm, could have survived the other bullet wounds.

Dr Baden also said there was no gunpowder residue on Mr Brown's body, indicating he was not shot at close range. However, Dr Baden said he did not have access to the teenager's clothing, and that it was possible the residue could be on the clothing.

Mr Crump also noted that Mr Brown had abrasions on his face from where he fell to the ground, but there was ""otherwise no evidence of a struggle"".",NA,13,NA,NA
Mirror,mirror3,http://www.mirror.co.uk/news/world-news/ferguson-riots-man-shot-dead-4076050,Ferguson riots: Man shot dead by police 4 miles from suburb where Michael Brown was killed,Jessica Best,08/19/2014,02/19/2016,"A man has died after being shot by police just four miles from Ferguson - the St Louis city where {the shooting of an unarmed black teenager}<hyperlink=""http://www.mirror.co.uk/all-about/michael-brown"">by a white police officer has sparked days of protests.

According to NewsChannel 5, the today's shooting in St Louis city happened around 12.30pm after a suspect tried to rob a convenience store with a knife.

He was challenged by the shop's owner, who called the cops when the man began ""acting erratically"" and grabbing his waistband. The suspect is then said to have ""brandished a knife"" when police arrived and tried to attack an officer outside the shop.

He was shot and pronounced dead at the scene. Sky News reports the victim was a 23-year-old African-American man.

There have been immediate appeals for calm, with St Louis Alderman Antonio French tweeting: ""We've had an officer involved shooting in St Louis City. Here at the scene to keep the crown calm & find out exactly what happened. #peace""

He added that a crowd had already gathered at the crime scene, and tweeted a short video of those gathered around police as they tried to give an update on the situation.

St Louis Police Chief Sam Dotson tweeted this evening: ""Today St Louis MO Police officers received a call for a subject who appeared agitated & was armed with a knife. Suspect yelled kill me now & approahced.

""Officers gave suspect verbal commands. Officers feared for their safety and both officers fired their weapons. Suspect is deceased.""

""Officers are on administrative duty per department policy. The investigation continues.""

Today's shooting comes after {trouble continued for a ninth night in Ferguson, following the death of black teenager Michael Brown.}<hyperlink=http://www.mirror.co.uk/news/world-news/ferguson-riots-police-come-under-4073379"">

The latest disturbances came at the end of a day in which a pathologist hired by Michael Brown's family said the unarmed {18-year-old suffered a bullet wound to his right arm}<hyperlink=""http://www.mirror.co.uk/news/world-news/michael-brown-shooting-harrowing-video-4072685"">that may indicate his hands were up or his back was turned.

But the pathologist said the team that examined Mr Brown cannot be sure yet exactly how the wounds were inflicted until they have more information.

An independent post-mortem examination determined that Mr Brown was shot at least six times, including twice in the head, the family's lawyers and hired pathologists said.

Witnesses have said the teenager's hands were above his head when he was repeatedly shot by an officer in Ferguson on August 9.",NA,335,NA,NA
Mirror,mirror4,http://www.mirror.co.uk/news/world-news/ferguson-darren-wilson-named-police-4055735,Ferguson: Darren Wilson named as police officer who shot dead unarmed black teenager,Anthony Bond,08/15/2014,02/19/2016,"A police officer who shot dead an unarmed black teenager sparking riots and protests has been named as Darren Wilson.

Ferguson Police Department named the officer as tens of thousands of people gathered in protests across the US today.

Police Chief Thomas Jackson announced the name at a press conference held near a QuikTrip convenience store that had been burned amid protests over the shooting of Michael Brown, 18, last Saturday.

Police also released video from a different convenience store where a robbery had taken place on Saturday before the shooting.

He did not say what, if any, link there was between Brown and the robbery. Jackson said he would answer reporters’ questions at another briefing later on Friday. 

""I cannot discuss the investigation about the attempted apprehension of the suspect in the strong-arm robbery,"" he said.

""That goes to the county prosecutor’s office."" Ferguson police had earlier withheld the name of the officer who shot Brown, citing security concerns.

The officer is a six-year veteran on the force with a good record, officials have said. He was placed on paid administrative leave after the shooting.

Police had withheld Wilson’s name because of fears that he could be harmed amid the volatile protests that followed Brown’s death.

It came as tens of thousands of people across America attended protest vigils for the Missouri teenager.

As riot police once again took to the street to quell growing racial tensions, more than 90 cities took part in a National Moment of Silence, days after the shooting death of 18-year-old Michael Brown and the death of a New York man caused by a police officer’s chokehold.

In downtown St. Louis, in a tiny park near the Gateway Arch, several hundred people, seemingly an equal number whites and blacks, gathered in Brown’s memory.",NA,136,NA,NA
Mirror,mirror5,http://www.mirror.co.uk/news/world-news/teenager-michael-brown-gunned-down-4057925,Teenager Michael Brown was gunned down by police over £30 cigar theft,Nina Massey 08/16/14,08/16/2014,02/19/2016,"Unarmed black teenager Michael Brown was shot dead over the theft of £30 worth of cigars, it has been claimed.

He had become a suspect in the theft minutes before being gunned down, {police reports revealed yesterday.}<hyperlink=”http://www.mirror.co.uk/all-about/polic"">

However, the 18-year-old’s family said that {no robbery would justify the shooting}<hyperlink=""http://www.mirror.co.uk/all-about/shooting""> and slammed the Ferguson Police Department for tarnishing Brown’s reputation.

""It's bad enough they assassinated him, and now they're trying to assassinate his character,"" the family's lawyer, Benjamin Crump, said.

Brown’s shooting in St. Louis {has sparked wide spread riots across the U S}<hyperlink=""http://www.mirror.co.uk/news/world-news/rioting-continues-fourth-night-racial-4047688"">, and after initially refusing to release the name of the officer responsible for pulling the trigger, police yesterday named him as Darren Wilson.

Hours after the robbery report was released police said the officer had no idea Brown was a robbery suspect, and simply wanted him to move from the sidewalk.

Ferguson Police Chief Tom Jackson told a news conference: ""He was walking down the middle of the street blocking traffic. That was it.”

Five hours after releasing the robbery incident report Chief Jackson, when prompted, said Wilson did not know about the robbery when he encountered Brown.

The report suggested Wilson had been responding to a nearby call involving a sick child, when descriptions of Brown and another man were broadcast over the police radio as robbery suspects.

Shortly afterwards Wilson came across Brown walking down the street, but the papers contained no description of what happened between the two. 

The decision by the overwhelmingly white police department to release a report on the robbery while keeping details of the shooting secret has added to the frustration felt by many in the St. Louis area.

But as protests entered their sixth night, some of the tension appeared to have died down after local forces were replaced by state police, led by a black captain.

Outside a burned-out building where protesters were shot with rubber bullets two days ago, the scene resembled a summer carnival.           

Music teacher Hope Walker, 46, said: ""It's more like a block party than what I was calling little Beirut.”

After calls from U.S. President Barack Obama for the incident to be investigated, it was confirmed police had started a probe into the shooting. ",NA,12,NA,NA
Mirror,mirror6,http://www.mirror.co.uk/news/world-news/michael-brown-shooting-blacks-twice-4073013,"Michael Brown shooting: 'Blacks twice as likely as whites to say shooting raises ""important issues about race""'","Anthony Bond, Sam Adams ",08/19/2014,02/23/2016,"Black Americans are twice as likely to say the shooting of Michael Brown raises ""important issues about race,"" a survey has found.

Unarmed Michael, 18, was shot dead by a cop in Ferguson, Missouri, on August 9, sparking days of civil unrest in the neighbourhood.

A survey of 1,000 adults by the Pew Research Center has found that 80 percent of African-Americans believe the case raises important issues about race compared to 37 percent of whites

The poll also showed that around two-thirds of blacks think the police went too far when responding to the resulting civil unrest compared to one-third of whites. 

{Micheal's g}<hyperlink=”http://www.mirror.co.uk/news/world-news/michael-brown-shooting-unarmed-teenager-4067876"">randfather has called on President Barack Obama to meet with him to discuss the case.

Les McSpadden made the request as {tensions in Ferguson}<hyperlink=""http://www.mirror.co.uk/news/world-news/michael-brown-shooting-national-guard-4071015"">, have heightened following news that a privately commissioned autopsy reportedly found the teenager was shot six times.

In an interview on MSNBC's ""Politics Nation,"" McSpadden said Darren Wilson, the police officer who shot Michael, should be in custody while the investigation continues.

Referring to the results of the private autopsy, he said: ""If I was to go out there and brutally murder someone and shoot them six times, ask yourself, would I be incarcerated? The answer is yes.

""America is built on people coming together at times like this, and now is the time for my president to step forward,"" he said. ""I want to say this to my president: I voted for you, so you ought to able to meet with me.""

Meanwhile, a video has been revealed apparently showing the moment Wilson paces backwards and forwards near Michael's body as it lays on the ground.

Cop Wilson, 28, can be seen talking to another police officer and pacing close to the dead body of the 18-year-old.

The footage was taken by Piaget Crenshaw who lives in an apartment overlooking the scene in Ferguson, Missouri.

In the upsetting footage, which was taken on a mobile phone, Ms Crenshaw says: 'God bless his soul, police shot this boy outside my apartment.'

Speaking to CNN today, she says she knew something was 'not right' and claims she saw the moment the teenager was shot dead.

'I knew the police shouldn't have been chasing this boy and firing at the same time. And the fact he got shot in his face, something clicked in me and I thought someone else should see this so I recorded.'

Ms Crenshaw said it had appeared as though Wilson had attempted to pull the teenager into a police cruiser in the moments before the shooting.

But she claims Michael managed to get away but after turning around he was shot a number of times.

She added: 'He was running away and when he [Brown] turned around he was shot.'

America’s National Guard has been called in to control mobs that have been causing mayhem since the shooting.

Violence escalated on Sunday night in Ferguson, which has been rocked by protests, looting and arson since Michael was killed.

A 400-strong crowd clashed with police. Rioters fired shots and hurled Molotov cocktails and stones.

Massed-ranks of cops responded with rubber bullets, tear gas and smoke grenades - making the St Louis suburb resemble a war zone. Some involved were just 10.

Last night there were fears things could get even worse after an {autopsy revealed that Brown, 18, had been shot six times}<hyperlink=http://www.mirror.co.uk/news/world-news/michael-brown-shooting-unarmed-teenager-4067876""> - twice in the head.

The second post mortem examination, carried out at the request of Brown’s family by New York city’s former chief medical examiner Michael Baden, showed the 18-year-old was shot at a distance, disproving police claims he had been trying to grab the gun of officer Darren Wilson who killed him.

Friends of Brown claim he had his arms in the air.",NA,605,NA,NA
