Source,ArticleID,ArticleLink,Title,Author,DatePublished,DateRetrieved,ArticleText,NumberComments,NumberSocialMedia,TheShitBetween,Notes
Mirror,mirror7,http://www.mirror.co.uk/news/world-news/michael-brown-shooting-dramatic-pictures-4058686,Michael Brown shooting: Dramatic pictures show moment teenager was gunned down by cops,Richard Charley-Parkinson,08/16/2014,03/02/2016,"Pictures have emerged of the moment unarmed black teenager Michael Brown was shot dead by police sparking several nights of confrontation.

The images, posted on Twitter, were taken by a 27-year-old rap artist in Ferguson, Missouri, moments after Brown was shot by police officer Darren Wilson.

Twitter user TheePharoah was at home when he posted the picture with the words ""I just saw someone die"".

He added that there was ""blood all over the street"".

The photos appear to show Brown's body in the middle of a street with a policeman standing over him.

CCTV was released today that showed the moment Brown stole £30 worth of cigarettes just minutes before he was gunned down.

The shop where he carried out the robbery was also raided overnight by looters.

The 18-year-old’s family said that {no robbery would justify the shooting}<hyperlink=""http://www.mirror.co.uk/all-about/shooting""> and slammed the Ferguson Police Department for tarnishing Brown’s reputation.

""It's bad enough they assassinated him, and now they're trying to assassinate his character,"" the family's lawyer, Benjamin Crump, said.

Brown’s shooting in St. Louis {has sparked wide spread riots across the U}<hyperlink=""http://www.mirror.co.uk/news/world-news/rioting-continues-fourth-night-racial-4047688""> S, and after initially refusing to release the name of the officer responsible for pulling the trigger, police yesterday named him as Darren Wilson.

Hours after the robbery report was released police said the officer had no idea Brown was a robbery suspect, and simply wanted him to move from the sidewalk.

Ferguson Police Chief Tom Jackson told a news conference: ""He was walking down the middle of the street blocking traffic. That was it.”

Five hours after releasing the robbery incident report Chief Jackson, when prompted, said Wilson did not know about the robbery when he encountered Brown.

The report suggested Wilson had been responding to a nearby call involving a sick child, when descriptions of Brown and another man were broadcast over the police radio as robbery suspects.

Shortly afterwards Wilson came across Brown walking down the street, but the papers contained no description of what happened between the two.

The decision by the overwhelmingly white police department to release a report on the robbery while keeping details of the shooting secret has added to the frustration felt by many in the St. Louis area.

But as protests entered their sixth night, some of the tension appeared to have died down after local forces were replaced by state police, led by a black captain.

Outside a burned-out building where protesters were shot with rubber bullets two days ago, the scene resembled a summer carnival.           

Music teacher Hope Walker, 46, said: ""It's more like a block party than what I was calling little Beirut.”

After calls from U.S. President Barack Obama for the incident to be investigated, it was confirmed police had started a probe into the shooting.",NA,657,NA,NA
Mirror,mirror8,http://www.mirror.co.uk/news/world-news/rioting-continues-fourth-night-racial-4047688,"
Rioting continues for fourth night as racial tension grows after police shot unarmed teenager dead",Richard Charley-Parkinson,08/14/2014,03/02/2016,"Police fired tear gas, stun grenades and smoke bombs after demonstrators threw rocks at officers and some prepared petrol bombs

Rioting has continued for a fourth night as racial tensions grow between police and a community where an unarmed black teenager was shot dead.

Around 350 protesters were faced with tear gas, stun grenades and smoke bombs as officers tried to disperse them last night.

Some demonstrators hurled rocks at police as others scattered down side streets and into cars, while smoke engulfed the area.

An eyewitness saw two young men preparing what appeared to be petrol bombs in a bus-stop shelter, their faces covered by bandanas.

Protesters have gathered every night {since Saturday when 18-year-old Michael Brown was shot to death}<hyperlink=""http://www.mirror.co.uk/news/uk-news/mike-brown-shooting-unarmed-teens-4035824""> in the mostly black suburb of St. Louis, during what authorities said was a struggle over a gun in a police car.

Obama, who is vacationing on the Massachusetts island of Martha's Vineyard, was briefed on Wednesday night about events in Ferguson by senior advisor Valerie Jarrett and U.S. Attorney General Eric Holder, the White House said.

About 40 protesters have been arrested since Saturday.

Police have sent a heavy deployment of camouflage-clad officers in body armor, including one manning a rifle on a tripod atop an armored car, to Ferguson.

""I've had enough of being pushed around because of the color of my skin. I'm sick of this police brutality,"" said one protester who only gave his first name, Terrell, 18.

""I'm going to keep coming back here night after night until we get justice,"" he said.

Police have been slow to release information about the shooting, except to say that it followed a struggle between the unnamed officer and Brown, and that the officer was treated at a hospital for swelling on the side of his face.

One witness who was walking with Brown at the time has said in media interviews that Brown put his hands in the air and was not struggling with the officer. He said the officer fired multiple times into Brown's head and chest.

The witness, Dorian Johnson, was expected to meet on Wednesday with prosecutors and investigators, local media reported. His lawyer, Freeman Bosley, a former St. Louis mayor, did not immediately answer requests for comment.

Another witness, Tiffany Mitchell, told CNN she watched Brown and the officer ""tussling through the window,"" with the officer pulling the teen in as he struggled to get away, and then a ""shot was fired through the window.""

""The kid he finally gets away and he starts running. As he runs, the police get out of his vehicle and he follows behind him shooting,"" Mitchell said, adding that Brown turned around and put his hands in the air.

""And the cop continued to fire until he just dropped down to the ground and his face just smacks the concrete.""

Police have declined to release the name of the officer involved in the incident, citing concerns for his safety, a decision that has been criticized by demonstrators. The officer has been placed on administrative leave.

Police Chief Thomas Jackson told reporters his priority was improving race relations in Ferguson, which has seen a stark demographic shift in recent decades, going from mostly white to mostly black. About two-thirds of the town's 21,000-strong population are black. On a police force of 53, three officers are black.

""This is an opportunity to fix what's wrong,"" he said.

The local Ferguson-Florissant school district meanwhile postponed its first day of classes until Monday, cancelling classes for this Thursday and Friday.

As the protest swelled on Wednesday night, journalists Wesley Lowery of the Washington Post and Ryan J. Reilly of Huffington Post were briefly arrested inside a fast-food restaurant.

Meanwhile, police in California were investigating a separate incident of an officer fatally shooting an unarmed 25-year-old black man in Los Angeles.

On social media, groups claiming to be associated with the Anonymous hacker activist group called for nationwide protests and threatened to reveal personal information about Ferguson police officers.

The Ferguson police said there have been attempts to hack their website and that it was temporarily disrupted, and that the cyber-threats prompted the decision not to release the officer's name.",NA,5,NA,NA
Mirror,mirror9,http://www.mirror.co.uk/news/world-news/michael-brown-shooting-harrowing-video-4072685,Michael Brown shooting: Harrowing video shows cop who shot unarmed teen standing over his body,"Anthony Bond, Sam Adams ",08/18/2014,03/02/2016,"This video shows the moment the police officer who shot dead {unarmed black teenager Michael Brown}<hyperlink=""http://www.mirror.co.uk/news/world-news/michael-brown-shooting-unarmed-teenager-4067876""> paces backwards and forwards near his body.

Cop Darren Wilson, 28, can be seen talking to another police officer and pacing close to the dead body of the 18-year-old.

The footage was taken by Piaget Crenshaw who lives in an apartment overlooking the scene in Ferguson, Missouri.

In the upsetting footage, which was taken on a mobile phone, Ms Crenshaw says: 'God bless his soul, police shot this boy outside my apartment.'

Speaking to CNN today, she says she knew something was 'not right' and claims she saw the moment the teenager was shot dead.

'I knew the police shouldn't have been chasing this boy and firing at the same time. And the fact he got shot in his face, something clicked in me and I thought someone else should see this so I recorded.'

Ms Crenshaw said it had appeared as though Wilson had attempted to pull the teenager into a police cruiser in the moments before the shooting.

But she claims the 18-year-old managed to get away but after turning around he was shot a number of times.

She added: 'He was running away and when he [Brown] turned around he was shot.'

America’s National Guard has been called in to control mobs that have been causing mayhem since the shooting.

Violence escalated on Sunday night in Ferguson, Missouri, which has been rocked by protests, looting and arson since Michael Brown was killed there on August 9.

A 400-strong crowd clashed with police. Rioters fired shots and hurled Molotov cocktails and stones.

Massed-ranks of cops responded with rubber bullets, tear gas and smoke grenades - making the St Louis suburb resemble a war zone. Some involved were just 10.

Last night there were fears things could get even worse after an {autopsy revealed that Brown, 18, had been shot six times}<hyperlink=""http://www.mirror.co.uk/news/world-news/michael-brown-shooting-unarmed-teenager-4067876""> - twice in the head.

The second post mortem examination, carried out at the request of Brown’s family by New York city’s former chief medical examiner Michael Baden, showed the 18-year-old was shot at a distance, disproving police claims he had been trying to grab the gun of officer Darren Wilson who killed him.

Friends of Brown claim he had his arms in the air.

Also on Sunday supporters of policeman Wilson, now on enforced leave, rallied to support him wearing t-shirts printed with ‘I stand by Darren Wilson’.

There are two Facebook pages backing Wilson, 28.",NA,1541,NA,NA
Mirror,mirror10,http://www.mirror.co.uk/news/world-news/michael-brown-shooting-national-guard-4071015,Michael Brown shooting: National Guard sent in to control unrest since unarmed black teen killed,Christopher Bucktin ,08/18/2014,03/02/2016,"America’s National Guard has been called in to control mobs that have been causing mayhem since an {unarmed black teenager was shot dead}<hyperlink=""http://www.mirror.co.uk/news/world-news/michael-brown-shooting-national-guard-4071015""> by a white policeman.

Violence escalated on Sunday night in Ferguson, Missouri, which has been rocked by protests, looting and arson since Michael Brown was killed there on August 9.

A 400-strong crowd clashed with police. Rioters fired shots and hurled Molotov cocktails and stones.

Massed-ranks of cops responded with rubber bullets, tear gas and smoke grenades - making the St Louis suburb resemble a war zone. Some involved were just 10.

Last night there were fears things could get even worse after an {autopsy revealed that Brown, 18, had been shot six times}<hyperlink=""http://www.mirror.co.uk/news/world-news/michael-brown-shooting-unarmed-teenager-4067876""> - twice in the head.

The second post mortem examination, carried out at the request of Brown’s family by New York city’s former chief medical examiner Michael Baden, showed the 18-year-old was shot at a distance, disproving police claims he had been trying to grab the gun of officer Darren Wilson who killed him.

Friends of Brown claim he had his arms in the air.

An hour into Sunday’s violence police held an impromptu press conference.

Missouri Highway Patrol captain Ron Johnson, the black officer brought in to take over security, blamed “premeditated criminal acts” intended to provoke the police.

""We had to act to protect lives and property,” he said.

He confirmed his officers had been fired on with their command centre in a shopping mall targeted.

Capt Johnson said shortly before 9pm hundreds of protesters arrived throwing “multiple Molotov cocktails at police.”

He added: “There were shootings, looting, vandalism, and other acts of violence, clearly not spontaneous.”

Police also said a nearby McDonalds had also been seized by the angry mob.

It finally dispersed after being hit by a volley of tear gas.

Barricades set up near a burned-out store were bulldozed by police armoured cars.

Protester Martin McDonald said: “Tear gas - I’ve never seen it escalate to that point. It was unbelievable.”

Later it was announced all schools in the Ferguson-Florissant district are to remain closed until further notice.

Missouri governor Jay Nixon has appealed for calm, saying: “A day of hope, prayers and peaceful protests was marred by the violent criminal acts of an organised and growing number of individuals.”

Deploying the National Guard, a reserve military force, marks a major escalation of the crackdown on unrest.

A midnight to 5am curfew has been imposed.

Also on Sunday supporters of policeman Wilson, now on enforced leave, rallied to support him wearing t-shirts printed with ‘I stand by Darren Wilson’.

There are two Facebook pages backing Wilson, 28.",NA,2,NA,NA
Mirror,mirror11,http://www.mirror.co.uk/news/world-news/michael-brown-shooting-unarmed-teenager-4067876,Michael Brown shooting: Unarmed teenager was 'shot at least six times',Jessica Best;Chris Rickards,08/18/2014,03/09/2016,"An unarmed black teenager whose death at the hands of the police sparked days of protest was shot at least six times, it's been reported.

{The New York Times reports}<hyperlink=""http://www.nytimes.com/2014/08/18/us/michael-brown-autopsy-shows-he-was-shot-at-least-6-times.html?action=click&pgtype=Homepage&version=LedeSumLargeMedia&module=a-lede-package-region&region=lede-package&WT.nav=lede-package&hp&_r=1""> that a preliminary private autopsy carried out at the request of Michael Brown's family found the 18-year-old was shot twice in the head and four times in the right arm.

Dr Michael Baden concluded one of the gunshot wounds was in the top of the teenager's skull, indicating he may have been bent forward when the bullet hit and killed him in Ferguson, Missouri, last week.

The Justice Department is due to perform its own post mortem examination, following the private autopsy and one carried out by local officials, due to the ""extraordinary circumstances involved in this case"".

The news came overnight as cops fired smoke grenades at at a crowd protesting against the killing of an unarmed black teenager.

The canisters were shot as up to 400 people, including families with children, who had gathered to express their anger at the death of Mr Brown.

The police drove into the protest area in armoured vehicles and shot smoke canisters during a demo that had until then appeared to be peaceful.

The Missouri Highway Patrol said it used the devices to disperse ""aggressors"" who were trying to infiltrate a law enforcement command post.

It added that the armoured vehicles were deployed to ensure public safety.

The unrest followed the earlier introduction of a curfew i in a bid to quell violence following the death of Brown, who was shot dead by white police officer Darren Wilson.

Wilson is currently on administrative leave.

",NA,24,NA,NA
Mirror,mirror12,http://www.mirror.co.uk/news/world-news/michael-brown-shooting-man-critically-4067784,Michael Brown shooting: Man critically ill after being shot as police impose curfew following killing of black teenager,Christopher Bucktin ,08/17/2014,03/09/2016,"A man was shot as riot squads imposed a curfew to quell violence following the killing of an unarmed black teenager by a white police officer.

He was critically injured as a mob of around 200 defied the 12am to 5am ban on all movement and overran a restaurant to hold a rooftop protest.

Civil rights leader Al Sharpton called for peace as trouble continued, eight days after 18-year-old Michael Brown was shot dead by Officer Darren Wilson in Ferguson, Missouri.

He said: ""One person was shot last night, and we don't know if it was related to the protest or not, or who shot them, but we do not need more people hurt to stop the hurt.""

Violence broke out in the St Louis suburb when police stepped in to halt the restaurant siege.

Seven protesters were arrested.

The critically injured man was not believed to have been shot by the police.

At one point a man brandished a handgun at officers who took to armoured cars and warned the mob to disperse.

Scores of reinforcements arrived in body armour, armed with batons.

As they took up position SWAT teams patrolled with rifles.

Facing Molotov cocktails from the rioters, officers put on their gas masks and fired the first of 18 tear gas canisters into the crowd at 1am.

Chants of ""no justice, no curfew"" rang out as a masked rioter threw a smoking canister back at police.

Some protesters simply held their hands up mimicking the pose Brown was said to have adopted just before he was shot dead.

Missouri governor Jay Nixon said yesterday that though many protesters were making themselves heard peacefully, the state would not allow looters to endanger the community of Ferguson.

One local business owner said: ""The police said they would protect us and our livelihoods but so far they have failed.

""Everyone's worried for their safety and if this continues someone else will get killed.

""Already someone is fighting for life after being shot.

""Unless this is stopped it's a matter of time before someone else ends up in the mortuary.""

US Attorney General Eric Holder has ordered a second autopsy of Brown's body.",NA,192,NA,NA
Mirror,mirror13,http://www.mirror.co.uk/news/world-news/michael-brown-shooting-man-critical-4063563,Michael Brown shooting: Man in critical condition as police fire smoke canisters at protesters defying curfew,Richard Hartley-Parkinson,08/17/2014,03/17/2016,"A man is in a critical condition today after being shot during protests over the death of {a black teenager by a white police officer}<hyperlink=“http://www.mirror.co.uk/all-about/michael-brown”>.

Tear gas and smoke cannisters were also fired into the crowd of protesters in Ferguson, Missouri, where a curfew has been put in place between midnight and 5am.

Remaining protesters - chanting ""No justice! No curfew!"" - refused to leave the area.

As five armoured tactical vehicles approached the crowd, officers spoke through a loudspeaker: ""You are in violation of a state-imposed curfew. You must disperse immediately. Failure to comply, may result in arrest.""

As officers put on gas masks, a chant from the distant crowd emerged: ""We have the right to assemble peacefully.""

A moment later, police began firing smoke into the crowd of protesters.

Missouri governor Jay Nixon said yesterday that though many protesters were making themselves heard peacefully, the state would not allow looters to endanger the community of Ferguson, where {18-year-old Michael Brown was shot in a street}<hyperlink=“http://www.mirror.co.uk/news/world-news/michael-brown-shooting-dramatic-pictures-4058686”>.

""I am committed to making sure the forces of peace and justice prevail,"" Mr Nixon said during a press conference at a church that was interrupted repeatedly by people objecting to the curfew and demanding that the officer who shot Mr Brown be charged with murder.

""We must first have and maintain peace. This is a test. The eyes of the world are watching,"" Mr Nixon, who also declared a state of emergency, said.

State statute gives the governor broad powers when he or she declares a state of emergency, but Mr Nixon has not indicated that he plans to do anything other than impose the curfew and empower the state highway patrol to enforce it.

The curfew announcement came after tensions again flared in Ferguson. Earlier, local {police identified the officer who shot Mr Brown as Darren Wilson}<hyperlink=“http://www.mirror.co.uk/news/world-news/ferguson-darren-wilson-named-police-4055735”> and released documents and video footage claiming that Mr Brown had robbed a convenience store just before he was shot.

Police said Officer Wilson was unaware Mr Brown was a suspect when he encountered him walking with a friend.

Mr Nixon said the US Department of Justice was stepping up its civil rights investigation of the shooting.

As the curfew approached, New Black Panther Party leader Malik Shabazz roamed the street with a bullhorn, encouraging people to leave for their own safety. Many appeared to follow his suggestion.

Crowds that were in the hundreds dwindled significantly in the final hour, as police with riot gear stood guard.

Missouri State Highway Patrol captain Ron Johnson, who is in charge in Ferguson after state police took over responsibility for security from the local force, said 40 FBI agents were going door-to-door in the neighburhood talking to people who might have seen or have information about the shooting.

Capt Johnson told at the news conference that police would not enforce the curfew with armoured trucks and tear gas but communicate with protesters and give them ample opportunity to leave. Local officers faced strong criticism earlier in the week for their use of tear gas and rubber bullets against protesters.

""Why is the focus on security and not getting justice? Why is there not an arrest?"" one women yelled.

Mr Brown's death ignited several days of clashes with furious protesters. Tensions eased on Thursday after Mr Nixon turned oversight of the protests over to the Missouri Highway Patrol. But Friday night saw a resurgence of unrest.

Yesterday some residents said it appeared the violent acts were being committed by people from other suburbs or states.

""Who would burn down their own back yard?"" said Rebecca McCloud, who works with the Sonshine Baptist Church in St Louis.

Greg Thomas said he had seen new people, younger, more eager for a confrontation with police, on the streets. The 28-year-old former US Marine said he left as quickly as he could when he heard people talking about getting their handguns.

""There's three agendas out there,"" he said. ""People who want to party, people who want to be martyrs and get killed by police, and the people here to protest.""

Capt Johnson said one tear gas canister was deployed on Friday night after the group of rioters became unruly and several officers were trapped and injured.

Officer Wilson is a six-year police veteran who has had no previous complaints against him, the local police chief says. Ferguson Police Department has refused to say anything about his whereabouts and reporters were unable to contact him.

Officer Wilson has been on paid administrative leave since the shooting. St Louis County prosecutor Bob McCulloch said it could be weeks before the investigation ended.",NA,1,NA,NA
