Source,ArticleID,ArticleLink,Title,Author,DatePublished,DateRetrieved,ArticleText,NumberComments,NumberSocialMedia,TheShitBetween,Notes
Mirror,mirror14,http://www.mirror.co.uk/news/uk-news/mike-brown-shooting-unarmed-teens-4035824,Mike Brown shooting: Unarmed teen's mum learned of son's death from online photo,Sam Rkaina,08/11/2014,03/17/2016,"The mum of a black teenager shot and killed by police learned he was dead when she was shown his picture on a mobile phone.

Mike Brown death on Saturday sparked demonstrations yesterday followed by riots and looting in the city of Ferguson, Missouri, USA.

A video uploaded to YouTube shows an interview by local news reporters with the 18-year-old's mother Leslie McSpadden after the tragic shooting.

Asked what police were telling her about his killing, she said: ""They aren't telling me anything. They haven't told me anything. They wouldn't even let me identify my son.

""The only way I knew it was my son was from people out here showing me his picture on their phones and their tablets.

""I learned about it from a guy calling me on the phone. I was able to look at that picture and say yes that's my son. Laying in the street for hours. Hours.""

A day of demonstrations was held in Ferguson yesterday but after dark they descended into looting and rioting.

There is ""a lot of unrest up there, and a lot of rioting going on, and looting,"" Officer Brian Schellman, a spokesman for the St. Louis County Police Department, said earlier today.

He said the unrest had spread from Ferguson, a largely black St. Louis suburb, to neighbouring communities. About 150 officers in riot gear from throughout St. Louis County had been sent to the area.

Footage from local news station KMOV TV showed a QuikTrip convenience store set on fire after it was looted. A teenage witness told KMOV, ""They destroyed everything.""

Mobs rushed out of other stores, including an AutoZone and a Ross Dress for Less, with armfuls of stolen goods, KMOV and the St. Louis Post-Dispatch newspaper reported.

A number of videos of the violence have been posted online, clearly showing men and women, some in masks, breaking into shops and taking what's inside.

Officer Schellman said arrests had been made but had no details of how many. He and three hospitals had no reports of injuries.

Police said Mike was shot after a struggle over a gun in a police car, but it was not immediately clear why the boy was in the car. At least one shot was fired during the struggle, and then the officer fired more shots before leaving the car.

The officer involved in the shooting has not been identified but has six years on the job.

St. Louis County Police Chief Jon Belmar told a news conference he has been put on administrative leave, but the officer's race has not been revealed.

Brown's mother told TV station KSDK that her son was a ""good child getting ready to go to college"" and that he was visiting his grandmother when the shooting took place.

A Facebook group called {Justice for Mike Brown}<hyperlink=“https://www.facebook.com/JusticeForMikeBrownFerguson/“> has been set up to protest the shooting, shile supporters are using the hashtag Justiceformike to air their views.

[tweetbegin 498250037554847745 tweetend]

— Asha (@AshaDarlingg) August 9, 2014
The teenager is the latest in a series of black American youths to be shot and killed, prompting widespread protests.

{Trayvon Martin}<hyperlink=“http://www.mirror.co.uk/search/simple.do?destinationSectionId=219&publicationName=mirror&sortString=publishdate&sortOrder=desc&sectionId=69&articleTypes=+news+opinion+advice&pageNumber=1&pageLength=5&searchString=trayvon”> was just 17-years-old when he was killed by George Zimmerman in February 2012. Zimmerman, a neighbourhood watch co-ordinator, spotted the unarmed boy and thought he 'looked suspicious'. 

The St. Louis County branch of the civil rights group NAACP has said it wants the Federal Bureau of Investigation to look into the Mike Brown incident.

On Sunday civil rights leader the Rev. Al Sharpton said he had spoken with the dead teenager's grandfather and had agreed to visit St. Louis to help the family.",NA,445,NA,NA
