Source,ArticleID,ArticleLink,Title,Author,DatePublished,DateRetrieved,ArticleText,NumberComments,NumberSocialMedia,TheShitBetween,Notes
Mic,mic20,http://mic.com/articles/96144/11-things-white-people-should-stop-saying-to-black-people-immediately#.rW1sfD7U7,11 Things White People Should Stop Saying to Black People Immediately,Derrick Clifton,08/14/14,07/07/16,"Whenever a black youth like {Michael Brown gets shot,}<hyperlink=""https://mic.com/articles/95930/anonymous-just-released-this-powerful-video-statement-on-the-michael-brown-shooting""> or a racist blowhard like Donald Sterling {gets exposed,}<hyperlink=""https://mic.com/articles/88611/if-you-re-mad-at-donald-sterling-you-ll-love-what-the-nba-just-did-to-him""> many white people on and off the Internet {react with remarks}<hyperlink=""http://www.vice.com/read/heres-whats-happening-on-the-internets-most-racist-forums""> brimming with the ugliness of anti-black racism. And it absolutely has to stop. 

More often than not, many white people resort to putting the onus back on the people who are experiencing the pain of racism. This tactic {often derails}<hyperlink=""http://www.theroot.com/articles/culture/2013/07/national_conversation_on_race_time_for_some_ground_rules.html""> the broader conversation, allowing white people to continue ignoring {their own biases,}<hyperlink=""http://www.tolerance.org/magazine/number-36-fall-2009/feature/colorblindness-new-racism""> and prevents a frank examination of the {larger systems and powers}<hyperlink=""http://www.thenation.com/blog/178101/effects-ignoring-systemic-racism""> accountable for enshrining the dehumanization of and discrimination against blacks and people of color. That larger system is white supremacy, a version of which has little to do with neo-Nazis or the KKK as most would assume.

A {growing number}<hyperlink=""http://thinkprogress.org/justice/2014/08/12/3470313/justice-race-and-michael-brown/""> of black people have been ruthlessly beaten, shot and killed by white police officers of late, a fact all too easy to gloss over for white people who will continue moving through American life {with white privilege.}<hyperlink=""https://mic.com/articles/89653/7-actual-facts-that-prove-white-privilege-exists-in-america""> White privilege means not having to deal with the disproportionate impact of police brutality, racial profiling and exclusion from everyday social settings and public accommodations.

[tweetbegin 499907982197813249 tweetend]
[tweetbegin 499902281782157312 tweetend]
[tweetbegin 499572863859707906 tweetend]
[tweetbegin 499757124017487872 tweetend]

Rather than tackle a thorny issue with {tact and honesty,}<hyperlink=""http://www.dailydot.com/opinion/clueless-things-white-people-say-racism/""> however, privilege also allows people to ignore the conversation, mock it or walk away from it altogether. But it doesn't have to be that way. Americans don't have to let this type of ignorance stop us from examining the many subtle, insidious attitudes and beliefs that help perpetuate racism through {microaggressions}<hyperlink=""http://www.psychologytoday.com/blog/microaggressions-in-everyday-life/201010/racial-microaggressions-in-everyday-life""> — a term coined by African-American psychologist Chester Pierce and further developed by Derald Wing Sue and researchers at Columbia University to explain smaller instances of systemic, cumulative racial indignities. 

Here are a few problematic examples that can be used to help elevate a much-needed dialogue as the images streaming out of Ferguson, Mo., bring us face to face with America's {legacy of institutional intolerance.}<hyperlink=""http://www.dailydot.com/opinion/17-things-yes-all-black-people/"">

1. ""Why do black people have to make everything about race?""

The fact that someone was shot in general is the actual problem, stop making everything about race we don't choose our flesh.

— Hawaiian Punch Haley (@ThatHaleyWay) {August 14, 2014}<hyperlink=""https://twitter.com/ThatHaleyWay/statuses/499859293156294657"">

If it seems as though black people talk about race so much, that's because America, as a government and as a power structure, has made everything about race, from the moment Columbus landed in 1492 to the recent shooting of Michael Brown at the hands of a cop with {institutional power and privilege}<hyperlink=""http://time.com/3107729/michael-brown-shooting-ferguson-missouri-white-flight/""> on his side.

White people will never fully understand how racism impacts the everyday lives of black people and people of color. That's because they benefit from a racial system that enshrines {institutional racism}<hyperlink=""http://www.msnbc.com/hardball/watch/does-institutional-racism-persist-today-240281667797""> and racial prejudice as {the rule of law}<hyperlink=""https://mic.com/articles/95956/one-striking-image-captures-the-depressing-reality-of-the-michael-brown-shooting""> and social order.

[tweetbegin 499822566992003073 tweetend]
[tweetbegin 498490487616327680 tweetend]

For those who aren't already actively anti-racist, however, exercising empathy is a good place to start. Doing so means {taking the lead}<hyperlink=""http://feminspire.com/why-white-feminists-need-to-shut-up-and-listen-when-it-comes-to-race/""> from black people, listening to their stories of racialized pains and struggles, and reflecting on the ways privilege minimizes those hindrances for white people.

If the continuing conversation about racism upsets you, take a second to imagine what it's like for the black people who deal with racism everyday, and who are tired of thinking and talking about it, but discuss it anyway because for them, it's not just a dinner table dialogue. 

2. ""I don't have white privilege. Stop saying that I have white privilege.""

[tweetbegin 499845452376715266 tweetend]
[tweetbegin 499797003526631425 tweetend]

White privilege isn't inherently about being raised in an affluent, two-parent home with high educational attainment and markers of upward mobility in American society. White privilege is the many built-in perks afforded to white people by virtue of being born with white skin and white ethnicity in a social and legal system that enforces white supremacy as the rule of law. It's not having to seriously think about or discuss how the situation in Ferguson will affect friends and relatives or even how a broader justice system will work to protect (or to not protect) the constitutional rights of black people. 

White privilege is being able to walk away from the conversation, or to stop reading a piece about racism when it stirs up discomfort, rather than wrestling with the subject matter and owning up to personal biases and limits to understanding.

White privilege can be used for good too, of course, if those who wield it actively challenge the prejudices of their white friends and reject white supremacy. But as long as white people keep denying their privilege, white officers with badges and institutional power on their side will continue killing blacks with impunity. 

3. ""I'm not racist. I have black friends.""

Aside from the lazy logic of such a statement, this phrase describes the phenomenon wherein people use black people as accessories and distractions.

Having a black friend, or any relationship with a person of color, doesn't mean your everyday habits and politics are exempt from having racist implications. For proof, look no further than {Donald Sterling,}<hyperlink=""http://deadspin.com/exclusive-the-extended-donald-sterling-tape-1568291249""> who told his girlfriend, a person of color, to stop bringing black people with her to basketball games because he feels blacks are inferior.

4. ""These protesters speak so well, but they're such violent people.""

Most of the protests in Ferguson have been peaceful, but that fact hasn't stopped some characterizations from making it appear as though a race war is brewing. In effect, blacks are being typecasted as loud, irrational people who shouldn't be paid attention to, when they actually have valid concerns about the abuses from their local police force.

[tweetbegin 499929575884070912 tweetend]
[tweetbegin 499931742816706560 tweetend]

These types of remarks go hand in hand with an amazement about how poised, well-spoken and presentable some black protesters have been amid the chaos. In other contexts, ""You speak so well"" may sound like earnest praise, and sometimes it's received by black people as a commendation because of the apparent intent. However, more often than not, this sentiment is a {backhanded compliment}<hyperlink=""http://www.npr.org/2014/04/10/301417507/boss-says-youre-smart-for-a-woman""> that assumes most black people speak with rudimentary grammar and communicate using ""lesser"" linguistic patterns such as Ebonics.

If a black person has great oratory skills, it's certainly possible to say so in a way that isn't infantilizing or denigrating. Talk about the content of the remarks and other communication dynamics they employed to be effective, but please do not assume that someone else's method of communication is automatically inferior just because it sounds different.

5. ""You probably voted for Barack Obama just because he's black.""

President Obama {issued a statement}<hyperlink=""http://www.ky3.com/news/local/president-obama-issues-statement-on-death-of-ferguson-missouri-teenager/21048998_27431674""> on Tuesday regarding Brown's shooting death, and {finally spoke Thursday}<hyperlink=""http://www.washingtonpost.com/politics/obama-speaks-about-shooting-of-michael-brown-in-ferguson-mo/2014/08/14/d49f63ac-23c7-11e4-86ca-6f03cbd15c1a_story.html""> about it as he would any other major policy issue, noting a Justice Department investigation already in progress, and that there's ""never an excuse"" for police brutality or {excessive force}<hyperlink=""https://twitter.com/micnews/status/499963077430104065""> against peaceful protesters.

Unlike many other presidents and political leaders before, Obama has a better understanding of black issues, given his lived experiences as a person of color and his education. But don't treat black people as though they can't make an informed political decision that uses a cost-benefit analysis, or even a pragmatic approach to politics, in order to cast their vote.

[tweetbegin 499963077430104065 tweetend]
[tweetbegin 499731384169402368 tweetend]

The vast majority of African-Americans vote for Democratic candidates like President Obama in major elections, but this is often because of a sense of {""linked racial fate""}<hyperlink=""http://www.blackyouthproject.com/2011/05/linked-fate-organizing-and-the-power-of-a-shared-experience/""> — in other words, the candidate that represents the issues most relevant to the everyday lives of black people is most likely to win a disproportionate share of votes from black constituents. So it's not as much about skin color as it is about positions on issues, which is how most anyone else votes.

Otherwise, people like former Tea Party Republican congressman {Allen West}<hyperlink=""http://mediamatters.org/blog/2014/07/18/allen-west-obama-purposefully-creating-drama-li/200143""> would have swept the the black vote in their elections, despite their problematic views on issues affecting black people.

6. ""It's not fair that you all can say the n-word, but we can't.""

[tweetbegin 499806851702091776 tweetend]

The n-word has hundreds of years of slavery, segregation and institutional racism attached to it. But in recent decades, it's been reclaimed by black people, which now means that some blacks use it in a variety of different ways, often to refer to one another in a not-so-derogatory manner.

But just because some black people have reclaimed the word in their everyday vernacular, or even in their cultural productions, doesn't mean white people get to participate in that same reclamation. White people irrevocably {lost that opportunity}<hyperlink=""http://everydayfeminism.com/2014/03/white-people-cant-use-the-n-word/""> the day the n-word coincided with lynchings, whippings, mob beatings and police shootings. 

7. ""I'm clutching my purse or my wallet when you walk past, because I think you might steal from me.""

Anyone of any race can perpetrate a mugging, or commit any other crime that involves physical or personal property. But because of how {white overrepresentation}<hyperlink=""http://www.washingtonpost.com/wp-srv/special/national/police-staffing/""> in America's police departments and the justice system impacts the enforcement of laws, research shows there's a {disproportionate impact}<hyperlink=""http://www.sentencingproject.org/doc/publications/rd_reducingracialdisparity.pdf""> on how blacks are caught and publicly held accountable for their wrongdoing. The {situation in Ferguson}<hyperlink=""https://mic.com/articles/96234/one-alarming-statistic-perfectly-explains-the-violence-in-ferguson""> mirrors that very reality, as the {Los Angeles Times}<hyperlink=""http://www.latimes.com/nation/nationnow/la-na-nn-michael-brown-ferguson-missouri-shooting-20140811-story.html""> shows, based on a report from the Missouri attorney general's office {about racial profiling}<hyperlink=""http://ago.mo.gov/VehicleStops/Reports.php?lea=161""> in that state. That might explain why some people feel as though every time they hear about a violent crime or theft, they see a black mugshot or hear a name that ""sounds"" black. 

It also removes accountability from {larger social systems,}<hyperlink=""http://www.globalresearch.ca/the-prison-industry-in-the-united-states-big-business-or-a-new-form-of-slavery/8289""> such as the {school-to-prison pipeline}<hyperlink=""http://www.aclu.org/school-prison-pipeline""> and the {prison-industrial complex,}<hyperlink=""http://colorlines.com/archives/1998/09/masked_racism_reflections_on_the_prison_industrial_complex.html""> that may put someone in a position where they must choose between not having basic needs and stealing from someone who can afford them. Instead, disproportionately white police departments pull out all the stops in a show of excessive force, {protecting white privilege}<hyperlink=""http://www.cnn.com/2014/08/11/opinion/granderson-missouri-police-shooting/""> and {white wealth}<hyperlink=""http://www.pbs.org/race/000_About/002_04-teachers-07.htm""> in the process.

[tweetbegin 499963401561735169 tweetend]
[tweetbegin 499906675026198528 tweetend]
[tweetbegin 499769500603260928 tweetend]

8. ""I don't understand why you people...""

The phrase ""you people"" is {coded language,}<hyperlink=""http://www.diversityinc.com/things-not-to-say/10-things-never-to-say-to-a-black-coworker/""> a euphemism for the n-word, black people, outsiders or ""the other."" By being an outsider to whiteness and white supremacy, ""you people"" suggests that blacks (and other people of color) do not belong in the same rooms, venues or halls of power as white people. 

9. ""When I see you, I don't see race.""

{Color-blind racism}<hyperlink=""https://mic.com/articles/55867/colorblindness-is-the-new-racism""> is still racism. Without facing history and the present realities, it's impossible to understand how racism affects the everyday life of peoples of all races and ethnicities. 

Almost everyone, save for those who ascribe to a racist system or retain deep-seated racial prejudice, wants to be able to unite across races, ethnicities and cultures to live in harmony. But with the systems and structures of previous generations still in place, which codify and promote racism in politics and everyday life, we're nowhere close to being post-race or being able to ""not see"" skin color.

But there are moments every day when that racial divide is bridged in a way that is mutually beneficial and even life-giving for all parties involved. For proof, take a look at this black family, which welcomed a white reporter from the St. Louis Post-Dispatch into their home for safe shelter and sustenance while he reports about the situation in Ferguson. It's an illuminating example of what an authentic cross-cultural embrace can look like.

[tweetbegin 499746654887899136 tweetend]

10. ""If black men don't want to get stopped by police, maybe they shouldn't dress that way.""

It shouldn't matter what a young person is wearing, or how they walk down the street, or how they talk, how they speak or where they come from. It doesn't matter if black men wear suits everywhere, or stop sagging their pants, or stop wearing hoodies — a ""classy"" dress code isn't going to {stop police brutality.}<hyperlink=""http://www.buzzfeed.com/jesset9/don-lemon-and-the-failure-of-respectability-politics""> 

In fact, many white young people wear the same kinds of clothing, yet are not subjected to the same kinds of the racialized subtexts. On average, a white man in a hoodie is less likely to be perceived as a threat by a police officer or concerned citizen. Indeed, the moment a self-appointed Florida neighborhood watchman named George Zimmerman thought he could accost and harass a black young man wearing a hoodie and jeans, the situation snowballed into that young man's death.

It is never the victim's fault. And {no change of clothing}<hyperlink=""http://www.postbourgie.com/2013/07/24/in-the-face-of-respectability/""> will hold the people and systems accountable for murdering young black people.

11. ""Racism ended in the 1960s. Stop making such a big deal out of nothing.""

This statement couldn't be farther from the truth. In fact, if you pay attention to news coverage, there's a laundry list of big and small issues proving that American racism is far from being a thing of the past.

The killings of Michael Brown, Renisha McBride, Jordan Davis, Trayvon Martin, Eric Garner and many other nameless, faceless black young people — all at the hands of police and whites — come at a time when black women like Marissa Alexander are simultaneously being denied the {""stand your ground""}<hyperlink=""http://www.salon.com/2014/07/22/marissa_alexander_denied_new_stand_your_ground_hearing_still_faces_up_to_60_years_in_prison/""> defense and instead threatened with decades in jail for firing a warning shot at an allegedly abusive spouse.

When it comes to the reality in Ferguson, Mo., the images speak for themselves. And that unsavory reality begins with the family that Brown leaves behind, including a father and mother struggling with the pain of burying their son because of the very people who should be keeping them safe.

[tweetbegin 499917799289274368 tweetend]
[tweetbegin 499838374312955904 tweetend]
[tweetbegin 499932762200363008 tweetend]",NA,NA,NA,NA
Mic,mic21,http://mic.com/articles/96378/7-things-worth-more-than-a-black-person-s-life-in-america#.pKCHCXQ1R,7 Things Worth More Than a Black Person's Life in America,Zak Cheney-Rice,08/16/14,07/07/16,"We’re constantly being asked to qualify black life in America. So when Ferguson Police Chief Thomas Jackson identified Darren Wilson as the officer who killed 18-year-old Michael Brown {during a press conference on Friday,}<hyperlink=""https://www.youtube.com/watch?v=6XJ1Kh1CTB8""> the logic he employed to justify Wilson's actions was all too familiar.

""At 11:51, there was a 9-1-1 call from a convenience store nearby. At 11:52 dispatch gave a description of the robbery suspect over the radio ... further description of the suspect was given over the radio, which describe the suspect walking towards QuickTrip. The office [involved in the shooting] left a sick call. At 12:01 p.m., our officer encountered Michael Brown on Canfield Drive. At 12:04, a second officer arrived on the scene immediately following the shooting.""

In {not too subtle}<hyperlink=""https://www.aclu.org/blog/racial-justice-criminal-law-reform/ferguson-polices-pr-stunt-poisons-independent-and-impartial""> a move, Jackson accompanied his announcement with video of Brown allegedly shoplifting a box of cigars from a convenience store the day of his murder. The implication was clear: Brown was a criminal, hence a violent encounter with police was inevitable and most likely warranted.

It didn’t matter that Officer Wilson had no knowledge of the theft before shooting Brown. Nor that Jackson likely aired the tape unprompted, despite his claims to the contrary.

{#BREAKING}<hyperlink=""https://twitter.com/hashtag/BREAKING?src=hash""> exclusive source: Tape released was NOT in response to purported FOIA request as {#Ferguson}<hyperlink=""https://twitter.com/hashtag/Ferguson?src=hash""> chief claimed. {pic.twitter.com/7JCA8sWpNv}<hyperlink=""http://t.co/7JCA8sWpNv"">

— Goldie Taylor (@goldietaylor) {August 16, 2014}<hyperlink=""https://twitter.com/goldietaylor/statuses/500473566169939968"">

What mattered was this: When a black person is killed under dubious circumstances, the conversation inevitably turns to what the victim did to precipitate – if not outright deserve – such an abrupt and violent demise.

This is not a new phenomenon, of course. Into the mid-20th century, even the most casual display of {disrespect}<hyperlink=""http://www.pbs.org/wgbh/amex/till/""> towards a white person, real or imagined, was enough to justify a gruesome death. But in recent years, the tone has shifted: It’s more common to justify black death relative to specific items, e.g. what the victim had allegedly stolen, possessed or wanted at the time of his or her murder. 

Disputes over material goods have prompted a disturbing frequency in black people being killed by police and regular citizens alike in recent years. And in each of these actions lies an implicit value judgment: The black victims lives' are worth no more to their murderers than the items for which they were killed.

This is the America we live in today. Here are seven troubling examples from the past 22 years: 

1. Mike Brown = 1 box of convenience store cigars (approx. $34.99)

Brown, unarmed, allegedly stole a box of cigars from a convenience store shortly before Officer Darren Wilson shot him to death in Ferguson, Mo., on August 9.

2. Eric Garner = 1 carton of cigarettes (less than $48.57)

Garner, 43 and unarmed, was allegedly selling untaxed cigarettes when New York police officers {choked him}<hyperlink=""https://mic.com/articles/94604/this-moment-should-be-the-absolute-last-straw-for-americans-tired-of-police-brutality""> to death on Staten Island, NY, on July 17.

3. Renisha McBride = 1 phone call (approx. 25 cents)

McBride, 19 and unarmed, was seeking help after a car accident when she knocked on Theodore Wafer's front door the night of Nov. 2, 2012. Wafer {shot her to death}<hyperlink=""http://www.nydailynews.com/news/crime/renisha-mcbride-shooter-shocked-guilty-verdict-article-1.1897748""> on his front porch outside of Detroit, Mich.

4. Kendrec McDade = 1 laptop (approx. $1,099.00)

McDade, 19 and unarmed, had allegedly stolen a laptop when police {shot him}<hyperlink=""http://latimesblogs.latimes.com/lanow/2012/12/kendrec-mcdade-pasadena-police-shooting-justified.html""> to death in Pasadena, Calif., on March 24, 2012.

5. Trayvon Martin = 1 hooded sweatshirt (approx. $14.95)

Martin, 17 and unarmed, was wearing a black hooded sweatshirt when George Zimmerman chose to follow him and instigate the fight that led to his murder. FOX News host Geraldo Rivera famously blamed Martin's attire for his death, {claiming}<hyperlink=""http://content.usatoday.com/communities/entertainment/post/2012/03/geraldo-rivera-blames-hoodie-for-trayvon-martins-death/1#.U--96lYYHjQ""> the sweatshirt was ""as much responsible ... as George Zimmerman.""

6. Anthony Kyser = 1 tube of toothpaste (approx. $3.89)

Kyser, 35, homeless and unarmed, had allegedly stolen a tube of toothpaste from a Chicago, Ill., CVS when the store's manager, Pedro Villanova, followed him outside into an alley and {choked him to death}<hyperlink=""http://www.huffingtonpost.com/2013/01/18/anthony-kyser-death-video_n_2506106.html""> on May 8, 2010.

7. Latasha Harlins = 1 bottle of orange juice ($1.79)

On March 16, 1991 in Los Angeles, Calif., Harlins, 15 and unarmed, was accosted by convenience store owner Soon Da Ju, who claimed she was stealing a bottle of orange juice. A scuffle ensued, after which Harlins walked away. Ju pulled out a gun and {shot}<hyperlink=""http://www.laweekly.com/informer/2013/07/10/how-a-179-bottle-of-orange-juice-helped-spark-the-la-riots""> Harlins to death.",NA,NA,NA,NA
