Source,ArticleID,ArticleLink,Title,Author,DatePublished,DateRetrieved,ArticleText,NumberComments,NumberSocialMedia,TheShitBetween,Notes
Mic,mic1,http://mic.com/articles/96632/how-fresh-prince-of-bel-air-anticipated-ferguson-more-than-20-years-ago#.5PHVD99ba,How 'Fresh Prince of Bel-Air' Anticipated Ferguson More Than 20 Years Ago,Jared Keller,08/19/14,03/31/16,"""Hands up, don't shoot"" has been the rallying call of protesters in Ferguson, Mo., following the {shooting death}<hyperlink=“http://mic.com/articles/95998/days-after-michael-brown-s-death-ferguson-looks-like-a-war-zone#.xK0we9wAJ”> of unarmed black teen Michael Brown by white police officer Darren Wilson on Aug. 9. 

Eerily, that sentiment is nearly identical to one put forth by Will's best friend Jazz in The Fresh Prince of Bel-Air. In the second season episode ""Cased Up,"" Jazz (played by DJ Jazzy Jeff) appears in court following a car accident with Uncle Phil's protege Eric. The whole episode is, in typical Fresh Prince style, relatively humorous, but this bit (posted by Tumblr user {Marvin}<hyperlink=“http://mvgl.tumblr.com/about”>) is eerily familiar in light of the ongoing unrest in Ferguson.

Obviously, pop culture ephemera is often an inefficient (and, in some cases, {grossly inappropriate}=hyperlink<“http://www.buzzfeed.com/bennyjohnson/the-story-of-egypts-revolution-in-jurassic-park-gifs#.um5Q4Q6KE”>) medium for explaining the intricacies of complex sociopolitical conflicts. But this episode, which was first broadcast on Nov. 11, 1991, resonates deeply in the wake of Ferguson (Jazz was worried about being shot six times; according to an autopsy reports, Michael Brown {actually was}<hyperlink=“http://www.nytimes.com/2014/08/18/us/michael-brown-autopsy-shows-he-was-shot-at-least-6-times.html”>). The sad fact is that Fresh Prince captured what remains, 23 years later, a disturbing truth for black Americans: They're constantly in jeopardy for no other reason than “{walking while black}<hyperlink=“http://gawker.com/florida-man-literally-arrested-for-walking-while-black-1303208765”>.” 

And this was true well before the death of Michael Brown. Consider Jordan Davis, shot and killed for {listening to loud music}<hypothesis=“http://www.motherjones.com/mojo/2013/07/trayvon-martin-jordan-davis-stand-your-ground”>. Or Bobby Wingate, tasered and arrested for {walking on the wrong side of the street}<hyperlink=“http://gawker.com/florida-man-literally-arrested-for-walking-while-black-1303208765”>. Or Chris Beatty, arrested for ""trespassing"" while {drinking iced tea}<hyperlink=“http://gawker.com/florida-man-literally-arrested-for-walking-while-black-1303208765”>. Or Earl Sampson, arrested simply for {showing up to work}<hyperlink=“http://www.miamiherald.com/news/local/community/miami-dade/article1957716.html”>.

Why does this happen? Because, despite {ridiculous claims}<hyperlink=“http://mic.com/articles/96144/11-things-white-people-should-stop-saying-to-black-people-immediately#.yfI3kG3Cu”> that racism ""ended in the '60s,"" black men in America are continually forced to grapple with the fact that their lives are essentially valueless to law enforcement. Judging by the violence they've faced under the most asinine circumstances, you'd think a black person's life in America was worth less than a {box of cigars}<hyperlink=“http://mic.com/articles/96378/7-things-worth-more-than-a-black-person-s-life-in-america#.YB6l8WJaL”>, a {carton of cigarettes}<hyperlink=“http://mic.com/articles/96378/7-things-worth-more-than-a-black-person-s-life-in-america#.YB6l8WJaL”>, a {phone call}<http://mic.com/articles/96378/7-things-worth-more-than-a-black-person-s-life-in-america#.4IvkBxS0A”>, a {laptop}<hyperlink=“http://mic.com/articles/96378/7-things-worth-more-than-a-black-person-s-life-in-america#.4IvkBxS0A”>, a {tube of toothpaste}<hyperlink=“http://mic.com/articles/96378/7-things-worth-more-than-a-black-person-s-life-in-america#.4IvkBxS0A”>, {a hoodie}<hyperlink=“http://mic.com/articles/96378/7-things-worth-more-than-a-black-person-s-life-in-america#.wWRRBHSS7”> and {a bottle of orange juice}<hyperlink=“http://mic.com/articles/96378/7-things-worth-more-than-a-black-person-s-life-in-america#.geFnBErAo”>. Mic's Zak Cheney-Rice sums this up {powerfully}<hyperlink=“http://mic.com/articles/96378/7-things-worth-more-than-a-black-person-s-life-in-america#.RfLx9neZE”>: ""When a black person is killed under dubious circumstances, the conversation inevitably turns to what the victim did to precipitate — if not outright deserve — such an abrupt and violent demise.""

And this is the fundamental problem expressed in Fresh Prince, which was one of the highest-rated television shows among black audiences in 1991, {according to Nielsen}<hyperlink=“https://library.uoregon.edu/sites/default/files/data/guides/english/nielsen_ratings.pdf”>. To the average NBC viewer of the time, Jazz is the trouble-making counterpart to Will, a black Jughead to Smith's updated Archie. But in reality, Jazz in ""Cased Up"" is a sad reminder of the oppressive truth of life as a black man in America. 

Some viewers may have greeted his line with a laugh; today, with all eyes on Ferguson, it's plain to see it was no joke. ",NA,NA,NA,NA
Mic,mic2,http://mic.com/articles/96502/john-oliver-brilliantly-eviscerates-police-militarization-in-ferguson#.4oFEXKBPb,John Oliver Brilliantly Eviscerates Police Militarization in Ferguson, Elizabeth Plank,08/18/14,03/31/16,"In the wake of Michael Brown's shooting on Aug. 9, all eyes may be trained on Ferguson, Mo. Our television sets and social media feeds may be flooded in images of aggression and violence, but fully understanding what's actually happening outside St. Louis requires context. 

The events of Ferguson took a horrendous turn Sunday night as police fired tear gas at protesters, including children, three hours before the imposed curfew. One man {was shot}<hyperlink=“http://www.latimes.com/nation/nationnow/la-na-nn-ferguson-curfew-20140816-story.html”> by an unidentified gunman and seven were arrested, while members of the media were {threatened}<hyperlink”http://gawker.com/ferguson-police-threaten-to-shoot-reporter-and-mace-chr-1623125660?utm_source=feedburner&utm_medium=feed&utm_campaign=Feed%3A+gawker%2Ffull+%28Gawker%29”> with guns and mace. One {image}<hyperlink=“https://twitter.com/paleofuture/status/501211605909000192”> captured a woman being treated at a nearby McDonald's for tear gas, while a {Vine}<hyperlink=“https://twitter.com/ryanjreilly/status/501192051304972289”> clip shows an 8-year-old boy dealing with the aftermath of tear gas thrown by police.

The continuing unrest in Ferguson proves that the issues playing out in front of a national audience reach far deeper than this particular shooting. Racial tensions, mixed with a growing militarization of our police force, have reached a boiling point, which John Oliver flawlessly addressed Sunday on Last Week Tonight

Oliver begins by dismantling the Ferguson mayor's laughable defense that race has never been an issue in his town, a town where two-thirds of its population is African-American, while only three members of its police force are. ""As a general rule, no one should ever be allowed to say there is no history of racial tension here, because that sentence has never been true anywhere on Earth,"" Oliver points out.

He then uses data from MSNBC to highlight the striking racial makeup of arrests in Ferguson, 93% of which are of African-Americans: ""If you are white in Ferguson, you would need to be snorting cocaine directly on your dashboard to be stopped by the police.""

On the issue of police militarization, Oliver points to the influx of Department of Defense money funneled to police departments since 9/11. ""The number of SWAT rates has gone up by 1,400% since the 1980s,"" he notes. But there's more to this picture: Roughly 79% of SWAT operations involve search warrants for drugs, allegations that have been shown to “disproportionately target”<hyperlink=“http://www.vox.com/2014/7/1/5850830/war-on-drugs-racist-minorities”> minority suspects. Clearly, these SWAT teams are not being deployed in white college dorm rooms. Meanwhile, the coded, racialized language being used in Ferguson would be ""barely acceptable"" for a ""zoo escape.""  

Ultimately, police are not soldiers, as Oliver points out that police officers in the U.S. would be wise to ""dress for the job [they] have, not the job [they] want.""

While humorous as always, Oliver's segment delivers important context missing from much of the mainstream media's coverage of the story. We can't look at these protests in isolation; they exist within the larger structures of institutional racism, not just in Ferguson but in the rest of the country as well. As Melissa Harris-Perry {indicated}<hyperlink=“http://www.huffingtonpost.com/2014/08/16/melissa-harris-perry-black-men-killed-by-police_n_5684588.html?ncid=fcbklnkushpmg00000047&ir=Black+Voices”> on Saturday, a black person has been killed at least twice a week by a white police officer between 2006 and 2012. When it comes to the violence in Ferguson, we need to address the cause of the problem, not just the symptoms.

What did you think about John Oliver's commentary? Let me know on {Twitter}<hyperlink=”https://twitter.com/feministabulous”> and {Facebook}<hyperlink=“https://www.facebook.com/feministabulous”>.  ",NA,NA,NA,NA
Mic,mic3,http://mic.com/articles/95998/days-after-michael-brown-s-death-ferguson-looks-like-a-war-zone#.3HSsY5rz4,"Days After Michael Brown's Death, Ferguson Looks Like a War Zone",Tom McKay,08/12/14,03/31/16,"A vigil held for Michael Brown, an unarmed black teenager {gunned down}<hyperlink=“http://www.stltoday.com/news/local/crime-and-courts/fatal-shooting-by-ferguson-police-prompts-mob-reaction/article_04e3885b-4131-5e49-b784-33cd3acbe7f1.html?utm_medium=twitter&utm_source=twitterfeed”> by Ferguson, Mo., police on Saturday in {disputed circumstances}hyperlink=“http://thedailybanter.com/2014/08/missouri-rages-after-police-shooting-of-unarmed-black-teenager-michael-brown/“>, turned into what the media {described as a riot}hyperlink=“http://legacy.ksdk.com/story/news/local/2014/08/11/looting-reported-at-ferguson-walmart/13884055/“> on Monday evening.

But while national coverage has focused on the indisputably counterproductive violence and destruction committed by Ferguson residents during a moment of anguish, videos and photos taken from the scene show local police aggravating the situation as well.

Monday's riots didn't happen in a vacuum. The Los Angeles Times {reports}<hyperlink=“http://www.latimes.com/nation/nationnow/la-na-nn-michael-brown-ferguson-missouri-shooting-20140811-story.html”> that 48 of the department's 53 officers are white, while 65% of Ferguson is black. {Racial profiling statistics}<hyperlink=“http://ago.mo.gov/VehicleStops/2013/reports/161.pdf” from the Missouri Attorney General's office reveal the community is subject to disproportionate police action on everything from traffic stops and searches to contraband seizures and arrests.

The conflict on Monday wasn't just about Brown, but also the result of years of racial tension given a sudden shove. Likewise, tweets, videos and images from the scene on the ground demonstrate that the authorities in Ferguson did their part maintaining an atmosphere of mutual hostility.

This video caught by CNN shows a white officer telling Ferguson residents to ""bring it, all you fucking animals"":

Other tweets by locals demonstrate how Ferguson police resorted to heavy-handed tactics that helped escalate peaceful protests into a full-blown riot:

[tweetbegin 498723899547197440 tweetend]
[tweetbegin 499015176256233472 tweetend]
[tweetbegin 499019260874981376 tweetend]
[tweetbegin 499013273732542464 tweetend]
[tweetbegin 499003397324828674 tweetend]
[tweetbegin 499018809236533250 tweetend]
[tweetbegin 499051112293355521 tweetend]
[tweetbegin 499013750712569857 tweetend]

One video shot by St. Louis alderman Antonio French appears to show him being threatened by armed police:

Others show how the anger in Ferguson stemmed from deeper issues of power and oppression, as opposed to just one incident.

[tweetbegin 499013325939036160 tweetend]
[tweetbegin 499030781541371905 tweetend]
[tweetbegin 499009119190540288 tweetend]

While the media is focusing on the violent actions of Monday night, Ferguson community members have also taken action in peaceful ways that aren't getting nearly as much coverage.

[tweetbegin 498981077256781824 tweetend]
[tweetbegin 498860178922823681 tweetend]

There's no denying that something turned ugly in Ferguson on Sunday. But what's absolutely clear is the authorities played a role in making that happen, both on the night itself and through years of racially-tinged policing.",NA,NA,NA,NA
Mic,mic4,http://mic.com/articles/96276/the-disturbing-reason-ferguson-police-look-like-soldiers-from-call-of-duty#.qwAEBN185,The Disturbing Reason Ferguson Police Look Like Soldiers From 'Call of Duty',Zak Cheney-Rice,08/14/14,04/06/16,"The news: If you're following the {events in Ferguson}<hyperlink=“http://mic.com/articles/96242/this-is-what-happens-when-the-police-become-the-military#.hVvUM7luG”>, you may be wondering why a group of suburban St. Louis police look like something out of ""Call of Duty: Modern Warfare.""

The answer is simple and more than a little disturbing: The Pentagon is {giving them weapons}<hyperlink=“http://www.usatoday.com/story/opinion/2014/08/13/ferguson-police-michael-brown-militarization-column/14006383/“>.

USA Today reports that the Ferguson police are part of a federal program called ""1033."" Established in the early 1990s, 1033 lets the U.S. government distribute ""hundreds of millions of dollars of surplus military equipment"" to ""civilian police forces"" across the country.

What does this mean? Instead of the traditional gun-and-badge combo, local cops look increasingly like they're ready to storm the beach at Normandy.

It's unclear what war they imagine they'll be waging anytime soon. But it's bad news: Their equipment ranges from handguns and automatic rifles to camouflage gear and armored vehicles, all of which they've prominently displayed at protests throughout the week.

In 2013 alone, USA Today {reports}<hyperlink=“http://www.usatoday.com/story/opinion/2014/08/13/ferguson-police-michael-brown-militarization-column/14006383/“> the Pentagon transferred $449,309,003.71 worth of equipment to police departments nationwide. Cops have received $4.3 billion in ex-military swag since the program launched.

More: The Pentagon does not disclose what equipment it gives which departments. But it does share the county figures, and between 2012 and 2014, police forces in the same county as Ferguson received at least ""advanced rifle sights and night vision equipment.""

Michelle McCaskill of the Defense Logistics Fund tells USA Today that Ferguson received its latest transfer in November. That shipment included ""two vehicles ... a trailer and a generator.""

Background: While no one has explicitly confirmed that Pentagon equipment is being used in Ferguson, the militarization of police arms and tactics there is undeniable.

There's a clear and visible reason why media outlets are comfortable calling the city a “{war zone},hyperlink=“http://mic.com/articles/95998/days-after-michael-brown-s-death-ferguson-looks-like-a-war-zone#.lVOMOv8iW”>” and comparing it to places like Egypt and Iraq:

Additional case in point: {The Wire}<hyperlink=“http://www.thewire.com/national/2014/08/the-pentagon-gave-the-ferguson-police-department-military-grade-weapons/376033/“> quotes an NBC interview where Washington Post reporter Radley Balko says, ""The militarization itself is part of a larger trend ... a willingness or a policy among domestic police"" to use ""more force more often for, you know, petty offenses.""

He adds: ""It is a mentality that sees the people they are supposed to be serving not as citizens with rights but as potential threats.""

Or as Ferguson police might say, “{fucking animals}<hyperlink=“http://www.huffingtonpost.com/2014/08/12/michael-brown-protests_n_5672163.html”>.”

Takeaway: That the murder of 18-year-old Michael Brown sparked protests is reasonable. That local police have responded with tear gas, rubber bullets, combat vehicles and the prominent display of military-grade assault rifles is not.

Fortunately, they won't be doing so much longer: Bloomberg {reports}<hyperlink=“http://www.huffingtonpost.com/2014/08/12/michael-brown-protests_n_5672163.html”> Missouri Gov. Jay Nixon is relieving St. Louis County law enforcement of their duties in Ferguson today.

But the bigger problem of police militarization isn't going away soon. And justice for Mike Brown and his family remains elusive.",NA,NA,NA,NA
Mic,mic5,http://mic.com/articles/95930/anonymous-just-released-this-powerful-video-statement-on-the-michael-brown-shooting#.gnyJNInAI,Anonymous Just Released This Powerful Video Statement on the Michael Brown Shooting,Zak Cheney-Rice,08/11/14,04/06/16,"The news: Internet ""hacktivist"" collective Anonymous has released a {statement}<hyperlink=“http://gawker.com/anonymous-vows-action-over-shooting-death-of-unarmed-te-1619233440?utm_campaign=socialflow_gawker_facebook&utm_source=gawker_facebook&utm_medium=socialflow”> on the Michael Brown shooting.

In the two-minute video posted to {YouTube}<hyperlink”https://www.youtube.com/watch?v=eOSRQ-c1XW0#t=56”> Sunday night, a digitally altered voice delivers a strict list of demands for local police and legislators:

More: The voice {adds}<hyperlink=“https://www.youtube.com/watch?v=eOSRQ-c1XW0#t=56”> a motion of support for citizens of Ferguson, Mo., who've taken to the streets in the past two days to express their dissent over Saturday's shooting. ""To the good people of Ferguson, take heart and take your streets,"" it {says}<hyperlink=“https://www.youtube.com/watch?v=eOSRQ-c1XW0#t=56”>. ""You are not alone.""

It also contains a {warning}<hyperlink=“https://www.youtube.com/watch?v=eOSRQ-c1XW0#t=56”> to local police: ""We are watching you very closely ... If you abuse, harass or harm in any way the protesters in Ferguson we will take every web-based asset of your departments and governments offline. That is not a threat. It is a promise.""

And finally: An {outline}<hyperlink=""https://www.youtube.com/watch?v=eOSRQ-c1XW0#t=56”> of more individualized retribution tactics: ""Attacking the protesters will result in the release of personal information on every single member of the Ferguson police department,"" the voice states. ""[We] will seize all your databases and email spools and dump them on the Internet.

""This is your first and last warning.""

And it turns out Anonymous was completely serious:
[tweetbegin 498844490874888193 tweetend]

""The time has come to draw a line in the sand"": When a local police officer {shot and killed}<hyperlink”http://mic.com/articles/95880/this-18-year-old-s-death-is-everything-wrong-with-america-s-police-force#.1g4rhox6R”> unarmed 18-year-old Michael Brown in Ferguson, Mo. on Saturday afternoon, the city's residents responded in force.
[tweetbegin 498641534615822338 tweetend]

Vigils, protests and civil unrest were met by armored officers from at least 15 local jurisdictions, and a swift Twitter response drew national attention to the incident.

The shooting comes less than a month after New York police officers {choked and killed}<hyperlink=“http://mic.com/articles/94604/this-moment-should-be-the-absolute-last-straw-for-americans-tired-of-police-brutality”> 43-year-old Eric Garner on Staten Island. Both incidents fuel allegations of a nationwide police brutality epidemic that disproportionately targets black men.

U.S. Attorney General {Eric Holder}<hyperlink=“https://twitter.com/mattapuzzo/status/498828591908786178”> and the {NAACP}<hyperlink=“http://thegrio.com/2014/08/10/naacp-fbi-should-investigate-black-teens-death/#ferguson_police_shooting”> have both called on outside monitors to ensure internal investigations into the Ferguson incident remain corruption-free.

Anonymous has a track record for holding authority figures accountable, as evidenced by their famous oversight of the {Steubenville rape case}<hyperlink=“http://mic.com/articles/47177/anonymous-activist-who-exposed-steubenville-rape-could-spend-more-time-in-jail-than-the-rapists#.u1OzjBAPO”> in April 2013. {Gawker}<hyperlink=“http://gawker.com/anonymous-vows-action-over-shooting-death-of-unarmed-te-1619233440?utm_campaign=socialflow_gawker_facebook&utm_source=gawker_facebook&utm_medium=socialflow”> reports they've also launched a website and hashtag and published a {written statement}<hyperlink=“http://gawker.com/anonymous-vows-action-over-shooting-death-of-unarmed-te-1619233440?utm_campaign=socialflow_gawker_facebook&utm_source=gawker_facebook&utm_medium=socialflow”> to amplify action around the Mike Brown shooting.",NA,NA,NA,NA
Mic,mic6,http://mic.com/articles/96554/why-white-people-don-t-seem-to-understand-ferguson-in-one-chart#.Z1M1xapXY,"Why White People Don't Seem to Understand Ferguson, in One Chart",Tom McKay,08/19/14,04/06/16,"The news: In some very discouraging news, almost half of white Americans have put on their color blinders regarding Ferguson, Mo., and the fatal police shooting of Mike Brown. A recent {Pew poll}<hyperlink=“http://www.people-press.org/2014/08/18/stark-racial-divisions-in-reactions-to-ferguson-police-shooting/“> of 1,000 adults has discovered that an astonishing 47% of white Americans think that ""race is getting more attention than it deserves"" on the circumstances of his death, compared to just 18% of black people.

Just 37% of whites said that they thought the ""case raises important issues about race,"" while an overwhelming 80% of black people said they thought the focus on Brown's ethnicity was warranted.

It's one thing to disagree about the circumstances of the shooting death of Mike Brown, but it's another entirely to pretend that the case truly lacks racial implications . Despite sustained protests and {arrest statistics}<hyperlinks=“https://www.washingtonpost.com/politics/even-before-teen-michael-browns-slaying-in-mo-racial-questions-have-hung-over-police/2014/08/13/78b3c5c6-2307-11e4-86ca-6f03cbd15c1a_story.html?hpid=z2”> that prove Ferguson's police department disproportionately targeted the town's black community, four out of 10 whites don't think that the resulting conversation about race and policing deserves as much attention as it's gotten.

It gets worse: Pew found whites were also much less likely to think the police response to Brown's death — which has involved crackdowns on protesters, arresting and harassment of reporters and a calculated attempt to smear Brown by releasing CCTV footage of his involvement in a shoplifting incident — ""has gone too far."" Sixty-five percent of black people were critical of the authorities' response, while as many whites thought it has ""been about right"" or excessive. The largest group of white respondents, 35%, didn't know — either because they haven't been paying attention or haven't given it much thought thereafter.

Whites are also far more confident than black people in the authorities' ability to reach a fair conclusion from their investigation:

In practice, these differing racial perspectives play out in real ways like news coverage. As Mediaite's Andrew Kirell {notes}<hyperlink=“http://www.mediaite.com/tv/this-one-image-sums-up-how-cable-news-covered-ferguson-last-night/“>, FOX News' conservative coverage has been much less focused on the events in Ferguson than its competitors — probably partially because it caters to an {older, whiter audience}<hyperlink”http://www.theatlantic.com/business/archive/2014/01/half-of-fox-news-viewers-are-68-and-older/283385/“> than them.

[tweetbegin 501216617376645121 tweetend]

Why the sharp divide? It's easy to attribute the difference to outright racism and to be clear, that plays a definite role. But mostly, it's likely because black Americans are more sharply aware of racial discrimination in policing because it {disproportionately happens to them}<hyperlink=“http://mic.com/articles/96452/one-troubling-statistic-shows-just-how-racist-america-s-police-brutality-problem-is#.A7MnJuAYM”>. The ACLU {reports}<hyperlink=“https://www.aclu.org/sites/default/files/assets/jus14-warcomeshome-report-web-rel1.pdf”> that SWAT teams are more likely to be used on minority suspects than white ones, while multiple studies have {confirmed}<hyperlink=“http://www.civilrights.org/publications/reports/racial-profiling2011/the-reality-of-racial.html?referrer=http://mic.com/articles/96554/why-white-people-don-t-seem-to-understand-ferguson-in-one-chart”> that racial profiling is rampant across American police departments.

Whites would do well to listen to black people as they continue to speak out in Ferguson because it's clear that many of them don't realize the struggles of being black in America. And the ones that do and don't care are a big part of the problem.",NA,NA,NA,NA
