Source,ArticleID,ArticleLink,Title,Author,DatePublished,DateRetrieved,ArticleText,NumberComments,NumberSocialMedia,TheShitBetween,Notes
Chron,chron16,http://www.chron.com/news/local/article/Report-Texas-law-enforcement-received-millions-5691105.php,Report: Texas law enforcement received millions in unused military gear,Joshua Fechter ,08/15/2014,02/22/2016,"AUSTIN — The recent events in Ferguson, Missouri, have drawn attention to how military grade equipment makes its way into the hands of law enforcement agencies — including those in Texas.

Texas is one of the top five states given unused military equipment by the U.S. Department of Defense, {The Washington Post reports}<hyperlink=”https://www.washingtonpost.com/news/wonk/wp/2014/08/15/florida-alabama-and-texas-are-among-the-most-enthusiastic-recipients-of-surplus-military-gear/”>, receiving almost $94 million worth of gear since 2006 under the department's excess property program.

Police in Ferguson used military grade gear to quell protests after {police allegedly shot and killed 18-year-old Michael Brown, who was unarmed}<hyperlink=”http://www.mysanantonio.com/news/crime/article/Turmoil-tear-gas-give-way-to-hope-in-Ferguson-5690307.php”>.

The Post slugged through records of 243,000 transactions dealing with about 2.8 million individual items doled out by the Defense Department.

Those items include small firearms — such as rifles, pistols and grenade launchers — vehicles, clothing, and other supplies.

The department program originated in the National Defense Authorization Act of fiscal year 1997 as a means to help local law enforcement tackle the war on drugs, {according to the Post}<hyperlink=”http://www.washingtonpost.com/blogs/wonkblog/wp/2014/08/14/the-pentagon-gave-nearly-half-a-billion-dollars-of-military-gear-to-local-law-enforcement-last-year/”>. The law gives preferential treatment to ""those applications indicating that the transferred property will be used in the counter-drug or counter-terrorism activities of the recipient agency.""

Florida has received the most equipment under the program since 2006 at more than $252 million. Alabama comes in second, receiving about $117 million.

California has snagged about $92 million worth of unused military gear and Tennessee accepted about $88 million.

Missouri, the site of the protests, received more than $17 million in equipment under the program.",0,NA,NA,NA
Chron,chron17,http://www.chron.com/bayarea/article/Oakland-rally-protests-Missouri-shooting-5692419.php,"Oakland, Berkeley marchers protest Missouri shooting",Vivian Ho,08/16/2014,02/22/2016,"(08-16) 16:27 PDT BERKELEY -- The events of the last week in Ferguson, Mo., where the fatal police shooting of 18-year-old {Michael Brown}<hyperlink=”http://www.chron.com/search/?action=search&channel=bayarea&inlineLink=1&searchindex=gsa&query=%22Michael+Brown%22”> led to days of protests against heavy-handed police tactics in the St. Louis suburb, continued to reverberate across the country Friday.

More than 100 people marched through the streets of Oakland and Berkeley and on the UC Berkeley campus on Friday evening, protesting police brutality in solidarity with those in Ferguson and calling for justice in the name of Bay Area victims of violence at the hands of law enforcement.

Protesters broke windows and damaged property in both cities.

Two arrests were reported in Oakland. A 45-year-old Oakland man was taken into custody for allegedly assaulting an officer, and a 41-year-old Hayward man was arrested on suspicion of obstructing police.

In Berkeley, police arrested {Taylor Tengwall}<hyperlink=”http://www.chron.com/search/?action=search&channel=bayarea&inlineLink=1&searchindex=gsa&query=%22Taylor+Tengwall%22”>, 24, of Berkeley for allegedly resisting arrest and {Lael Montgomery}<hyperlink=”http://www.chron.com/search/?action=search&channel=bayarea&inlineLink=1&searchindex=gsa&query=%22Lael+Montgomery%22”>, 19, of Vallejo on suspicion of trying to remove a weapon - not a gun - from an officer and resisting an officer. Tengwall was being held at Berkeley City Jail in lieu of $5,000 bail, while Montgomery has posted bail.

{Dana Sabir}<hyperlink=”http://www.chron.com/search/?action=search&channel=bayarea&inlineLink=1&searchindex=gsa&query=%22Dana+Sabir%22”>, 23, of San Leandro said she joined the march ""to show that America will not go for justice anymore, that it's not OK to treat people who are different than you like animals.""

""Something has to change,"" she said between chants for justice for Brown and {Oscar Grant}<hyperlink=”http://www.chron.com/search/?action=search&channel=bayarea&inlineLink=1&searchindex=gsa&query=%22Oscar+Grant%22”>, ""because it keeps happening and happening.""

The march got under way around 7 p.m., heading south on Broadway from {Frank H. Ogawa Plaza}<hyperlink=”http://www.chron.com/search/?action=search&channel=bayarea&inlineLink=1&searchindex=gsa&query=%22Frank+H.+Ogawa+Plaza%22”> with protesters chanting, ""Justice for Michael Brown!"" and ""Hands up! Don't shoot!""

Police presence was heavy, with officers in riot helmets carrying long batons, but the march was mostly peaceful except for several tense moments. Police faced off with protesters near a freeway on-ramp and, at one point, someone discharged a noxious spray, causing many to cough. The origin of the spray was unclear.

Oakland police on scene said they did not use any chemical agents, and several officers were affected by the spray, according to Sgt. {Holly Joshi}<hyperlink=”http://www.chron.com/search/?action=search&channel=bayarea&inlineLink=1&searchindex=gsa&query=%22Holly+Joshi%22”>, chief of staff for Chief {Sean Whent}<hyperlink=”http://www.chron.com/search/?action=search&channel=bayarea&inlineLink=1&searchindex=gsa&query=%22Sean+Whent%22”>. One officer suffered a back injury, she said.

""The majority of protesters were committed to being peaceful. However, there were elements in the crowd intent on committing acts of vandalism and attempting confrontation with officers,"" Joshi said.

Whent said his officers acted with ""tremendous restraint"" and ""exhibited a high level of professionalism.""

As night fell, a few protesters with covered faces pulled out paint cans and hammers and sprayed antipolice graffiti on buildings along the march route and broke some windows of businesses on Telegraph Avenue.

Drivers along the way, sitting in cars blocked by the marchers, honked in support, eliciting cheers from the crowd. At one point, aerial fireworks were set off near 14th Street and Broadway, bringing more whoops and hollers from the rowdy protesters.

When one masked protester tried to spray paint on the window a restaurant, 53-year-old {Ralph Guerra}<hyperlink=”http://www.chron.com/search/?action=search&channel=bayarea&inlineLink=1&searchindex=gsa&query=%22Ralph+Guerra%22”> ran at him, telling him to stop.

For his efforts, protesters poured liquid down his back. ""Smells like urine,"" Guerra said, but it had the strong burn of alcohol.

""These people are just local business people,"" Guerra said. ""Like over there, Youth Radio? They broke their windows last time. They're a nonprofit. They're not trying to hurt anybody.""

Guerra is a plumber who services local Oakland businesses. He said he had an equal beef with the police not doing more to stop the vandalism.

""That?"" he said, gesturing to a helicopter above. ""That's not helping anybody. They're spending millions of dollars, but what are they doing?""

The march was billed as a ""F- the Police"" action by organizers, but ""FTP"" meant different things to different people.

{Patricia Williams}<hyperlink=”http://www.chron.com/search/?action=search&channel=bayarea&inlineLink=1&searchindex=gsa&query=%22Patricia+Williams%22”>, 17, of Oakland said ""FTP"" for her and many others meant ""For the People.""

""We're standing up for ourselves,"" she said.",0,NA,NA,NA
Chron,chron18,http://www.chron.com/default/article/Obama-Makes-Statement-On-Heartbreaking-Police-5684579.php,Obama Makes Statement On 'Heartbreaking' Police Shooting That Led To Riots In Missouri,Hunter Walker,08/12/2014,02/22/2016,"President Barack Obama issued a statement Tuesday responding to the fatal shooting of an African-American teenager Michael Brown by police in Ferguson, Missouri on Saturday. Obama called the incident ""heartbreaking"" and alluded to the riots that subsequently {engulfed the town}<hyperlink=”http://www.businessinsider.com/ferguson-mo-michael-brown-shooting-2014-8?utm_source=hearst&utm_medium=referral&utm_content=allverticals”> by calling on people to respond ""in a way that heals, not in a way that wounds.""

""The death of Michael Brown is heartbreaking, and Michelle and I send our deepest condolences to his family and his community at this very difficult time. As Attorney General Holder has indicated, the Department of Justice is investigating the situation along with local officials, and they will continue to direct resources to the case as needed,"" said Obama. ""I know the events of the past few days have prompted strong passions, but as details unfold, I urge everyone in Ferguson, Missouri, and across the country, to remember this young man through reflection and understanding. We should comfort each other and talk with one another in a way that heals, not in a way that wounds. Along with our prayers, that’s what Michael and his family, and our broader American community, deserve.""

Police have said Brown, who was 18-years-old and unarmed, assaulted an officer before his death. On Monday evening, police {fired rubber bullets and tear gas}<hyperlink=”http://www.businessinsider.com/ferguson-missouri-has-turned-into-a-war-zone-2014-8?utm_source=hearst&utm_medium=referral&utm_content=allverticals”> at members of the largely African-American community who were protesting over Brown's death.",0,NA,NA,NA
Chron,chron19,http://www.chron.com/opinion/outlook/article/Pitts-First-Amendment-suspended-in-recent-police-5693135.php,Pitts: First Amendment suspended in recent police brutality, Leonard Pitts Jr. ,08/16/2014,02/24/2016,"Looks like police in Ferguson, Mo., took it upon themselves to suspend the First Amendment on Wednesday night.

It seems two reporters, {Ryan Reilly}<hyperlink=”http://www.chron.com/search/?action=search&channel=opinion%2Foutlook&inlineLink=1&searchindex=gsa&query=%22Ryan+Reilly%22”> of the {Huffington Post}<hyperlink=”http://www.chron.com/search/?action=search&channel=opinion%2Foutlook&inlineLink=1&searchindex=gsa&query=%22Huffington+Post%22”>  and {Wesley Lowery}<hyperlink=”http://www.chron.com/search/?action=search&channel=opinion%2Foutlook&inlineLink=1&searchindex=gsa&query=%22Wesley+Lowery%22”> of the Washington Post, were working at a McDonald's, which has been used as a staging ground by reporters covering the ongoing unrest following the Aug. 9 police shooting of an unarmed African-American man. According to their accounts, the two were accosted by police, some in militaristic riot gear, demanding identification and ordering them out. These officers refused to provide their badge numbers or names or a reason for the order and grew angry when one of the men attempted to take a video.

Both reporters were arrested. Reilly says a cop intentionally banged his head against the glass on the way out of the restaurant, then gave him a facetious ""apology.""

The two were transported to a lockup. No mug shots were taken, no fingerprints collected, no paperwork done. After some minutes, they were released. The men were told they'd been arrested for ""trespassing.""

At a McDonald's. Where they were customers.

""Apparently, in America, in 2014,"" tweeted Lowery, ""police can manhandle you, take you into custody, put you in cell and then open the door like it didn't happen.""

Actually, both men had been treated with a heavy-handedness and official contempt that are apparently all too familiar to black people in Ferguson - and to black and poor people of whatever tribe all over America. In arresting reporters for reporting, Ferguson police raise a pressing question: Just what are they trying to hide?

The same night Reilly and Lowery were handcuffed, after all, a local alderman who had posted video of the protests to social media was arrested. All last week, we had reports of news photographers being ordered to stop taking pictures and reporters being tear-gassed. One officer reportedly took a TV camera and pointed it to the ground. Add to this police refusal until six days after the incident to name the officer who shot 18-year-old {Michael Brown}<hyperlink=”http://www.chron.com/search/?action=search&channel=opinion%2Foutlook&inlineLink=1&searchindex=gsa&query=%22Michael+Brown%22”>, and the picture that emerges is not one of transparency.

At least three witnesses have now disputed the official version of what happened, the tale of how Brown inexplicably shoved a police officer back inside the officer's car, and they wrestled for the officer's gun. One witness, {Dorian Johnson}<hyperlink=”http://www.chron.com/search/?action=search&channel=opinion%2Foutlook&inlineLink=1&searchindex=gsa&query=%22Dorian+Johnson%22”>, said he was walking in the street with Brown toward Brown's grandmother's apartment when the officer, who was in his car, commanded them to ""get the eff"" out of the street. The street in question, to judge from television images, is a quiet one. We're not talking Broadway at rush hour.

Johnson said the officer reached out of the car and grabbed Brown when the struggle ensued, the two men wrestling through the car window as a shot was fired. Then the officer got out. Another witness, {Tiffany Mitchell}<hyperlink=”http://www.chron.com/search/?action=search&channel=opinion%2Foutlook&inlineLink=1&searchindex=gsa&query=%22Tiffany+Mitchell%22”>, said Brown had broken away and was facing the officer with hands up when he was shot.",37,NA,NA,NA
Chron,chron20,http://www.chron.com/news/houston-texas/article/Houstonians-honor-slain-Missouri-teen-shot-by-5690079.php,Houstonians honor slain Missouri teen shot by police,Dana Thompson,08/14/2014,02/24/2016,"Hundreds of miles away from the racial tension in the St. Louis area, a crowd of Houstonians spoke out against the police shooting of an unarmed teenager on Thursday.

A vigil at MacGregor Park drew dozens. It was a far cry from the violent protests earlier this week in Ferguson, Missouri. Photos from the gathering hit social media on Thursday night. 

The vigil in Houston was one of several across the nation on Thursday, as crowds took part in a ""National Moment of Silence."" The movement — promoted by a hashtag, #NMOS14, on social media — came one day after disturbing photos and videos from the violence in Ferguson drew outrage.

Michael Brown, a black 18-year-old, was fatally shot on Saturday by a white police officer. The killing sparked a firestorm in the Missouri town.

Ferguson is nearly 70 percent black and is patrolled by a nearly all-white police force.

The Missouri Highway Patrol seized control of the St. Louis suburb on Thursday, the Associated Press reported. Local police were stripped of their law-enforcement authority after four days of clashes between officers in riot gear and furious crowds.

For the first time since the crisis erupted, President Obama weighed in on the protests Thursday, saying there was ""no excuse"" for violence either against the police or by officers against peaceful protesters.",90,NA,NA,NA
Chron,chron21,http://www.chron.com/default/article/Here-s-When-Cops-Are-Justified-In-Using-Force-5698507.php,Here's When Cops Are Justified In Using Force Against Protesters,Drake Baer,08/19/2014,02/24/2016,"Ferguson, Missouri, {is chaotic once again}<hyperlink=”http://www.businessinsider.com/ferguson-protests-police-tear-gas-michael-brown-shooting-death-2014-8?utm_source=hearst&utm_medium=referral&utm_content=allverticals”>, more than a week after a police officer shot and killed Michael Brown, a black 18-year-old who was unarmed. 

After a few nights of relative peace, tear gas and stun grenades are part of the news as protestors assemble and police disperse them. 

This onslaught of chaos raises the question of when and how police officers should use force. 

Within the police studies community, it's agreed that every encounter between police and citizen is ""defined by the potential for the officer to use force,"" Mike White, a criminologist at Arizona State University, tells Business Insider. ""For the citizen, for the officer — (force) is an underlying theme."" 

Yet while the specter of force is always present, it's rarely used in the United States. The U.S. Bureau of Justice Statistics {has found}<hyperlink=”http://www.bjs.gov/index.cfm?ty=dcdetail&iid=251”> that force is only used in 2% of all police-citizen encounters. In the case of encounters that result in arrests, that number bumps up to 20% of the time. 

So what's happening in Ferguson? 

""When things are about to boil over,"" White says, the appropriate tactic is ""a show of force rather than use of force.""

This translates as a police presence, which he says acts as ""a visual deterrent"" to violence, looting, and other criminal acts that can happen when frustrated people gather.  

Cops are taught what level of force to use by their police departments, usually decided on as a state policy. White says most of the time this policy is taught as a ""use of force continuum,"" which the National Institute of Justice {defines as}<hyperlink=”http://www.nij.gov/topics/law-enforcement/officer-safety/use-of-force/Pages/continuum.aspx”> ""an escalating series of actions an officer may take to resolve a situation.""

Here's {the NIJS example of the appropriate use of force}<hyperlink=”http://www.nij.gov/topics/law-enforcement/officer-safety/use-of-force/Pages/continuum.aspx”>: 

• Officer Presence: No force is used• Verbalization: Force is non-physical.• Empty-Hand Control: Officers use bodily force to gain control of a situation.• Less-Lethal Methods: Officers use less-lethal technologies to gain control of a situation.• Lethal Force: Officers use lethal weapons to gain control of a situation. 

White says the point is to use the ""least amount of force necessary to accomplish the objective, usually to resolve police-citizen encounter peacefully.""

In Ferguson, the use of force has escalated with the behavior of the crowds. University of Missouri-St. Louis criminologist David Klinger says that if protesters are throwing Molotov cocktails, bricks, and rocks — as has {reportedly been the case in Ferguson}<hyperlink=”http://www.businessinsider.com/ferguson-protests-police-tear-gas-michael-brown-shooting-death-2014-8?utm_source=hearst&utm_medium=referral&utm_content=allverticals”> — then using higher degrees of force is appropriate. 

But ""some of it doesn't make any sense to me,"" he says, ""like pointing lethal rifles at the crowd — there's things (that the police in Ferguson) are doing that have me and my colleagues scratching our heads."" 

Another element in the escalation: how militarized the police have become,{a topic that Business Insider has dived into here}<hyperlink=”http://www.businessinsider.com/police-militarization-ferguson-2014-8?utm_source=hearst&utm_medium=referral&utm_content=allverticals”>. ",0,NA,NA,NA
Chron,chron22,http://www.chron.com/default/article/The-Unnerving-Precedent-Of-Using-The-National-5698825.php,The Unnerving Precedent Of Using The National Guard To Quell Civil Unrest,Jeremy Bender,08/19/2014,02/24/2016,"Missouri Governor Jay Nixon announced early Monday that he was {bringing}<hyperlink=”http://www.nytimes.com/2014/08/20/us/ferguson-missouri-protests.html?_r=0”> in troops from the Missouri National Guard to help contain demonstrations that have at times turned violent in the Saint Louis suburb of Ferguson. 

Bringing in the National Guard — which is an actual military force — may do little to help quell the ongoing civil unrest. Protesters and outside observers continue to be outraged over the Ferguson Police Department's use of military-grade equipment to deal with protesters who are mostly unarmed.

However, there is a long history in the United States of governors, and at times even the president, deploying the National Guard to help put down riots or seemingly uncontrollable demonstrations. Events in Ferguson are an echo of some of the tensest moments of the Civil Rights Movement — and hearken back to some of the most notorious moments in recent American history.

Here are the most noteworthy deployments of National Guard troops throughout the U.S. in recent decades: 

1957: Little Rock, Arkansas: President Dwight D. Eisenhower, in a historic move, federalized the National Guard and deployed them to a southern state for the first time since the Civil War. The troops were used to forcefully integrate Little Rock Central High School and protect black students from rioters. 

1962: Oxford, Mississippi: President John F. Kennedy followed his predecessor's lead and federalized the Mississippi National Guard to prevent violence against the first black students attending the University of Mississippi. 

1964: Rochester, New York: Governor Nelson Rockefeller called in the New York National Guard to put down riots that started after allegations of police brutality surfaced in the city.

1965: Selma, Alabama: President Lyndon Johnson federalized the Alabama National Guard in order to protect peaceful civil rights protesters marching from Selma to Montgomery. A previous attempt at a march had ended with police brutally beating protesters. 

1968: Detroit, Michigan; Chicago, Illinois; and 

Washington, D.C.: President Johnson federalized the Michigan, Illinois, and District of Colombia's National Guards in response to riots that erupted following the assassination of Martin Luther King Jr. National Guard troops under state control were also sent to several other major metropolitan areas in order to respond to the civil unrest after King death. 

1970: Kent, Ohio: Ohio Governor James Rhodes sent the National Guard to Kent State University to quell a series of anti-Vietnam protests on the campus. The deployment of the guard led to the infamous Kent State massacre, in which four students were killed after the troops opened fire. 

1992: Los Angeles, California: Riots erupted in Los Angeles after the acquittal of police officers who were videotaped brutally beating Rodney King. President George H. W. Bush federalized the California Army and Air National Guards in an attempt to end the riots and bring order to the city. 

1993: Waco, Texas: During the siege of the Branch Dravidian compound in Waco, Texas, elements of the Alabama and Texas National Guard were called in to assist operations being conducted by the ATF and the FBI. The compound burned down under controversial circumstances, and 91 people were killed in the standoff.

1999: Seattle, Washington: Governor Gary Locke called in the Washington National Guard in an attempt to restore order in the face of massive riots during a World Trade Organization meeting. ",0,NA,NA,NA
