Source,ArticleID,ArticleLink,Title,Author,DatePublished,DateRetrieved,ArticleText,NumberComments,NumberSocialMedia,TheShitBetween,Notes
Chron,chron9,http://www.chron.com/default/article/ERIC-HOLDER-The-Amount-Of-Sensitive-Information-5696591.php,ERIC HOLDER: The Amount Of Sensitive Information That's Been Released About Michael Brown Is 'Troubling',Brett LoGiurato,08/18/2014,02/17/2016,"""U.S. Attorney General Eric Holder said Monday evening that he was troubled by the amount of """"sensitive"""" information pertaining to the fatal Aug. 9 shooting of 18-year-old Michael Brown that he said has been """"selectively released"""" over the past week. 

Holder's sentiment came as part of a lengthy statement updating the status of the federal civil rights investigation into the shooting, which took place in the St. Louis suburb of Ferguson, Missouri. He urged patience from the public on the federal investigation, which he said would take time to complete.

""""I realize there is tremendous interest in the facts of the incident that led to Michael Brown’s death, but I ask for the public’s patience as we conduct this investigation. The selective release of sensitive information that we have seen in this case so far is troubling to me,"""" said Holder, who {President Barack Obama announced would travel to Ferguson on Wednesday}<hyperlink=”http://www.businessinsider.com/obama-statement-ferguson-protests-iraq-michael-brown-2014-8?utm_source=hearst&utm_medium=referral&utm_content=allverticals”>.

""""No matter how others pursue their own separate inquiries, the Justice Department is resolved to preserve the integrity of its investigation. This is a critical step in restoring trust between law enforcement and the community, not just in Ferguson, but beyond.""""

Ferguson has been the {site of racially charged protests}<hyperlink=”http://www.businessinsider.com/state-of-emergency-declared-in-ferguson-2014-8?utm_source=hearst&utm_medium=referral&utm_content=allverticals”> since the Aug. 9 shooting of Brown by Ferguson police officer Darren Wilson. Clashes between protesters and police had calmed as the week {progressed but ramped up again over the weekend}<hyperlink=”http://www.businessinsider.com/ferguson-protests-mike-brown-shooting-curfew-2014-8?utm_source=hearst&utm_medium=referral&utm_content=allverticals”>.

Holder said the Justice Department began conducting its federal autopsy of Brown's body on Monday, which he said was being performed by """"one of the most experienced medical examiners in the United States military."""" Holder announced Sunday that the federal government would conduct its own autopsy, hours before Brown's family released an autopsy conducted on their behalf. That autopsy showed Brown was {shot at least six times, including at least twice in the head}<hyperlink=”http://www.businessinsider.com/michael-brown-ferguson-arrest-autopsy-2014-8?utm_source=hearst&utm_medium=referral&utm_content=allverticals”>.

Holder also said that as part of the investigation, more than 40 FBI agents continued conducting new interviews and canvassing the neighborhood where Brown was shot. Holder said that as part of his trip to Ferguson on Wednesday, he intends to meet with FBI investigators and other federal law-enforcement officials.

Two days ahead of his trip, Holder urged calm from both law-enforcement officials and protesters in Ferguson. """,0,NA,NA,NA
Chron,chron10,http://www.chron.com/default/article/Taser-Shares-Are-Going-Nuts-And-Analysts-Are-5696330.php,Shares Of The Company That Makes Wearable Police Cameras Go Bonkers Again (TASR),Myles Udland,08/19/2014,02/17/2016,"""Shares of TASER International rallied for the third straight day on Tuesday, climbing 9% as Ferguson, Missouri officials announced they would raise funds to secure dash and vest cams for Ferguson police officers.

TASER International makes wearable police cameras, and in the last five trading days, the stock has gained 30%.

A {Bloomberg report last Friday}<hyperlink=”http://www.bloomberg.com/news/articles/2014-08-15/taser-gains-as-shooting-spurs-calls-for-police-cameras”> quoted an analyst who said that shares of TASER were trading higher on speculation that more officers will be wearing cameras, saying the advance is, """"directly related to what's happening in Missouri.""""

On Monday, TASER shares gained 5%, which followed a more than 9% gain on Friday. 

Tuesday's advances comes after an announcement by Ferguson officials, {posted by The Wire}<hyperlink=”http://www.thewire.com/national/2014/08/city-of-ferguson-pledges-to-foster-diverse-police-force-and-vest-cameras/378778/”>, comes after {another tough night in Ferguson on Monday}<hyperlink=”http://www.businessinsider.com/ferguson-protests-police-tear-gas-michael-brown-shooting-death-2014-8?utm_source=hearst&utm_medium=referral&utm_content=allverticals”>, which saw police fire several rounds of tear gas and stun grenades into a crowed of protestors.""",0,NA,NA,NA
Chron,chron11,http://www.chron.com/default/article/Tear-Gas-Can-Cause-Deaths-Amputations-and-5698989.php,"Tear Gas Can Cause Deaths, Amputations, and Miscarriages",Ben Winsor,08/19/2014,02/17/2016,"Despite frequent use in Egypt, Turkey, Palestine, Bahrain, and now Ferguson, Missouri, only limited research has been done on the potentially lethal effects of the neurotoxins found in tear gas.

Of the studies that have been done, doctors note that most cases of tear gas exposure result in only {temporary side effects}<hyperlink=”http://www.ncbi.nlm.nih.gov/pubmed/24379300”>, though some cases {can result in severe complications}<hyperlink=”http://www.ncbi.nlm.nih.gov/pmc/articles/PMC1343325/”>, including death.

How it feels to be tear gassed

The most common form of tear gas — and the one {fired on TV crews}<hyperlink=”http://www.businessinsider.com/police-fire-tear-gas-on-al-jazeera-america-tv-crew-and-then-take-their-equipment-2014-8?utm_source=hearst&utm_medium=referral&utm_content=allverticals”> and protestors in Ferguson — is known as CS. The compound, actually a solid suspended in liquid droplets, is a nerve agent that works by switching on pain receptors, which tell your brain when something hurts.

After 20 seconds of exposure, protestors in Ferguson would have experienced a tightening in the chest and painful stinging in the nose and eyes, {according to the Journal of the Royal Society of Medicine}<hyperlink=”http://www.ncbi.nlm.nih.gov/pmc/articles/PMC539444/”>. People who are tear-gassed have a burning sensation in their throats and cough, wretch, and sometimes vomit.

Business Insider's politics editor, Hunter Walker, who was hit with tear gas while covering 'Occupy Oakland' protests in 2011, describes being ""suddenly gripped by a pain so intense, I nearly fell to my knees.""

""The most overwhelming aspect of the pain was an intense tightness in my chest. It felt like my heart might burst or collapse into itself and it was so bad I thought I might be having a serious medical issue,"" he {wrote}<hyperlink=”http://www.businessinsider.com/this-is-what-its-like-to-get-tear-gassed-2014-8?utm_source=hearst&utm_medium=referral&utm_content=allverticals#ixzz3AriRxUnQ”>.

When tear gas and smoke is fired from canisters, there's also a risk of serious injury if protestors are hit with the canisters.

An {Iranian study}<hyperlink=”http://www.ncbi.nlm.nih.gov/pubmed/23365472”> during protests in 2008 and 2009 found that canister impacts caused 18 cases of severe bleeding and fractures, leading to at least three amputations. They aren't small and can explode after hitting the ground.

An American made tear gas canister fired by Israel in Palestine

What to do if tear gassed

Medical professionals dealing with tear gassed patients have no specific antidote for the toxins used — all they can do is get them out of the area and wash the gas from their eyes and other affected areas using sterile saline. If the patients are injured in other ways, doctors run into trouble when performing surgery — the swelling in the throat can make it {impossible to intubate them}<hyperlink=”http://www.ncbi.nlm.nih.gov/pubmed/11183362”>, so they can't breathe if they need to be sedated.

Palestinian activists give advice to Furguson protesters over Twitter

After police in Ferguson fired the gas on protestors last week, activists in Palestine offered advice on twitter:

""Keep calm when you're teargassed, the pain will pass, don't rub your eyes!"" West Bank resident Mariam Barghouti tweeted.

Doctors advise immediately moving as far away from the gas as possible to minimize exposure.

If you are hit with tear gas, take out your contact lenses and use lots of saline or water to rinse affected areas. Not rinsing thoroughly can spread the chemicals further.

After mild exposure, symptoms should subside after 10 to 15 minutes, but after moderate or high exposure, symptoms can take several hours to die down. Skin irritations and breathing difficulties can last days, and you should seek further treatment.

When someone isn't at the top of their health game, the effects of tear gas can be way worse. Children, the elderly, women who are pregnant, or anyone with an underlying respiratory illness or heart condition should seek medical attention as soon as possible after being hit.

After widespread use of tear gas on protestors in Bahrain in 2012, the international human rights group, Physicians for Human Rights, {reported}<hyperlink=”http://physiciansforhumanrights.org/press/press-releases/bahrain-uses-tear-gas-as-lethal-weapon.html?referrer=http://www.chron.com/default/article/Tear-Gas-Can-Cause-Deaths-Amputations-and-5698989.php”> that several women miscarried after exposure, and one asthmatic man died.

In August 2013, Egyptian police killed 37 prisoners after {firing tear gas into a loaded van}<hyperlink=”http://www.businessinsider.com/r-egypt-court-cancels-jail-sentence-against-policeman-linked-to-39-deaths-2014-07?utm_source=hearst&utm_medium=referral&utm_content=allverticals”>, causing the victims to suffocate in excruciating pain. Four police officers, including a Lieutenant Colonel, were convicted of manslaughter over the incident.

Cairo, Egypt protests clashes tear gas

Unknown consequences

Dr Vincent Iacopino from Physicians for Human Rights told Business Insider the long term effects of tear gas remain unknown.

""It is important to understand that, in many countries, large populations have been exposed to significant levels of tear gas for periods of days to weeks. The long term effects of such long-term exposures have not been studied,"" he said.

Iacopino did tell us that tear gas can be used safely, but ""the fact that it is commonly misused increases the possibility of severe injuries and/or death.""

The compounds used in tear gas were developed during the First World War and used alongside other more deadly chemical weapons, such as mustard gas and chlorine.

The effects of the chemical warfare were so horrific that many of the nations which deployed them in the First World War had agreed on a ban, the Geneva Gas-War Protocol, by the time the Second World War flared in 1939.

Tear gas is banned under the 1993 international Chemical Weapons Convention which has been adopted by by 190 countries including the United States, however, the treaty only covers international conflict, and not domestic use.",0,NA,NA,NA
Chron,chron12,http://www.chron.com/opinion/outlook/article/Pitt-Ferguson-riots-can-t-be-condoned-but-can-5689496.php,"Pitt: Ferguson riots can't be condoned, but can be understood",Leonard Pitts Jr ,08/14/2014,02/17/2016,"Leonard Pitts Jr. says this week's violence in Ferguson, Mo., is about the bitter sense that it is always open season on African-American males.

A riot can be many things.

It can be an act of communal madness, reflecting the emotional imbecility of those who believe the best way to express joy at their ball team's win is to overturn a car.

It can be an act of opportunism, a chance, under cover of darkness, influence of chaos, suspension of order, to smash and grab and run away, arms heavy with loot.

And it can be an act of outcry, a scream of inchoate rage.

That's what happened this week in Ferguson, Missouri. The people screamed.

To believe that this carnage - the windows smashed, the buildings torched, the tear gas wafting - is all about the killing of {Michael Brown}<hyperlink=”http://www.chron.com/search/?action=search&channel=opinion%2Foutlook&inlineLink=1&searchindex=gsa&query=%22Michael+Brown%22”> is to miss the point. Brown, of course, was the unarmed 18-year-old African-American man shot multiple times by a Ferguson police officer on Saturday.

St. Louis County Police Chief Jon Belmar - Ferguson Police asked his department, as an outside agency, to investigate the shooting (the Missouri governor on Thursday relieved the St. Louis County police of their Ferguson policing duties) - has said Brown was walking with another individual when a so-far unnamed officer sitting in a police car, stopped him. According to Belmar, the officer was trying to get out of his car when one of the two individuals pushed him back inside, where there was a struggle over the officer's weapon and at least one shot was discharged. He says the officer came out of the car and fired, striking Brown, who was about 35 feet away, multiple times.

Witnesses say Brown, who was to have started college this week, had his hands up when he was shot. Police have not said why the officer felt the need to stop him in the first place.

Details are still too sketchy for us to draw hard conclusions about what happened that afternoon. But it is all too easy to understand what happened afterward and why good people should be paying attention.

Because, again, this is not just about Brown. It's about {Eric Garner}<hyperlink=”http://www.chron.com/search/?action=search&channel=opinion%2Foutlook&inlineLink=1&searchindex=gsa&query=%22Eric+Garner%22”>, choked to death in a confrontation with New York City Police. It's about {Jordan Davis}<hyperlink=”http://www.chron.com/search/?action=search&channel=opinion%2Foutlook&inlineLink=1&searchindex=gsa&query=%22Jordan+Davis%22”>, shot to death in Jacksonville, Fla., because he played his music too loud. It's about {Trayvon Martin}<hyperlink=”http://www.chron.com/search/?action=search&channel=opinion%2Foutlook&inlineLink=1&searchindex=gsa&query=%22Trayvon+Martin%22”>, shot to death in Sanford, Fla., because a self-appointed neighborhood guardian judged him a thug. It's about {Oscar Grant}<hyperlink=”http://www.chron.com/search/?action=search&channel=opinion%2Foutlook&inlineLink=1&searchindex=gsa&query=%22Oscar+Grant%22”>, shot by a police officer in an Oakland, Calif., subway station as cellphone cameras watched. It's about {Amadou Diallo}<hyperlink=”http://www.chron.com/search/?action=search&channel=opinion%2Foutlook&inlineLink=1&searchindex=gsa&query=%22Amadou+Diallo%22”>, executed in that vestibule and {Abner Louima}<hyperlink=”http://www.chron.com/search/?action=search&channel=opinion%2Foutlook&inlineLink=1&searchindex=gsa&query=%22Abner+Louima%22”>, sodomized with that broomstick. It's about {Rodney King}<hyperlink=”http://www.chron.com/search/?action=search&channel=opinion%2Foutlook&inlineLink=1&searchindex=gsa&query=%22Rodney+King%22”>.

And it is about the bitter sense of siege that lives in African-American men, a sense that it is perpetually open season on us.

And that too few people outside of African America really notice, much less care. People who look like you are every day deprived of health, wealth, freedom, opportunity, education, the benefit of the doubt, the presumption of innocence, life itself - and when you try to say this, even when you document it with academic studies and buttress it with witness testimony, people don't want to hear it, people dismiss you, deny you, lecture you about white victimhood, chastise you for playing a so-called ""race card.""

They choke off avenues of protest, prizing silence over justice, mistaking silence for peace. And never mind that sometimes, silence simmers like water in a closed pot on a high flame.

One can never condone a riot. It is a self-defeating act that sells some fleeting illusion of satisfaction at a high cost in property and life.

But understanding this does not preclude recognizing that the anger we see in Ferguson did not spring from nowhere, nor arrive, fully formed, when Michael Brown was shot. It is the anger of people who are, as {Fannie Lou Hamer}<hyperlink=”http://www.chron.com/search/?action=search&channel=opinion%2Foutlook&inlineLink=1&searchindex=gsa&query=%22Fannie+Lou+Hamer%22”> famously said, sick and tired of being sick and tired.

Silence imposed on pain cannot indefinitely endure. People who are hurting will always, eventually, make themselves heard.

Even if they must scream to do so.",33,NA,NA,NA
Chron,chron13,http://www.chron.com/default/article/Members-Of-Congress-Want-Hearings-To-Ask-Whether-5689717.php,Members Of Congress Want Hearings To Ask Whether 'Local Law Enforcement Is Out Of Control',Hunter Walker,08/14/2014,02/17/2016,"Three members of the House Judiciary Committee sent a letter to Chairman Bob Goodlatte on Thursday asking him to hold hearings on a series of issues related to local law enforcement in the wake of the {controversial police response to protests in Ferguson, Missouri this week}<hyperlink=”http://www.businessinsider.com/ferguson-police-chief-freaked-after-cops-arrested-reporters-2014-8?utm_source=hearst&utm_medium=referral&utm_content=allverticals”>. In their letter, Rep. John Conyers (D-Michigan), Rep. Bobby Scott (D-Virginia), and Rep. Steve Cohen (D-Tennessee) said the situation in Ferguson raised the question of whether ""local law enforcement is out of control.""

""For five days the citizens of Ferguson have protested the killing of an unarmed teenager by local police. Last night, law enforcement broke up the protest with brutal force: confronting demonstrators in riot gear and armored vehicles, arresting journalists, and firing tear gas and rubber bullets into the crowds,"" the congressmen wrote. ""These incidents raise concerns that local law enforcement is out of control and, instead of protecting the safety and civil liberties of the residents of Ferguson, is employing tactics that violate the rights of citizens and hinder the ability of the press to report on their actions.""

Conyers, Scott, and Cohen cited three isusues they said were highlighted by the situation in Ferguson.

Firstly, they said the killing of 18-year-old Michael Brown on Saturday, which started the protests, was part of ""a continuing pattern of the use of deadly force by police against unarmed African Americans."" Secondly, they pointed to what they described as a ""series of troubling arrests in Ferguson."" Specifically, the congressmen pointed to the arrests of two reporters and an alderman from St. Louis, Missouri on Wednesday evening. However, in addition to these three specific incidents, they cited reports they described as having raised ""questions about the legitimacy of all arrests made during the course of these protests. Lastly, the congressman said Ferguson has highlighted the need to ""address the extensive militarization of state and local police.""

""The use of overwhelming force by police against unarmed citizens requires our urgent attention,"" the congressmen wrote. ""It is imperative the Committee convene to examine these issues as soon as possible.""

Read a full copy of Conyers, Scott, and Cohen's letter to Goodlatte below.",0,NA,NA,NA
Chron,chron14,http://www.chron.com/news/local/article/Local-demonstrators-protest-police-brutality-5690158.php,Local demonstrators protest police brutality,Mark D. Wilson,08/14/2014,02/22/2016,"SAN ANTONIO — More than 100 people gathered in downtown San Antonio Thursday evening to protest police brutality and stand in solidarity with citizens of Ferguson, Missouri.

With their hands in the air and holding signs reading “Don't shoot me” and “Pray for Ferguson,” activists marched to Public Safety Headquarters chanting, “The whole system is guilty!”

The National Moment of Silence, a grassroots effort to bring awareness to the death of {Michael Brown}<hyperlink=”http://www.chron.com/search/?action=search&channel=news%2Flocal&inlineLink=1&searchindex=gsa&query=%22Michael+Brown%22”>, an unarmed teen shot by Ferguson police, and other similar cases across the United States, was held in an estimated 90 cities nationwide Thursday night, said organizer {Margarita McAuliffe}<hyperlink=”http://www.chron.com/search/?action=search&channel=news%2Flocal&inlineLink=1&searchindex=gsa&query=%22Margarita+McAuliffe%22”>.

“There have been far too many killings at the hands of police,” she said. “It is an epidemic.”

McAuliffe said she hopes to raise awareness on what she described as the militarization of America's police and a culture that reinforces it.

San Antonio Police Department Spokesman {Javier Salazar}<hyperlink=”http://www.chron.com/search/?action=search&channel=news%2Flocal&inlineLink=1&searchindex=gsa&query=%22Javier+Salazar%22”> said SAPD's special operations teams have reasons for functioning the way they do.

“Everything that our special operations teams do has a sound tactical reason behind it. Many of these are rooted in officer safety and public safety,” he said. “From an officer's very beginnings in the academy, the use of force policies are taught and reinforced on a constant basis. Our officers are always taught to use only the force that is necessary to make an arrest.”

Still, many demonstrators said they feel police exercise their powers too heavily, alluding to cases like the death of {Cameron Redus}<hyperlink=”http://www.chron.com/search/?action=search&channel=news%2Flocal&inlineLink=1&searchindex=gsa&query=%22Cameron+Redus%22”>, who was gunned down by a {University of the Incarnate Word}<hyperlink=”http://www.chron.com/search/?action=search&channel=news%2Flocal&inlineLink=1&searchindex=gsa&query=%22University+of+the+Incarnate+Word%22”> police officer last year. Others turned their attention to Ferguson.

“The life of {Mike Brown}<hyperlink=”http://www.chron.com/search/?action=search&channel=news%2Flocal&inlineLink=1&searchindex=gsa&query=%22Mike+Brown%22”> being snatched away is something that everyone should be worried about,” said {Mike Lowe}<hyperlink=”http://www.chron.com/search/?action=search&channel=news%2Flocal&inlineLink=1&searchindex=gsa&query=%22Mike+Lowe%22”>, adding he knows how it feels to be profiled by police.

“Any time I can stand with the masses and give a voice to the voiceless I will,” he said.",0,NA,NA,NA
Chron,chron15,http://www.chron.com/news/article/IfTheyGunnedMeDown-hashtag-goes-viral-in-the-5684202.php,#IfTheyGunnedMeDown hashtag goes viral in the wake of Brown shooting in Missouri,Craig Hlavaty ,08/13/2014,02/22/2016,"Right now on Twitter the hashtag #IfTheyGunnedMeDown is sparking conversation among Twitter users. The tag has come to prominence in the days since the shooting death of Michael Brown Jr. in Ferguson, Missouri. Brown was just 18 years old.

Brown, who was unarmed, was shot Saturday by a Ferguson police officer while walking with a friend down the center of the street. Police have said a scuffle broke out after the officer asked the boys to move to the side. Witnesses say Brown's arms were in the air — in a sign of surrender — as a white policeman repeatedly shot the black youth.

NONE In The Back: Brown Autopsy Shows He Was Shot In The Front Of The Body
Daily Caller

One of the first pictures to be made public of Brown showed him scowling and wearing headphones, which for a teenager in America is pretty standard.

Since his death the city of Ferguson has been plagued byviolent protests and looting.

The hashtag seeks to bring to light what some call a media bias against young black people. Their argument is that the media uses pictures of slain black men and women that show them looking quote “thuggish” or angry, instead of other available photos, they say, which would paint them in a more positive light given the circumstances.

#IfTheyGunnedMeDown has now gone viral, with Twitter users sharing their own thoughts and pictures about the Brown shooting, and also harkening back to the shooting death of Trayvon Martin in early 2012.

The question raised here is whether or not the media apparatus is using photos on social media at whim, or if they are picking and choosing photos which subliminally or otherwise voice a bias.",35,NA,NA,NA
