Source,ArticleID,ArticleLink,Title,Author,DatePublished,DateRetrieved,ArticleText,NumberComments,NumberSocialMedia,TheShitBetween,Notes
Slate,slate24,http://www.slate.com/articles/news_and_politics/jurisprudence/2014/08/we_know_how_to_decrease_police_violence_like_what_we_ve_seen_after_the_michael.html,Policing the Police,LaDoris Hazzard Cordell,08/15/2014,02/17/2016,"In just the last two months, {Michael Brown, 18}<hyperlink=“http://www.vox.com/2014/8/11/5993609/michael-brown-ferguson-shooting-protests-riots-police-violence-unarmed”>, was killed by a police officer in Ferguson, Missouri; {Ezell Ford, 25}<hyperlink=“http://www.latimes.com/local/lanow/la-me-ln-ezell-ford-meeting-20140814-story.html”>, was killed by a police officer in Los Angeles; {Frank Alvarado, 39}<hyperlink=“http://www.montereycountyweekly.com/blogs/news_blog/first-details-emerge-about-the-salinas-police-shooting-death-of/article_b0a2eb5a-094f-11e4-a14c-001a4bcf6878.html”>, was killed by a Salinas police officer; {Eric Garner, 43}<hyperlink=“http://nymag.com/daily/intelligencer/2014/07/cops-react-to-the-death-of-eric-garner.html”>, was killed by a New York police officer; and {Marlene Pinnock, 51}<hyperlink=“http://www.huffingtonpost.com/2014/07/18/marlene-pinnock-punched-by-police-files-lawsuit_n_5600989.html”>, was brutally beaten by a California Highway Patrol officer. All of these victims were of color, and all were unarmed.

Since these latest incidents, there has been much talk about the need for retraining officers; and there have been repeated calls from an outraged public for investigations by the U.S. Department of Justice and the FBI. But training and federal investigations are ineffective responses to allegations of police misconduct. We know how to solve this epidemic; we just need to find the political will to do it.

Before they even don their uniforms, police officers receive hours and hours of training about the appropriate use of force. At the nation’s police academies, they learn how to evaluate situations where force could be an option and when it’s illegal. By the time officers are patrol-ready, they know how to use their firearms, batons, and stun guns. Yet, in response to the chokehold killing of Erin Garner, New York Police Commissioner William Bratton has called for the “retraining” of his officers. Training is, of course, essential to law enforcement. But it would be a serious and dangerous error to shrug off these deaths and beatings by cops and simply attribute them to inadequate training.

Retraining is useless when officers view people of color as “f--king animals”—the words shouted by a police officer at a crowd in Ferguson protesting the killing of Michael Brown. All of the training and retraining in the world are of no moment if officers see the people they are charged to protect and serve as subhuman and dangerous.

And while some investigations by the FBI and the Justice Department have resulted in major and positive changes to police departments, these kinds of costly inquiries frequently take years to complete. Case in point: the fatal shooting of Brown in Ferguson. The FBI has opened a civil rights inquiry in response to the public outcry, but a week after the shooting, critical information such as the name of the officer, and the number of times and where on his body Brown was shot, has not been released. This is not a training problem. It’s a transparency problem.

So, if more training and federal investigations are not the answer, what is? First, police departments must broaden the definition of reasonable use of force. In 1989 the U.S. Supreme Court in {Graham v. Connor}<hyperlink=“http://hanfordsentinel.com/news/local/crime/use-of-force-what-does-the-law-say/article_04a4ad69-7dd5-5099-a1e8-e764ab26c9b2.html”> defined the reasonable use of force as force “judged from the perspective of a reasonable officer on the scene, and its calculus must embody an allowance for the fact that police officers are often forced to make split-second decisions about the amount of force necessary in a particular situation.” That definition has been interpreted narrowly by law enforcement agencies across the country to mean that the reasonableness of the force is limited to an examination of only the amount of force used in the moment. The conduct of officers right before the use of force is never examined. Under this definition, officers who provoke individuals and officers who escalate situations get a pass. 

The definition of what constitutes the reasonable use of force must be expanded to include the circumstances leading up to the use of force, so that the inquiry into the misconduct sweeps in whatever the officer did prior to the decision to  use force, along with the conduct of the victim. There is precedent for this. This year, both the Seattle Police Department and the Los Angeles Police Department expanded their definitions of reasonable use of force. Now, in Seattle, officers cannot use physical force “against individuals who only verbally confront them unless the vocalization impedes a legitimate law enforcement function or contains specific threats to harm the officers or others.” And in Los Angeles, the use of deadly force must include “consideration of not only the use of deadly force itself, but also an officer’s tactical conduct and decisions leading up to the use of force when determining its reasonableness.”

Second, cities and counties must establish independent civilian oversight agencies for their law enforcement departments. Civilian oversight of law enforcement is far from novel. Worldwide, countries such as South Africa, Canada, Belgium, and the European Union have police oversight agencies. And there are numerous cities and counties in the United States that have established civilian oversight departments, from Palo Alto, California, to Kalamazoo, Michigan, to Honolulu, Hawaii. (A complete listing of all civilian oversight agencies can be found at {nacole.org}<hyperlink=“http://www.nacole.org/”>). In San Jose, California, where I am the independent police auditor, our civilian oversight office has existed for 21 years. The beauty of civilian oversight is that it holds police officers accountable to the public by providing independent review of complaints of police misconduct, instead of relying solely upon internal investigations in which the police investigate themselves.

The 1988 murder of 20-year-old Cara Knott by Officer Craig Peyer, a six-year veteran of the California Highway Patrol, illustrates what happens when independent civilian oversight is not a part of misconduct investigations. After stopping Knott, ostensibly for a traffic violation, Peyer made sexual advances on her. When she refused, he killed her by bludgeoning her with his flashlight, strangling her, and then tossing her body over a bridge. It turned out that a number of young women had also been the victims of Peyer’s advances. And while they had filed complaints with the CHP’s Internal Affairs Unit, the department’s internal investigations dismissed their complaints, finding in favor of Peyer. Peyer is now serving a life sentence in a California prison for Knott’s murder.

Third, {and as Reihan Salam argues today in Slate}<hyperlink=“http://www.slate.com/articles/news_and_politics/politics/2014/08/ferguson_police_officers_should_be_forced_to_videotape_themselves_for_our.html”>, every single law enforcement officer should be required to wear body-worn cameras, or BWCs; and every single law enforcement agency should adopt a protocol for the operation of these cameras that strictly regulates when the cameras can be turned off by officers. Bystanders with cameras have changed policing forever. Witness the public outrage after the release of videos that depicted the beating of Marlene Pinnock and the chokehold death of Eric Garner. Police officers should have cameras, too.

BWCs promote transparency in policing, they hold officers and the public accountable for their actions, and they reduce civil litigation. The police department of Rialto, California, has 115 sworn officers. In 2009 it became the first known police department to utilize BWCs. A study that analyzed the use of BWCs in Rialto showed that use of force incidents dropped by 59 percent, and that civilian complaints about police misconduct decreased by 87.5 percent. Those numbers are staggering. The benefit to police and the public of recording police interactions clearly justifies its costs. Even the ACLU has concluded that BWCs assist in holding law enforcement more accountable to the communities that they serve.

Over the last decade, claims against cities and counties across the country stemming from police incidents amounted to $22 billion. The special counsel to the Los Angeles County Sheriff’s Department recently reported that between January 2013 and April 2014, 132 cases of excessive force against the department were closed by settlements or court verdicts, totaling $12,175,000. The largest payout in fiscal 2012–2013 was a jury award of $6 million, settled by the County for $3.9 million. The plaintiff in that case claimed that two deputies escalated a traffic stop into violence, pepper-spraying him, punching him in the head, kneeing him in the face, and slamming his head into the pavement. And don’t forget the attorneys’ fees that are often a key driver in the decision of whether or not to settle or proceed to litigation. In Los Angeles County, for every dollar spent on a payout in fiscal 2012, another dollar was spent on the lawyers, amounting to $43 million. Communities policed by officers wearing BWCs will see a dramatic decrease in litigation and the costs associated with it.

All the outrage surrounding the violence against unarmed black people this summer will amount to nothing if we simply settle for more investigations and more training. There are steps we can take to reduce police violence, and they have been proved to work.",341,4000,NA,NA
Slate,slate25,http://www.slate.com/articles/podcasts/gabfest/2014/08/the_gabfest_on_michael_brown_and_the_protests_in_ferguson_eric_garner_and.html,The “All Criminal Justice” Edition,"Emily Bazelon, James Forman Jr., Vesla Weaver",08/15/2014,02/17/2016,"Become a fan of the Political Gabfest on {Facebook}<hyperlink=“https://www.facebook.com/Gabfest”>. We post to the Facebook page throughout the week, so keep the conversation going by joining us there. Or follow us {@SlateGabfest}<hyperlink=“https://twitter.com/slategabfest”>!

To listen to the discussion, use the player below:

{Subscribe in iTunes}<hyperlink=“https://itunes.apple.com/us/podcast/slates-political-gabfest/id158004641?mt=2”> ∙ {RSS feed}<hyperlink=“http://feeds.feedburner.com/SlatePoliticalGabfest”> ∙ {Download}<hyperlink=“http://hwcdn.libsyn.com/p/d/5/7/d5750651c6c1a6a8/SPG14081501_Gabfest.mp3?c_id=7507966&expiration=1455740998&hwt=50cb783375c93d3cd914db4fa612de48”> ∙ {Play in another tab}<hyperlink=“”https://soundcloud.com/slateradio/the-political-gabfest-the-all-criminal-justice-edition>

For this week’s Slate Plus bonus segment Emily, Vesla, and James discuss Vesla’s new book {Arresting Citizenship: The Democratic Consequences of American Crime Control}<hyperlink=“http://www.amazon.com/dp/022613783X/?tag=slatmaga-20”>. Slate Plus members get an ad-free version of this podcast with bonus segments. Visit slate.com/gabfestplus and try it free for two weeks.

On this week’s Slate Political Gabfest, Emily Bazelon, James Forman Jr., and Vesla Weaver discuss the protests in Ferguson, Eric Garner’s death and the problems with “broken windows” policing, and sociologist Alice Goffman’s new book On the Run.

Here are some of the links and references mentioned during this week’s show:

Following {the death of 18-year-old Michael Brown}<hyperlink=“http://www.slate.com/articles/news_and_politics/jurisprudence/2014/08/michael_brown_eric_garner_debra_harrell_just_three_examples_of_why_i_don.html”> at the hands of a police officer on Saturday, protests erupted in the St. Louis suburb of Ferguson, Missouri. The police claim that Brown hit an officer, provoking the shooting, while Brown’s friend claims that the officer shot Brown while he was running with his hands up.
Brown would’ve {started college}<hyperlink=“http://www.slate.com/blogs/the_slatest/2014/08/10/michael_brown_unarmed_black_teenager_shot_in_ferguson_a_st_louis_suburb.html”> this past Monday.
Ferguson’s {elected officials}<hyperlink=“http://www.slate.com/blogs/moneybox/2014/08/14/ferguson_missouri_government_why_is_it_so_white.html”> and {police force}<hyperlink=“https://www.washingtonpost.com/news/the-fix/wp/2014/08/14/visualizing-the-rapid-racial-change-in-ferguson-over-the-past-decade/”> are not racially representative of the majority-black population. The New York Times {reports}<hyperlink=“http://www.nytimes.com/2014/08/13/opinion/racial-history-behind-the-ferguson-protests.html?_r=0”> that no one on the school board is black.
The Department of Justice studies the percentages of racial breakdowns in districts to determine whether there is voter discrimination.
Local law enforcement agencies have acquired {more sophisticated equipment}<hyperlink=“http://www.slate.com/articles/news_and_politics/politics/2014/08/police_in_ferguson_military_weapons_threaten_protesters.html”> since the beginning of the War on Drugs.
The police have not released the name of the officer who shot Brown, but that {may soon change}<hyperlink=“http://www.slate.com/blogs/the_slatest/2014/08/14/ferguson_running_blog_updates_on_protests_in_missouri.html”>.
{Studies show}<hyperlink=“http://www.apa.org/news/press/releases/2014/03/black-boys-older.aspx”> that black boys are frequently viewed as older than they actually are.
Last month, Eric Garner was allegedly choked to death by Staten Island police officers. Garner’s death was {caught on video}<hyperlink=“http://www.slate.com/blogs/the_slatest/2014/07/18/nypd_death_chokehold_possibly_kills_new_york_city_suspect.html”> and went viral.
Garner’s death is {testing}<hyperlink=“”http://nymag.com/daily/intelligencer/2014/07/eric-garner-death-de-blasio.html> how far Mayor Bill de Blasio is willing to enforce his mandate to reform the police department’s relationship with minority communities.
In the 1985 decision Tennessee v. Garner, the Supreme Court {ruled}<hyperlink=“http://scholarlycommons.law.northwestern.edu/cgi/viewcontent.cgi?article=6811&context=jclc”> that law enforcement officers cannot shoot a fleeing suspect unless there’s probable cause that the suspect poses a threat to police or the public.
A {recent report}<hyperlink=“http://www.msnbc.com/msnbc/doj-violence-rikers-island”> issued by the U.S. Attorney’s Office for the Southern District of New York found that prisoners suffered mistreatment at the hands of guards who have little accountability.
Some NYPD police union leaders are {hinting at possible work slowdowns}<hyperlink=“http://www.theguardian.com/world/2014/aug/09/disquiet-nypd-bill-de-blasio-anti-police-stance”> in response to de Blasio’s seemingly tepid support for police.
The Supreme Court {ruled}<hyperlink=“https://www.oyez.org/cases/1982/81-1064”> in Los Angeles v. Lyons that Adolf Lyons, who’d been put in a chokehold by LAPD officers, did not have sufficient standing to bar the city from using chokeholds in the future.
Adopted by the NYPD to break the crime wave in the ’80s and ’90s, “broken windows” policing has nevertheless been {criticized}<hyperlink=“http://www.slate.com/articles/news_and_politics/politics/2014/08/broken_windows_policing_deaths_racism_in_chokeholds_arrests_and_convictions.html”> for disproportionately punishing black and Latino communities for minor crimes.
Sociologist Alice Goffman spent six years in Philadelphia {studying}<hyperlink=“http://www.nytimes.com/2014/04/30/books/alice-goffman-researches-poor-black-men-in-on-the-run.html”> the effects of mass surveillance and incarceration on poor black neighborhoods. The culmination of her work is a new book called {On the Run}<hyperlink=“http://www.slate.com/articles/news_and_politics/jurisprudence/2014/07/alice_goffman_s_on_the_run_she_is_wrong_about_black_urban_life.html”>.
Goffman {burned her notes}<hyperlink=“http://articles.philly.com/2014-05-06/news/49636858_1_field-notes-fugitives-young-men”> to keep them from being subpoenaed.

Vesla chatters about “{Divergent Pathways of Gentrification}<hyperlink=“http://asr.sagepub.com/content/early/2014/06/12/0003122414535774.abstract”>,” a new study of Chicago gentrification written by Harvard sociologists Robert J. Sampson and Jackelyn Hwang.

James chatters about {Devil in the Grove: Thurgood Marshall, the Groveland Boys, and the Dawn of a New America}<hyperlink=“http://www.amazon.com/Devil-Grove-Thurgood-Marshall-Groveland/dp/0061792268”>.

Emily chatters about Jodi Kantor’s piece in the New York Times, “{Working Anything but 9 to 5}<hyperlink=“”http://www.nytimes.com/interactive/2014/08/13/us/starbucks-workers-scheduling-hours.html?smid=pl-share&_r=0>.”

Topic ideas for next week? You can tweet suggestions, links, and questions to {@SlateGabfest}<hyperlink=“http://www.nytimes.com/interactive/2014/08/13/us/starbucks-workers-scheduling-hours.html?smid=pl-share&_r=0”>.

The email address for the Political Gabfest is {gabfest@slate.com}<hyperlink=“http://www.nytimes.com/interactive/2014/08/13/us/starbucks-workers-scheduling-hours.html?smid=pl-share&_r=0”>. (Email may be quoted by name unless the writer stipulates otherwise.)",46,200,NA,Are we including small summaries before the actual articles?
Slate,slate26,http://www.slate.com/blogs/the_slatest/2014/08/15/ron_johnson_press_conference_highway_police_captain_takes_questions_from.html,Missouri Highway Patrol Capt. Ron Johnson Speaks Gracefully on Anger in Ferguson,Ben Mathis-Lilley,08/15/2014,02/17/2016,"Ron Johnson is the Missouri Highway Patrol captain who took over patrol in Ferguson Thursday night; Johnson, {a Ferguson native}<hyperlink=“https://www.washingtonpost.com/news/post-nation/wp/2014/08/14/meet-the-missouri-highway-state-patrol-captain-who-is-taking-over-in-ferguson/”>, spoke and walked with protesters and supervised a force that presented itself much less aggressively than the quasi-military SWAT teams that had confronted residents on previous days. The result, by all accounts, was a significantly less tense evening. ""There were not any calls for service, we did not deploy any tear gas, we did not make any arrests,"" Johnson said when he met minutes ago with members of the media and local citizens.

He seemed to have been taken by surprise by Ferguson Police Chief Thomas Jackson's release this morning of {an incident report that alleges slain teen Michael Brown stole a box of cigars}<hyperlink=“”http://www.slate.com/blogs/the_slatest/2014/08/14/ferguson_running_blog_updates_on_protests_in_missouri.html> from a convenience store and assaulted the store's clerk on Saturday. ""Today I will meet with the chief of Ferguson and talk about what was released and try to get a copy,"" he said, emphasizing several times that he will be returning to the protest site today to meet with residents. ""This afternoon I will be walking back down to the QuikTrip, and I will talk to the people there and explain what I see in the packet and some of the questions that may have been unclear in the presentation this morning, I will try to make those clear.""

He also spoke more broadly about the response to Brown's death: ""This inner anger ... we have to make sure that we don't burn down our own house, that we don't go down there and vandalize our own buildings. We can stand on the sidewalk and we can talk about our issues and we can talk about what we want and what we need and a conversation that needs to happen and we can make that happen. But what I don't want is us to go down and burn down our own neighborhood. That doesn't prove a point. That does not solve the issue. That hurts this community, and that's what I don't want.""

One questioner asked him a broad question about race relations and justice. ""The governor talked about old wounds,"" Johnson said. ""This is an old wound. It's time to stop saying it's an old wound, and close it for good."" Later he spoke about the future of the community: ""Yesterday we saw what it could be. We saw what it should be. And we saw what it will be.""",80,1000,NA,NA
