Source,ArticleID,ArticleLink,Title,Author,DatePublished,DateRetrieved,ArticleText,NumberComments,NumberSocialMedia,TheShitBetween,Notes
Slate,slate1,http://www.slate.com/blogs/the_slatest/2014/08/10/michael_brown_unarmed_black_teenager_shot_in_ferguson_a_st_louis_suburb.html,Police in St. Louis Suburb Shoot Unarmed Black Teenager Multiple Times,Daniel Politi,08/10/2014,02/10/2016,"[tweetbegin 498453798730227714 tweetend]

A local chapter of the NAACP is demanding the FBI get involved in the investigation into why an unarmed black teenager was killed Saturday by a police officer in a St. Louis suburb. After a night of protests in Ferguson following the shooting of Michael Brown, officials confirmed the 18-year-old was not armed and was running away when he was shot “more than just a couple” of times, St. Louis County Police Chief Jon Belmar said. Still, Belmar said the teenager had tried to reach for an officer’s gun in a patrol car, where one shot was fired. Brown’s fatal gunshot wounds came outside the vehicle, reports {St. Louis Post-Dispatch}<hyperlink=”http://www.stltoday.com/news/local/crime-and-courts/police-ferguson-teen-struggled-over-officer-s-gun-before-being/article_f9d627dc-e3c8-5bde-b2ab-7f0a3d36a083.html”>. It’s unclear what caused the altercation in the first place. The officer who shot Brown has not been identified but has been placed on administrative leave.

Belmar gave a brief news conference Sunday as some community members marched to the Ferguson police department with their hands up in the air, chanting “Don’t shoot.” They also carried signs that read “stop police terrorism” and “disarm the police,” reports the {Associated Press}<”http://hosted.ap.org/dynamic/stories/U/US_POLICE_SHOOTING_MISSOURI?SITE=AP&SECTION=HOME&TEMPLATE=DEFAULT&CTIME=2014-08-10-11-23-22”>.

""My son just turned 18 and graduated from high school, and he don't bother nobody,"" Brown's mother, Lesley McSpadden, told local NBC affiliate {KSDK}<hyperlink=”http://www.ksdk.com/story/news/crime/2014/08/10/ferguson-police-news-conference-michael-brown/13860601/”>. McSpadden says Brown, who was scheduled to begin classes at Vatterott College next week, was shot eight times. Police say they still have to investigate to determine how many times Brown was actually shot.

Brown’s shooting took place two weeks before a planned march to protest the death of 43-year-old Eric Garner, a Staten Island man who was killed by a police chokehold during an arrest on July 17.

[tweetbegin 498253652755111937 tweetend]",481,259,NA,NA
Slate,slate2,http://www.slate.com/blogs/the_slatest/2014/08/11/michael_brown_shooting_ferguson_rioting_reported_fbi_will_investigate.html,32 Arrested in Rioting as FBI Takes Over Investigation of St. Louis Police Killing (Update: FBI Denies),Ben Mathis-Lilley,08/11/2014,02/12/2016,"Thirty-two people were arrested overnight as {riots and looting broke out}<hyperlink=“http://www.stltoday.com/news/local/crime-and-courts/violence-breaks-out-near-site-of-vigil-for-teen-killed/article_f9d627dc-e3c8-5bde-b2ab-7f0a3d36a083.html”> after protests over the shooting death of Michael Brown, an unarmed black teenager who was {killed by police in the St. Louis suburb of Ferguson}<hyperlink=“”http://www.slate.com/blogs/the_slatest/2014/08/10/michael_brown_unarmed_black_teenager_shot_in_ferguson_a_st_louis_suburb.html> on Saturday. The Associated Press has just reported, meanwhile, that the {FBI will take over the investigation of the shooting}<hyperlink=“http://bigstory.ap.org/article/fbi-taking-over-missouri-police-shooting-teen”>. From the St. Louis Post-Dispatch:

Officer Brian Schellman of the St. Louis County police said two officers were injured overnight Sunday — one was hit by a brick and one suffered knee injuries. Police arrested 32 people for theft, assault or burglary.

A convenience store was smashed and set on fire—videos showed that parts of it were almost completely destroyed—and at least four other stores were attacked.

From the Associated Press:

Ferguson Police Chief Tom Jackson tells The Associated Press that he was informed Monday that the FBI was going to take over the investigation into the death of 18-year-old Michael Brown. Jackson says he welcomes the move.

Police have said that Brown or a man he was with {attempted to take an officer's gun}<hyperlink=“http://www.nytimes.com/2014/08/11/us/police-say-mike-brown-was-killed-after-struggle-for-gun.html”> in a struggle that took place next to and inside a police vehicle—but they also said that Brown was 35 feet away from the vehicle and unarmed when he was shot.

Update, August 11, 1 p.m.:

[tweetbegin 498874675687358465 tweetend]",226,358,NA,NA
Slate,slate3,http://www.slate.com/blogs/the_slatest/2014/08/12/michael_brown_witness_police_allegedly_turn_down_offer_of_interview.html,Police Reportedly Refused Offer to Interview Man Who Was With Michael Brown During Shooting,Ben Mathis-Lilley,08/12/2014,02/15/2016,"Early this morning, MSNBC {posted an interview with Dorian Johnson}<hyperlink=“http://www.msnbc.com/msnbc/eyewitness-michael-brown-fatal-shooting-missouri”>, a 22-year-old from Ferguson, Missouri, who says he was the {other man}<hyperlink=“http://www.nytimes.com/2014/08/11/us/police-say-mike-brown-was-killed-after-struggle-for-gun.html”> walking with Michael Brown before the incident that led to Brown's death:

The officer demanded that the two “get the f—k on the sidewalk,” Johnson says. “His exact words were ‘Get the f—k on the sidewalk.’ ”

After telling the officer that they were almost at their destination, Johnson’s house, the two continued walking. But as they did, Johnson says the officer slammed his brakes and threw his truck in reverse, nearly hitting them.

Now, in line with the officer’s driver’s side door, they could see the officer’s face. They heard him say something to the effect of, “what’d you say?” At the same time, Johnson says the officer attempted to thrust his door open but the door slammed into Brown and bounced closed. Johnson says the officer, with his left hand, grabbed Brown by the neck.

Johnson does not report seeing Brown attempt to take the officer's gun, which police have claimed was the action that precipitated the shooting. He says Brown was first shot next to the patrol car, again after running away, and again after turning to face the attacking officer with his hands in the air. Johnson is being represented by Freeman Bosley, a former St. Louis mayor. Bosley says police haven't spoken to Johnson and turned down Bosley's offer to set up a meeting; the police haven't responded to that claim.",267,1100,NA,NA
Slate,slate4,http://www.slate.com/blogs/the_slatest/2014/08/12/faa_no_fly_zone_in_ferguson_missouri_amid_tensions_over_shooting.html,FAA Imposes No-Fly Zone in Ferguson After Police Say Its Helicopters Fired Upon,Elliot Hannon,08/12/2014,02/15/2016,"Following a {night of heavy protests}<hyperlink=“http://www.slate.com/blogs/the_slatest.html”> in Ferguson, Missouri over the death of teenager Michael Brown, {the Federal Aviation Administration imposed a no-fly zone}<hyperlink=“”http://tfr.faa.gov/save_pages/detail_4_2599.html> over the St. Louis suburb. The reason cited by the FAA for the ban on low flying aircraft—anything up to 3,000 feet—is “to provide a safe environment for law enforcement activities.”

The shooting death of Michael Brown by a Ferguson police officer has sparked outrage in the community. On Monday night, tensions hit a new level as {protestors were cleared by riot police with tear gas}<hyperlink=“”http://www.slate.com/blogs/the_slatest/2014/08/12/ferguson_tear_gas_video_angry_but_apparently_unarmed_residents_face_attack.html>. According to the St. Louis police department, police helicopters were fired on, causing the FAA to clear the skies. Here’s more on the ban {from NBC News}<hyperlink=“”http://www.nbcnews.com/news/us-news/michael-brown-death-no-fly-zone-enacted-over-missouri-town-n179011>:

""On Sunday night our police helicopter came under fire on 3 or 4 occasions, so we requested that the FAA put up a no-fly zone for the safety of pilots who would be in the area,"" St. Louis County Police Department Officer Brian Schellman told NBC News. The ban on flights is scheduled to last until Monday, Aug. 18.

No aircraft have been hit, but police chopper pilots did see shots fired from various locations during looting and riots that took place on Sunday night from about 10 p.m. to midnight, Schellman said. ""We don’t know if it was a long gun or a handgun or what,"" he said.

He denied that the move was to keep news helicopters from covering the scene.",236,539,NA,NA
Slate,slate5,http://www.slate.com/blogs/the_slatest/2014/08/12/ferguson_police_shooter_s_name_won_t_be_released_because_of_threats.html,Police Won't Release Name of Officer Who Shot Teen Out of Concern for His Safety,Ben Mathis-Lilley,08/12/2014,02/15/2016,"Ferguson, Missouri, police won't release the name of the officer who killed Michael Brown {because of ""threats,”}<hyperlink=“https://www.washingtonpost.com/news/post-nation/wp/2014/08/12/ferguson-police-wont-identify-officer-who-shot-and-killed-michael-brown/”> the Washington Post's Marc Berman reports:

Timothy Zoll, a spokesman for the Ferguson Police Department, told The Washington Post that the name won’t be released because of threats made against Ferguson police officers on social media sites.

The officer involved in the incident has been placed on paid administrative leave. There is no timetable for when police could release the officer’s name, Zoll said.

A group claiming association with the online hacker collective Anonymous has said that they believe they know the name of the officer who shot Brown {but are checking their information before releasing it}<hyperlink=“https://twitter.com/OpFerguson/status/499203260528328705”>. St. Louis police are investigating Brown's death at the request of Ferguson's police department.",251,25,NA,NA
Slate,slate6,http://www.slate.com/blogs/the_slatest/2014/08/12/ferguson_s_motif_protestors_with_arms_raised_asking_police_not_to_fire.html,"""Don't Shoot"": Protestors, Arms Raised, Face Heavily Armed Police on Tense Night in Ferguson",Ben Mathis-Lilley,08/12/2014,02/15/2016,"Images of police releasing tear gas have been circulating online, as have reports of police firing rubber bullets and ordering residents and members of the media to leave public areas. 

[tweetbegin 499024693525884928 tweetend]

Fortunately, despite the unsettling visuals and volatile circumstances, only a few seemingly minor injuries have been reported so far—two men hit by rubber bullets, presumably fired by police officers—and no one has been reported arrested. What has emerged from Ferguson is a characteristic image of protest—men and women approaching police with their arms raised over their heads.

[tweetbegin 499018748129316866 tweetend]

It seems to be a response to the circumstances of Brown's death—he was shot while unarmed, reportedly with his {hands above his head}<hyperlink=“”http://www.newyorker.com/news/amy-davidson/michael-brown-die-ferguson>.

[tweetbegin 499006766349185027 tweetend]

[tweetbegin 499030781541371905 tweetend]

[tweetbegin 499036082344710144 tweetend]


The Justice Department, FBI, and local police are investigating the shooting.

[tweetbegin 499051240526192640 tweetend]",827,1300,NA,NA
Slate,slate7,http://www.slate.com/blogs/the_slatest/2014/08/13/ferguson_protest_curfew_police_ask_residents_not_to_gather_after_dark.html,Ferguson Police Ask Residents to Self-Enforce Protest Curfew,Ben Mathis-Lilley,08/13/2014,02/15/2016,"The Ferguson, Missouri, police department has issued a statement about the unrest that has followed the killing of Michael Brown:

In addition to looting and property destruction on Sunday night, authorities allege that protesters have thrown rocks and bottles and fired shots at police helicopters.
 
In other Ferguson news, a lawyer for Dorian Johnson—the man who {says he was with Brown}<hyperlink=“”http://www.slate.com/blogs/the_slatest/2014/08/12/michael_brown_witness_police_allegedly_turn_down_offer_of_interview.html> when Brown was shot—{says}<hyperlink=“”https://twitter.com/WesleyLowery/status/499606771246567424> Johnson will meet with the FBI and prosecutors today.",74,92,NA,NA
Slate,slate8,http://www.slate.com/blogs/the_slatest/2014/08/13/new_ferguson_shootings_armed_man_shot_near_site_of_killing_protests.html,Two Shootings Reported in Ferguson Area Overnight,Ben Mathis-Lilley,08/13/2014,02/15/2016,"{An armed man was shot by police near Ferguson, Missouri, early this morning}<hyperlink=“http://www.ksdk.com/story/news/crime/2014/08/13/north-county-police-shooting-chambers/13989885/”>, but the incident does not seem to be related to protests over the death of Michael Brown, and the officers involved came from the St. Louis County force rather than Ferguson Police Department. From KSDK:

The shooting happened just before 1 a.m. Wednesday at Chambers Road and Sheffingdell Court in unincorporated St. Louis County.

St. Louis County police say they responded to a report about four masked men carrying shotguns in the area. The caller said the suspects had fired shots.

When police arrived at the scene they saw the men running. One officer ""came into contact"" with a suspect, who turned and pointed a handgun at the officer.

A police officer fired at least once at the suspect, wounding him. He was taken to an area hospital in critical condition.


In an earlier incident, a Ferguson woman was injured in (a possible drive-by shooting}<hyperlink=“”http://www.ksdk.com/story/news/crime/2014/08/13/ferguson-woman-shot-in-head/13990051/>.

Protests continued in Ferguson on Tuesday night, and some tear gas was used by police, but no arrests or injuries were reported.",265,23,NA,NA
