Source,ArticleID,ArticleLink,Title,Author,DatePublished,DateRetrieved,ArticleText,NumberComments,NumberSocialMedia,TheShitBetween,Notes
Slate,slate12,http://www.slate.com/articles/news_and_politics/dispatches/2014/08/ferguson_police_attack_protestors_with_tear_gas_rubber_bullets_on_site_reporting.html,How a Demonstration Turned Into a Disaster,Jamelle Bouie,08/14/2014,02/15/2016,"FERGUSON, Missouri—On Wednesday afternoon, a healthy-sized group of local organizers, religious leaders, parents, and teenagers walked down West Florissant—the street where Michael Brown was killed—chanting the unofficial slogan of the Ferguson demonstrations. “Hands up, don’t shoot! No justice, no peace!”

They were energized, animated, and peaceful. They were holding signs with slogans such as “Love, Peace & Prayer Equals Non-Violence” and demanding answers from police officials, who—four days after the shooting—have yet to release the name of the officer who shot Brown, nor have they said how many times he shot the unarmed 18-year-old.

Directly across from them, sitting near the intersection where rioters burned a convenience store on Sunday, were the local police, clad in riot gear and armed with batons. It was a bit much, given the modest, peaceful crowd, but it was a de-escalation from Tuesday, when SWAT teams entered the fray to disperse the demonstrators.

After an hour of marching, speeches, and calls for justice, most of the group moved to a nearby parking lot, where they continued to talk and demonstrate. A small number, however (including a state senator), wouldn’t budge, even after clergy asked them to move. They weren’t disruptive—they were sitting down, hands up—but they were blocking the road.

Still, the situation was calm. It wouldn’t have been easy, but police could have worked with the leaders of the demonstration to move people to the sidewalks and the parking lots.

Instead, they brought reinforcements. Police officers were replaced with camouflaged SWAT teams—clad in helmets and body armor—and batons were replaced with shotguns, high-powered rifles, and dogs. They didn’t identify themselves, and it wasn’t clear to the crowd where they were from. But St. Louis County has been in command of officers on the street since Sunday, and one of the armored vehicles was labeled “St. Charles County SWAT.” In any case, they weren’t interested in actual crowd control. On at least two occasions, they refused to let uninvolved bystanders go to their cars or leave the area. No, from their stance to their numbers, this was about intimidation. Two snipers monitored the demonstrators from their armored vehicles, and other police began to close off side streets and other exits, to prevent anyone from coming in (or going out, for that matter).

With the arrival of SWAT teams, the demonstration escalated into a standoff. And an hour after the teams’ arrival, they began marching down the street and shouting orders. “You must return to your vehicles, or your homes, in a peaceful manner,” they said, advancing down the street, “Your right to assembly is not being denied.”

The crowd backed away from the police, but people were clearly agitated by the show of force. Still, there was no aggression. At this point, I drove 15 minutes down the road to another event, one organized by the demonstrators. The contrast was incredible. There, hundreds of people were gathered in a community party, oblivious to the crackdown three miles away.

When I returned to the standoff, an hour after SWAT teams arrived, streets were completely blocked off, helicopters were circling, and officers were pouring tear gas onto West Florissant and the surrounding neighborhood, launching flash bangs, shooting rubber bullets, and using noise-based weapons to force people inside.

Police say this was a necessary response—someone had thrown a Molotov cocktail, and there is a photo to confirm as much. But the full picture tells a different story. If elements of the crowd reacted with violence, it’s because police stoked it with repression.

So far, police have killed an unarmed teenager, stonewalled anyone requesting information, and met peaceful demonstrations with draconian crackdowns. Indeed, at every stage, police have opted for repression rather than communication. Which is to say that, as much as {some reports}<hyperlink=“http://www.businessinsider.com/ferguson-missouri-riots-continue-2014-8”> have focused on the Sunday night riot, the chaos in Ferguson has much more to do with a {militarized}<hyperlink=“http://www.slate.com/articles/news_and_politics/politics/2014/08/police_in_ferguson_military_weapons_threaten_protesters.html”>, out-of-control police presence than it does with any of the demonstrators.",1200,3100,NA,"Title has subtitle “The outrageous police actions in Ferguson, Missouri. “"
Slate,slate13,http://www.slate.com/blogs/weigel/2014/08/14/president_obama_gov_nixon_an_anonymous_cop_the_internet_looks_for_blame.html,"President Obama, Gov. Nixon, an Anonymous Cop: The Internet Looks for Blame in Ferguson",David Weigel,08/14/2014,02/15/2016,"My colleague Elliot Hannon {has collected the tweets}<hyperlink=“http://www.slate.com/blogs/the_slatest/2014/08/13/two_journalists_briefly_arrested_in_ferguson.html”> of the Huffington Post's Ryan Reilly and the Washington Post's Wes Lowery into a long post about how the two reporters were arrested in the Ferguson, Missouri, McDonalds they'd been using as a filing center. My colleague {Jamelle Bouie}<hyperlink=“https://twitter.com/jbouie”> is on the ground in Missouri, and I have a statement from the Huffington Post:

We are relieved Ryan Reilly and Wesley Lowery are safe, but we are disturbed by their arrest and assault.
 
Ryan was working on his laptop in a McDonald's near the protests in Ferguson, MO, when police barged in, armed with high-powered weapons, and began clearing the restaurant. Ryan photographed the intrusion, and police demanded his ID in response. Ryan, as is his right, declined to provide it. He proceeded to pack up his belongings, but was subsequently arrested for not packing up fast enough. Both Ryan and Wesley were assaulted.
 
Compared to some others who have come into contact with the police department, they came out relatively unscathed, but that in no way excuses the false arrest or the militant aggression toward these journalists. Ryan, who has reported multiple times from Guantanamo Bay, said that the police resembled soldiers more than officers, and treated those inside the McDonald's as 'enemy combatants.' Police militarization has been among the most consequential and unnoticed developments of our time, and it is now beginning to affect press freedom.

Reilly and Lowery are incredibly hard-working reporters, both well-liked and respected in D.C. (Don't hold that against them.) There are {reports that higher-ups}<hyperlink=“https://twitter.com/mattdpearce/status/499719019747090433”> in the Missouri police forces realized that the arrests were terrible mistakes, committed by people who never heard {the cliché}<hyperlink=“”http://freakonomics.com/2011/05/12/ink-by-the-barrel/> that you don't ""pick a fight with people who buy ink by the barrel."" This is even truer when the barrel-owners happen to own Amazon.com and AOL.com.

But the story is moving at Twitter-speed, and there is little time to waste before assigning political blame. Shortly before midnight, BuzzFeed's political editor Katherine Miller (formerly of the Washington Free Beacon) captured the zeitgeist by {sharing the White House pool report}<hyperlink=“”http://www.buzzfeed.com/katherinemiller/president-obama-attends-birthday-party-in-marthas-vineyard?utm_source=twitterfeed&utm_medium=twitter#3nslljf> and noting that ""violence continued"" in Missouri. Meanwhile:

[In] his toast for [Ann] Jordan, President quipped that he met Vernon and first, but liked Ann more. The menu consisted of surf and turf and pasta. The Obamas danced nearly every song. A good time was had by all.

The snark wrote itself: dancing while Ferguson burned. A tweet from the office of Gov. Jay Nixon elicited a similar, can-you-believe-the-gall response.

Canceling all appearances at the {@MoStateFair}<hyperlink=“”https://twitter.com/MoStateFair> to visit North {#STL}<hyperlink=“https://twitter.com/hashtag/STL?src=hash”> County tomorrow. Statement to follow.

— Governor Jay Nixon (@GovJayNixon) {August 14, 2014}<hyperlink=“”https://twitter.com/GovJayNixon/statuses/499763706297741313>

When you clicked on the tweet, Twitter recommended an article from {Mother Jones co-editor}<hyperlink=“”http://www.motherjones.com/mojo/2014/08/where-governor-jay-nixon> Clara Jeffrey, headlined ""Where is Governor Jay Nixon?"" and illustrated by a parody of a Where's Waldo? cover. Jeffrey's piece, consisting mostly of tweets from journalists asking why Nixon was not acting, was shared on Facebook more than 1,000 times in an hour. Nixon, a Democrat re-elected in 2012, had {already asked the DOJ}<hyperlink=“http://politicmo.com/2014/08/11/gov-jay-nixon-calls-for-justice-department-investigation-into-shooting-of-ferguson-teen/”> to look into the shooting of Michael Brown. But Nixon {makes a poor contrast}<hyperlink=“http://content.time.com/time/specials/2007/la_riot/article/0,28804,1614117_1614084_1614519,00.html”> with other governors who reacted to unrest in major cities by plunging in and meeting with municipal and law enforcement leaders.

Decades ago, when unrest and police responses broke out in cities, the measurable civilian response was limited to what the media could capture. Local Philadelphians talked to reporters about what it was like to live near the MOVE siege; residents of Cincinnati did the same when their neighbors protested the {killing of Timothy Thomas}<hyperlink=“”http://www.npr.org/programs/atc/features/2001/nov/cincinnati/011101.cincinnati.html>. The reaction to Ferguson (or #Ferguson) is happening on social media, everywhere, shaped by conservatives who want to blame Democrats, police state critics who want to talk about militarization, and foreigners who wonder what the hell is wrong with America. The easiest and most famous targets are the politicians. But as Josh Harkinson has been reporting, Internet activists with no determinated location are currently working to {identify the cop}<hyperlink=“http://www.motherjones.com/politics/2014/08/anonymous-releases-st-louis-police-dispatch-tapes”> who killed Mike Brown.

Update: From Ryan Reilly's Facebook page:

A St. Louis County police officer in full riot gear, who refused to identify himself despite my repeated requests, purposefully banged my head against the window on the way out and sarcastically apologized. I'm fine. But if this is the way these officers treat a white reporter working on a laptop who moved a little too slowly for their liking, I can't imagine how horribly they treat others.

Update II: From Rep. Justin Amash, one week off his defeat of a candidate backed by the Chamber of Commerce:

Images & reports out of {#Ferguson}<hyperlink=“https://twitter.com/hashtag/Ferguson?src=hash”> are frightening. Is this a war zone or a US city? Gov't escalates tensions w/military equipment & tactics.

— Justin Amash (@repjustinamash) {August 14, 2014}<hyperlink=“”https://twitter.com/justinamash/status/499740253633388546>",68,105,NA,NA
Slate,slate14,http://www.slate.com/blogs/moneybox/2014/08/14/ferguson_missouri_government_why_is_it_so_white.html,Ferguson Is Mostly Black. Why Is Its Government So White?,Jordan Weissmann,08/14/2014,02/15/2016,"Ferguson, Missouri, is a majority-black city governed mostly by whites. The mayor is white. The police chief is white. The police force is {94 percent white}<hyperlink=“http://www.vox.com/xpress/2014/8/12/5994181/ferguson-is-67-percent-black-and-its-police-force-is-94-percent-white”>. Only one of its six city council members is black. These facts, as much as anything, have shaped the protests over the police shooting of Michael Brown. Ferguson, with a 67 percent black population, is a place where the largest community has little political voice.

Why is that? David Kimball, a political science professor at the University of Missouri–St. Louis, {has studied}<hyperlink=“http://www.umsl.edu/~kimballd/dk_papers.htm”> the dynamics of race and elections in St. Louis proper. He says that the pattern in Ferguson is common throughout the city’s inner-ring suburbs, where blacks have gradually replaced whites in recent decades.

The issue boils down to who votes. Ferguson is roughly two-thirds black, but compared with the city’s whites, the community is younger, poorer (the city has a 22 percent poverty rate overall), and, as the New York Times recently wrote, {somewhat transient}<hyperlink=“”http://www.nytimes.com/2014/08/13/opinion/racial-history-behind-the-ferguson-protests.html?_r=0&assetType=opinion>, prone to moving “from apartment to apartment.” All of these factors make black residents less likely to go to the polls, especially in low-turnout municipal elections. And so whites dominate politically. “The entire mobilization side of it is what accounts for the difference,” Kimball said.

To illustrate the point, Kimball told me about a recent school board election in which the city’s racial fissures came to the fore. In 2013, Art McCoy, the young and promising school district superintendent, {was suspended}<hyperlink=“”http://www.stltoday.com/news/local/education/suspension-of-ferguson-florissant-superintendent-questioned/article_d26b81af-7010-55b1-8233-50b33a08bb09.html> by the board without explanation. McCoy, who later resigned, was black, as were three-quarters of the district’s students. Six of the school board’s members were white, while the other was Hispanic. Local outrage grew quickly.

“It’s a white school board and then you have this black superintendent, who so many people are impressed with,” Esther Haywood, president of the St. Louis County branch of the NAACP, told the {St. Louis Post Dispatch}<hyperlink=“”http://www.stltoday.com/news/local/education/suspension-of-ferguson-florissant-superintendent-questioned/article_d26b81af-7010-55b1-8233-50b33a08bb09.html>. “Why are they trying to get rid of this black superintendent? We don’t know.”

In the wake of the controversy, three black candidates chose to run for the school board; despite the anger over McCoy’s ouster, {only one}<hyperlink=“”http://news.stlpublicradio.org/post/voters-back-incumbents-normandy-ferguson-florissant-school-board-elections> managed to win a seat.

“I think the school board election is illustrative, because all the elements are there,"" Kimball said. ""You’d think, OK, this is going to motivate the African American community. We’re going to see some changes. It’s kind of depressing from the standpoint of democracy serving all the constituents in the community.” In other words, democracy doesn’t always serve the poor.",539,1600,NA,NA
Slate,slate15,http://www.slate.com/blogs/the_slatest/2014/08/14/ferguson_running_blog_updates_on_protests_in_missouri.html,The Latest on Ferguson: Officer Who Stopped Michael Brown Did Not Know He Was a Robbery Suspect,Ben Mathis-Lilley; Elliot Hannon,08/15/2014,02/15/2016,"Slate will post running news updates about the situation in Ferguson below. {For other Slate coverage of Ferguson, click here.}<hyperlink=“http://www.slate.com/topics/f/ferguson.html”>

Friday, Aug. 15, 3:25 p.m.: Ferguson police chief Thomas Jackson says that Darren Wilson, the officer who stopped and shot Michael Brown, did not know he was a suspect in the robbery of a convenience store and that Brown was stopped because he was blocking traffic.
Friday, Aug. 15, 3 p.m.: From CNN, security camera footage that police say shows Michael Brown stealing cigars and shoving a convenience store clerk on the day of Brown's shooting:

Friday, Aug. 15, 10:17 a.m.: Ferguson police chief Thomas Jackson announced that six-year police veteran Darren Wilson is the officer who killed Michael Brown. According to Jackson, Wilson encountered Brown at 12:01 p.m. on Saturday and, by the time another officer arrived on the scene at 12:04 p.m., Brown had been shot. Jackson said that Wilson did not have a previous disciplinary record.

A report handed out to reporters by Ferguson police alleges that Brown stole cigars from a convenience store and assaulted the store's cashier shortly before the shooting.*

[tweetbegin 500279501369397248 tweetend]

[tweetbegin 500279952160600064 tweetend]

[tweetbegin 500283372925902848 tweetend]

Thursday, Aug. 14, 11:15 p.m.: CNN's Julian Cummings with a {big-if-true report}<hyperlink=“https://twitter.com/JulianCummings/statuses/500100606187819008”>.

Thursday, Aug. 14, 9 p.m.: Slate’s Jamelle Bouie is reporting from Ferguson and spoke to Casey and Nate Fielder, who were at Thursday afternoon’s protest with their three children, all under the age of 3. The Fielders have lived in Ferguson for two years, in the neighborhood right by where Michael Brown was killed. Jamelle asked Casey Fielder: Why are you here? This was her response:


Thursday, Aug. 14, 7:45 p.m.: Protests continued in Ferguson into the evening on Thursday and, so far, reports indicate the tone is much improved from Wednesday night’s confrontation. Highway Patrol Capt. Ron Johnson has taken command of the policing of Ferguson and has taken a new approach to managing the protests. Here’s more on Johnson’s outreach efforts from {the Associated Press}<hyperlink=“http://www.msn.com/en-us/news”>:

He said he planned to keep heavily armored vehicles away from the scene and told his officers not to bring their tear gas masks. By late afternoon, Johnson was walking down the street with a group of more than 1,000 protesters as they chanted ""Hands up, don't shoot,"" a reference to witness accounts that described Brown as having his hands in the air when the officer kept firing. Johnson planned to talk to the demonstrators throughout the night.

{St. Louis Post-Dispatch}<hyperlink=“http://www.stltoday.com/news/local/crime-and-courts/peaceful-ferguson-march-underway/article_0806541b-ed48-5d06-9267-323531ad6cf1.html”>: “As many as 300 marchers are making their way along West Florissant Avenue in what is so far the most peaceful demonstration since the shooting death of Michael Brown five days ago. A police car is leading the procession. Well-wishers and residents handed the marchers water, pizza, homemade dishes and cookies as they passed.”

From {the Associated Press}<hyperlink=“http://abcnews.go.com/US”>: “Early Thursday evening, St. Louis County police and state troopers were walking alongside demonstrators. Several marchers stopped to shake hands with officers. One woman hugged Capt. Ron Johnson of the Highway Patrol, who is overseeing security. The scene stands in stark contrast to earlier this week when officers in riot gear and in military equipment clashed with protesters.”

Thursday, Aug. 14, 5:05 p.m.: Missouri Gov. Jay Nixon says the Missouri Highway Patrol has taken over management of Ferguson ""security operations."" The Ferguson and St. Louis County police who had previously been in place have taken {heavy criticism for their provocative, militaristic approach to maintaining order}<hyperlink=“http://www.vox.com/2014/8/13/6000799/ferguson-governor-nixon-president-obama-need-to-get-control”>. It appears at this point that the St. Louis County police will still be investigating Michael Brown's death, though federal authorities are conducting an independent probe.

Video of Nixon's announcement:

Thursday, Aug. 14, 2:40 p.m.: Missouri Rep. William Lacy Clay says that Gov. Jay Nixon {plans to replace the St. Louis County police officers who have been patrolling Ferguson}<hyperlink=“http://www.bloomberg.com/news/articles/2014-08-14/st-louis-county-police-to-be-removed-from-ferguson-clay”>.

“The governor just called me, and he’s on his way to St. Louis now to announce he’s taking away St. Louis County police out of the situation,” Clay, a Missouri Democrat, said in a telephone interview. He added that Nixon, a 58-year-old Democrat, may ask the Federal Bureau of Investigation to step in.

At an appearance in Florissant (a city near Ferguson that shares a name with Florissant Avenue, a street on which police and protestors have faced off), Nixon promised ""operational shifts"" regarding protests but was not more specific:


Nixon is expected to speak publicly again later this afternoon.

Thursday, Aug. 14, 1:35 p.m.: Minutes ago, President Obama {addressed the Ferguson situation}<hyperlink=“https://www.washingtonpost.com/politics/transcript-president-obamas-remarks-on-unrest-in-ferguson-mo-and-iraq/2014/08/14/c8ce971e-23c7-11e4-958c-268a320a60ce_story.html”> from Martha's Vineyard, where he is on vacation. The president did not announce any new official actions—he reiterated that the FBI and Justice Department will independently investigate Michael Brown's shooting death—but condemned {aggressive police action}<hyperlink=“”http://www.slate.com/articles/news_and_politics/dispatches/2014/08/ferguson_police_attack_protestors_with_tear_gas_rubber_bullets_on_site_reporting.html?wpsrc=sh_all_dt_tw_top>, specifically criticizing the {arrest of journalists}<hyperlink=“http://www.slate.com/blogs/the_slatest/2014/08/13/two_journalists_briefly_arrested_in_ferguson.html”>, and asked protestors to remain peaceful.

...when something like this happens, the local authorities, including the police, have a responsibility to be open and transparent about how they are investigating that death and how they are protecting the people in their communities. There is never an excuse for violence against police or for those who would use this tragedy as a cover for vandalism or looting. There’s also no excuse for police to use excessive force against peaceful protests or to throw protesters in jail for lawfully exercising their First Amendment rights. And here in the United States of America, police should not be bullying or arresting journalists who are just trying to do their jobs and report to the American people on what they see on the ground.

Here is video of Obama's remarks:

In Ferguson, St. Louis alderman Antonio French tweeted that he had been {released from jail}<hyperlink=“https://twitter.com/AntonioFrench/status/499964972823486464”> after being {arrested last night}<hyperlink=“”http://www.slate.com/blogs/the_slatest/2014/08/14/antonio_french_arrested_in_ferguson_st_louis_alderman_taken_in.html>.

Elsewhere, Georgia Congressman and civil-rights movement veteran John Lewis called on Obama to {declare martial law}<hyperlink=“https://twitter.com/mitchellreports/status/499959202841120768”> in order to allow National Guard units to replace local police in Ferguson.

Correction, Aug. 15, 10:55 a.m.: This post originally stated that the convenience store that was allegedly robbed by Michael Brown was the QuikTrip that was later burned. It also stated that Brown allegedly stole several boxes of cigars. The alleged robbery did not take place at the QuikTrip, and only one box of cigars appears to have been taken from the store. ({Return}<hyperlink=”http://www.slate.com/blogs/the_slatest/2014/08/14/ferguson_running_blog_updates_on_protests_in_missouri.html#rt”>.)",3900,1200,NA,NA
