Source,ArticleID,ArticleLink,Title,Author,DatePublished,DateRetrieved,ArticleText,NumberComments,NumberSocialMedia,TheShitBetween,Notes
BlackAmericaWeb,baw17,http://blackamericaweb.com/2014/08/18/the-autopsy-concludes-our-worst-fears-attorney-ben-crump-on-michael-browns-autopsy/,‘The Autopsy Concludes Our Worst Fears’ – Attorney Ben Crump On Michael Brown’s Autopsy,Roland Martin,08/18/14,06/09/16,"Roland Martin talks to Attorney Ben Crump, Glen Ivey (former Federal Maryland Prosecutor) and retired General Honere about the shooting of Michael Brown, the Ferguson teen who was unarmed and shot by police. Attorney Crump is representing Brown’s family and has famously represented Trayvon Martin and many other deaths on social injustice.

“The autopsy concludes our worst fears. He was shot multiple times, the most troubling being the head shots. This is only part of the story. Dr. Baden was not allowed to have his clothes to see if there was gunshot residue on them,” Attorney Crump says.

Glen Ivey expands on the importance of Attorney General Eric Holder stepping in.

“It’s a big step that the Attorney General intervened in this way,” Ivey says. “It was critical for him to move forward with that and it’s important that the Feds have a parallel investigation.”

Click the link above to hear the entire interview!",NA,NA,NA,2 reads
BlackAmericaWeb,baw18,http://blackamericaweb.com/2014/08/15/j-cole-records-michael-brown-tribute-be-free-listen/,J. Cole Records Michael Brown Tribute: ‘Be Free’ [Listen],Eurweb.com,08/15/14,06/09/16,"J. Cole has responded to the shooting death of Michael Brown with a new song titled “Be Free.”

Over somber piano notes, the rapper wails the refrain, “All we wanna do is take the chains off…all we wanna do is be free.”

His tear-stained delivery moves from spoken word to singing. The lyrics plead for peace and equality in light of Brown’s death and the protests in Ferguson, Mo.

The eyewitness accounts of Brown’s friend Dorian Johnson and others are featured in the song.

Listen below:

{J. Cole - Be Free}<hyperlink=""https://soundcloud.com/dreamvillerecords/j-cole-be-free"">

{Folks Jailed While Zimmerman Walks Free}<hyperlink=""http://blackamericaweb.com/playlist/famous-folks-jailed-while-zimmerman-walks-free/item/146055/"">",NA,NA,NA,4 reads
BlackAmericaWeb,baw19,http://blackamericaweb.com/2014/08/19/twitter-backlash-follows-keke-palmer-to-ferguson-video/,Twitter Backlash Follows Keke Palmer to Ferguson (Video),Krystal Franklin,08/19/14,06/09/16,"These days, being Keke Palmer can get you some negative feedback on social media.

The “Just Keke” host found this out firsthand when she weighed in on the Michael Brown shooting and resulting protests on Twitter.

Palmer received “extreme backlash” when she posted the following tweet, which questioned the reason why people were killing and causing harm as she advised her followers to stop using race to separate themselves:

“Oh my Lord, bless Mike Brown & his family. This is terrible. Why y’all? Why do we do this to each other. Why do we hate each other, harm each other, kill each other? We are brothers & sisters y’all. All colors! Peace is the answer. Stop separating yourself through race. That’s the issue. We actually think that’s a thing, we are ALL family! You don’t stop hate with hate. Come on now, MLK taught us that. If you want to end racism, you start by not generalizing/grouping ppl w/ the thought that they all believe the same things.”

Aware of the backlash, Palmer addressed her tweet during an interview with the Huffington Post, as she confessed that she might have been naïve when speaking on what was going on. In addition, the actress mentioned that she planned to visit Ferguson to get a better understanding of what was going on:

“Being naïve is never anything to be ashamed of, because I believe me being naïve [to racism] is what has allowed me to do all the things that I can because if I believe in and quote what’s realistic then I wouldn’t be doing what I’m doing right now. I simply wouldn’t be ‘Cinderella’ on Broadway, I wouldn’t have ‘Just KeKe,’” she stated.

“I wouldn’t have done any of the things that I’ve done. So I think that’s a play on people’s ideas of what they can’t do and what they believe is possible. And for me, I believe everything is possible. That’s the way that I was raised, and from what I’ve been able to do I’ve seen that to be true that your reality is what you make it.”
Regarding her opinion of the Mike Brown situation, Palmer said:

“As far as what’s going on with Mike Brown, I spoke up on that, because unproductive outrage has never gotten us anywhere. Even with MLK and everything that he did for black people…all he spoke about was unity, because throwing hate and being angry, and violence, that doesn’t give us peace and equality. That’s like having sex in order to get your virginity. It’s just the complete opposite thing to do.

“I don’t have all the answers and there are no quick fixes for things like this. But uniting and coming together on one clear message and trying to get that message across is much better than us all being everywhere and fighting against one another and coming from all different sides. That’s never going to get us anywhere.”

{Remembering Mike Brown On His 19th Birthday (May 20, 1996- August 9, 2014)}<hyperlink=""http://blackamericaweb.com/playlist/remembering-mike-brown-on-his-19th-birthday-may-20-1996-august-9-2014/item/282658/"">",NA,NA,NA,17 reads
BlackAmericaWeb,baw20,http://blackamericaweb.com/2014/08/12/president-obama-michael-browns-death-is-heartbreaking/,President Obama: ‘The Death of Michael Brown is Heartbreaking’,The Associated Press,08/12/14,06/09/16,"EDGARTOWN, Mass. (AP) — {President Barack Obama}<hyperlink=""http://blackamericaweb.com/2014/08/08/president-obama-authorizes-airstrikes-in-iraq/""> says that while the shooting death of a Missouri teenager has prompted “strong passions,” people should remember Michael Brown through “reflection and understanding.”

Obama’s comments came in a written statement about 18-year-old Brown. The unarmed teen was fatally shot by a police officer Saturday while walking on a street near his suburban St. Louis home.

Witnesses have said the officer was white and Brown was black. The shooting has prompted violent protests in Brown’s community.

Obama says he and wife Michelle send their deepest condolences to Brown’s family and community. He says the Justice Department is continuing to investigate the situation along with local officials.

The president also called on people to comfort each other “in a way that heals, not in a way that wounds. “

Read Obama’s full statement below:

The death of Michael Brown is heartbreaking, and Michelle and I send our deepest condolences to his family and his community at this very difficult time. As Attorney General Holder has indicated, the Department of Justice is investigating the situation along with local officials, and they will continue to direct resources to the case as needed. I know the events of the past few days have prompted strong passions, but as details unfold, I urge everyone in Ferguson, Missouri, and across the country, to remember this young man through reflection and understanding. We should comfort each other and talk with one another in a way that heals, not in a way that wounds. Along with our prayers, that’s what Michael and his family, and our broader American community, deserve.",NA,NA,NA,7 reads
BlackAmericaWeb,baw21,http://blackamericaweb.com/2014/08/15/rapper-killer-mike-pays-tribute-to-mike-brown/,Rapper Killer Mike Pays Tribute To Mike Brown,NewsOne Staff,08/15/14,06/09/16,"“We are human beings. We deserve to be buried by our children not the other way around. No matter how u felt about black people look at this mother and look at this father and tell me as a human being how u cannot feel empathy for them. How can u not feel sympathy for their pain and loss. These are not ‘THOTS, niggas/niggers, hoes, Ballers, Divas.’ These two people are parents. They are humans that produced a child and loved that child and that child was slaughtered like Game and left face down as public spectacle while his blood drained down the street.” {Read more.}<hyperlink=""http://pitchfork.com/news/56283-killer-mike-writes-essay-about-michael-brown-black-teenager-killed-by-police-in-missouri/"">

Democrats Pay Black Staffers 30% Less

If you’re a person of color hoping to get hired by a political campaign, here’s the ugly truth: You’ll probably get paid less than your white counterparts, if you’re even hired at all. On both sides of the aisle, there is a racial pay gap in campaign politics. Asian, Black and Latino staffers are paid less than their white counterparts, according to an analysis by the New Organizing Institute. For example, African-American staffers on Democratic campaigns were paid 70 cents for each dollar their white counterparts made. For Hispanic staffers in Democratic campaigns, the figure was 68 cents on the dollar. {Read more.}<hyperlink=""http://www.thedailybeast.com/articles/2014/08/11/washington-s-race-pay-gap.html"">

FICO Changes Scoring System For Your Benefit

Changes are coming to the FICO credit-scoring system, potentially allowing millions of people to take out loans. The Wall Street Journal reports that Fair Isaac (FICO), which produces the FICO score, will no longer include failures to pay bills when calculating a score if the issue has since been resolved. The tabulation also will take unpaid medical bills less into account, according to the Journal. {Read more.}<hyperlink=""http://www.dailyfinance.com/2014/08/08/fico-changes-credit-scores/"">

Dawn Porter’s Anti-Civil Rights Espionage Doc ‘Spies Of Mississippi’

In Dawn Porter’s “Spies of Mississippi,” the height of racist delusion is reflected in the history of Mississippi’s Sovereignty Commission, an entity created In 1956 to enable the state government to “maintain a successful fight to preserve the separation of the races,” using “any and all powers.” Those powers, it is revealed throughout the course of the film, involved the construction of a clandestine spy organization which investigated, infiltrated, and sabotaged civil rights organizations throughout Mississippi. {Read more.}<hyperlink=""http://blogs.indiewire.com/shadowandact/review-dawn-porters-anti-civil-rights-espionage-doc-spies-of-mississippi-20140812"">

Young Mother Commits Suicide By Walking Into Oncoming Traffic After Son’s Mysterious Death

A distraught young mother ended her life by walking into oncoming traffic just hours after the mysterious death of her 14-month-old son, Omoyele Gonzales. According to the {Canton Repository,}<hyperlink=""http://www.cantonrep.com/article/20140808/NEWS/140809379/?Start=1""> police were called on Thursday around 7:30 pm to Kayelisa Martin’s Ohio residence after relatives said that she was suicidal. At the same time, investigators say that a relative of the 20-year-old mother showed up at a nearby Canton fire station to report that a toddler was dead. By the time officers arrived at the home, Martin was gone. {Read more.}<hyperlink=""http://madamenoire.com/457332/young-mother-commits-suicide-walking-oncoming-traffic-sons-mysterious-death/"">",NA,NA,NA,1 reads
BlackAmericaWeb,baw22,http://blackamericaweb.com/2014/08/19/kem-talks-new-music-mack-third-sings-happy-birthday-to-sybil/,"Kem Is Performing At The 2014 Allstate Tom Joyner Family Reunion, Talks New Music, ‘Mack & Third’",Krystal Franklin,08/19/14,06/09/16,"Kem is performing at the 2014 Tom Joyner family Reunion Sky Show on Friday, August 29th! His new CD, “Promise to Love” goes on sale August 26th.

He stopped by the TJMS to talk about his new music and much more!

Click the links above to hear or read the entire interview below:

Tom Joyner:  Kem.

KEM:  What’s going on, man?

TOM JOYNER:  What’s going on, man?

SYBIL WILKES:  We need promise to love.

KEM:  Promise to love.

TOM JOYNER:  Man, it’s tight out here, isn’t it?

KEM:  That’s right.

TOM JOYNER:  Man, this whole thing in Ferguson.

KEM:  Yeah.

TOM JOYNER:  And sending Eric Holder in now, Attorney General.  It’s getting rough.

KEM:  I think they need to, yeah.

TOM JOYNER:  Yeah.

KEM:  Yeah, I think they need to.

TOM JOYNER:  Yeah, yeah.  All right, let’s change gears here.

J. ANTHONY BROWN:  Let’s get it smooth, eh?  Smooth it out.

TOM JOYNER:  Yeah, let’s get smooth.  Let’s get smooth.  First of all, I have a favor to ask.

KEM:  Yeah?

TOM JOYNER:  Sybil’s birthday is coming up this tomorrow.

SYBIL WILKES:  It’s tomorrow.

KEM:  It’s tomorrow.

TOM JOYNER:  It’s tomorrow, it’s tomorrow.

SYBIL WILKES:  Yeah.

TOM JOYNER:  Sybil’s birthday is tomorrow, you’re here today.

KEM:  Yeah.

TOM JOYNER:  If you could bang out a Happy Birthday …

J. ANTHONY BROWN:  Bang out Sybil?  (Laughter) You can bang out Sybil.

TOM JOYNER:  It’s early in the morning.

J. ANTHONY BROWN:  He’ll be holding it to you.

SYBIL WILKES:  It wasn’t the way I would’ve asked him.

TOM JOYNER:  You wouldn’t have put it quite that way.

J. ANTHONY BROWN:  You can’t top that with a car.

TOM JOYNER:  Not in …

SYBIL WILKES:  Off air, maybe, Kem, but

TOM JOYNER:  But you can’t bang out a Happy Birthday.

J. ANTHONY BROWN:  Bang out Sybil.  (Laugh)

SYBIL WILKES:  Bang out a Happy Birthday.

J. ANTHONY BROWN:  Put my name on that bang.  (Laughter)

SYBIL WILKES:  Now you’re ruining the moment, Jay.  (Laughter)

TOM JOYNER:  Kem is going to be with us at the Family Reunion.

SYBIL WILKES:  Yes, he is.

JAB:  Yes, he will.

TOM JOYNER:  And I don’t know, when have you been home last?  Because every time you go to a market to promote your new music …

KEM:  Yeah?

TOM JOYNER:  … I hear about it, because in Texas they text me at 646464, and you’ve been a lot of places.  When the last time you’ve been back to Detroit?

KEM:  It’s been a minute.  You know, I told you, we already are promoting Promise To Love, which is out on August 25th, like I’m running for President.  I’m campaigning like I’m running for President.  But, you know, serious talk though, I don’t take my listenership for granted

TOM JOYNER:  No, you don’t.  You never have.

KEM:  So it’s important to go into these markets and see people face to face and thank them, you know, for their support of this classic R&B music face to face.  You know, I learned that from you, man.  I learned that from you, getting up at 3, 4 o’clock in the morning, man, out in the parking lot of Ralph’s and Kroger’s, you know what I mean?  (Laughter)

TOM JOYNER:  I like hugs and kisses.  You know?  Nice bosomy hugs too.

KEM:  Yeah, nothing happens without the people, man.  You got to let the people know you appreciate them.

TOM JOYNER:  Yeah.  And you do, you do.

SYBIL WILKES:  And this will coincide with your fundraising event, your charity, Mack and Third.

KEM:  Right, Mack and Third.

TOM JOYNER:  It’s time for that again.

KEM:  Mack and Third Live is happening on the 24th, the day before the release of the album, in Detroit.  It’s an event, it’s a flagship event of my foundation, Mack and Third, which puts resources back in the hands of organizations and individuals that help people, like the people that helped me when I was homeless and in my addiction in Detroit.  It’s a concert, it’s a benefit, people can come and get, you know, wellness services, blood pressure, cholesterol, activities for the kids, feed the homeless, collect canned goods, you know, so it’s good, I’m performing, and I’ve got some good friends of mine, and yours, the OJ’s are performing as well.

SYBIL WILKES:  Nice.

TOM JOYNER:  Yeah.

KEM:  So it’s going to be a, we’re going to have a good time.

TOM JOYNER:  Good, good, good.  And you’re raising money for your foundation.

KEM:  Yes, sir.  Yes, sir.

TOM JOYNER:  Okay.  Let me donate $5,000 to your foundation.  From me personally.

KEM:  I appreciate that, man.

SYBIL WILKES:  Nice.

KEM:  Thank you so much.

SYBIL WILKES:  Very nice.

KEM:  Yeah, absolutely.

TOM JOYNER:  Because your foundation helps …

SYBIL WILKES:  The people of Detroit.

KEM:  It helps people of the metropolitan Detroit area.

SYBIL WILKES:  Put Sybil down and me for $5,000.

TOM JOYNER:  Put Sybil, put your name on this too?

J. ANTHONY BROWN:  Yeah.

TOM JOYNER:  Put your name on this $5,000?

SYBIL WILKES:  Jay would like to donate $5,000.

J. ANTHONY BROWN:  Yeah.

TOM JOYNER:  Put your name on the $5,000 donation?

J. ANTHONY BROWN:  Yes, yes.  (Laugh) It’s for a good cause, right?

TOM JOYNER:  Yeah.

J. ANTHONY BROWN:  Put my name on it.

TOM JOYNER:  Put your name on it.

KEM:  Yeah, but we’re helping people in the city of Detroit.

TOM JOYNER:  You’re not going to put anything on it?

J. ANTHONY BROWN:  I just did.  (Laughter)

SYBIL WILKES:  Oh, Lord.

TOM JOYNER:  When we come back we’ll talk about the new music, and KEM will bang out Happy Birthday.

KEM:  Watch out, now.

TOM JOYNER:  Promise To Love.

SYBIL WILKES:  That’s the new CD coming out next week.

TOM JOYNER:  It goes on sale next week.

KEM:  Yes, sir.

TOM JOYNER:  Kem, all right, let’s take a listen to this new CD.  This is called Nobody.

[Song]

SYBIL WILKES:  Hmm.

TOM JOYNER:  Ron Isley is featured?

KEM:  Yeah, Ron Isley on My Favorite Thing, yeah, yeah, you know about that.

[Song]

TOM JOYNER:  This sounds real for you.

KEM:  Oh, yeah.

TOM JOYNER:  Don’t Say Goodbye.

[Song]

SYBIL WILKES:  That’s your girl.

KEM:  That’s my artist, that’s my artist, El Renay, who’s also from Detroit, her record is coming out at the top of the year, but I put her single, Don’t Say Goodbye, on my record.

SYBIL WILKES:  Nice.

TOM JOYNER:  I fell in love with her on the cruise.

KEM:  Yeah, yeah, yeah, she’s that, she’s that.

SYBIL WILKES:  And good reason, she is phenomenal.

TOM JOYNER:  Yeah.

KEM:  Yes, and a sweetheart too.

TOM JOYNER:  Yeah.  Still got the short and sexy hair?

KEM:  Absolutely.  Yeah.

TOM JOYNER:  Yeah, I like that.  I like that.  (Laughter) I really like that.  You hooked up with Snoop Dogg?

KEM:  Snoop Dogg’s on this record.

TOM JOYNER:  Snoop Dogg and Kim.

KEM:  Yeah, I know it sound, it sounds crazy, right?

TOM JOYNER:  (Laugh)

SYBIL WILKES:  Yeah, it does, yeah.

KEM:  But somebody sent me a YouTube of Snoop and 2Chainz(?) singing I Can’t Stop Loving You.  Right?  So this rap that I was going to do myself, as soon as I saw it, I was like, dude, why rap when you can get a real rapper, you know what I mean?  And we put the word out and, uh, and he graced us, he graced us with this presence on this album, I love him.

[Song]

TOM JOYNER:  Aw, you didn’t put the rap on there.  Okay, okay, okay.  Soft Side of Love.

[Song]

TOM JOYNER:  Why don’t you come on over for dinner?  And put that knew Kem on.  Oh, Lord, he put the new Kem on.

SYBIL WILKES:  Now I got to stay.

TOM JOYNER:  Now I got to stay, I didn’t come here for all this, I don’t …

[Song]

TOM JOYNER:  Oh, Lord, oh, Lord, oh, Lord.

SYBIL WILKES:  Hmm.

TOM JOYNER:  Okay, so how many Kem CDs are we up to now?

KEM:  This is the fourth studio album, not including the …

TOM JOYNER:  The Christmas …

KEM:  The Christmas record, but just my fourth studio album, yeah.  It’s hard to believe, man, I was thinking about that on the way over here.  I ain’t had a real job in over a decade.

SYBIL WILKES:  (Laugh)

TOM JOYNER:  Because it’s been ten years?

SYBIL WILKES:  Ten years.

KEM:  Yeah.  Yeah.

TOM JOYNER:  It’s been ten years?

ANTHONY BROWN: Out of your regular music, Kem, which is harder for you to put together? Christmas music?

KEM:  Christmas music is harder.

ANTHONY BROWN: It is, eh?

KEM:  Yeah.

ANTHONY BROWN: Because you got to write it in July or something like that.

KEM:  You got to do it – right.  Right.

SYBIL WILKES:  In July.

TOM JOYNER:  Kem, would you come out the basement?

ANTHONY BROWN: I’m writing Christmas songs!

TOM JOYNER:  Kem, I got a sandwich for you.

ANTHONY BROWN: I’m writing Christmas songs!

KEM:  Yeah, people picky about their Christmas music.

TOM JOYNER:  Aren’t you hungry, Kem.

ANTHONY BROWN: (Laugh) No, no.

SYBIL WILKES:  So in terms of picking your favorite Christmas songs?  Or being mindful of other people’s favorites?

KEM:  Either, you know, both.  I mean writing a Christmas song is like, you know, you can’t be really cheesy, you know what I mean, but you got to get all the words in there, and there’s only so many words you can put in a Christmas song, right?  And then when you’re doing somebody else’s record, every record’s been done so many times, so how are you going to approach this differently?  You know what I mean?

SYBIL WILKES:  Yeah, put that Kem spin on it.

[Song]

SYBIL WILKES:  There’s your Christmas, I mean, your wedding song right there.

KEM:  Yeah.

SYBIL WILKES:  There’s your wedding song.

ANTHONY BROWN: No one needs that.

SYBIL WILKES:  (Laugh)

TOM JOYNER:  Says the bitter brother.

SYBIL WILKES:  Everybody but ju, Bitter man, bitter man, bitter man.

ANTHONY BROWN: Yeah.

TOM JOYNER:  Someone just texted and said your single, It’s You, is going to be their wedding song when they get married in October.  You probably get a lot of requests to do weddings.

KEM:  Yeah, I do weddings.  Yeah, I’d be glad to sing at anybody’s wedding, you know?

SYBIL WILKES:  Aw.

TOM JOYNER:  Say what?

KEM:  For $75,000.  (Laughter) For $350,000 you can get me at your wedding.

ANTHONY BROWN: And I would like to.

SYBIL WILKES:  I would like to.

KEM:  But I’ve actually done that in the show, you know?  Somebody will propose at the show, you know?  And I’ve sang, I’ve gone to a couple of fan’s wedding and sang at their wedding.

TOM JOYNER:  Yeah?

KEM: Yeah.

TOM JOYNER:  I don’t know why you said that today.

KEM:  Right?  (Laugh)

TOM JOYNER:  I’m going to send all these messages to you, okay?

ANTHONY BROWN: Yeah, you’re going to be busy.

TOM JOYNER:  Yeah, you’re going to be busy.  (Laugh) Yeah.  And the single, It’s You.

KEM:  The single, It’s You.

TOM JOYNER:  Here it is.

TOM JOYNER:  Kem, and It’s You.  Promise To Love goes on sale next week.

KEM:  Next week, August 25th.

TOM JOYNER:  Yeah.  And Happy Birthday, Sybil.

SYBIL WILKES:  Really, thank you so much.  This really is a great birthday present.  I’m telling you, this CD, really, yesterday just lifted my heart.  It really did.

TOM JOYNER:  All because you were riding around and trying to get Ferguson off your mind for a minute.

SYBIL WILKES:  Just consumed by all that’s going on and putting this in and driving yesterday just really took me to a whole other place, away from all of the madness and all of the sadness.

TOM JOYNER:  Yeah, you listen to Kem and…

SYBIL WILKES:  I don’t like downtown with Snoop, you know, Kem, but all of …

TOM JOYNER:  And Jay, to get his mind off of everything, was watching ratchet reality shows last night.

SYBIL WILKES:  Everybody has their own …

ANTHONY BROWN: right.

TOM JOYNER:  All right, Kem, well, good luck on album, CD number four.

KEM:  Number four. Yeah.

TOM JOYNER:  CD number four, Promise To Love.  On sale next week.

SYBIL WILKES:  And good luck with Mack and Third this weekend yeah.

TOM JOYNER:  Yeah.

KEM:  Thank you, so much, and thanks, Tom, for the donation, we appreciate it, man.

TOM JOYNER:  You got it.  You got it.

SYBIL WILKES:  And we’ll see you next week.

KEM:  Absolutely.

TOM JOYNER:  Yeah, after I’ve made my donation I’ve got no other …

ANTHONY BROWN: Sybil should be dry by then. (Laughter)

TOM JOYNER:  I’ve got no other request to make a donation, but when you sang Happy Birthday everybody wants them to sing Happy Birthday to them now.  (Laugh) All right, Kem, thanks for dropping by, man.",NA,NA,NA,9 reads
