Source,ArticleID,ArticleLink,Title,Author,DatePublished,DateRetrieved,ArticleText,NumberComments,NumberSocialMedia,TheShitBetween,Notes
BlackAmericaWeb,baw8,http://blackamericaweb.com/2014/08/19/in-solidarity-sybrina-fulton-pens-open-letter-to-michael-browns-family/,In Solidarity: Sybrina Fulton Pens Open Letter To Michael Brown’s Family,NewsOne Staff,08/19/14,06/09/16,"Sybrina Fulton, mother of slain teen Trayvon Martin, who at 17-years-old was profiled, stalked and shot to death by George Zimmerman in Stanford, Fla. on February 26, 2012, has penned an open letter to Lesley McSpadden, mother of 18-year-old Michael Brown, who was executed in broad daylight by Ferguson, Missouri police officer Darren Wilson on August 9.

Both teens were unarmed.

In the heartbreaking and powerful letter, published on {Time.com,}<hyperlink=""http://time.com/3136685/travyon-sybrina-fulton-ferguson/""> Fulton urges McSpadden not to allow the character assassination of her son perpetuated by some media outlets and law enforcement, to define who he was:

Facts, myths, and flat out lies are already out there in Michael’s case. Theories, regardless of how ridiculous, are being pondered by the pundits. My advice is to surround yourselves with proven and trusted support. Through it all, I never let go of my faith, my family, or my friends. Long after the overwhelming media attention is gone, you will need those three entities to find your ‘new normal.’ Honor your son and his life, not the circumstances of his alleged transgressions. I have always said that Trayvon was not perfect. But no one will ever convince me that my son deserved to be stalked and murdered. No one can convince you that Michael deserved to be executed.

A recently released autopsy reports shows that Officer Wilson shot Michael Brown at least 6 times, at least twice in the head, before leaving him uncovered on the pavement.

The Ferguson police department refused to release his name for 5 days, even though it’s legally a matter of public record. And once Wilson’s identity was revealed, it was also discovered that he had been allowed to leave town on paid administrative leave.

Read Ms. Fulton’s entire letter at {Time.com.}<hyperlink=""http://time.com/3136685/travyon-sybrina-fulton-ferguson/"">",NA,NA,NA,1 reads
BlackAmericaWeb,baw9,http://blackamericaweb.com/2014/08/13/who-is-anonymous-and-why-do-they-care-about-mike-brown/,Who Is Anonymous – And Why Do They Care About Mike Brown?,Eurweb.com,08/13/14,06/09/16,"Who is behind the shadowy Internet hacker collective Anonymous? We have no idea.

All we know if that they are a loose collective of cyber hackers who sometimes step into volatile situations where hacking might make a difference.  They were involved in the Steubenville rape case, as much of the evidence was disseminated via social media. They started in 2003, and have also been involved in denial of service attacks on government and corporate websites in the hopes of sabotaging or dismantling governments, agencies or corporations that they feel are harmful or oppressive.

A few years ago, several hackers alleged to be their main crew {were arrested and charged with various computer crimes,}<hyperlink=""http://www.huffingtonpost.com/2013/08/21/anonymous-arrests-fbi_n_3780980.html""> but apparently some new people have taken their place. Calling their campaign #OpFerguson, the “hactivists” are working toward the cause of justice in Ferguson, Missouri in the wake of 18-year-old Mike Brown’s shooting by police this past weekend. Protesters have descended on the small town, and several nights of looting and unrest have followed. Brown was unarmed and an eyewitness says he was shot several times even after his hands were up.

{Gawker is reporting}<hyperlink=""http://gawker.com/anonymous-vows-to-id-michael-browns-killer-1621016789?utm_source=feedburner&utm_medium=feed&utm_campaign=Feed%3A+gawker%2Ffull+%28Gawker%29""> Anonymous says they plan to publicly identify the Ferguson, Mo., police officer who shot and killed  Brown over the weekend. They have already released audio that purports to be of the police radio on the night of the day of the shooting.

Ferguson Police Chief Jon Belmar has refused to divulge over fears for the officer’s safety. Belmar has been specifically targed by the group who is alleging some shady goings-on in the department as well as Belmar’s personal life.

{Mother Jones’ Josh Harkinson writes:}<hyperlink=""http://www.motherjones.com/politics/2014/08/anonymous-ferguson-police-killing-unarmed-michael-brown"">

I traded emails last night with one of the half-dozen core Anonymous members working on Operation Ferguson, as the group’s effort to pressure and shame the local police department is known. They were still working to verify the identity of the shooter. “I can only tell you that our source is very close personally to the officer who killed Mike Brown, and that this person is terrified to be our source,” said the anon, whom I will call Fawkes. He added that the source “reached out to us, we did not seek out this person.”

Harkinson’s source said that Anon members were firmly united behind the group’s recent efforts in Ferguson:

Per Harkinson:

It has been a busy few days for Operation Ferguson. The hackers shut down the city’s website for a few hours on Sunday night and Tuesday morning, posted the home address and number of police chief John Belmar, and dropped an email bomb that crammed city and police inboxes with junk messages. The goal was “to get journalists like you to do interviews with us, and incidentally maybe talk about the issue at hand in the process,” Fawkes told me. “Looks like it worked.” Early this morning, the allied Twitter account @TheAnonMessage announced that it had access to emergency response recordings related to Brown’s death.",NA,NA,NA,2 reads
BlackAmericaWeb,baw10,http://blackamericaweb.com/2014/08/15/say-what-draya-michele-calls-browns-death-an-accidental-killing/,Say What?! Draya Michele Calls Michael Brown’s Death An ‘Accidental Killing’,Eurweb.com,08/15/14,06/09/16,"The death of Mike Brown and the outrage and turmoil in Ferguson, MO has triggered a slew of reaction from everyone on social media.

And reality star Draya Michele is no different as she took to Instagram to air out her feelings regarding the tragedy.

Maybe she shouldn’t have bothered.

The following are Draya’s comments on the Mike Brown situation:

“To keep seeing things escalate makes me upset…I don’t know what I can do with my voice other than make other people aware… I wish #MichaelBrown was alive to tell his side of the story, somehow we never get to hear the other side when things like this happen. I don’t think it’s a race thing, I think the police training is outdated, I don’t know maybe the sensitivity has risen due to 9/11 but I really think it’s time for new procedures based on all these accidental killings. #PrayforFerguson.”

Needless to say, Draya got a lot of backlash from what she posted. Which is why she went on Twitter to smooth things over

“And yeah I was just saying, we can’t fix the race issues… But we can train the people to protect and serve us better procedures,” the reality TV star tweeted. “Poor choice of words saying accidental :: I meant homicides that just shouldn’t have happened . I apologize. Sincerely,” Draya said while addressing the haters and the dust up over her Instagram post. “You use voices for whatever you want on your own page… Talking @ me, isn’t going to do much.

“I don’t know how that came off ignorant … But ok… Screaming out racism isn’t going to change what’s inside these people’s head,” she continued.
OK, there you have it straight from Draya Michelle. What say ye? Sound off below.

{Famous Celebrity Feuds}<hyperlink=""http://blackamericaweb.com/playlist/fightin-words-famous-celebrity-feuds/item/98029/"">

{Celebrities React To the Zimmerman Verdict Via Twitter}<hyperlink=""http://blackamericaweb.com/playlist/celebs-more-react-to-the-zimmerman-verdict-via-twitter/item/146103/"">",NA,NA,NA,13 reads
BlackAmericaWeb,baw11,http://blackamericaweb.com/2014/08/13/say-what-gilbert-arenas-calls-rev-al-sharpton-a-thot/,Say What?! Gilbert Arenas Calls Rev. Al Sharpton A Thot,Tonya Pendleton,08/13/14,06/09/16,"NBA bust Gilbert Arenas, who last played for a Chinese basketball team decided to take to his Instagram today to talk about Rev. Al Sharpton and give his thoughts on the Mike Brown shooting. Predictably, Arenas quickly made a fool of himself, calling Sharpton a “coon” and a “thot’ for heading to St. Louis to assist in the Ferguson, Missouri unrest.

Here’s what Arenas had to say:

“I would like to start off by saying too the family of the victim GOD BLESS#RIPmichealbrown you will be missed: too EVERY African American out there..how dumb are we really???every time we hear some bad news, the first thing we do is #RIOT #ROB #STEAL #BURN sh-t in our OWN neighborhoods..this racism fight has never been #blackvswhite, it’s ALWAYS been #blackvsblack from what the stats.. About 10 riots from the black community over the years and the only thing damaged ,was the BLACK COMMUNITY by The BLACK COMMUNITY..only reason they issue riot police isssss just in case you actually got smart enough to walk 6 blocks ,YALL ain’t f-cking up white rich sh-t smdh”

“FAMILiES of the victims pleaseeeeee stop asking #alsharpton to speak or ur behalf,you have a better chance having #caesar the monkey from #planetoftheapes to get justice for you..the stats also show AL coon sharpton has not helped one situation he has protested at,he actually made it worst and because of him the jury goes the other way..(think about it) Jena six,trayvon and the list goes back way back..#AL ur like a #THOT in the club,lookn for attention what u said at trayvons rally #enoughisenough ur right were tired of u PRETENDING”

Of course, Arenas, who says that he’s given over $100,000 to D.C. school while he played for the Washington Wizards and that he gave away $300,000 worth of shoes to needy kids, didn’t mention his own stupidity got him drummed out of the NBA.

You may remember that Arenas was suspended in 2010 when he and Wizards teammate Javaris Crittenton pulled multiple guns on each other during a dispute over a card game on Christmas Eve of 2009. Arenas pled guilty to a misdemeanor gun charge in 2012 and served two years of probation.

The NBA suspended him for 50 games and he last played in the NBA for the Memphis Grizzlies in 2012. (Arenas still collects a lucrative NBA contract and will through 2015, he said recently.) Crittenton was also suspended and was ultimately released by the Wizards, his last NBA team. In 2013, he  was indicted on murder charges in Georgia.

Arenas has four children with longtime girlfriend Gloria Govan, who appeared on Basketball Wives: LA. Her sister Laura Govan is married to L.A. Clipper Matt Barnes and was also part of the Basketball Wives franchise.",NA,NA,NA,5 reads
BlackAmericaWeb,baw12,http://blackamericaweb.com/2014/08/15/breaking-robbery-now-alleged-in-mike-brown-shooting/,"BREAKING: Robbery Now Alleged in Mike Brown Shooting, Officer ID’ed [PHOTO, VIDEO]",David A. Lieb; Alan Scher Zagier; The Associated Press,08/15/14,06/09/16,"FERGUSON, Mo. (AP) — A suburban St. Louis police chief on Friday identified the officer whose fatal shooting of an unarmed black teenager ignited days of heated protests, and released documents alleging the teen was killed after a robbery in which he was suspected of stealing a $48.99 box of cigars.

Brown and his friend, Dorian Johnson, were suspected of taking a box of cigars from a convenience store in Ferguson that morning, according to police reports. Jackson said Wilson went to the area after a 911 call reporting a “strong-arm” robbery just before noon. He said a dispatcher gave a description of the robbery suspect, and Wilson, who had been assisting on another call, was sent to investigate.

Wilson, a six-year veteran of the police department, encountered Brown just after 12:01 p.m., with a second officer arriving three minutes later, Jackson said.

Brown’s uncle, Bernard Ewing, questioned whether Wilson really believed Brown was a suspect. He noted Johnson’s account that the officer told the two young men to get out of the street and onto the sidewalk, and that Brown had his hands up when he was shot.

“If he’s a robbery suspect, they would have had the lights on,” Ewing said. “If you rob somebody, you would tell them, ‘Get on the ground’ or something, not, ‘Get off the sidewalk.'”

“It still doesn’t justify shooting him when he puts his hands up,” he added. “You still don’t shoot him in the face.”

A phone message seeking comment from the family’s attorney, Benjamin Crump, wasn’t immediately returned.

Brown’s death has sparked several days of clashes with furious protesters in the city. The mood was quelled on Thursday after the governor turned oversight of the protests over to the state Highway Patrol. State troopers walking side-by-side with thousands of peaceful protesters replaced the image of previous nights: police in riot gear and armored tanks.

But the police chief’s announcement Friday was met with immediate disbelief and anger by several dozen community members who also attended the news conference, which was hastily held at a gas station burned during a night of looting earlier in the week in Ferguson, a town of 21,000 that is nearly 70 percent black and patrolled by a nearly all-white police force.

“He stopped the wrong one, bottom line,” yelled Tatinisha Wheeler, a nurse’s aide who was at the news conference.

A couple dozen protesters began marching around the charred gas station and in the street chanting, “Hands up, don’t shoot,” and, “What do we want? Justice! When do we want it? Now!”

Police have said Brown was shot after an officer encountered him and another man on the street during a routine patrol. They say one of the men pushed the officer into his squad car, then physically assaulted him in the vehicle and struggled with the officer over the officer’s weapon. At least one shot was fired inside the car before the struggle spilled onto the street, where Brown was shot multiple times, according to police.

Dorian Johnson has told media a different story. He said he and Brown were walking in the street when an officer ordered them onto the sidewalk, then grabbed his friend’s neck and tried to pull him into the car before brandishing his weapon and firing. He said Brown started to run and the officer pursued him, firing multiple times.

Tensions in Ferguson boiled over after a candlelight vigil Sunday night, as looters smashed and burned businesses in the neighborhood, where police have repeatedly fired tear gas and smoke bombs.

By Thursday, there was a dramatic shift in the atmosphere after Gov. Jay Nixon assigned protest oversight to Highway Patrol Capt. Ron Johnson, who is black and grew up near Ferguson. He marched alongside protesters, along with other high-ranking brass from the Highway Patrol and the St. Louis County Police Department.

“We’re here to serve and protect,” Johnson said. “We’re not here to instill fear.”

The streets were filled with music, free food and even laughter. When darkness fell — the point at which previous protests have grown tense — no uniformed officers were in sight outside the burned-out QuikTrip convenience store that had become a flashpoint for standoffs between police and protesters.

“All they did was look at us and shoot tear gas,” Pedro Smith, who has participated in the nightly protests, said Thursday. “This is totally different. Now we’re being treated with respect.”

The more tolerant response came as President Barack Obama spoke publicly for the first time about the shooting — and the subsequent violence that shocked the nation and threatened to tear apart Ferguson.

Obama said there was “no excuse” for violence either against the police or by officers against peaceful protesters.

Attorney General Eric Holder has said federal investigators have interviewed witnesses to the shooting. After the press conference above, the man now in charge of operations in Ferguson, Missouri Highway Patrol captain Ronald Johnson said {even if there were a robbery, the shooting is unrelated}<hyperlink=""http://www.mediaite.com/tv/cpt-ron-johnson-slams-ferguson-presser-shooting-and-alleged-robbery-are-two-separate-issues/#ooid=JydGVvbzrIiTJ29ATJ_1Skad304BqfSJ""> and the two should not be confused.",NA,NA,NA,1 reads
BlackAmericaWeb,baw13,http://blackamericaweb.com/2014/08/11/roland-martin-talks-death-of-mike-brown-riots-in-missouri/,"Roland Martin Talks Death of Mike Brown, Riots in Missouri",Roland Martin,08/11/14,06/09/16,"Roland Martin talks to Brittany Novell of KMO-TV about the killing of Mike Brown, the unarmed Missouri teen who was shot down by the police over the weekend. Brown was supposed to start college on Monday won’t make it there. Instead, his family is planning his funeral after he was shot by police in Ferguson, MO, a suburb of St. Louis.

Click the link above to hear the entire interview!",NA,NA,NA,2 reads
BlackAmericaWeb,baw14,http://blackamericaweb.com/2014/08/19/michael-baisden-is-coming-to-the-2014-allstate-tom-joyner-family-reunion-talks-mentoring-young-men-casting-for-new-play/,"Michael Baisden Is Coming To The 2014 Allstate Tom Joyner Family Reunion, Talks Mentoring Young Men, Casting For New Play",Tonya Pendleton,08/19/14,06/09/16,"Michael Baisden will be joining the Tom Joyner Morning Show crew at the 2014 Family Reunion but the former radio host says he’s thinking about one family in particular right now – the family of slain teenager Michael Brown.

“What’s up to the family down in St. Louis,” Baisden says. “There haven’t been many days that I’ve felt a void or a loss since I’ve been off the air  I have during this situation down in Ferguson. So to the family down in St. Louis, please tell Michael Brown’s family that I’m doing everything I can through {Baisden Live}<hyperlink=""http://www.michaelbaisden.com/""> on Facebook, Instagram and Twitter to support them. The great thing about being on in the afternoon is that we had a chance to support them as all these marches were happening  so we were able to have a plan together and to tell the truth about what was going on. I miss you family, and its hard to be on the sidelines for something like this, but I’m sure it’s all going to work out.”

At the 2014 Tom Joyner Allstate Family Reunion which takes place in Orlando August  28 through September 1, Baisden will be hosting the  ‘Raise Your Hand Relationship Seminar,”a mentoring panel for young men and auditioning actors for his stage play Men Cry In The Dark  II. Baisden has committed himself to working with a group of young Black males in the Orlando area and part of what they’re taught is how to respond to the police.

“We’re going to talk about how to respond to the police. We do that at the beginning of every year. We bring police officers in and all of the boys have individual mentors. Mad love to all the churches in Orlando who pitched in and helped us get mentors. The first two books we’re reading are {Rich Dad, Poor Dad}<hyperlink=""http://www.amazon.com/Rich-Dad-Poor-Teach-Middle/dp/1612680011#""> by Robert Kiyosaki and {Think and Grow Rich}<hyperlink=""https://www.amazon.com/Think-Grow-Rich-Dennis-Kimbro-ebook/dp/B0054KLWOE?ie=UTF8&keywords=kimbro%20think%20and%20grow%20rich&qid=1408459301&ref_=sr_1_1&s=books&sr=1-1""> by Dennis Kimbro. It’s not just an mentoring issue, it’s an economic issue and we need to own those businesses in our community.”

Its unnerving and frustrating for many parents to think that part of raising their sons to be men is ensuring they know how not get killed by the police. It’s particularly frustrating when those are the very people who are supposedly trained to protect them.

“Someone needs to teach these cops how to respond to us. It’s a lot of police both Black and white, who are afraid of us. This is what the Captain has been saying down there in Ferguson – you have to have a relationship with the people. Cops used to walk the beat and we actually touched the cops, talked to the cops and sat down on a park bench with the cops. That’s part of the problem we’re having right now. This occoupation down there it’s like the Keystone cops nonsense down there. Mad love to the protestors. People don’t want to be invisible. When you’re invisible the only thing you can do is protest. That is the voice of the power and that’s what you see happening right now.”

Baisden understand the pain Black men face every day. That’s why he’s taking his book turned stage play Men Cry In The Dark II on the road. He’ll be auditioning at the Family Reunion with Leah Daniels IYes, Lee’s sister)  and is searching for unknowns as well as experienced actors.

“If you’re an unknown it doesn’t matter. I was an unknown radio personality I was an unknown author so you have to know I’m going to be promoting unknowns.”

{Our Favorite Allstate Tom Joyner Family Reunion Moments!}<hyperlink=""http://blackamericaweb.com/playlist/our-favorite-allstate-tom-joyner-family-reunion-moments/item/351482/"">",NA,NA,NA,7 reads
BlackAmericaWeb,baw15,http://blackamericaweb.com/2014/08/15/why-rioting-isnt-the-answer-in-the-michael-brown-case/,Why Rioting Isn’t The Answer In The Michael Brown Case,Jazmine Pendleton,08/15/14,06/09/16,"Once again the nation is in an outrage over the murder of Michael Brown by a Missouri police officer. But the focus has shifted from the actual killing of the 18-year-old to the rioting and looting that has taken place in response. Listen to the audio player to hear Rickey Smiley discuss why this isn’t the answer to seek justice for slain teen.

{Mothers Who Never Received Justice [PHOTOS]}<hyperlink=""http://blackamericaweb.com/playlist/mothers-who-never-received-justice-photos-2/item/282528/"">",NA,NA,NA,1 reads
BlackAmericaWeb,baw16,http://blackamericaweb.com/2014/08/18/verses-and-flow-poet-prentice-powells-mic-dropping-piece-on-being-a-black-man-in-america-exclusive-video/,‘Verses And Flow’ Poet Prentice Powell’s Mic-Dropping Piece On Being A Black Man In America [EXCLUSIVE VIDEO],Jazmine Pendleton,08/16/14,06/09/16,"The fourth season of TV One’s “Verses And Flow” premieres tonight (August 16) and the program is sure to leave you snapping from your living room!  Presented by Lexus and hosted by Laz Alonso, each 30-minute episode features star-studded musical guests and spoken word performances from some of the most profound poets around.

HelloBeautiful caught up with one such artist, Prentice Powell, a Oakland, California native who has had the distinct honor of being the only poet to grace the “Verses And Flow” stage every year since the show’s inception. You may have also seen the 2013 NAACP Image Award Nominee on the “Arsenio Hall Show,” touring with singer Jill Scott or performing at your nearest slam with his spoken word poetry collective, Fiveology, a group of five talented, passionate, and internationally recognized artists. And if you haven’t seen him perform yet, whew, you’re in for a treat! This season of “Verses And Flow,” is unlike any other, he says.

“It was a really really different experience this season for me,” Powell tells us. “Usually I’ve had the opportunity to perform individually but I was blessed by Lexus ‘Verses And Flow’ and asked to be back to be a part of an organization called IconMan which is all about highlighting Black men in general. They highlight your local mailman, your coach who coaches the local basketball team in his free time, Harry Belafonte and other prominent Black men.

So what I was asked to do by ‘Verses And Flow’ is to write and introductory piece for the season. [It] was really different because usually they know your poems, they look and see what they like and you do your own poems, but I was asked to write something specifically for this season. Not only to do that, but to write for four other people as well. So I was able to share the stage with Lance Reddick, Aldis Hodge, Wesley Jonathan and Jay Ellis…it was really wonderful. It was a great experience to get up there and perform with other people who were doing my work — a completely new experience for me.”

Now, he didn’t want to spoil that group performance since it will open tonight’s seasons premiere, but Powell did give us a taste of a poem that he recorded that didn’t make it on the show–and if this is what was left on the cutting room floor, we can’t wait to see more. The piece (in the video above) expresses the poet’s thoughts on what it means to be a Black man in America, a particularly potent narrative and perspective in the wake of Michael Brown’s death by police and the current aftermath in Ferguson, Missouri that has shaken the nation.

In addition to Powell, more than 25 other mic-dropping poets will appear on this year’s eight-episode season of “Verses And Flow” that will also feature the soulful sounds of artists including Maxwell, K. Michelle, Joe, Johnny Gill, Ruben Studdard, Candice Glover, Gary Clark Jr., Sebastian Mikael, Leela James, Anthony Hamilton, Alice Smith and Mali Music. You won’t want to miss it!

{Maya Angelou: Her Beauty, In Her Words}<hyperlink=""http://hellobeautiful.com/playlist/maya-angelou-4/item/2724624/"">",NA,NA,NA,1 reads
