Source,ArticleID,ArticleLink,Title,Author,DatePublished,DateRetrieved,ArticleText,NumberComments,NumberSocialMedia,TheShitBetween,Notes
TheBlaze,blaze56,http://www.theblaze.com/blog/2014/08/15/dems-demand-holder-investigate-another-death-at-the-hands-of-white-cops/,Dems demand Holder investigate another death at the hands of white cops,Pete Kasperowicz,08/15/2014,11/12/2015,"A half dozen New York Democrats are calling on Attorney General Eric Holder to investigate another incident involving the death of a black man at the hands of a white police officer.

Rep. Hakeem Jeffries (D-N.Y.) and his colleagues say they don’t think New York police can fairly investigate the death of 43-year old Eric Garner back in July. Garner was put into a choke hold by NYPD Office Dan Pantaleo that forced him to gasp “I can’t breathe!”

Garner died, and soon after, Pantaleo was {stripped of his gun and badge}<hyperlink=http://www.theblaze.com/stories/2014/07/19/nypd-officer-stripped-of-gun-badge-after-death-of-man-placed-in-apparent-chokehold-during-arrest/>.

But on Thursday in New York, Jeffries said justice has not been served to Pantaleo, which demands a formal federal investigation.

“Eric Garner is dead,” he said. “The person who videotaped the incident was arrested. And the officer who killed Mr. Garner in broad daylight remains free and on the N.Y.P.D.’s payroll. There’s something wrong with that picture.”

Others added that NYPD regulations prohibit choke holds.

“Everything seems to indicate that Mr. Garner was a victim of an unlawful practice that was banned two decades ago, and there are some worrying indications that this tragedy may not get a full and fair investigation absent federal intervention,” said Rep. Jose Serranno (D-N.Y.). “We need a forceful and unbiased entity like the Department of Justice to step in and ensure justice is done.”

Their letter to Holder said police tried to arrest Garner on the suspicion of selling untaxed cigarettes, and instead placed him in a choke hold that caused his death.

“The entire incident was video-taped, including Mr. Garner’s desperate pleas for help,” the letter states. “His request for assistance was ignored by Officer Pantaleo and other NYPD officials who were on the scene.”

“[T]here is no indication that the local district attorney is prepared to aggressively prosecute this case,” they added. “Absent DOJ intervention, we may be marching toward a miscarriage of justice.”

The lawmakers say the event stems from the NYPD’s “broken windows” police policy that targets minorities for minor violations, and said there is evidence that similar crimes are “ignored by the NYPD in the majority-white neighborhoods of New York City.”

“We strongly urge the Department of Justice to open a formal investigation into the policy custody death of Eric Garner and the alleged constitutional and civil rights violations connected with the broken windows law enforcement strategy,” the letter concludes.

Their request came just days after members of the Congressional Black Caucus asked Holder to investigate the shooting death of Michael Brown in Ferguson, Missouri, by a white police officer. Holder has said the Justice Department will run its own investigation of that event, parallel to the investigation being conducted in Missouri.

In that case, Holder has encouraged Ferguson police to have more minorities on staff, and has also warned them {against using military gear}<hyperlink=http://www.theblaze.com/stories/2014/08/14/holder-warns-missouri-police-on-use-of-military-equipment/> to suppress protesters.

Read the letter from New York Democrats to Holder here:",31,28,NA,NA
TheBlaze,blaze57,http://www.theblaze.com/stories/2014/08/14/holder-warns-missouri-police-on-use-of-military-equipment/,Holder Warns Missouri Police on Use of Military Equipment,Pete Kasperowicz,08/14/2014,11/12/2015,"Attorney General Eric Holder on Thursday said his department has warned Missouri police officials against the deployment of military equipment as part of its effort to quell riots taking place there, and said the use of this equipment sends the wrong message.

“At a time when we must seek to rebuild trust between law enforcement and the local community, I am deeply concerned that the deployment of military equipment and vehicles sends a conflicting message,” Holder said Thursday. “At my direction, department officials have conveyed these concerns to local authorities.”

“Also at my direction, the department is offering – through our COPS office and Office of Justice Programs – technical assistance to local authorities in order to help conduct crowd control and maintain public safety without relying on unnecessarily extreme displays of force,” Holder added. “The local authorities in Missouri have accepted this offer of assistance as of this afternoon.”

Holder’s statement was released shortly after President Barack Obama spoke in a televised address that he used to call for {peace and calm}<hyperlink=http://www.theblaze.com/stories/2014/08/14/obama-appeals-for-peace-and-calm-in-ferguson/> among both police and protestors in Missouri.

“There is never an excuse for violence against police or for those who would use this tragedy as a cover for vandalism or looting,” Obama said Thursday. “There’s also no excuse for police to use excessive force against peaceful protests or to throw protesters in jail for lawfully exercising their First Amendment rights.”

Efforts to control protesters Wednesday night led to discussion Thursday about the aggressive actions of the police, including the arrest of two reporters who were later released. Various videos showed police firing tear gas into crowds and near reporters and camera crews, and reports circulated that police were firing rubber bullets.

Those events led Sen. Rand Paul (R-Ky.) to call for a broad effort to {demilitarize the police.}<hyperlink=http://www.theblaze.com/blog/2014/08/14/rand-paul-on-ferguson-police-forces-must-be-demilitarized/> Paul blamed Washington DC for providing anti-terrorism funding to local police departments, which he has has turned some police forces into small armies.

Holder said Justice Department officials are in Missouri to help work with law enforcement officials and others to help reduce tensions in the community, where many are reacting to the killing of an 18-year old black student by a yet-to-be named police officer. One of those steps, Holder said, is that the police should “consider the role that increased diversity in law enforcement can play in helping to build trust within communities.”

In the meantime, Holder said Justice is continuing its parallel investigation of that shooting.

Like Obama, Holder said acts of violence by protestors cannot be condoned.

“Looting and willful efforts to antagonize law enforcement officers who are genuinely trying to protect the public do nothing to remember the young man who has died,” Holder said. “Such conduct is unacceptable and must be unequivocally condemned.”

But at the same time, he said law enforcement officers must do what they can to reduce tensions.

“Those who peacefully gather to express sympathy for the family of Michael Brown must have their rights respected at all times,” Holder said. “And journalists must not be harassed or prevented from covering a story that needs to be told.”",163,613,NA,NA
TheBlaze,blaze58,http://www.theblaze.com/contributions/now-the-time-for-libertarian-politicians-to-take-charge-against-police-militarization/,Now is the Time for Libertarian Politicians to Take Charge Against Police Militarization,Casey Given,08/15/2014,11/12/2015,"As Ferguson, Missouri continues to devolve into chaos, Paul Waldman is standing on the sidelines sticking his tongue out at the liberty movement.

“Why aren’t libertarians talking about Ferguson?” the American Prospect editor {asks in the Washington Post}<hyperlink=https://www.washingtonpost.com/blogs/plum-line/wp/2014/08/13/why-arent-libertarians-talking-about-ferguson/?utm_source=dlvr.it&utm_medium=twitter>, pointing to the fact that prominent politicians and pundits like Sen. Rand Paul (R-Ky.), Rep. Justin Amash (R-Mich.), and John Stossell haven’t said much since last Saturday’s {shooting of unarmed teenager Michael Brown}<hyperlink=http://www.cnn.com/2014/08/11/us/missouri-ferguson-michael-brown-what-we-know/index.html>.

As a noted progressive, Waldman’s motivations in calling out libertarians is little more than partisan tribalism. After all, libertarian thinkers have a long history of opposing police militarization; as seen in the work of publications like {Reason Magazine}<hyperlink=https://reason.com/tags/police-brutality>, think tanks like the {Cato Institute}<hyperlink=http://www.cato.org/blog/police-militarization-ferguson-nationwide?utm_source=Cato+Institute+Emails&utm_campaign=de1a69e265-Cato_Today&utm_medium=email&utm_term=0_395878584c-de1a69e265-142760201&mc_cid=de1a69e265&mc_eid=37b3027a09>, and journalists like {Radley Balko.}<hyperlink=http://www.amazon.com/Rise-Warrior-Cop-Militarization-Americas/dp/1610392116> Mediaite has aggregated a {thorough list}<hyperlink=http://www.mediaite.com/online/libertarians-have-not-been-silent-about-ferguson/> of libertarian commentary on the issue proving this point well.

However, Waldman is correct that it’s taken a few days for small-government congressional champions Paul and Amash to comment on this egregious example of the police state in action. Liberty-loving politicians should take note and jump ahead of partisan trolls like Waldman in the future to establish themselves as true defenders of freedom.

To their credit, both Paul and Amash have broken their silence on the matter since the article was published.

Amash {tweeted}<hyperlink=https://twitter.com/justinamash/status/499740253633388546> at 10:12 PM on Aug. 13, “Images & reports out of {#Ferguson}<hyperlink=https://twitter.com/hashtag/Ferguson?src=hash> are frightening. Is this a war zone or a US city? Gov’t escalates tensions w/military equipment & tactics.” Paul published in {op-ed in Time}<hyperlink=http://time.com/3111474/rand-paul-ferguson-police/> calling to demilitarize the police in wake of the tragedy.

While it is encouraging to watch both politicians disprove Waldman’s bunk criticism, the Ferguson situation presents a rare opportunity for them to lead the charge against police militarization.

To begin with, police militarization like what the American public is witnessing in Ferguson is the very embodiment of big government.

Since 2001, the Department of Homeland Security has spent {$34 billion}<hyperlink=http://www.thedailybeast.com/articles/2011/12/20/local-cops-ready-for-war-with-homeland-security-funded-military-weapons.html> in federal grants for state and local police departments to purchase weapons of warlike tanks and assault rifles, fueling paramilitarylike operations in America’s cities and even small towns. In the early 1970s, there were only a few hundred SWAT raids across the country; by 2005, that number had skyrocketed to {50,000}<hyperlink=http://www.wsj.com/news/articles/SB10001424127887323848804578608040780519904>. Even worse, {hundreds of these raids}<hyperlink=http://www.cato.org/raidmap> have targeted innocent people – some even tragically leading to their deaths.

Politicians afraid of big government squandering their money and trampling on their freedom are witnessing it in action in Ferguson today, highlighting the urgency to get in front of the issue.

Paul should especially be on top of his game as the current Republican {frontrunner for the 2016 presidential election}<hyperlink=http://www.realclearpolitics.com/video/2014/07/21/meet_the_press_rand_paul_is_republican_presidential_frontrunner.html>. The Kentucky politician has historically reached across the aisle to form alliances with Democrats on issues where the libertarian policy perspective aligns with progressives.

For example, he co-sponsored the {Justice Safety Valve Act of 2013}<hyperlink=http://www.huffingtonpost.com/2013/03/20/justice-safety-valve-act-senate_n_2918823.html> with Sen. Patrick Leahy (D-Vt.), giving federal judges more flexibility in sentencing than what mandatory minimums would prescribe. By pushing for more transparency in DHS’s military-to-police pipeline, Paul could further promote his reputation as a no-nonsense, nonpartisan politician who consistently calls the government out when it tramples on Americans’ freedom.

Furthermore, doing so could greatly improve Paul’s reputation among potential African-American voters. The senator has admirably tried to reach out to this historically Democratic demographic by speaking at Howard University last fall, but the talk {did not go as smoothly as he imagined}<hyperlink=https://www.washingtonpost.com/news/post-politics/wp/2013/04/17/rand-paul-acknowledges-stumbles-at-howard-it-is-harder-for-me/>.

By positioning himself as a leader in Congress fighting police militarization, Paul could patch up this rocky relationship and establish himself as a statesman who cares about all Americans’ struggles.

However, Paul and Amash are by no means the only two politicians who can take advantage of the Ferguson situation. The Republican Party in general can work wonders in improving its reputation among the citizenry as defenders of liberty by getting in front of this issue.

After all, what is happening in Ferguson is an injustice not just to Missourians, but all Americans of every political persuasion.",2,20,NA,NA
TheBlaze,blaze59,http://www.theblaze.com/stories/2014/08/19/watch-live-protests-over-michael-brown-shooting-continue-following-violent-monday-night/,Protests Over Michael Brown Shooting Continue Following Violent Monday Night,Jason Howerton,08/19/2014,11/12/2015,"Demonstrators in Ferguson, Missouri, continued to protest the officer-involved shooting of 18-year-old Michael Brown on Tuesday night.

Despite concerns that the situation could intensify after a {police officer in fatally shot a knife-wielding man}<hyperlink=http://www.theblaze.com/stories/2014/08/19/watch-live-coverage-knife-wielding-suspect-reportedly-shot-by-police-in-st-louis-residents-spill-into-the-streets/> in nearby St. Louis, things were calm throughout the night until just after 1 a.m. ET. when tensions briefly flared. Several arrests were then made, including that of at least two journalists, according to reports.

Law enforcement in Ferguson faced a fresh wave of violence and chaos on Monday night as {shots were fired by protesters}<hyperlink=http://www.theblaze.com/stories/2014/08/18/watch-live-protests-over-michael-brown-shooting-ramp-up-once-again-in-ferguson/> and police deployed tear gas. Dozens of people were reportedly arrested and the National Guard was on the ground in Ferguson.",85,137,NA,NA
TheBlaze,blaze60,http://www.theblaze.com/stories/2014/08/12/faa-reportedly-declares-partial-no-fly-zone-over-missouri-suburb-where-unarmed-black-teen-was-shot/,FAA Reportedly Declares Partial No-Fly Zone Over Missouri Suburb Where Unarmed Black Teen Was Shot,Zach Noble,08/12/2014,11/12/2015,"The Federal Aviation Administration has declared a partial no-fly zone over the Missouri suburb in which an unarmed black teenager was killed this weekend, according to multiple reports.

Flights are banned over the St. Louis suburb of Ferguson, Missouri, where {Michael Brown was fatally shot}<hyperlink=http://mashable.com/2014/08/11/brown-shooting-ferguson-protests/#Sbs6D8EcIPqg> by police on Saturday afternoon. The ban apparently stems from a police helicopter being fired upon.

However, some have noted that since the ban seemingly does not apply to commercial flights, its impact falls primarily on news media covering local protests.

NBC News investigative reporter Tom Winter reported that the FAA has restricted the airspace above Ferguson to “provide a safe environment for law enforcement activities.”

[tweetbegin 499281721297498113 tweetend]

[tweetbegin 499282240099344386 tweetend] 

Winter noted the ban is hindering media coverage of the town, which has been {plagued with unrest}<hyperlink=http://www.theblaze.com/stories/2014/08/11/surreal-video-images-out-of-ferguson-as-unrest-resumes-following-shooting-of-unarmed-teenager-i-cant-believe-this-is-happening/> since the police shooting of Brown.

Mashable Editor Brian Ries probed the ban a bit more, learning from authorities that commercial aircraft were exempt from the ban.

[tweetbegin 499284878425612288 tweetend] 

[tweetbegin 499284927075352577 tweetend] 

It seems that media may be the primary target of the ban.

[tweetbegin 499286515345002496 tweetend] 

According to Ries, authorities say the ban was prompted after a police helicopter was shot at Sunday night.

[tweetbegin 499286306175078402 tweetend] 

[tweetbegin 499286399452217344 tweetend] 

",72,280,NA,NA
TheBlaze,blaze61,http://www.theblaze.com/stories/2014/08/10/teen-killed-by-officer-confirmed-as-unarmed-angry-crowds-renew-protests-stop-police-terrorism/,"Teen Killed by Officer Confirmed as Unarmed, Angry Crowds Renew Protests; 'Stop Police Terrorism' (UPDATE: Mom of Dead Teen Wants 'Death Penalty' for Officer)",Dave Urbanski,08/10/2014,11/12/2015,"UPDATE 5:30 p.m.: FERGUSON, Mo. (TheBlaze/AP) — The mother of the 18-year-old black man fatally by a police officer said the officer should be fired, jailed and get “the death penalty.”

Lesley McSpadden said Sunday she doesn’t understand why police didn’t subdue her son with a club or Taser.

Speaking at the site of the Saturday killing, McSpadden added that police haven’t explained why her son was confronted by the officer.

Original story is below

FERGUSON, Mo. (TheBlaze/AP) — An 18-year-old black man {fatally shot by a suburban St. Louis police officer}<hyperlink=http://www.theblaze.com/stories/2014/08/09/hundreds-yell-kill-the-police-after-officer-fatally-shoots-allegedly-unarmed-teenager/> was unarmed, police said Sunday during a news conference that occurred while hundreds of angry protesters gathered outside to demand answers.

Police have not disclosed the name of the man who was killed, but family members said it was Michael Brown, a 2014 high school graduate set to begin classes at Vatterott College on Monday.

Brown’s grandmother, Desiree Harris, said Saturday she saw him minutes before she heard a commotion and went outside. She found Brown’s body less than two blocks away.

“My grandson never even got into a fight,” she said. “He was just looking forward to getting on with his life. He was on his way.”

St. Louis County Police Chief Jon Belmar said that an officer encountered two people on the street near an apartment complex Saturday afternoon in Ferguson, a predominantly black suburb a few miles north of downtown St. Louis.

Belmar said one of the men pushed the officer back into his squad car and a struggle began. Belmar said at least one shot was fired from the officer’s gun inside the police car. Ferguson Police Chief Tom Jackson said authorities were still sorting out what happened inside the police car.

The struggle spilled out into the street, where Brown was shot multiple times. Belmar said the exact number of shots wasn’t known, but “it was more than just a couple.” He also said all shell casings found at the scene matched the officer’s gun. Police are still investigating why the officer shot Brown, who police have confirmed was unarmed.

The second person has not been arrested or charged and was expected to be interviewed later Sunday, Jackson said, adding that authorities aren’t sure if that person was unarmed.

A few hundred protesters gathered outside Ferguson Police headquarters about the time the news conference was to begin. At one point many of them marched into an adjacent police building, some chanting “Don’t shoot me” while holding their hands in the air. Officers stood at the top of a staircase, but didn’t use force; the crowd eventually left.

Protesters outside chanted slogans — “No justice, no peace” and “We want answers” — and some carried signs that read “Stop police terrorism” and “Disarm the police.”

Protests also flared up Saturday night, hours after the shooting:

St. Louis County Police Department is in charge of the investigation. But St. Louis County NAACP member John Gaskin said Saturday that the FBI should get involved “to protect the integrity of the investigation.” St. Louis County Executive Charlie Dooley, who showed up at the protest Sunday to urge calm, said he also will request an FBI investigation.

The officer has been with the Ferguson Police Department for six years, Belmar said, noting he wasn’t aware of other issues involving the officer. He has been placed on paid administrative leave, which is a common procedure after police shootings. Authorities have not disclosed the officer’s race.

Critics have contended that police in the St. Louis area too often target young black men. Statistics on police-involved shootings in the region were not immediately available.

Gaskin alluded to the 2012 racially charged shooting of 17-year-old Trayvon Martin by a Florida neighborhood watch organizer who was acquitted of murder charges, as well as the New York City man who died from a police chokehold after he was confronted for selling individual cigarettes.

“With the recent events of a young man killed by the police in New York City and with Trayvon Martin and with all the other African-American young men that have been killed by police officers … this is a dire concern to the NAACP, especially our local organization,” Gaskin said.

Anthony Shahid, a community activist who led Sunday’s protest, urged demonstrators to post videos and photos on social media so Monday’s planned protests would draw thousands instead of hundreds.

“We’re not worried about what’s happening in Afghanistan,” Shahid said. “We’re worried about what’s happening in Ferguson … black youths being murdered.”",264,3000,NA,NA
TheBlaze,blaze62,http://www.theblaze.com/stories/2014/08/14/the-key-detail-apparently-left-out-of-reports-on-viral-photo-showing-swat-team-dismantling-al-jazeera-crews-equipment/,The Key Detail Apparently Left Out of Reports on Viral Photo Showing SWAT Team 'Dismantling' Al Jazeera Crew's Equipment,Jason Howerton,08/14/2014,11/12/2015,"Stunning photos showing St. Charles County SWAT Team members “disassembling” an Al Jazeera America news crew’s camera equipment during unrest in Ferguson, Missouri, went viral on Wednesday night — but police say the circulating images and reports are very misleading.

[tweetbegin 499933040580501504 tweetend] 

In a statement on Thursday, the St. Charles County Sheriff’s Department said SWAT Team officers were actually “assisting the media in moving their camera equipment and media personnel to a safer area with their consent so that they could continue to cover the event.” The news crew was caught in tear gas and had to leave their position.

The officers reportedly located the journalists and put them into an armored car and proceeded to disassemble and load their equipment. However, people snapped photos and seemingly drew their own conclusions.

According to {KTVI-TV}<hyperlink=http://fox2now.com/2014/08/14/despite-reports-swat-team-helped-al-jazeera-reporters-did-not-take-their-equipment/>, the Al Jazeera reporters even “thanked the officers.”

“On Wednesday, August 13th, video footage was taken of St. Charles County SWAT officers handling media camera equipment,” the statement reads. “The position of the St. Charles County Sheriff’s Department is that the media has the right to cover these events and supports the freedom of the press, and the SWAT Team has not been any part of attempting to prevent media coverage.”

Watch the raw video below:",182,4700,NA,first hyperlink does not work 
