Source,ArticleID,ArticleLink,Title,Author,DatePublished,DateRetrieved,ArticleText,NumberComments,NumberSocialMedia,TheShitBetween,Notes
TheBlaze,blaze15,http://www.theblaze.com/stories/2014/08/13/watch-live-coverage-police-face-off-with-protesters-as-unrest-in-ferguson-continues-days-after-shooting/,Intense Video: Ferguson Resembles a War Zone as Police Clash With Protesters for Fourth Straight Night ,Jason Howerton,08/13/2014,11/10/2015,"Residents in Ferguson, Missouri, on Wednesday night were once again demonstrating in protest of the controversial shooting death of 18-year-old Michael Brown.

Since Sunday, there have been riots, multiple arrests, looting and some violence in the disgruntled St. Louis suburb. Police have responded with heavy-handed tactics, using military-style vehicles and tear gas in an attempt to quell the unrest.

Ferguson Police Chief Thomas Jackson, who has been the public face of the city torn by Saturday’s death of Brown, told reporters earlier in the day that the St. Louis County investigation of the shooting could take weeks to complete. In the meantime, he said, his department welcomes Justice Department training on racial relations in the suburb, where two-thirds of the 21,000 residents are black while all but three of the police force’s 53 officers are white.

“Unfortunately, an undertow (of racial unrest) has bubbled to the surface,” said Jackson. “Race relations is the top priority right now.”

Two reporters were also {reportedly arrested}<hyperlink=http://www.theblaze.com/stories/2014/08/13/reporters-say-ferguson-officers-assaulted-arrested-them-for-not-leaving-mcdonalds-quickly-enough-upon-request/> and then released without charges after they apparently failed to clear an area fast enough.

Here are some of the photos and videos that started to emerge on Wednesday:


At one point, police reportedly used sound in an attempt to disperse demonstrators. Watch the video via Facebook/Wes Suber

[tweetbegin 499754224134012928 tweetend] 

[tweetbegin 499738276698525696 tweetend] 

[tweetbegin 499749214704779264 tweetend] 

[tweetbegin 499694783691239424 tweetend]

[tweetbegin 499728407316692992 tweetend] 

[tweetbegin 499727269913698304 tweetend] 

[tweetbegin 499692589143298049 tweetend] 

[tweetbegin 499710622422949888 tweetend]

[tweetbegin 499744688107446272 tweetend] ",328,4600,NA,NA
TheBlaze,blaze16,http://www.theblaze.com/stories/2014/08/12/the-little-covered-aspect-of-the-unrest-in-ferguson-the-alarming-militarization-of-local-police-photos/,The Little-Covered Aspect of the Unrest in Ferguson: The Alarming Militarization of Local Police (PHOTOS) ,Jason Howerton,08/12/2014,11/10/2015,"Following the police-involved shooting of unarmed teenager Michael Brown, unrest has gripped a St. Louis suburb as protesters and police have clashed for two days straight. The looting and violence that occurred after the tragic shooting in Ferguson, Missouri, resulted not only in multiple arrests, but also a stronger police response.

That brings us to the seemingly glossed over aspect of the unrest in Ferguson: the startling militarization of local police forces.

Some of the photos coming out of Ferguson more closely resemble a war zone than a suburban community in Missouri.

Officers — some riding in military vehicles — responded to the unrest wearing full-camo riot gear, combat boots and armed with “short-barreled 5.56-mm rifles based on the military M4 carbine, with scopes that can accurately hit a target out to 500 meters,” according to {Business Insider’s Paul Szoldra.}<hyperlink=http://www.businessinsider.com/police-militarization-ferguson-2014-8>

Szoldra, who served on a U.S. Marine on patrol in Afghanistan, brings a {unique perspective}<hyperlink=http://www.businessinsider.com/police-militarization-ferguson-2014-8> to the police situation in Ferguson:

While serving as a U.S. Marine on patrol in Afghanistan, we wore desert camouflage to blend in with our surroundings, carried rifles to shoot back when under enemy attack, and drove around in armored vehicles to ward off roadside bombs.

We looked intimidating, but all of our vehicles and equipment had a clear purpose for combat against enemy forces. So why is this same gear being used on our city streets?

[...]

Their uniform would be mistaken for a soldier’s if it weren’t for their “Police” patches. They wear green tops, and pants fashioned after the U.S. Marine Corps MARPAT camouflage pattern. And they stand in front of a massive uparmored truck called a Bearcat, similar in look to a mine-resistant ambush protected vehicle, or as the troops who rode in them call it, the MRAP.

“Why do these cops need MARPAT camo pants again,” I asked on Twitter this morning. One of the most interesting responses came from a follower who says he served in the Army’s 82nd Airborne Division: “We rolled lighter than that in an actual warzone.”",541,13900,NA,NA
TheBlaze,blaze17,http://www.theblaze.com/stories/2014/08/18/obama-sends-attorney-general-eric-holder-to-ferguson-calls-for-calm-in-wake-of-renewed-violence/,"Obama Sends Attorney General Eric Holder to Ferguson, Calls for Calm in Wake of Renewed Violence ",Fred Lucas,08/18/2014,11/10/2015,"President Barack Obama announced Monday that Attorney General Eric Holder will be traveling to Ferguson, Missouri this week, a community torn by racial tension after a police shooting.

“The attorney general himself will be traveling to Ferguson on Wednesday to meet with the FBI agents and DOJ personnel conducting the criminal investigation and he will receive an update from them on their progress. He will also be meeting with other leaders in the community,” Obama said during a Monday press conference.

Obama called again for restraint from both protesters and police to “seek some understanding, rather than simply holler at each other.”

“It is clear that the vast majority of people are peacefully protesting, what is also clear is a small minority of individuals are not,” Obama said. “Giving into that anger by looting, carrying guns, or even attacking the police, only serves to raise tensions and stir up chaos. It undermines rather than advancing justice.”

“Let me also be clear that our constitutional rights to speak freely, assemble, and to her wart in the press must be vigilantly safeguarded — and to report in the press must be vigilantly safeguarded. Ours is a nation of laws. The citizens who live under them and for them — for the citizens who live under them and for those who enforce them,” Obama said.

Obama returned from his vacation in Martha’s Vineyard to meet with administration officials before delivering remarks, and addressed the unrest in Missouri resulting from a police shooting.

The city of Ferguson, Missouri has seen racial tension for the last two weeks after a white policy officer shot and killed Michael Brown, an 18-year-old African American.

He said that he urged caution to Missouri Gov. Jay Nixon, who called up the National Guard in the state.",129,219,NA,NA
TheBlaze,blaze18,http://www.theblaze.com/stories/2014/08/19/many-people-are-getting-this-ferguson-related-story-about-news-reporter-completely-wrong/,Many People Are Getting This Ferguson-Related Story About News Reporter Completely Wrong,Jason Howerton,08/19/2014,11/10/2015,"Despite speculation on social media, St. Louis Post-Dispatch reporter Christine Byers has not been suspended or placed on leave for reporting on Twitter Monday night that more than a dozen witnesses have corroborated the police’s account of the fatal shooting of 18-year-old Michael Brown.

The Post-Dispatch provided the following statement from Editor Gilbert Bailon to TheBlaze on Tuesday:

Christine Byers is a police reporter for the St. Louis Post-Dispatch who has been on FMLA leave since March. She is not involved in the Ferguson coverage while she is on leave. Her tweets are personal.
 
She has tweeted today in regards to her tweet Monday: “On FMLA from paper. Earlier tweets did not meet standards for publication.”

Byers made a splash when she reported on Monday night: “Police sources tell me more than a dozen witnesses have corroborated cop’s version of events in shooting.” The tweet sparked several news reports and more than 2,600 retweets.

On Tuesday, Byers then tweeted: “On FMLA from paper. Earlier tweets did not meet standards for publication.” Her message was meant to convey that she is on leave and not actively covering the Ferguson situation for the newspaper.

FMLA is the abbreviation for the Family and Medical Leave Act, which permits qualified employees to “take unpaid, job-protected leave for specified family and medical reasons with continuation of group health insurance coverage under the same terms and conditions as if the employee had not taken leave.”

[tweetbegin 501788192727498752 tweetend] ",86,151,NA,NA
TheBlaze,blaze19,http://www.theblaze.com/stories/2014/08/18/report-more-than-a-dozen-witnesses-have-corroborated-officer-darren-wilsons-version-of-ferguson-shooting/,Report: More Than a Dozen Witnesses Have Corroborated Officer Darren Wilson's Version of Ferguson Shooting ,Jason Howerton,08/18/2014,11/10/2015,"More than a dozen witnesses have backed up the account of Ferguson police officer Darren Wilson in the controversial shooting of 18-year-old Michael Brown, police sources reportedly told St. Louis Post-Dispatch reporter Christine Byers.

Byers also reported on Monday that Brown’s body was transported from the county medical examiner to a funeral home and then back to the medical examiner for three autopsies.

[tweetbegin 501556693382094848 tweetend] 

Protests continued on Monday night, more than a week after Brown was fatally shot by Wilson.

Though Wilson has not spoken publicly about his side of the story, an alleged friend of the officer, identified only as Josie, shared what she claimed to be Wilson’s recollection of events. CNN later confirmed that the woman’s account matches Wilson’s account of the shooting, according to their law enforcement sources.

The woman called into TheBlaze TV host Dana Loesch’s radio show on Friday, claiming that {Brown “bum-rushed” Wilson}<hyperlink=http://www.theblaze.com/stories/2014/08/18/cnn-now-reporting-potential-bombshell-in-ferguson-shooting-regarding-what-alleged-friend-of-officer-darren-wilson-told-theblazes-dana-loesch-on-air/> moments after pushing him into his squad car, punching him in the face and trying to grab the cop’s gun.

“Michael and his friend turn around. And Michael taunts him… And then all the sudden he just started bumrushing him. He just started coming at him full speed. And, so he just started shooting. And, he just kept coming. And, so he really thinks he was on something,” the caller added. “The final shot was in the forehead, and then he fell about two or three feet in front of the officer.”",549,58200,NA,NA
TheBlaze,blaze20,http://www.theblaze.com/stories/2014/08/18/watch-live-protests-over-michael-brown-shooting-ramp-up-once-again-in-ferguson/,"Protests in Ferguson Reach Critical Point Amid Reports of Shots Fired, Tear Gas ",Jason Howerton,08/18/2014,11/10/2015,"UPDATE — 2:05 a.m.: 12 individuals were apparently arrested with weapons on them:

[tweetbegin 501604373571833856 tweetend] 

UPDATE — 12:15 a.m.: Though protests in Ferguson, Missouri, on Monday stayed relatively peaceful for most of the night, there were reports of shots fired and police seemingly deployed tear gas at around midnight. Police made multiple arrests.

A police officer later confirmed to CNN that there was a gunshot victim injured during the protests. KMBC-TV reporter Eli Rosenberg posted the following photo on Twitter late Monday:

[tweetbegin 501580853840216064 tweetend] 

It was unclear who shot the man pictured above. There were also unconfirmed reports of additional shots fired.

[tweetbegin 501581299858284544 tweetend] 

[tweetbegin 501580206369280000 tweetend] 

[tweetbegin 501583865828638720 tweetend] 

[tweetbegin 501581193284829184 tweetend] 

VICE News also had their own live stream going on Monday night:

Protests continued in Ferguson, Missouri, on Monday, more than a week after the shooting death of 18-year-old Michael Brown. Though some of the unrest was temporarily quelled when Missouri Highway Patrol replaced militarized police forces on Thursday, things spun out of control over the weekend as looting and violence reemerged.

Brown, a robbery suspect at the time, was fatally shot by Ferguson police officer Darren Williams after an alleged physical altercation. An alleged friend of Williams called into TheBlaze TV host Dana Loesch’s radio show on Friday to offer what she said is the {officer’s side of the story.}<hyperlink=http://www.theblaze.com/stories/2014/08/18/cnn-now-reporting-potential-bombshell-in-ferguson-shooting-regarding-what-alleged-friend-of-officer-darren-wilson-told-theblazes-dana-loesch-on-air/>

The protests got off to a tense start as Getty photographer Scott Olson was apparently arrested and released for not clearing out of an area fast enough. Further, protesters reportedly attempted to storm Missouri Gov. Jay Nixon’s office in St. Louis:

[tweetbegin 501497010189791232 tweetend] 

There were reportedly several arrests made in St. Louis after protesters blocked the entrance to the governor’s office

[tweetbegin 501496689127997440 tweetend] 

[tweetbegin 501474294258757633 tweetend] 

[tweetbegin 501485501518725121 tweetend] 

[tweetbegin 501521638144221184 tweetend] ",172,469,NA,NA
TheBlaze,blaze21,http://www.theblaze.com/stories/2014/08/18/missouri-governor-orders-national-guard-to-ferguson-to-help-restore-peace-and-order/,Missouri Governor Orders National Guard to Ferguson to 'Help Restore Peace and Order',Oliver Darcy,08/18/2014,11/10/2015,"FERGUSON, Mo. (AP) — Missouri Gov. Jay Nixon ordered the National Guard to Ferguson early Monday, hours after police used tear gas to clear protesters off the streets following a week of demonstrations against the fatal police shooting of a black Missouri teenager.

In a statement, Nixon said the National Guard would “help restore peace and order” to this the St. Louis suburb that has been filled almost nightly with angry, defiant crowds.

[tweetbegin 501259626365874177 tweetend] 

The latest confrontation came on the same day that Attorney General Eric Holder ordered a federal medical examiner to perform another autopsy on a black Missouri teenager who was fatally shot by a white police officer. A preliminary private autopsy found that Brown was shot at least six times, including twice in the head.

As night fell in Ferguson, another peaceful protest quickly deteriorated after marchers pushed toward one end of a street. Police pushed them back by repeatedly firing tear gas, and the streets were empty well before the curfew took effect at midnight.

Authorities said they were responding to reports of gunfire, looting, vandalism and protesters who hurled Molotov cocktails.

“Based on the conditions, I had no alternative but to elevate the level of response,” said Capt. Ron Johnson of the Missouri Highway Patrol, who is command in Ferguson.

At least two people wounded in shootings, he said.

The “extraordinary circumstances” surrounding the death of 18-year-old Michael Brown and a request by Brown’s family members prompted the Justice Department’s decision to conduct a third autopsy, agency spokesman Brian Fallon said in a statement.

The examination was to take place as soon as possible, Fallon said.

The results of a state-performed autopsy would be taken into account along with the federal examination in the Justice Department investigation, Fallon said.

Dr. Michael Baden, a former New York City chief medical examiner, told The New York Times that one of the bullets entered the top of Brown’s skull, suggesting that his head was bent forward when he suffered a fatal injury.

Brown was also shot four times in the right arm, and all the bullets were fired into his front, Baden said.

The Justice Department already had deepened its civil rights investigation into the shooting. A day earlier, officials said 40 FBI agents were going door-to-door gathering information in the Ferguson neighborhood where Brown, who was unarmed, was shot to death Aug. 9.

A federally conducted autopsy “more closely focused on entry point of projectiles, defensive wounds and bruises” might help that investigation, said David Weinstein, a former federal prosecutor who supervised the criminal civil rights section of Miami’s U.S. attorney’s office. The move is “not that unusual,” he added.

Federal authorities also want to calm any public fears that no action will be taken on the case, Weinstein said.

Back in Ferguson, Sunday’s clashes erupted three hours before the midnight curfew imposed by Gov. Jay Nixon.

Officers in riot gear ordered all the protesters to disperse. Many of the marchers retreated, but a group of about 100 stood defiantly about two blocks away until getting hit by another volley of tear gas.

Protesters laid a line of cinder blocks across the street near the QuikTrip convenience store that was burned down last week. It was an apparent attempt to block police vehicles, but the vehicles easily plowed through. Someone set a nearby trash bin on fire, and the crackle of gunfire could be heard from several blocks away.

Within two hours, most people had been cleared off West Florissant Avenue, one of the community’s main thoroughfares. The streets remained quiet as the curfew began. It was to remain in effect until 5 a.m.

Earlier in the day, Johnson said he had met members of Brown’s family and the experience “brought tears to my eyes and shame to my heart.”

“When this is over,” he told the crowd, “I’m going to go in my son’s room. My black son, who wears his pants sagging, who wears his hat cocked to the side, got tattoos on his arms, but that’s my baby.”

Johnson added: “We all need to thank the Browns for Michael. Because Michael’s going to make it better for our sons to be better black men.”

The protests have been going on since Brown’s death heightened racial tensions between the predominantly black community and the mostly white Ferguson Police Department, leading to several run-ins between police and protesters and prompting Missouri’s governor to put the state highway patrol in charge of security.

Ferguson police waited six days to publicly reveal the name of the officer and documents alleging Brown robbed a convenience store shortly before he was killed. Police Chief Thomas Jackson said the officer did not know Brown was a robbery suspect when he encountered him walking in the street with a friend.

Nixon said Sunday on ABC’s “This Week” that he was not aware the police were going to release surveillance video from the store where Brown is alleged to have stolen a $49 box of cigars.

“It’s appeared to cast aspersions on a young man that was gunned down in the street. It made emotions raw,” Nixon said.

Police have said little about the encounter between Brown and the officer, except to say that it involved a scuffle in which the officer was injured and Brown was shot. Witnesses say the teenager had his hands in the air as the officer fired multiple rounds.

The officer who shot Brown has been identified as Darren Wilson, a six-year police veteran who had no previous complaints against him. Wilson has been on paid administrative leave since the shooting, and the department has refused to say anything about his whereabouts. Associated Press reporters have been unable to contact him at any addresses or phone numbers listed under that name in the St. Louis area.

Also Sunday, about 150 people gathered in St. Louis to show support for Wilson. The crowd protested outside a TV station because it had broadcast from in front of the officer’s home.

The St. Louis Post-Dispatch said the station, KSDK, later apologized. Other in the group, composed mostly of police and relatives of officers, carried signs urging people to wait for all the facts.",298,3700,NA,NA
TheBlaze,blaze22,http://www.theblaze.com/stories/2014/08/17/watch-live-ferguson-braces-for-second-midnight-curfew/,Tear Gas Fills Streets as Ferguson Braces for Second Midnight Curfew,Dave Urbanski,08/17/2014,11/10/2015,"Protesters and police clashed Sunday night on the streets of {Ferguson, Missouri}<hyperlink=http://www.theblaze.com/news/ferguson/>, as the town braced for a second midnight curfew.

The curfew was in effect until 5 a.m. Monday, as protests showed no sign of abating after the fatal shooting of unarmed teenager {Michael Brown}<hyperlink=http://www.theblaze.com/news/michael-brown/> in the St. Louis suburb last weekend.

Saturday, the first night of a state-imposed curfew in Ferguson, ended with tear gas and seven arrests after police dressed in riot gear used armored vehicles to disperse defiant protesters. Sunday was much the same.

After marchers pushed toward one end of a street, police pushed them back by repeatedly firing tear gas; the streets were empty well before the curfew took effect at midnight.

Authorities said they were responding to reports of gunfire, looting, vandalism and protesters who hurled Molotov cocktails.

“Based on the conditions, I had no alternative but to elevate the level of response,” said Capt. Ron Johnson of the Missouri Highway Patrol, who is command in Ferguson.

At least two people wounded in shootings, he said.

[tweetbegin 501202447373578242 tweetend] 

[tweetbegin 501202390830178305 tweetend] 

UPDATE 10:59 p.m.: Some protesters threw Molotov cocktails toward officers before police shot tear gas toward them, {CNN reported}<hyperlink=http://www.cnn.com/2014/08/17/us/missouri-teen-shooting/index.html?hpt=hp_t1>, citing St. Louis County police. CNN added that authorities hit one defiant protester with rubber bullets.

UPDATE 10:48 p.m.: More images and reports from Sunday night’s activity in the streets from {Jon Swaine}<hyperlink=https://twitter.com/jonswaine> of the Guardian:

[tweetbegin 501195561710518274 tweetend] 

[tweetbegin 501194703354990592 tweetend] 

[tweetbegin 501193280948682752 tweetend] 

[tweetbegin 501192293546598400 tweetend] 

[tweetbegin 501191915610456064 tweetend] ",241,3500,NA,NA
TheBlaze,blaze23,http://www.theblaze.com/stories/2014/08/15/minister-who-called-out-black-community-following-ferguson-riots-has-a-message-for-al-sharpton/,Minister Who Called Out Black Community Following Ferguson Riots Has a Message for Al Sharpton ,Jonathon M. Seidl,08/15/2014,11/10/2015,"On Tuesday, Johnathan Gentry became an Internet sensation when he went on rant against the black community following the riots in Ferguson, Missouri, and the shooting death of 18-year-old Michael Brown. Friday, he doubled down in a passionate appearance on Fox News, calling out everyone from President Obama to the NAACP and Al Sharpton.

“I hate to say this, but I’m going to tell you what you need to hear as opposed to what you want to hear!” Gentry, identified by Fox as a {minister}<hyperlink=http://video.foxnews.com/v/3731606825001/ministers-explosive-rant-on-violence-in-ferguson-goes-viral/?playlist_id=930909787001#sp=show-clips> and who is {based in Los Angeles}<hyperlink=https://www.facebook.com/johnathangentrydotcom/timeline>, said earlier in the week. “All we know how to do is blame the police and white folks for our actions. That’s all we know how to do is blame police and white folks.”

“‘They mistreating us,’” he added in a mocking voice. “‘They beating on us. Oh slavery still exists. Oh oh.’ I’m sick of it!”

On Friday, he picked up right where he left off, turning his attention to Al Sharpton and others after he was asked about them.

He started by asking Sharpton “Where were you?” in regards to shootings in Chicago and California.

“You only come around when something happens with the police or Caucasians. You’re not there for the black community so you need to stop fronting — and NAACP as well. I want to call them out as well! They’re good for nothing. All they do is perpetuate hate.”

He also referenced comments from NBA player Gilbert Arenas, {who called out Sharpton, too}<hyperlink=http://www.mediaite.com/online/nba-star-calls-al-sharpton-a-coon-for-stepping-into-ferguson/>.

As for Obama? “Same old song and dance.”

“It’s just PR in my opinion,” he added. “Someone just handed him a note and said, ‘Speak.’”

He also went on to place blame on Brown and his friend for what happened:

If you two brothers would have just moved to the sidewalk like the officer said, we would not be here. If you would have just moved to the sidewalk and obeyed, we would not be here. 1 Samuel 15:23: “Rebellion is at the sin of witchcraft.” This went from stage one, stage two, stage three, here we are, stage five. Total chaos.",186,27200,NA,NA
