Source,ArticleID,ArticleLink,Title,Author,DatePublished,DateRetrieved,ArticleText,NumberComments,NumberSocialMedia,TheShitBetween,Notes
TheBlaze,blaze30,http://www.theblaze.com/stories/2014/08/14/here-is-your-new-police-leader-missouri-highway-patrol-seizes-control-of-ferguson-as-protests-enter-fifth-night/,'Here Is Your New Police Leader': Missouri Highway Patrol Seizes Control of Ferguson as Protests Enter Fifth Night,Oliver Darcy,08/14/2014,11/10/2015,"FERGUSON, Mo. (AP) — The Missouri Highway Patrol seized control of a St. Louis suburb Thursday, stripping local police of their law-enforcement authority after four days of clashes between officers in riot gear and furious crowds protesting the death of an unarmed black teen shot by an officer.

The intervention, ordered by Missouri Gov. Jay Nixon, came as President Barack Obama spoke publicly for the first time about Saturday’s fatal shooting of Michael Brown and the subsequent violence that has threatened to tear apart Ferguson, a town that is nearly 70 percent black patrolled by a nearly all-white police force.

Obama said there was “no excuse” for violence either against the police or by officers against peaceful protesters.

Nixon’s promise to ease the deep racial tensions was swiftly put to the test as demonstrators gathered again Thursday evening in the neighborhood where looters smashed and burned businesses on Sunday and police repeatedly fired tear gas and smoke bombs.

[textbegin 500048780188979201 textend] 

After a particularly violent Wednesday night, Nixon said Thursday that local police are no longer in charge of the area, although they would still be present. He said Highway Patrol Capt. Ron Johnson was in command.

[textbegin 500049827015979008 textend] 

The change was meant to ensure “that we allow peaceful and appropriate protests, that we use force only when necessary, that we step back a little bit and let some of the energy be felt in this region appropriately,” Nixon said.

“Ferguson will not be defined as a community that was torn apart by violence but will be known as a community that pulled together to overcome it,” the governor said at a news conference in the nearby community of Normandy.

Johnson, who is black, said he grew up in the area and “it means a lot to me personally that we break this cycle of violence.” He said he planned to keep heavily armored vehicles away from the scene and told his officers not to bring their tear gas masks.

By late afternoon, Johnson was walking down the street with a group of more than 1,000 protesters as they chanted “Hands up, don’t shoot,” a reference to witness accounts that described Brown as having his hands in the air when the officer kept firing.

Johnson planned to talk to the demonstrators throughout the night.

“We’re going to have some conversations with them and get an understanding of what’s going on.”

Earlier Thursday, President Barack Obama appealed for “peace and calm” on the streets.

“I know emotions are raw right now in Ferguson, and there are certainly passionate differences about what has happened,” Obama said, speaking from the Massachusetts island where he’s on a two-week vacation. “But let’s remember that we’re all part of one American family. We are united in common values, and that includes the belief in equality under the law, respect for public order and the right to peaceful public protests.”

St. Louis County police spokesman Brian Schellman said officers on Wednesday night tossed tear gas to disperse a large crowd of protesters after some threw Molotov cocktails and rocks at officers. More than 10 people were arrested in Ferguson.

“In talking to these guys, it is scary,” Schellman said of officers on the front lines of the protest. “They hear gunshots going off, and they don’t know where they’re coming from.”

[textbegin 500075189779329024 textend] 

Residents in Ferguson have complained about the police response that began soon after Brown’s shooting with the use of dogs for crowd control — a tactic that for some evoked civil-rights protests from a half-century ago. The county police force took over, leading both the investigation of Brown’s shooting and the subsequent attempts to keep the peace at the smaller city’s request.

County Police Chief Jon Belmar said his officers have responded with “an incredible amount of restraint” as they’ve had rocks and bottles thrown at them, been shot at and had two dozen patrol vehicles destroyed.

The city and county are also under criticism for refusing to release the name of the officer who shot Brown, citing threats against that officer and others. The hacker group Anonymous on Thursday released a name purported to be that of the officer, but the Ferguson police chief said later that the name was incorrect.

Twitter quickly suspended the Anonymous account that posted the officer’s purported identity and personal information. The site’s code of conduct strictly forbids the publication of private and confidential information without permission.

Police have said Brown was shot after an officer encountered him and another man on the street. They say one of the men pushed the officer into his squad car, then physically assaulted him in the vehicle and struggled with the officer over the officer’s weapon. At least one shot was fired inside the car. The struggle then spilled onto the street, where Brown was shot multiple times.

The officer involved was injured, with one side of his face swollen, Jackson said.

Dorian Johnson, who says he was with Brown when the shooting happened, has told a much different story. He has told reporters that the officer ordered them out of the street, then grabbed his friend’s neck and tried to pull him into the car before brandishing his weapon and firing. He says Brown started to run and the officer pursued him, firing multiple times.
",143,206,NA,NA
TheBlaze,blaze31,http://www.theblaze.com/stories/2014/08/14/hacker-group-claims-to-have-idd-officer-who-shot-michael-brown-in-ferguson-but-police-say-name-is-false/,Hacker Group Claims to Have ID'd Cop Who Shot Unarmed Teen in Ferguson – but Police Say It's a 'Random Citizen',Jason Howerton,08/14/2014,11/10/2015,"Hacker group Anonymous released what it claimed to be the name of the police officer who shot and killed 18-year-old Michael Brown in Ferguson, Missouri. The group also threatened on Thursday to publish the officer’s photograph and other information if they didn’t get a response from St. Louis County Police Department.

However, St. Louis County police reportedly told St. Louis Post-Dispatch reporter {Joel Currier}<hyperlink=https://twitter.com/joelcurrier> that the name released by Anonymous is false and is not a Ferguson or St. Louis County officer.

St. Louis County Police also responded to the Anonymous group on Twitter, refusing to release the identity of the officer involved in the shooting.

[textbegin 499932127664676864 textend] 

“Do not release more info on this random citizen,” the police department added.

Police in Ferguson have decided against naming the officer involved in the shooting due to concerns for his safety after several death threats were made against him and his family.

The Anonymous group threatened to release a photo of who it claimed was the officer at 10 a.m. CT, his address at 12 p.m. CT and everything else they know about the officer at 2 p.m. CT if they get no response from St. Louis County police, which is overseeing one of the investigations into Brown’s death.


Despite being told by police that the name they released was false, the hacker group released the man’s alleged photo anyway at roughly 10 a.m. CT.

An outraged community has been calling for the name of the officer ever since Brown was fatally shot on Saturday following what police described as a physical altercation. There has been unrest in the streets and a strong police presence in Ferguson ever since, including instances of looting and some violence.

“We only release suspect information after the investigation is complete and charges have been issued,” the St. Louis County Police Department wrote in another Twitter response on Thursday.

Protesters were seen on Wednesday night with firearms and attempting to light molotov cocktails. Police used tear gas and LRADs — long-range acoustic devices — in attempts to disperse demonstrators. There were also several arrests made, including that of two journalists and a St. Louis alderman.

Ferguson resembled more of a war zone than a suburb of a major U.S. city on Wednesday night. See TheBlaze’s comprehensive coverage of the latest demonstrations {here.}<hyperlink=http://www.theblaze.com/stories/2014/08/13/watch-live-coverage-police-face-off-with-protesters-as-unrest-in-ferguson-continues-days-after-shooting/>

UPDATE:

Around noon E.T. on Thursday, the Twitter account associated with Anonymous was suspended. However, the group put up two backup accounts and called the move “an act of war.”",107,179,NA,NA
TheBlaze,blaze32,http://www.theblaze.com/blog/2014/08/14/texas-dem-predicts-ted-cruz-wont-stand-up-for-freedom-in-ferguson-is-proven-wrong-hours-later/,"Texas Dem predicts Ted Cruz won't stand up for freedom in Ferguson, but is proven wrong hours later ",Pete Kasperowicz,08/14/2014,11/10/2015,"Just hours after Rep. Joaquin Castro (D-Texas) predicted that Sen. Ted Cruz (R-Texas) would not speak out against government overreach in Ferguson, Missouri, Cruz released a statement proving Castro wrong.

Late Wednesday, during another night of rioting in Ferguson to protest the shooting of an 18-year old black student, Castro issued this mocking challenge on Twitter:

[textbegin 499744437724266496 textend] 

Castro was not more specific, although his tweet seems to imply that Cruz does not object to either the shooting incident, or police efforts to suppress the rioting over the last few days.

But by Thursday morning, Cruz had released a statement that said the events in Ferguson show more work is needed to “keep our communities safe and free.” Like many other politicians have, Cruz called for an end to the violence of the last few days, but said afterwards, the events surrounding the shooting of Michael Brown needed to be investigated.

“Once the unrest is brought to an end, we should examine carefully what happened to ensure that justice is served,” he said.

Cruz also criticized the police in Missouri for arresting two reporters on Wednesday night. “Reporters should never be detained — a free press is too important — simply for doing their jobs,” he said.

Cruz directed people to his Facebook statement via Twitter:

[textbegin 499909121437872128 textend] ",5,19,NA,NA
TheBlaze,blaze33,http://www.theblaze.com/stories/2014/08/19/video-communist-revolutionaries-travel-from-chicago-nyc-to-incite-riots-in-ferguson/,See Who's Been Spotted in Ferguson Trying to 'Incite' Riots and Mingling Among Group Armed With Molotov Cocktails,Jason Howerton,08/19/2014,11/10/2015,"As the outraged community in Ferguson, Missouri, continues to protest the officer-involved shooting of 18-year-old Michael Brown, radical communist revolutionaries from places like Chicago and New York City are {seemingly infiltrating the local demonstrations}<hyperlink=http://duanelester.com/a/meet-travis-morales-another-communist-revolutionary-agitating-in-ferguson-video/> and allegedly attempting to “incite” riots.

A video uploaded on YouTube Tuesday shows Gregory Lee Johnson, a veteran member of the {Revolutionary Communist Party}<hyperlink=http://revcom.us/rcp/index.html>, riling up a crowd and seemingly discouraging them from listening to police’s advice to calm things down. Watch that video here (Strong language warning):

St. Louis Alderman Antonio French also took notice of Johnson’s presence at demonstrations in Ferguson on Tuesday. He included a photo of Johnson among a group of men apparently trying to light Molotov cocktails:

[textbegin 501748522996482048 tweetend] 

Also spotted in Ferguson was Revolutionary Communist Party operative Travis Morale

[tweetbegin 501714090675290112 tweetend] 

French recently uploaded a video on Vine reportedly showing Morales arguing with a black community leader.

“You’re not gonna hurt our kids,” says a man, identified by {the Missouri Torch}<hyperlink=http://duanelester.com/a/meet-travis-morales-another-communist-revolutionary-agitating-in-ferguson-video/> as Brother Anthony Shahid.

“No, they’re hurting our kids. They’re hurting our kids, everyday,” Morales shouts back.

Morales was later reportedly among four men from Brooklyn to be arrested in Ferguson:

[tweetbegin 501799224997326848 tweetend]

Obviously, it is highly unlikely that Johnson and Morales traveled to Ferguson alone — though it’s unclear how many of their colleagues are currently in the area.

The presence of communist revolutionaries at the demonstrations is not unusual, however. Revolutionaries like Johnson and Morales seek to use chaos and unrest to further their radical agenda to transform America away from its capitalist system.

It was reported that {25 percent of protesters arrested}<hyperlink=http://www.cnn.com/2014/08/19/us/missouri-ferguson-agitators/index.html> on Monday night were not from Ferguson. These are some the people people CNN has described as “agitators.”
",360,15200,NA,2nd tweet does not work 
TheBlaze,blaze34,http://www.theblaze.com/stories/2014/08/18/ferguson-business-owner-watches-real-time-video-as-rioters-destroy-loot-and-fire-bullets-into-his-store-what-justice-is-this/,Angry Business Owner Likely Couldn't Believe His Eyes as He Watched Live Video Feed of His Store in Ferguson,Jason Howerton,08/18/2014,11/10/2015,"A business owner in Ferguson, Missouri, watched in horror as rioters destroyed and looted his store, the Dellwood Market, on Sunday night. Luckily, Mumtaz Lalani wasn’t at his store at the time, but he watched a live video feed of the chaos from his home.

After unsuccessfully trying to break into the establishment, one protester is seen firing bullets into the storefront. Rioters then proceed to “ransack the liquor and cigarette cabinets,” {CNN’s Jake Tapper reports}<hyperlink=http://thelead.blogs.cnn.com/2014/08/18/peaceful-protests-by-day-mayhem-at-night-in-ferguson/>. Two women also reportedly attempted to light the business on fire.

Lalani told CNN that he doesn’t think his business can recover from the shocking incident. He expressed anger at protesters who claim they want “justice” for 18-year-old Mike Brown, who was recently fatally shot by a police officer.

“They say they want justice for Mike Brown… I don’t understand. What justice is this?” he added.

Watch the rest of Tapper’s report via {CNN}<hyperlink=http://thelead.blogs.cnn.com/2014/08/18/peaceful-protests-by-day-mayhem-at-night-in-ferguson/> here:",216,5900,NA,NA
TheBlaze,blaze35,http://www.theblaze.com/stories/2014/08/13/reporters-say-ferguson-officers-assaulted-arrested-them-for-not-leaving-mcdonalds-quickly-enough-upon-request/,"When Ferguson Police Chief Found Out That These Two People Were Arrested and Why, His Reported Response Was 'Oh, God'",Oliver Darcy,08/13/2014,11/10/2015,"Two reporters say they were assaulted and arrested while covering the unrest in a Missouri suburb where an unarmed black teenager was shot and killed by police officers over the weekend.

[tweetbegin 499728023500107776 tweetend] 

According to a tweet sent out by The Huffington Post’s Ryan Reilly, he and the Washington Post’s Wesley Lowery were arrested for “not packing their bags quick enough” after officers swarmed a McDonalds and demanded everyone leave.

[tweetbegin 499705415106830336 tweetend] 

[tweetbegin 499717252380631040 tweetend] 

“Officers decided we weren’t leaving McDonald’s quickly enough, shouldn’t have been taping them,” Lowery tweeted, adding the two were “released without any charges, no paperwork whatsoever.”

[tweetbegin 499717284122730497 tweetend] 

[tweetbegin 499717441472057345 tweetend] 

[tweetbegin 499721682224168960 tweetend] 

Lowery said police also assaulted both of them. The two reporters were using the McDonald’s as a hub to publish live-updates to social media about the unrest in Ferguson.

“Officers slammed me into a fountain soda machine because I was confused about which door they were asking me to walk out of,” he said.

[tweetbegin 499718214281347072 tweetend] 

The Ferguson Police Department did not immediately respond to TheBlaze’s request for comment Wednesday evening.

Los Angeles Times reporter Matt Pearce spoke with the Ferguson police chief who initially responded, “Oh, God” when he learned about the arrest of the two reporters.

The police chief later told him the officers responsible were “probably somebody who didn’t know better” and the he instructed cops “to release them.”

[tweetbegin 499718597288427520 tweetend] 

Washington Post executive editor Marty Baron released a statement on the incident.

“Wesley has briefed us on what occurred, and there was absolutely no justification for his arrest,” Baron said.

“He was illegally instructed to stop taking video of officers. Then he followed officers’ instructions to leave a McDonald’s — and after contradictory instructions on how to exit, he was slammed against a soda machine and then handcuffed,” he continued. “That behavior was wholly unwarranted and an assault on the freedom of press to cover the news. The physical risk to Wesley himself is obvious and outrageous.”

“After being placed in a holding cell, he was released with no charges and no explanation. He was denied information about the names and badge numbers of those who arrested him,” Baron concluded. “We are relieved that Wesley is going to be OK. We are appalled by the conduct of police officers involved.”",271,4600,NA,NA
TheBlaze,blaze36,http://www.theblaze.com/stories/2014/08/19/fox-news-host-hits-geraldo-rivera-over-irresponsible-ferguson-comments-that-is-poor-sighted-its-short-sighted-and-its-just-not-true/,"Fox News Host Hits Geraldo Rivera Over 'Irresponsible' Ferguson Comments: 'That is Poor-Sighted, It's Short-Sighted and It's Just Not True'",Oliver Darcy,08/19/2014,11/10/2015,"A Fox News host slammed colleague Geraldo Rivera Tuesday morning after he appeared to suggest that the dominant issue surrounding unrest in Ferguson is race.

“I’ll tell you what will happen. They’ll have a trial. The white jurors will see it one way, the black jurors another,” Rivera said. “The white jurors will look at that convenience store surveillance tape. They will see Michael Brown menacing that clerk. The white jurors will put themselves in the shoes of that clerk. They’ll say, of course the officer responded the way he did — he was menaced by a 6-foot 4-inch, 300-pound kid, 10 minutes fresh from a strong armed robbery. The officer was defending himself. The white jurors will put themselves in the white officer’s place.”

“The black jurors will see Michael Brown despite his flaws as the surrogate for every black youngster ever shot by a cop,” he concluded.

That assessment of the situation did not sit well with “Outnumbered” host Harris Faulkner, who accused Rivera of “reaching for the low hanging fruit.”

“What you are saying is that the nation is divided, particularly in a microcosm way,” she told him. “Ferguson, Missouri is divided black and white and that’s the only issue here. That is poor-sighted, it’s short-sighted and it’s just not true.”

Faulkner insisted that there are “a lot of things happening” in Ferguson contributing to the unrest, including economics and the militarization of police.

“This is more than a racial issue,” she said. “And for you to pick off the low hanging fruit is offensive and it incites more of it to go on. It’s irresponsible.”",295,4600,NA,NA
TheBlaze,blaze37,http://www.theblaze.com/stories/2014/08/18/cnn-now-reporting-potential-bombshell-in-ferguson-shooting-regarding-what-alleged-friend-of-officer-darren-wilson-told-theblazes-dana-loesch-on-air/,CNN Now Reporting Potential Bombshell in Ferguson Shooting Regarding What Alleged Friend of Office Darren Wilson Told TheBlaze's Dana Loesch On-Air ,Jason Howerton,08/18/2014,11/10/2015,"For the very first time, an alleged “friend” of the officer who fatally shot 18-year-old Ferguson man Michael Brown is revealing new details about the controversial incident that has sparked unrest in cities across the country, CNN reported on Monday.

Calling into {The Dana Loesch Radio Show}<hyperlink=http://danaloeschradio.com/alleged-friend-of-officer-darren-wilson-offers-his-side/> on Friday, “Josie” claimed that Brown “bum-rushed” officer Darren Wilson moments after pushing him into his squad car, punching him in the face and trying to grab the cop’s gun.

Though TheBlaze {reported on the call over the weekend}<hyperlink=http://www.theblaze.com/stories/2014/08/17/does-this-video-vindicate-the-officer-who-shot-michael-brown/>, CNN’s Don Lemon reported on Monday that a “source with detailed knowledge of the investigation into the Missouri shooting of Michael Brown” confirmed that the caller’s account “matches the account of officer Darren Wilson as to what happened at the time of the shooting.”

Josie said Wilson first noticed Brown and his friend when they were walking in the middle of the street. She said Wilson told them to get out of the street and the two men yelled back at him, including some obscenities.

“He pulled up ahead of them. And he was watching them, and then he gets the call-in that there was a strong-arm robbery. And, they gave a description,” Josie told Loesch on Friday. “And, he’s looking at them and they got something in their hands and it looks like it could be what, you know those cigars or whatever.”

Police later released surveillance video and revealed that Brown was a suspect in a “strong-arm robbery” at a nearby convenience store.

The alleged friend of Wilson continued: “So he goes in reverse back to them, tries to get out of his car. They slam his door shut violently. I think he said Michael did. And, then he opened the car again, you know, he tried to get out. He stands up. And then Michael just bum-rushes him and shoves him back into his car, punches him in the face and then, of course, Darren grabs for his gun. Michael grabbed for the gun. At one point, he got the gun entirely turned against his hip. And he shoves it away, and the gun goes off.”

The caller went on to claim that Brown then ran from the officer, making it about 35 feet away before Wilson got up and ordered the suspect to “freeze.”

“Michael and his friend turn around. And Michael taunts him… And then all the sudden he just started bumrushing him. He just started coming at him full speed. And, so he just started shooting. And, he just kept coming. And, so he really thinks he was on something,” she concluded. “The final shot was in the forehead, and then he fell about two or three feet in front of the officer.”

The Washington Post, citing a source “familiar with the county’s investigation,” reported that Brown {had marijuana in his system}<hyperlink=http://www.theblaze.com/stories/2014/08/18/report-michael-brown-had-pot-in-his-system-when-he-was-shot/> when he was fatally shot by Wilson. However, the county medical examiner has yet to release the full autopsy report to the public.

The caller told Loesch that she received Wilson’s version of the shooting directly from his “significant other.”",530,26500,NA,NA
