Source,ArticleID,ArticleLink,Title,Author,DatePublished,DateRetrieved,ArticleText,NumberComments,NumberSocialMedia,TheShitBetween,Notes
BusinessInsider,bus40,http://www.businessinsider.com/twitter-map-tweets-about-ferguson-protests-2014-8,This Remarkable Map Shows An Explosion Of Tweets About The Ferguson Protests,Kriston Capps,8/15/2014,10/29/2015,"While the shooting of Michael Brown and the police response has implications for law enforcement throughout the nation, the impact of the events in Ferguson, Missouri, this week can be measured on a global scale. 

Twitter compiled every geotagged tweet that mentioned Ferguson and plugged them all into one map. What begins as an area tragedy in the Midwest on Aug. 9 evolves into a national news story by Aug. 11. If the blips are any indication, Ferguson was a trending topic in North America and Europe for most of the week, and a topic of conversation across every continent on the planet.

I could be reading too much into the map function, but it appears that the arrests of the Huffington Post's Ryan J. Reilly and The Washington Post's Wesley Lowery on Aug. 13 pushed the story into the stratosphere. Judging by the procession of the progress bar, it's late-ish into Aug. 13 when Twitter goes nuclear, right around the time that the two reporters were arrested.

Needless to say, there's nothing to be proud of here. Michael Brown's death, and the events that have followed, brings shame to the nation. It may be the fact that the United States so consistently fails to live up to its lofty ideals about justice and freedom when it comes to its African American population that makes it a story that's compelling across the world.

If there is a bright side to the global appeal of this story, it's the fact that analysts and international observers are {weighing in with fascinating perspectives}<hyperlink=”https://twitter.com/sheeraf/status/500033486644711424”>—even analysis on {what #Ferguson means to Twitter}<hyperlink=”https://medium.com/message/ferguson-is-also-a-net-neutrality-issue-6d2f3db51eb0”> itself.",NA,NA,NA,CityLab
BusinessInsider,bus41,http://www.businessinsider.com/r-missouri-protests-calm-as-black-police-captain-and-state-officers-replace-locals--2014-15,Missouri Protests Calm As Black Police Captain And State Officers Replace Locals,Nick Carey,8/15/2014,10/29/2015,"FERGUSON Mo. (Reuters) - Protests over the shooting of an unarmed black teen in Missouri were boisterous but peaceable on Thursday night as a small number of state police, led by a newly appointed black captain, replaced riot gear-clad local forces and mingled with the crowd.

Missouri's governor Jay Nixon hours earlier put Highway Patrol Captain Ron Johnson in charge of security in the town of Ferguson after almost a week of clashes between protesters and police firing tear gas and stun grenades. Dozens of people have been arrested amid looting, shooting and vandalism.

In a tactical U-turn, Johnson and a handful of black officers without body armor walked among thousands of protesters filling the streets of the mostly black St. Louis suburb, demanding justice for the killing of 18-year-old Michael Brown.

""We just want to be able to come and demonstrate together without the fear of being shot. It's that simple,"" said 53-year-old protester Cat Daniels, an Iraq veteran. ""What you see tonight is people coming together. When that kid was killed the hurt and the pain was real.""

Mark Hall, a 21-year-old student, said: ""I'm so happy they left us alone so we could prove that all we wanted was the opportunity to exercise our rights peacefully ... a chance to be heard.""

In the forecourt of a gas station burned out during this week's rioting, a cowboy rode a horse and a group of children danced on pavement covered in chalk drawings with the words: ""Now the world knows your name, RIP Mike.""

Elsewhere drivers honked horns and waved signs in solidarity and one group of demonstrators even took to the streets on a car-sized replica of fictional steam train Thomas The Tank Engine.

""It's because of this young man right here,"" Johnson told a CNN reporter, as the captain held up a picture of Brown to shouts of approval from protesters around him. ""It's about the justice for everyone.""

The protests have cast a spotlight on racial tensions in greater St. Louis, where civil rights groups have complained in the past that police racially profiled blacks, arrested a disproportionate number of them and had racist hiring practices.

Two thirds of the town's population of 21,000 are black while 50 of its 53-strong police force are white.

Brown's shooting galvanized a national moment of silence and rallies in other U.S. cities.

In New York, a large crowd briefly overwhelmed a small police presence in Union Square park, forcing officers to scramble to close one of Manhattan's major thoroughfares. Local media showed a handful of protesters being arrested.

In St. Louis, CNN footage showed hundreds of people peacefully assembled in the shadow of the renowned Gateway Arch, Brown's mother and other family members among them.

Seeking to defuse the situation, U.S. President Barack Obama had called on police to respect peaceful demonstrations.

Nixon said Ferguson lately ""has looked a little bit more like a war zone, and that is unacceptable"".

Police have pledged to do better but have also justified the tough tactics, saying they have responded to the threat of violence during protests.

""WHAT'S HIS NAME?""

Protesters have decried what they say is a lack of transparency from police investigating Saturday's shooting, including the refusal to name of the officer responsible.

On Thursday night in Ferguson, about 200 demonstrators chanted, ""What's his name? What's his name?'"" at Johnson and the St. Louis County police chief, Jon Belmar.

Police said they plan to release the officer's name on Friday, according to CNN and Los Angeles Times reports.

Some critics have also called for St. Louis County Prosecuting Attorney Bob McCullough to be removed from the case.

U.S. Attorney General Eric Holder said in a statement that police had accepted an offer of technical assistance from the Justice Department on crowd control and public safety ""without relying on unnecessarily extreme displays of force"".

A law enforcement official told Reuters that Holder expressed his personal condolences for their son's death in a phone call with Brown's parents and promised the department would conduct a full, independent civil rights investigation.

Early on Thursday, a member of the Anonymous hacker activist collective tweeted the name of a person alleged to be the police officer who shot Brown. But police and other Anonymous tweeters said the activist had named the wrong person.

There is little clarity on what occurred during Saturday's incident. Police have said that Brown struggled with the officer who shot and killed him. The officer involved in the shooting was injured during the incident and was treated in a hospital for swelling on the side of his face, they said.

But some witnesses have said that Brown held up his hands and was surrendering when he was shot several times in the head and chest.",NA,NA,NA,"Reuters, same as article below"
BusinessInsider,bus42,http://www.businessinsider.com/ferguson-protests-calm-after-the-governor-put-a-black-police-captain-in-charge-2014-8,The Ferguson Protests Are Extraordinarily Calmer After The Governor Put A Black Police Captain In Charge,Nick Carey,8/15/2014,10/29/2015,"Protests over the shooting of an unarmed black teen in Missouri were boisterous but peaceful on Thursday night as a small number of state police, led by a newly appointed black captain, replaced riot-gear-clad local forces and mingled with the crowd.

Hours earlier, Missouri's governor Jay Nixon put Highway Patrol Captain Ron Johnson in charge of security in the town of Ferguson after almost a week of clashes between protesters and police firing tear gas and stun grenades. Dozens of people have been arrested amid looting, shooting and vandalism.

In a tactical U-turn, Johnson, and a handful of black officers without body armor, walked among thousands of protesters filling the streets of the mostly black St. Louis suburb demanding justice for the killing of 18-year-old Michael Brown.

""We just want to be able to come and demonstrate together without the fear of being shot. It's that simple,"" said 53-year-old protester Cat Daniels, an Iraq veteran. ""What you see tonight is people coming together. When that kid was killed the hurt and the pain was real.""

Mark Hall, a 21-year-old student, said: ""I'm so happy they left us alone so we could prove that all we wanted was the opportunity to exercise our rights peacefully ... a chance to be heard.""

In the forecourt of a gas station burned out during this week's rioting, a cowboy rode a horse and a group of children danced on pavement covered in chalk drawings with the words: ""Now the world knows your name, RIP Mike.""

Elsewhere drivers honked horns and waved signs in solidarity, and one group of demonstrators even took to the streets on a car-sized replica of fictional steam train Thomas The Tank Engine.

""It's because of this young man right here,"" Johnson, who grew up in the Ferguson area, told a CNN reporter, as the captain held up a picture of Brown to shouts of approval from protesters around him. ""It's about the justice for everyone.""

The protests have cast a spotlight on racial tensions in greater St. Louis, where civil rights groups have complained in the past that the police racially profiled blacks, arrested a disproportionate number of them, and had racist hiring practices.

Two-thirds of the town's population of 21,000 is black, while 50 of its 53-strong police force are white.

Brown's shooting galvanized a national moment of silence and rallies in other U.S. cities.

In New York, a large crowd briefly overwhelmed a small police presence in Union Square park, forcing officers to scramble to close one of Manhattan's major thoroughfares. Local media showed a handful of protesters being arrested.

In St. Louis, CNN footage showed hundreds of people peacefully assembled in the shadow of the renowned Gateway Arch, Brown's mother and other family members among them.

Seeking to defuse the situation, U.S. President Barack Obama had called on the police to respect peaceful demonstrations.

Nixon said Ferguson lately ""has looked a little bit more like a war zone, and that is unacceptable.""

The police have pledged to do better but have also justified the tough tactics, saying they have responded to the threat of violence during protests.

'WHAT'S HIS NAME?'

Protesters have decried what they say is a lack of transparency from the police investigating Saturday's shooting, including the refusal to name of the officer responsible.

On Thursday night in Ferguson, about 200 demonstrators chanted, ""What's his name? What's his name?'"" at Johnson and the St. Louis County police chief, Jon Belmar.

The police said they planned to release the officer's name on Friday, according to CNN and Los Angeles Times reports.

Some critics have also called for St. Louis County Prosecuting Attorney Bob McCullough, who was critical of Nixon's move, to be taken off the case.

""He had no legal authority to do that,"" McCullough was quoted as saying by the St. Louis Post-Dispatch newspaper. ""For Nixon to never talk to the commanders in the field and come in here and take this action is disgraceful.""

U.S. Attorney General Eric Holder said in a statement that the police had accepted an offer of technical assistance from the Justice Department on crowd control and public safety ""without relying on unnecessarily extreme displays of force.""

A law enforcement official told Reuters that Holder expressed his personal condolences for their son's death in a phone call with Brown's parents and promised that the department would conduct a full, independent civil rights investigation.

Early on Thursday, a member of the Anonymous hacker activist collective tweeted the name of a person alleged to be the police officer who shot Brown. But police and other Anonymous tweeters said the activist had named the wrong person.

There is little clarity on what occurred during Saturday's incident. The police have said that Brown struggled with the officer who shot and killed him. The officer involved in the shooting was injured during the incident and was treated in a hospital for swelling on the side of his face, they said.

But some witnesses have said that Brown held up his hands and was surrendering when he was shot several times in the head and chest. ",NA,NA,NA,Reuters.. there are hyperlinked texts in this article but none of them  are function or have an actual link
BusinessInsider,bus43,http://www.businessinsider.com/ferguson-police-release-name-of-officer-who-shot-michael-brown-2014-8,Ferguson Police Chief Releases Name Of Officer Who Shot Unarmed Teen,Pamela Engel,8/15/2014,10/29/2015,"After nearly a week of {tense and chaotic protests}<hyperlink=”http://www.businessinsider.com/pictures-ferguson-protests-2014-8”>, police in Ferguson, Missouri, have identified the officer who shot an unarmed black teenager last weekend.

Ferguson police chief Thomas Jackson named Darren Wilson as the officer who shot 18-year-old Michael Brown. Wilson has had no disciplinary action filed against him during his six years working for the police force.

Also on Friday, Ferguson police said they believed Brown {may have robbed a store}<hyperlink=”http://www.businessinsider.com/michael-brown-suspect-in-robbery-2014-8”> right before he was shot down. Wilson was on his way to the robbery call when he shot Brown, according to Ferguson police. 

Police initially declined to release Wilson's name out of concern for his safety. People had reportedly made threats against the officer's life earlier this week.

Protests in Ferguson have calmed down since Missouri Gov. Jay Nixon brought in the State Highway Patrol to take over security operations in the St. Louis suburb. Capt. Ron Johnson, who grew up near Ferguson, is now overseeing policing of the protests.

Tensions between residents and local police led to violent clashes earlier this week, with police donning riot gear and firing tear gas and rubber bullets into crowds of demonstrators. The city of Ferguson, with a population of 21,000, became an example of {how highly militarized America's police have become}<hyperlink=”http://www.businessinsider.com/police-militarization-ferguson-2014-8”>.

Ferguson police SWATAP Photo/Jeff Roberson
A member of the St. Louis County Police Department points his weapon in the direction of a group of protesters in Ferguson on Wednesday. On Saturday, a white police officer fatally shot Michael Brown, an unarmed black teenager, in the St. Louis suburb.

As Business Insider's Paul Szoldra has noted, police in Ferguson had short-barreled 5.56-mm rifles based {on the military M4 carbine}<hyperlink=”https://en.wikipedia.org/wiki/M4_carbine”> and wore body armor. They also had a massive armored vehicle {known as a BearCat}<hyperlink=”https://en.wikipedia.org/wiki/Lenco_BearCat”>.

The State Highway Patrol has {taken a different approach}<hyperlink=”http://www.businessinsider.com/ferguson-protests-calm-after-the-governor-put-a-black-police-captain-in-charge-2014-8”> to policing, with Johnson (who is black) and a number of African-American officers mingling with the protesters and ditching the riot gear. 

Mark Hall, a 21-year-old student, told Reuters: ""I'm so happy they left us alone so we could prove that all we wanted was the opportunity to exercise our rights peacefully ... a chance to be heard.""

The protests broke out after Brown, who was unarmed, was shot and killed on Saturday. His friend, who was a witness to the shooting, said he had his hands up when he was shot, but the police say Brown lunged for the officer's gun.

A former police chief told Business Insider on Thursday that local {police bungled their response}<hyperlink=”http://www.businessinsider.com/how-the-cops-made-things-worse-in-ferguson-2014-8”> to the shooting in many ways. Those missteps included arresting reporters and using police dogs — a practice dating back to the ugly relations between cops and protesters during the 1960s.",40,NA,NA,"Mark Hall is highlighted, though there is no hyperlink attached"
BusinessInsider,bus44,http://www.businessinsider.com/protestors-reportedly-named-officer-who-shot-teen-before-police-2014-8,Protestors Reportedly Named Officer Who Shot Teen Before Police,Christina Sterbenz,8/15/2014,10/29/2015,"After almost a week of uncertainty, the Ferguson police department {finally named the officer responsible}<hyperlink=”http://www.businessinsider.com/ferguson-police-release-name-of-officer-who-shot-michael-brown-2014-8”> for the shooting and killing of Michael Brown, an unarmed teen in the St. Louis suburb. 

Ferguson police chief Tom Jackson named Darren Wilson, who the chief described as a 6-year veteran of the force with no previous disciplinary action filed against him.

During a {press conference}<hyperlink=”http://www.businessinsider.com/ferguson-police-chief-tom-jackson-press-conference-august-14-2014-8”> yesterday, however, a reporter, citing protesters as the source, asked Jackson whether Wilson was Brown's shooter.

""I'm not going to comment on that,"" Jackson said. 

Though he refused to address the question about Wilson, Jackson specifically said another man who hacker group Anonymous {named as the shooter}<hyperlink=”http://www.businessinsider.com/twitter-suspends-anonymous-account-2014-8”> was not involved in the shooting. 

Jackson had previously said the department wouldn't release the name until ""someone is formally charged.""

Protesters in Ferguson had called for justice for the slain teen and urged the police to release the officer's name responsible. The police's response to the protests, however, {grew increasingly more militarized}<hyperlink=”http://www.businessinsider.com/pictures-ferguson-protests-2014-8”>, using tanks, rubber bullets, and tear gas, until Missouri Gov. Jay Nixon ordered the {highway patrol to step in}<hyperlink=”http://www.businessinsider.com/report-missouri-governor-will-take-st-louis-county-police-out-of-ferguson-2014-8”>.

Since the state police, led by {Capt. Ron Johnson}<hyperlink=”http://www.businessinsider.com/ferguson-protests-calm-after-the-governor-put-a-black-police-captain-in-charge-2014-8”>, took control, the situation has {drastically calmed}<hyperlink=”http://www.businessinsider.com/ferguson-protest-selfie-2014-8”>. ",NA,NA,NA,NA
BusinessInsider,bus45,http://www.businessinsider.com/michael-brown-suspect-in-robbery-2014-8,Ferguson Police Believe Slain Teen May Have Robbed A Store Right Before He Was Killed,Pamela Engel,8/15/2014,10/29/2015,"Update: Police issued {an apparently contradictory statment later on Friday}<hyperlink=”http://www.businessinsider.com/cop-who-shot-michael-brown-didnt-know-he-was-robbery-suspect-2014-8”> that the officer who killed Michael Brown might not have been aware of the robbery when he shot the teenager. Police say the officer stopped Brown and his friend for jaywalking, and that the encounter was completely unrelated to the earlier robbery.

A police officer who {shot and killed}<hyperlink=”http://www.businessinsider.com/ferguson-mo-michael-brown-shooting-2014-8”> 18-year-old Michael Brown in Ferguson, Missouri, over the weekend was on his way to a robbery call when he ran into the unarmed teenager, police said during a news conference on Friday.

Ferguson police {released the name of the officer}<hyperlink=”http://www.businessinsider.com/ferguson-police-release-name-of-officer-who-shot-michael-brown-2014-8”> who shot Brown and provided more details about the events that led to his death. Darren Wilson, a 28-year-old white man and six-year veteran of the police force, was identified as the officer.

The police report from a convenience-store robbery that happened on Saturday names Brown as a suspect. He and friend Dorian Johnson, {who witnessed Brown's shooting}<hyperlink=”http://www.businessinsider.com/eye-witness-account-of-michael-browns-shooting-2014-8”>, were allegedly trying to steal cigars. Johnson's lawyer has since {confirmed to MSNBC}<hyperlink=”http://www.msnbc.com/msnbc/ferguson-police-name-michael-brown?cid=sm_m_main_1_20140815_29822566”> that Brown took cigars from the store.

There was allegedly an altercation between Brown and a person who appears to be a store clerk as Brown was attempting to steal from the store, according to the report.

Wilson encountered Brown at about 12:01 p.m., Ferguson police chief Thomas Jackson said on Friday. Brown had been shot by the time a second officer arrived on scene at 12:04 p.m.

A description of the alleged convenience-store robber was dispatched on police radio as Wilson was in the area, Jackson said. Shortly after, Wilson stopped Brown nearby.

Here's the police report:

Police also provided stills from the convenience-store surveillance camera:

[tweetbegin 500279952160600064 tweetend]

And released this video footage:

There are conflicting reports about what happened the day Brown was shot. The slain 18-year-old's friend Johnson — an eye witness — {says Brown had his hands up when he was shot}<hyperlink=”http://www.businessinsider.com/eye-witness-account-of-michael-browns-shooting-2014-8”>, but police say Brown lunged for Wilson's gun.

Brown's family and their attorneys released this statement Friday:

Michael Brown’s family is beyond outraged at the devious way the police chief has chosen to disseminate piece mil [sic] information in a manner intended to assassinate the character of their son, following such a brutal assassination of his person in broad daylight.

There is nothing based on the facts that have been placed before us that can justify the execution style murder of their child by this police officer as he held his hands up, which is the universal sign of surrender.

The prolonged release of the officer’s name and then the subsequent alleged information regarding a robbery is the reason why the family and the local community have such distrust for the local law enforcement agencies.

It is no way transparent to release the still photographs alleged to be Michael Brown and refuse to release the photographs of the officer that executed him.

The police strategy of attempting to blame the victim will not divert our attention, from being focused on the autopsy, ballistics report and the trajectory of the bullets that caused Michael’s death and will demonstrate to the world this brutal execution of an unarmed teenager.

Massive protests erupted in Ferguson after Brown's shooting, capturing a national spotlight and bringing attention to the {militarization of police in America}<hyperlink=”http://www.businessinsider.com/police-militarization-ferguson-2014-8”>. Local police in Ferguson have been criticized for using riot gear, tear gas, dogs, and rubber bullets to control the protests that followed Brown's shooting.

After nearly a week of chaos, the State Highway Patrol was brought in to calm the protests. The mood in Ferguson improved significantly after the governor brought in Highway Patrol Captain Ron Johnson, who's African-American and a Ferguson native. Johnson and other members of the patrol have used a {different approach to crowd control}<hyperlink=”http://www.businessinsider.com/ferguson-protests-calm-after-the-governor-put-a-black-police-captain-in-charge-2014-8”>, mingling with the protesters and ditching the riot gear.",100,NA,NA,NA
