Source,ArticleID,ArticleLink,Title,Author,DatePublished,DateRetrieved,ArticleText,NumberComments,NumberSocialMedia,TheShitBetween,Notes
BusinessInsider,bus57,http://www.businessinsider.com/state-of-emergency-declared-in-ferguson-2014-8,"One Person Shot, Seven Arrested After Protesters Defy Curfew In Ferguson",Erin Fuchs; Paul Szoldra,8/16/2014,11/11/2015,"The governor of Missouri declared a state of emergency and a midnight curfew in the St. Louis suburb of Ferguson on Saturday afternoon, and while many decided to go home before 12 a.m., a large number of activists stayed in defiance of the order to continue their protests.

The streets were fairly quiet about an hour before curfew time, but soon after midnight loud chants of ""hands up, don't shoot!"" could be heard by a number of protesters. Most police officers on the scene were standing outside numerous businesses to protect them from potential looters.

[tweetbegin 500832103127597057 tweetend]

""I don't think it's a good idea,"" Maurice Millere told Huffington Post's Ryan Reilly of the curfew. The main chant of the protesters over the past week had been ""hands up, don't shoot,"" but as the Wall Street Journal's Ben Kesling tweeted, those had been outnumbered by chants of ""F--k 12.""

[tweetbegin 500872936719659008 tweetend]

Twenty minutes after the curfew began, police were not seen advancing or taking any action to arrest or force the protesters away. The St. Louis County Police Department {said it had received}<hyperlink=”https://twitter.com/stlcountypd/status/500873989049171968”> ""several calls"" of men with guns on the streets.

Roughly 200 people remained in the area and chanted in protest of the police, while some activists called for them to go home in an attempt to deescalate the situation.

Officers observed at least one person standing in the road with a handgun, and a police car was also fired upon, according to Capt. Ron Johnson, who spoke at a press conference after the clashes at around 2:30 a.m.

[tweetbegin 500912376632594433 tweetend]

At 12:40 a.m., police officers formed a line of vehicles and announced over the loudspeaker: ""This is the police department. You are violating a state-imposed curfew. ... you must disperse peacefully or you will be subject to arrest or other actions.""

Police fired {tear gas}<hyperlink=”https://twitter.com/bkesling/status/500894789517451266”> into the crowd about five minutes later, although a police spokesman insisted it was smoke. He later backtracked and {confirmed it was indeed used}<hyperlink=”https://twitter.com/samgustin/status/500899123256885248”>.

Vice News' Tim Pool observed at least one protester throwing a Molotov cocktail at a business. Other protesters quickly stamped out the fire that had been lit.

[tweetbegin 500881948907012097 tweetend]

Around 12:55 a.m., at least three to four gunshots were heard. The Guardian's Jon Swaine later {reported}<hyperlink=”https://twitter.com/jonswaine/status/500885072501694466”> one man was shot in the leg (not by police), and was quickly put in a car to be taken away. Capt. Johnson confirmed the man was transported to the hospital and was in critical condition.

Nearly two hours post-curfew, most people had vacated the streets. Police made seven arrests, all on charges of ""failure to disperse."" They did not arrest the person they observed with a handgun, or the suspect who had wounded a protester.

{In the wake of riots that ensued}<hyperlink=”http://www.businessinsider.com/feds-objected-to-the-release-of-alleged-michael-brown-robbery-tape-2014-8”> after a police officer shot an unarmed black 18-year-old, Gov. Jay Nixon put the curfew in place and declared a state of emergency.

“We will not allow a handful of looters to endanger the rest of this community,” Gov. Jay Nixon said in a heated press conference broadcast live on MSNBC.

People at the governor's press conference expressed anger, questioning why the police officer who shot Brown has not been arrested and charged with murder. Nixon responded by saying, ""If we want justice, we cannot be distracted ... We cannot have looting and crimes at night. We cannot have people fearful.""

As reporter Matt Pearce showed in this Instagram video, the press conference was quite tense:

'There is not going to be an armored truck come out'

Ferguson {has been in a state of unrest}<hyperlink=”http://www.businessinsider.com/feds-objected-to-the-release-of-alleged-michael-brown-robbery-tape-2014-8”> since a local police officer shot unarmed Michael Brown in broad daylight on Aug. 9. The curfew will run from midnight until 5 a.m., Missouri Highway Patrol Captain Ron Johnson said at the press conference. Johnson — an African-American native of Ferguson who was brought in to help quell the riots on Thursday — tried to strike a positive note on Thursday.

""We will survive this, and we will make a change,"" he said. Johnson implied that the all-night protests were threatening public safety and health, saying at one point, ""People are calling 911 and not getting their calls [answered] ... People get sick at one in the morning. People get sick at two in the morning.""

One person in attendance asked Johnson how he was going to enforce the curfew, saying, ""Are you going to use tear gas again? Are you bringing back military force?""

Johnson tried to ease those fears, explaining how police would enforce the curfew: ""We won't enforce it with trucks, with tear gas. We will communicate ... Because someone is standing in the street, there is not going to be an armored truck come out.""

The curfew will apparently not apply to reporters, as the governor specified that the press were free to monitor {how police enforce it}<hyperlink=”https://twitter.com/alanblinder/status/500746451207852034”>. Police in Ferguson were widely criticized for their response to the protests, which included bringing out military-style weapons and barking dogs. Following this criticism, on Thursday Nixon relieved the local police of their duties and brought in Johnson and other members of the state highway patrol.

Thursday night got calmer but police and protesters {clashed again on Friday}<hyperlink=”http://www.businessinsider.com/police-and-protesters-clash-again-in-ferguson-2014-8”> after police released a video allegedly showing the slain teenager stealing cigars from a convenience store before a police officer shot him dead on the street. The Justice Department reportedly {warned police not to release this video}<hyperlink=”http://www.businessinsider.com/feds-objected-to-the-release-of-alleged-michael-brown-robbery-tape-2014-8”> because they thought it would upset the community.

The teenager's family released a statement Friday saying they were ""{beyond outraged}<hyperlink=”http://www.businessinsider.com/feds-objected-to-the-release-of-alleged-michael-brown-robbery-tape-2014-8”>"" that the police were trying to assassinate their son's character. Ferguson police have acknowledged that the officer who shot Brown did not even realize he was suspected of the strong-armed convenience-store theft.",NA,NA,NA,NA
BusinessInsider,bus58,http://www.businessinsider.com/ron-johnson-police-tactics-ferguson-2014-8,How Capt. Ron Johnson Changed The Tone Of The Protests In Ferguson,Patrik Jonsson,8/16/2014,11/11/2015,"FERGUSON, MO. — As people continued to protest the police shooting death of {Michael Brown}<hyperlink”http://www.csmonitor.com/csmlists/topic/Michael+Brown”> Friday night, Capt. Ron Johnson took responsibility for the streets with a daring gambit that changed the tone of what promises to be protracted protests and struggles here in Ferguson, Mo.

At way over 6 feet tall with a bald imposing dome, Missouri Highway Patrol Capt. Johnson, after watching local police wage pitched battles against protesters earlier last week, took command by engaging protesters and defending their right to express anger at police for the death of Brown, an unarmed teenager, and the failure to arrest Darren Wilson, the officer who they believe killed him without justification.

The stance put the black commander at odds with the white police structure in Ferguson and St. Louis County, which had responded to the protests with riot gear, armored vehicles, high-powered rifles, tear gas, and rubber bullets.

Recommended: {IN PICTURES}<hyperlink=”http://www.csmonitor.com/Photo-Galleries/In-Pictures”> {Policing America}<hyperlink=”http://www.csmonitor.com/Photo-Galleries/In-Pictures/Policing-America”>

Bob McCulloch, the white county prosecutor who is in charge of investigating whether Brown was justifiably killed or murdered, criticized the decision to elevate Johnson over local police as disrespectful.

For the second night in a row, Johnson kept his officers back as a thousand protesters swelled along West Florissant Avenue – the thoroughfare near where Brown was shot and killed, witnesses say, with his hands up.

Throngs of mostly African American residents swore, danced, chanted, and at times surrounded honking cars with swaying dance moves. Along the street, late into the night, young children jumped up and down crying, “No justice, no peace!” and “Hands up, don’t shoot!”

Asked if he thought it was a gamble to draw back the police line in stark contrast to the much-criticized military response, Johnson said no. “I see people out here smiling and walking and speaking their piece,” he told the Monitor.

But shortly after midnight, in a drenching rain, that assessment changed as a group of protesters broke away and began looting the same liquor store pictured in a video released Friday that police say shows Brown stealing cigars and strong-arming a much smaller clerk.

After looters were finally dispersed by police, protesters took up guard outside the stores to prevent more looting. At Sam’s Meat Market, store owners brandished rifles to warn looters.

While Johnson may be criticized for allowing the looting to happen, the image of protesters helping protect their community is also notable as the nature of the protests evolve with the more respectful stance from police.

Protesters like Camese Bedford say a sense of deep injustice and distrust in the white political and police structure will continue to drive the protests. Officer Wilson “needs to be behind bars, flat out,” Mr. Bedford said.

The decision by {Gov. Jay Nixon}<hyperlink=”http://www.csmonitor.com/csmlists/topic/Jay+Nixon”> to put Johnson in charge came as national leaders, including President Obama, condemned the “bullying” police response, where journalists were attacked and detained. Nixon’s decision was certainly a coup for protesters, who saw the armed response – earlier, police pointed high-powered rifles at protesters and journalists – wither away.

“You the man who shook the world,” one protester told Johnson before shaking his hand late Friday night.

Earlier in the day, Johnson moved through the crowd as people shook his hand and took selfies with the imposing commander, who occasionally used a white kerchief to wipe sweat from his brow.

Johnson defended the right of protesters to take over the streets, especially as infractions, before the looting, were minor – some pot smoking and traffic violations as people climbed on top of vans and cars as they honked their horns wildly.

At one point, Johnson said he would have handled the release of the Brown video differently.

After releasing the video earlier Friday, Ferguson Police Chief Tom Jackson first said Wilson was investigating what police called a strong-arm robbery – protesters called it shoplifting – and then came back to say Wilson wasn’t aware that Brown was a suspect, and later clarified that to say Wilson saw Brown with the box of cigars and so suspected him when the altercation began.

Johnson, in charge of public safety, was never told the Brown video – which turned out to be a powder keg – would be released. He was incensed enough to tell protesters surrounding him that lots of people in the crowd may have committed crimes, “but they’re still standing here” – a jab at what Brown’s family alleged is a building narrative to paint Brown as an aggressor who may have done something to justify his own death.

Such stances have made the decision to install Johnson, who grew up in the area, “very controversial,” says the Rev. Darrell Burgess, who has lived all his life in Ferguson.

Johnson’s appointment and less confrontational approach also highlighted a vexing backdrop to Brown’s death: The appearance of police agencies at odds, which is fueling skepticism about whether justice will be served for Brown and his family.

The seeming disconnect between the various agencies in handling the investigation and the protests is unnecessary and counterproductive, Daniel Isom, a retired St. Louis police chief who now teaches at the University of Missouri-St. Louis, told the Associated Press.

""There are several agencies involved in this endeavor,"" Mr. Isom told the wire service. ""It seems that everyone is on their own page. And that's not good for us moving forward.""",NA,NA,NA,Christian Science Monitor
BusinessInsider,bus59,http://www.businessinsider.com/jack-dorsey-ferguson-protest-2014-8,"Twitter Cofounder Jack Dorsey Is Providing Live Updates From Ferguson, Missouri",Paul Szoldra,8/16/2014,11/11/2015,"The man {who sent out the world's first tweet}<hyperlink=”https://twitter.com/jack/status/20”> is using the platform to provide on-the-ground updates from the protests in Ferguson, Missouri.

Jack Dorsey, cofounder of Twitter and current founder and CEO of payment startup Square, {traveled}<hyperlink=”https://twitter.com/jack/status/500350429893365762”> on Friday to St. Louis, Missouri, which happens to be his hometown. Since then, he's been tweeting from the protests — stemming from the fatal police shooting of 18-year-old Michael Brown — and posting a ton of Vine videos.

{Born and raised}<hyperlink=”http://www.stltoday.com/co-founder-of-twitter-native-st-louisan-jack-dorsey-tweets/article_2eb5da13-5f1f-5a95-862f-0d331f09d358.html”> in St. Louis, the billionaire entrepreneur traveled {from his current residence in San Francisco}<hyperlink=”http://www.businessinsider.com/the-fabulous-life-of-jack-dorsey-2014-8#”> to join the protests. ""Feels good to be home. I'll be standing with everyone in Ferguson all weekend,"" he {tweeted}<hyperlink=”https://twitter.com/jack/status/500471497539190784”> Friday.

You can check out his {full timeline at @jack}<hyperlink=”https://twitter.com/jack”>, but here are some of his posts:

[twitterbegin 500435762945724417 twitterend]
[twitterbegin 500441589878358016 twitterend]
[twitterbegin 500453576062156800 twitterend]
[twitterbegin 500704966194233344 twitterend]
[twitterbegin 500734400213295105 twitterend]
[twitterbegin 500801377179009024 twitterend]
[twitterbegin 500808995721187328 twitterend]",NA,NA,NA,NA
BusinessInsider,bus60,http://www.businessinsider.com/eric-holder-federal-medical-examiner-michael-brown-death,"Eric Holder Orders Federal Medical Examiner To Take Another Look At Ferguson, Missouri Teen's Death",Colin Campbell,8/17/2014,11/11/2015,"U.S. Attorney General Eric Holder has taken another step in his investigation into the shooting of 18-year-old Michael Brown, whose death has {led to fierce protests}<hyperlink=”http://www.businessinsider.com/state-of-emergency-declared-in-ferguson-2014-8”> in the relatively small city of Ferguson, Missouri.

Holder's office released a statement Sunday morning declaring the ""extraordinary circumstances"" involved in the case have caused him to order Justice Department officials to perform a second autopsy by a federal medical examiner.

""Due to the extraordinary circumstances involved in this case and at the request of the Brown family, Attorney General Holder has instructed Justice Department officials to arrange for an additional autopsy to be performed by a federal medical examiner. This independent examination will take place as soon as possible,"" the statement said.

The St. Louis County Medical Examiner's office has {already examined}<hyperlink=”http://www.ksdk.com/story/news/local/2014/08/12/michael-brown-preliminary-autopsy-results/13961385/”> Brown's body, which concluded the young African-American teen had died of gunshot wounds after his encounter with the police just over one week ago. The local community has {rallied since the death}<hyperlink=”http://www.businessinsider.com/state-of-emergency-declared-in-ferguson-2014-8”>, alleging police bias amid an aggressive crackdown on the demonstrations.

Despite the push for a second look at Brown's body, Holder's office said the investigation won't discount the local medical examiner's analysis.

""Even after it is complete, Justice Department officials still plan to take the state-performed autopsy into account in the course of their investigation,"" the statement said.",NA,NA,NA,NA
BusinessInsider,bus61,http://www.businessinsider.com/al-sharpton-on-ferguson-protests,'AMERICA IS ON TRIAL': Al Sharpton On Ferguson Protests,Colin Campbell,8/17/2014,11/11/2015,"Rev. Al Sharpton gave a passionate speech in St. Louis on Sunday morning, where he sharply criticized the {release of video}<hyperlink=”http://www.nbcnews.com/storyline/michael-brown-shooting/feds-urged-police-not-release-michael-brown-robbery-video-n182346”> allegedly depicting Michael Brown, the black teen recently killed during a police encounter, robbing a convenience store before the fatal incident.

""Michael Brown is gone. You can run whatever video you want. He is not on trial. America is on trial!"" Sharpton declared at the Greater St. Marks Family Church, {according to video posted by Fox 2}<hyperlink=”http://fox2now.com/2014/08/17/live-updates-sharpton-speaks-at-ferguson-church/”>. ""I have never in all my years seen something as offensive and insulting as a police chief releasing a tape of a young man trying to smear him before we even have his funeral."" 

The relatively small city of Ferguson, Missouri, has been the epicenter {of racially charged protests}<hyperlink=”http://www.businessinsider.com/state-of-emergency-declared-in-ferguson-2014-8”> since Brown's death just over a week ago. Local police {have aggressively cracked down}<hyperlink=”http://www.businessinsider.com/police-militarization-ferguson-2014-8”> on the demonstrations, wielding military-style weapons, issuing curfews, and arresting a number of protesters and at least two reporters.

Sharpton argued the U.S. faces a ""defining moment"" for how police authorities manage the protests.

""America as a nation, Missouri as a state, Ferguson as a city, is at a defining moment on whether or not we know and are mature enough to handle policing — whether it goes over the line or not. We cannot lecture nations around the world about how they handle policing and we have an inability of handling it in our own nation. All policemen are not bad; most policemen are not bad. But all of them are not right all the time. And when they're wrong, they must pay for being wrong just like citizens pay when they're wrong,"" Sharpton said.

In order to make his point, the civil rights activist condemned looting in Ferguson and challenged police to do the same when officers fatally shoot members of the public.

""Looting is wrong. We condemn the looters,"" Sharpton said. ""But when will law enforcement condemn police who shoot and kill our young people? We got to be honest on both sides of this discussion.""",NA,NA,NA,NA
BusinessInsider,bus62,http://www.businessinsider.com/ferguson-protests-mike-brown-shooting-curfew-2014-8,Mayhem Is Erupting Again In Ferguson As Police And Protesters Clash,Brett LoGiurato,8/18/2014,11/11/2015,"The National Guard has been {called to Ferguson, Missouri}<hyperlink=”https://www.washingtonpost.com/national/justice-department-orders-new-autopsy-of-michael-browns-body/2014/08/18/023a4d12-2694-11e4-958c-268a320a60ce_story.html”>, where protests have escalated over the past two days after a midnight curfew was imposed by Gov. Jay Nixon. 

The St. Louis suburb has been the {site of racially charged protests}<hyperlink=”http://www.businessinsider.com/state-of-emergency-declared-in-ferguson-2014-8”> since the Aug. 9 shooting of 18-year-old Michael Brown by Ferguson police officer Darren Wilson. Clashes between protesters and police had calmed as the week progressed but have ramped up again over the weekend.

Nixon imposed the curfew on Saturday at a {rowdy press conference}<hyperlink=”http://www.businessinsider.com/state-of-emergency-declared-in-ferguson-2014-8”> during which Capt. Ron Johnson tried to assuage fears that police would use force to enforce it.

""We won't enforce it with trucks, with tear gas. We will communicate ... Because someone is standing in the street, there is not going to be an armored truck come out,"" he said.

Despite these assurances, there were numerous reports of police firing tear gas into crowds marching toward a police command center on Sunday night, hours before the curfew was set to be imposed. St. Louis County police {said}<hyperlink=”https://twitter.com/stlcountypd/status/501189523091361792”> Molotov cocktails were being thrown at police.

""It really is just pure chaos down here,"" Brian Schellman, a St. Louis County Police spokesman, {told KSDK News}<hyperlink=”https://twitter.com/RobertDEdwards/status/501216267097751553”>.

Many protesters disputed the police account that Molotov cocktails had been thrown at the police.

""That is a lie. It was no fight — it was no shots fired,"" {protester Lisha Williams told CNN}<hyperlink=”http://www.cnn.com/2014/08/17/us/missouri-teen-shooting/index.html?hpt=hp_t1”>. ""The only ones who fired was police. All we did was march to the command center to fall to our knees and say, 'Don't shoot.' And they started shooting.""

The clashes came on the same night The New York Times {released the results}<hyperlink=”http://www.nytimes.com/2014/08/18/us/michael-brown-autopsy-shows-he-was-shot-at-least-6-times.html?smid=tw-bna&_r=1”> of a private autopsy report conducted on behalf of Brown's family. According to the report, Brown was shot six times in the fatal incident, including twice in his head. The bullets that entered his body did not appear to have been fired from very close range, according to the report.

An autopsy conducted by local officials had still not been completed. Meanwhile, Attorney General Eric Holder said Sunday that the Justice Department would conduct its own autopsy because of what spokesman Brian Fallon said was ""due to the extraordinary circumstances involved in this case and at the request of the Brown family.""

Attorneys representing the {family held a press conference Monday morning}<hyperlink=”http://www.businessinsider.com/michael-brown-ferguson-arrest-autopsy-2014-8”>, during which they suggested the autopsy performed by Michael Baden, a former chief medical examiner for New York City, provided ""ample evidence"" that Wilson should be arrested.

""We believe given those kinds of facts, that this officer should have been arrested. Those things speak for themselves,"" family lawyer Daryl Parks said. ""Why would he have been shot in the very top of his head — 6-foot-4 man, makes no sense.""

Police also clashed with members of the press Sunday night. One journalist from Argus Radio {captured video}<hyperlink=”https://www.youtube.com/watch?v=razYgZ0P1KY”> of a person he identified as a police officer telling him to ""get the f--- out of here ... or you're getting shelled with this.""

Nixon announced early Monday that he had signed an executive order to send in National Guard troops to Ferguson. 

""Given these deliberate, coordinated and intensifying violent attacks on lives and property in Ferguson, I am directing the highly capable men and women of the Missouri National Guard ... in restoring peace and order to this community,"" he said in a statement.

Nixon had declared a state of emergency and {imposed the midnight curfew in Ferguson on Saturday}<hyperlink=”http://www.businessinsider.com/state-of-emergency-declared-in-ferguson-2014-8”>. One person was shot and seven were arrested Saturday night.

Below are some more images from the scene:",19,NA,NA,NA
