Source,ArticleID,ArticleLink,Title,Author,DatePublished,DateRetrieved,ArticleText,NumberComments,NumberSocialMedia,TheShitBetween,Notes
BusinessInsider,bus19,http://www.businessinsider.com/swat-ferguson-protest-2014-8,"SWAT Team Called On Peaceful Protesters In Ferguson — Police Arrest Journalists, Fire Tear Gas And Rubber Bullets",Paul Szoldra,8/13/2014,10/28/2015,"Police officers in Ferguson, Missouri, fired tear gas and rubber bullets into a crowd of peaceful protesters after telling them to go home, declaring they were ""no longer a peaceful protest"" on Wednesday evening.

Tensions began to rise as a large police SWAT team came on the scene around 6 p.m. CDT and ordered the {demonstrators to disperse}<hyperlink=”https://twitter.com/ryanjreilly/status/499690369546596355”>, reported The Huffington Post's Ryan J. Reilly.

Soon after the team of more than 70 officers came on the scene, they told protesters they needed to leave the area and that ""this [was] not open for discussion,"" Reilly {tweeted}<hyperlink=”https://twitter.com/ryanjreilly/status/499690369546596355”>. MSNBC reporter Trymaine Lee {tweeted}<hyperlink=”https://twitter.com/trymainelee/status/499691352171753472”> that the police told the crowd, ""Go home, return to your vehicles."" The protesters responded, ""Mike can't go home!""

""Your right to assembly is not being denied,"" the police said later over a loudspeaker.

Washington Post reporter Wesley Lowery and The Huffington Post's Ryan Reilly were live-tweeting from the scene, but both went silent around 6:45 p.m. CDT, with {their last updates}<hyperlink=”https://twitter.com/ryanjreilly/status/499705415106830336”> saying a police SWAT team had come into the McDonald's restaurant where they were working and asked for identification.

This news came around the same time that Guardian reporter Jon Swaine {tweeted that he saw}<hyperlink=”https://twitter.com/jonswaine/status/499706502290997248”> two reporters being handcuffed and put into a police van. Lowery {later}<hyperlink=”https://twitter.com/WesleyLowery/status/499716854169235456”> confirmed they were both arrested and {uploaded video}<hyperlink=”https://www.washingtonpost.com/posttv/national/post-reporter-detained-in-ferguson/2014/08/13/b0fc5720-2354-11e4-8b10-7db129976abb_video.html”> of the incident.

""[The police] slammed me into the soda machine, grabbed my bag, grabbed my phone, and put me in temporary restraints,"" Lowery told MSNBC's Rachel Maddow, adding that his press credentials were around his neck at the time.

Reilly, {who told}<hyperlink=”https://soundcloud.com/producermatthew/ryan-reilly-describes-ferguson-arrest-to-msnbc”> MSNBC's Chris Hayes that an officer slammed his head against glass and ""sarcastically apologized for it,"" said he asked for the arresting officer's badge and name repeatedly but that it was never given.

""Officers decided we weren't leaving McDonalds quickly enough, shouldn't have been taping them,"" Lowery {tweeted}<hyperlink=”https://twitter.com/WesleyLowery/status/499717284122730497”>, also {writing}<hyperlink=”https://twitter.com/WesleyLowery/status/499717441472057345”>: ""Released without any charges, no paperwork whatsoever.""

Of Lowery's arrest, Mark Berman {wrote}<hyperlink=”https://www.washingtonpost.com/news/post-nation/wp/2014/08/13/washington-post-reporter-arrested-in-ferguson/”> in The Washington Post:
Lowery was illegally instructed to stop taking video and followed police instructions, Baron said, after which he was slammed into a machine and handcuffed.

'That behavior was wholly unwarranted and an assault on the freedom of the press to cover the news,' [Executive Editor Martin] Baron said. 'The physical risk to Wesley himself is obvious and outrageous.'

At about 9 p.m. PDT, police told the protesters — who would not disperse — that they were ""no longer a peaceful protest,"" and they began firing tear gas and rubber bullets. Officers pushed forward into the crowds, using a deafening siren as people attempted to flee.

On one live-stream, a police loudspeaker instructed people to turn off their cameras. One protester responded that they were ""telling the media to turn off their cameras because they don't want no fu--ing witnesses.""

Ferguson has seen a wave of protests following the Saturday death of 18-year-old Michael Brown, an unarmed black man who was shot and killed by a still-unnamed Ferguson police officer. Most protests have been peaceful  — although it has occasionally turned violent — {while heavily armed police officers have been a staple at the events}<hyperlink=”http://www.businessinsider.com/police-militarization-ferguson-2014-8”>, clad in military-style uniforms and equipment and riding in a massive armored vehicle called a Bearcat.

The Wall Street Journal {reports}<hyperlink=”http://www.wsj.com/articles/missouri-community-seeks-answers-about-police-shooting-of-teen-1407939862”>:

Local officials have been trying to ease tensions in Ferguson, a city of 21,000 that's about two-thirds African American, promising a transparent and unbiased investigation into the death of Mr. Brown. Those efforts included a town-hall style meeting Tuesday night where Ferguson Police Chief Thomas Jackson and other city officials spoke.

""As long as violence stays down, our presence will stay down,"" Ferguson Police Chief Thomas Jackson said in a news conference earlier Wednesday.

[tweetbegin 499718214281347072 tweetend]
[tweetbegin 499714719318835201 tweetend]

Here are some of the images and video being shared from the scene:

[tweetbegin 499677372057399296 tweetend]
[tweetbegin 499689438092726273 tweetend]
[tweetbegin 499691017533403137 tweetend]
[tweetbegin 499694783691239424 tweetend]",48,NA,NA,NA
BusinessInsider,bus20,http://www.businessinsider.com/missouri-governor-jay-nixon-missing-in-ferguson-2014-8,"While Ferguson Situation Goes Out Of Control, Missouri Governor Tweets About School Board Meeting",Hunter Walker,8/13/2014,10/28/2015,"Missouri Gov. Jay Nixon (D) came under fire Wednesday for allegedly being conspicuously absent as a {SWAT team responded to protests over a police shooting in Ferguson}<hyperlink=”http://www.businessinsider.com/swat-ferguson-protest-2014-8”>. 

The city has been the scene of nightly protests since police officers there shot and killed an unarmed, African-American teenager named Michael Brown on Saturday. Law enforcement personnel have responded to the protesters with riot gear, rubber bullets, and tear gas. Police have said Brown attacked the officer involved in the shooting and tried to take his gun. Resident of Ferguson who are protesting have accused police of routinely engaging in racial profiling. 

On Wednesday evening, SWAT teams {attempted to disperse peaceful protesters and two reporters were arrested}<hyperlink=”http://www.businessinsider.com/swat-ferguson-protest-2014-8”>. In the afternoon, Nixon used his official Twitter account to post about attending the {meeting of a 4H chapter}<hyperlink=”https://twitter.com/GovJayNixon/status/499661063554486272”> at the University of Missouri in Columbia. Hours later, Nixon {tweeted about a school board meeting}<hyperlink=”http://governor.mo.gov/news/archive/remarks-gov-nixon-community-meeting-civic-and-faith-leaders-north-st-louis-county”> in Springfield.

Others took to Twitter to criticize Nixon for being silent on the situation in Ferguson.

""The Where Is Jay Nixon? meme is not new (frequent critique of lawmakers), but gaining new momentum in Ferguson situation,"" {wrote Springfield News-Leader statehouse reporter Jonathan Shorman}<hyperlink=”https://twitter.com/jshormanCJ/status/499710709555818499”>. 

Business Insider reached out to Nixon's office on Wednesday to ask if he had a response to the criticism. We also asked whether he was monitoring the situation in Ferguson and if he planned to travel there. Nixon's press secretary, Scott Holste sent a response noting the governor {spoke at a community meeting}<hyperlink=”http://governor.mo.gov/news/archive/remarks-gov-nixon-community-meeting-civic-and-faith-leaders-north-st-louis-county”> about the protests in St. Louis County on Tuesday night.

""Since Monday morning, the Governor has been communicating with many community, faith and civic leaders, in addition to requesting the DOJ investigation,"" Holste said. ""And I trust you saw his remarks to the standing room-only crowd at the church last night in north St. Louis County.""

View Nixon's tweets from Wednesday below. 

[tweetbegin 499701373823229953 tweetend]
[tweetbegin 499661063554486272 tweetend]",14,NA,NA,NA
BusinessInsider,bus21,http://www.businessinsider.com/ferguson-police-chief-freaked-after-cops-arrested-reporters-2014-8,Ferguson's Police Chief Freaked Out After Finding Out His Cops Arrested 2 Reporters,Hunter Walker,8/13/2014,10/28/2015,"The police chief of Ferguson, Missouri, had a stunned response after he learned his officers had arrested two reporters who were covering the ongoing protests that began in the city after an unarmed African-American teenager was shot by police there Saturday.

According to {The Los Angeles Times}<hyperlink=”http://www.latimes.com/nation/nationnow/la-na-nn-ferguson-reporter-arrests-20140813-story.html”>, Chief Thomas Jackson was shocked when he found out The Washington Post's Wesley Lowery and The Huffington Post's Ryan Reilly were arrested Wednesday evening.

""Oh God,"" Jackson said after learning of the arrests.

The Times reported that Jackson {said he immediately called the St. Louis County Police Department}<hyperlink=”http://www.latimes.com/nation/nationnow/la-na-nn-ferguson-reporter-arrests-20140813-story.html”>, which was leading the command, after learning the reporters were in custody.

The police have said the teenager who was killed, Michael Brown, attempted to attack an officer and take his gun. Protesters have accused law enforcement in Ferguson of engaging in racial profiling. Officers have responded to the protests with rubber bullets and tear gas. 

Both Reilly and Lowery said they were taken into custody and released soon after SWAT teams came into a McDonald's where they were working Wednesday.

Lowery did not respond to a request for comment from Business Insider. Reilly, who said he was held with Lowery, told Business Insider he did not hear from Jackson after his arrest. 

""We asked to speak with him when we left,"" Reilly said of Jackson. ""I think he was probably closer to the protests.""

Reilly said the police released him and Lowery after asking if they were members of the press. 

""When we were in our cell, an officer came through and asked if we were journalists. We were both in the same cell and said we were journalists,"" Reilly said. ""We were then taken out, given our bags, and sent on our way without any answers.""

Reilly said he and Lowery were given a police report number. 

""They said it would probably be a couple weeks before we got the report,"" he said.

Reilly added that he did not travel to Missouri ""intending to be the story.""

""There are people who have probably been treated much worse,"" Reilly said. ""We have the privilege that we're journalists and we've been given a get-out-of-jail-free card because of the sort of coverage that would result if we were kept in jail.""",76,NA,NA,NA
BusinessInsider,bus22,http://www.businessinsider.com/pictures-ferguson-protests-2014-8,"13 Photos From The Protests In Ferguson, Missouri, You Won't Believe Happened In The United States Of America",Paul Szoldra,8/13/2014,10/28/2015,"Protests entered their fifth and most tense day in Ferguson, Missouri, in response to a police officer on Saturday fatally shooting 18-year-old Michael Brown, an unarmed black man, and it's hard to look at the photos and believe the scene is in the United States.

{From heavily armed SWAT officers aiming rifles at unarmed civilians}<hyperlink=”http://www.businessinsider.com/swat-ferguson-protest-2014-8”> to the use of intimidating armored vehicles — it looks less small-town U.S.A. and more like Egypt's Tahrir Square during the Arab Spring. The behavior of police is similar — albeit less deadly — in the use of tear gas, rubber bullets, and a deafening loudspeaker meant to break up the demonstration officers had declared ""no longer peaceful.""

Various live streams showed a defiant but mostly peaceful crowd chanting and singing songs. But some protesters have indeed been seen, as St. Louis Post-Dispatch's David Carson {tweeted}<hyperlink=”https://twitter.com/PDPJ/statuses/499744688107446272”>, throwing rocks, bottles, and Molotov cocktails.

On Wednesday evening, the situation escalated as officers over a loudspeaker told the protesters they needed to go home, although they were told their ""right to assembly is not being denied."" Two reporters {were later arrested}<hyperlink=”http://www.businessinsider.com/swat-ferguson-protest-2014-8”> while working inside a McDonald's restaurant nearby for no apparent reason. (They were both later released, with no charges filed.)

Soon after, the police moved in on the crowd, firing tear gas and rubber bullets, and police officers instructed people to turn off their cameras.

These are the unbelievable images we've seen so far:

[tweetbegin 499751098266435584 tweetend]
[tweetbegin 499759565874163712 tweetend]
[tweetbegin 499734961318920193 tweetend]
[tweetbegin 499762359716421632 tweetend]
[tweetbegin 499744688107446272 tweetend]

The photos from Wednesday are among other disturbing images taken in recent days, {showing militarized police units being used:}<hyperlink=”http://www.businessinsider.com/police-militarization-ferguson-2014-8”>",140,NA,NA,NA
BusinessInsider,bus23,http://www.businessinsider.com/missouri-gov-situation-in-ferguson-deeply-troubling-2014-8,Missouri Governor Calls Situation In Ferguson 'Deeply Troubling',Hunter Walker,8/14/2014,10/28/2015,"Missouri Gov. Jay Nixon (D) issued a statement early Thursday mornng describing the situation in the city of Ferguson as ""deeply troubling."" Protesters in the city have been {demonstrating since Saturday}<hyperlink=”http://www.businessinsider.com/ferguson-police-chief-freaked-after-cops-arrested-reporters-2014-8”> after police killed an unarmed black teenager. Law enfrocement officers have responded with rubber bullets and tear gas and Nixon has been {criticized for his reaction}<hyperlink=”http://www.businessinsider.com/missouri-governor-jay-nixon-missing-in-ferguson-2014-8”>.

“The worsening situation in Ferguson is deeply troubling, and does not represent who we are as Missourians or as Americans,"" Nixon said. ""While we all respect the solemn responsibility of our law enforcement officers to protect the public, we must also safeguard the rights of Missourians to peaceably assemble and the rights of the press to report on matters of public concern.""

On Wednesday, two reporters were arrester when SWAT teams attempted to disperse a peaceful protest in Ferguson. Police in the city have said the 18-year-old who was killed, Michael Brown, was attempting to attack the officer who shot him. Protesters have accused police in Ferguson of widespread racial profiling.  Two reporters {were arrested while attempting to cover the protests}<hyperlink=”http://www.businessinsider.com/ferguson-police-chief-freaked-after-cops-arrested-reporters-2014-8”> Wednesday evening

Prior to his statement, Nixon, who commented on other local events, had been {accused of having an inadequte response}<hyperlink=”http://www.businessinsider.com/missouri-governor-jay-nixon-missing-in-ferguson-2014-8”> to the events in Ferguson on Wednesday. 

“I have been closely monitoring the situation and will continue to be in communication with local leaders, and I will be in north St. Louis County tomorrow. As Governor, I am committed to ensuring the pain of last weekend’s tragedy does not continue to be compounded by this ongoing crisis,"" said Nixon. ""Once again, I ask that members of the community demonstrate patience and calm while the investigation continues, and I urge law enforcement agencies to keep the peace and respect the rights of residents and the press during this difficult time.""",5,NA,NA,NA
BusinessInsider,bus24,http://www.businessinsider.com/the-ferguson-cover-of-the-st-louis-post-disptach-2014-8,Here's The Startling Ferguson Cover Of The St. Louis Post-Dispatch,Pamela Engel,8/14/2014,10/28/2015,"Protests over the police shooting of an unarmed teenager reached a boiling point in Ferguson, Missouri, on Wednesday night.

Two reporters and an alderman were arrested, and the police were armed with tear gas, rubber bullets, and armored vehicles as they attempted to control protests that they said were no longer peaceful.

{Thursday's front page}<hyperlink=”http://www.newseum.org/todaysfrontpages/hr.asp?fpVname=MO_SLPD&ref_pge=gal&b_pge=8”> of the St. Louis Post-Dispatch conveys the intensity of the clashes:

The scene looks like something out of the Middle East.

Residents of the St. Louis suburb are angered over the death of 18-year-old Michael Brown, who was apparently unarmed when police shot him on Saturday.",7,NA,NA,NA
BusinessInsider,bus25,http://www.businessinsider.com/police-fire-tear-gas-on-al-jazeera-america-tv-crew-and-then-take-their-equipment-2014-8,Missouri Police Fire Tear Gas At TV Crew And Take Their Equipment,Harrison Jacobs,8/14/2014,10/28/2015,"Wednesday night, police in Ferguson, Missouri, {attempted to disperse several hundred protesters with tear gas, stun grenades, and smoke bombs}<hyperlink=”http://www.businessinsider.com/pictures-ferguson-protests-2014-8”>. It was the fourth night of demonstrations in response to the death of Michael Brown, an unarmed black teenager, at the hands of a Ferguson police officer.

News organizations have had a notoriously difficult time covering the demonstrations in recent days {as the FAA has enacted a no-fly zone over the area}<hyperlink=”http://tfr.faa.gov/save_pages/detail_4_2599.html”>, preventing news helicopters from covering the scene, and police have {often turned away and arrested journalists}<hyperlink=”http://www.huffingtonpost.com/2014/08/13/ryan-reilly-_n_5677060.html”>.

Wednesday night, local news channel KSDK caught footage and photos of a SWAT team firing tear gas at an Al Jazeera America TV crew that was covering the events behind the police barricade. The SWAT team then moved to dismantle and carry off their camera equipment.

Here's footage from Al Jazeera America:

[tweetbegin 499939038238081025 tweetend]

Ash-har Quaraishi, a correspondent for Al Jazeera America who was on the scene, said police were fully aware of their presence on the scene. Here's what Quaraishi told Business Insider in a statement: 

... I had spoken to police officers who knew we were there. We had had discussions with them. We understood this was as far as we could get in terms of where the protest was going on, about a mile up the road. So, we didn’t think there would be any problems here so we were very surprised ...

We were very close to where those [tear gas] canisters were shot from. We yelled, as you heard there [on the video]. We were yelling that we were press. But they continued to fire. We retreated about half a block into the neighborhood, until we could get out of that situation.”

Marla Cichowski, a field producer at Al Jazeera America, gave her side of the situation in the same statement: 

We were clearly set up as press with a full live shot set up. As soon as first bullet hit the car we screamed out loud, ""We are press,’ ‘This is media.""

Police that were there at the intersection directing traffic earlier knew we were there. We never drove around the police barricade.

There was another station local NBC parked across the street from us the whole time.

 They shined a huge flood light at us before firing and I can only imagine they could see what they were shooting at.

Police have not yet released a statement about the event. Al Jazeera has. Here {it is in full}<hyperlink=”https://twitter.com/mlcalderone/status/499906107926917121”>: 

Last night at 10:30 pm CD in Ferguson, Missouri, an Al Jazeera America news crew was reporting behind police barricades. They were easily identifiable as a working television crew. As they were setting up their camera for a live report, tear gas canisters landed in their proximity and police fired rubber bullets in their direction. POlice continued to shoot after crew members clearly and repeatedly shouted ""Press.""

Al Jazeera America is stunned by this egregious assault on freedom of the press that was clearly intended to have a chilling effect on our ability to cover this important story. Thankfully, all three crew members are physically fine.

We believe that this situation must be investigated along with those involving our colleagues at other media outlets. 

{From heavily armed SWAT officers aiming rifles at unarmed civilians}<hyperlink=”http://www.businessinsider.com/swat-ferguson-protest-2014-8”> to the use of intimidating armored vehicles — Ferguson looks less small-town U.S.A. and more like Egypt's Tahrir Square during the Arab Spring. The behavior of police is similar — albeit less deadly — in the use of tear gas, rubber bullets, and a deafening loudspeaker meant to break up the demonstration officers had declared ""no longer peaceful.""

Various live streams showed a defiant but mostly peaceful crowd chanting and singing songs. But some protesters have indeed been seen, as St. Louis Post-Dispatch's David Carson {tweeted}<hyperlink=”https://twitter.com/PDPJ/statuses/499744688107446272”>, throwing rocks, bottles, and Molotov cocktails.

On Wednesday evening, the situation escalated as officers over a loudspeaker told the protesters they needed to go home, although they were told their ""right to assembly is not being denied."" Two reporters {were later arrested}<hyperlink=”http://www.businessinsider.com/swat-ferguson-protest-2014-8”> while working inside a McDonald's restaurant nearby for no apparent reason. 

One officer {reportedly slammed a reporter's head against glass}<hyperlink=”http://www.businessinsider.com/swat-ferguson-protest-2014-8”>, according to CBS correspondent Mark Strassmann. Both reporters were later released, with no charges filed.

Soon after, the police moved in on the crowd, firing tear gas and rubber bullets, and police officers instructed people to turn off their cameras.

Police made 16 arrests and that one officer was injured overnight.",114,NA,NA,Does a gif count as a picture? Second link is dead
