Source,ArticleID,ArticleLink,Title,Author,DatePublished,DateRetrieved,ArticleText,NumberComments,NumberSocialMedia,TheShitBetween,Notes
Vice,vice26,https://www.vice.com/read/its-time-to-start-preparing-for-president-rand-paul,It's Time to Start Preparing Yourself for President Rand Paul,Grace Wyler,08/18/14,09/30/16,"For the past two years, from the moment Ron Paul called off the Revolution and headed back to Texas, the political establishment has been eagerly waiting for his son, Kentucky Senator Rand Paul, to run for president. They've watched with amusement as Paul popped up around the country—in Iowa and New Hampshire, at Evangelical powwows, Howard University, the ACLU—and {at the top of early 2016 polls}<hyperlink=“http://www.washingtonpost.com/blogs/the-fix/wp/2014/07/17/rand-paul-is-right-where-he-wants-to-be-in-the-2016-race/”>. Unlike his father, it's hard to deny that he Paul is a ""serious"" candidate. But the idea that he could actually be elected President of the United States? That's never been taken very seriously.

But with half of the GOP's 2016 bench {trying to avoid prison time}<hyperlink=“http://www.texastribune.org/2014/08/16/five-things-know-about-perry-indictment/”> and Democrats spinning their wheels in Obama's second-term rut, the idea of a President Rand Paul is starting to sound less and less crazy. On issues like criminal justice reform, {mass surveillance}<hyperlink=“http://motherboard.vice.com/blog/rand-pauls-mission-to-save-silicon-valley-from-the-government”>, and drug policy, Paul is casting himself as Another Option, carving out new space as the candidate who can make room for both small-government libertarians and other voters—young people and minorities, mostly—who don't see either party as particularly effective or relevant. And some of what he's saying makes a lot of sense.

Take Paul's comments about the events in Ferguson, Missouri. In an {op-ed published by Time}<hyperlink=“http://time.com/3111474/rand-paul-ferguson-police/”> on Thursday, the Kentucky Senator laid out a remarkably blunt, even angry, assessment of the racial tensions at the center of this week's riots, linking policing issues to his broader critique of the federal government.

""If I had been told to get out of the street as a teenager, there would have been a distinct possibility that I might have smarted off. But, I wouldn't have expected to be shot,"" Paul wrote. Going on to condemn the aggressive police response to protesters, he then focuses his criticism on the militarization of the police forces in Ferguson, a problem he, perhaps predictably, blames on ""big government.""

""Washington has incentivized the militarization of local police precincts by using federal dollars to help municipal governments build what are essentially small armies—where police departments compete to acquire military gear that goes far beyond what most of Americans think of as law enforcement,"" Paul wrote. The result, he argues, is an erosion of civil liberties that is disproportionately felt by minorities.

""Given the racial disparities in our criminal justice system, it is impossible for African-Americans not to feel like their government is particularly targeting them,"" he states, adding later: ""Anyone who thinks that race does not still, even if inadvertently, skew the application of criminal justice in this country is just not paying close enough attention.""

The argument here isn't shocking; in fact, lots of people who aren't politicians have argued that giving cops billions of dollars in military hardware is scary and exacerbates racial tensions. ({Washington Post blogger Radley Balko}<hyperlink=“http://www.washingtonpost.com/news/the-watch/wp/2014/08/14/after-ferguson-how-should-police-respond-to-protests/”>, for one, {has been sounding the alarm for years}<hyperlink=“http://motherboard.vice.com/blog/police-militarization-an-interview-with-radley-balko”>.) A {recent ACLU report}<hyperlink=“https://www.aclu.org/sites/default/files/assets/jus14-warcomeshome-report-web-rel1.pdf”> on the militarization of America's police forces points out that federal grant programs provide incentives for local police departments to acquire and use billions of dollars in military-grade hardware, and found that the ""use of paramilitary weapons and tactics primarily impacted people of color."" According to a December {poll conducted for Reason}<hyperlink=“http://reason.com/assets/db/13867453755251.pdf”>, most Americans—57 percent, as well as 53 percent of Republicans—are concerned by these trends, and think that police use of military weapons and vehicles is ""going too far.""

But while other politicians, including Obama, have tried to avoid the politics of #Ferguson, Paul forcefully articulated, and shared, the public's outrage over #Ferguson—including the racial issues in play—and offered a policy solution in line with his ideas about small government. In short, he hit the elusive sweet spot between the libertarianism and civil rights—because you don't have to have read Ludwig von Misesto know it's a fucking problem that images of suburban St. Louis are {virtually indistinguishable from the Battle of Mosul}<hyperlink=“http://mashable.com/2014/08/13/ferguson-police-protests-vs-iraq/”>. By contrast, most politicians, including Obama, have avoided the politics and racial issues surrounding #Ferguson.

On other issues, too, Paul has been able to find unexpected common ground with voters outside of the aging, white GOP base. His views on issues like medical marijuana, federal sentencing laws, government spying, drones, and military intervention are much more closely aligned with public opinion—particularly among young voters—than those of any of his potential 2016 Republican rivals, and also of Hillary Clinton, the presumptive Democratic nominee. This is probably not, as {last week's New York Times Magazine suggested}<hyperlink=“http://www.nytimes.com/2014/08/10/magazine/has-the-libertarian-moment-finally-arrived.html?_r=0”>, the harbinger of some national libertarian moment. But it does give Paul the space to expand his appeal with the younger generation of voters—something the {Republican Party admits it needs to do}<hyperlink=“https://goproject.gop.com/RNC_Growth_Opportunity_Book_2013.pdf”> if it ever wants to win another presidential election.

Paul seems to be seizing the opportunity. His 13-hour filibuster protesting Obama's drone policy made him a national figure last year, and since then, he's become a leading voice against the NSA's sweeping domestic surveillance programs, earning a {standing ovation from a roomful of college students at UC Berkeley}<hyperlink=“http://www.sfgate.com/politics/article/Republican-Rand-Paul-fires-up-a-Berkeley-crowd-5332740.php”> this spring. When his neocon colleagues (and Obama) wanted the military to intervene in Syria last year, Paul joined forces with Democrats to oppose the effort. Recently, he introduced two bills with New Jersey Senator Cory Booker, one that would advance criminal justice reforms for juveniles and non-violent drug offenders, and another that would {bar the Drug Enforcement Agency from using its funds to crackdown on legal medical marijuana providers and their patients}<hyperlink=“http://www.vice.com/read/congress-has-had-a-surprising-moment-of-clarity-in-the-war-on-drugs”>. Of course, some of Paul's voter outreach efforts, {like his speech at Howard University last year}<hyperlink=“http://www.businessinsider.com/rand-paul-drug-policy-howard-university-2013-4”>, have fallen flat. But he's gotten people's attention, and at the very least, made it harder for them to hate him.

So what does all this mean for 2016? Civil liberties issues don't usually dominate presidential elections, and on the big issues—the economy, immigration reform, healthcare—Paul has been decidedly less bipartisan. But presidential elections are mostly a numbers game: As you are no doubt aware, Obama crushed both John McCain and Mitt Romney among voters ages 18-29 ({66-32}<hyperlink=“http://www.ropercenter.uconn.edu/elections/how_groups_voted/voted_08.html”> and {60-37}<hyperlink=“http://www.ropercenter.uconn.edu/elections/how_groups_voted/voted_12.html”>, respectively). But George W. Bush was {basically tied with both Al Gore}<hyperlink=“http://www.ropercenter.uconn.edu/elections/how_groups_voted/voted_00.html”> and {John Kerry}<hyperlink=“http://www.ropercenter.uconn.edu/elections/how_groups_voted/voted_04.html”> among that demographic. If Paul can use civil liberties as a wedge issue to eat away at Democratic margins with young people—particularly in swing states like Ohio, Virginia, Iowa, and in the West—he might actually have a shot in 2016. And the more {Hillary Clinton keeps reminding people of her hawkish, autocratic proclivities}<hyperlink=“http://www.vice.com/read/hillary-clintons-foreign-policy-is-already-terrifying-812”> the more likely it gets that voters will be open to other options.

Of course, no matter where you fall on the political spectrum, there are reasons to be concerned about the prospect of Rand Paul becoming the leader of the free world. (The {Democratic National Committee has been happy to point these out}<hyperlink=“http://www.thewire.com/politics/2014/08/democrats-give-rand-paul-the-beating-they-never-cared-to-give-his-father/376060/”>—they've blasted out at least 16 emails about Paul this month, a sign that someone over there recognizes he might be a problem.) But there will be plenty of time to go into all of that later. For now, just consider this a fair warning.",87,NA,NA,NA
Vice,vice27,https://www.vice.com/read/is-president-obama-about-to-send-a-new-york-times-reporter-to-jail-815,Is President Obama About to Send a 'New York Times' Reporter to Jail?,CJ Claramella,08/15/14,09/30/16,"It was one of those frequent but still oddly satisfying moments when the duplicity of the executive branch of the US government is on full display.

In a televised address from Martha's Vineyard Thursday, President Obama declared that ""police should not be bullying or arresting journalists who are just trying to do their jobs."" He was referring to the arrest of two reporters Wednesday night in Missouri by the paramilitary clown brigade known as the Ferguson Police Department.

At almost exactly the same moment as Obama's address, embattled New York Times journalist James Risen and several leading press freedom groups were pleading with the Justice Department to drop its years-long crusade to force Risen to reveal his confidential sources under threat of jail time.

Speaking at the National Press Club in DC, Risen called on the Obama administration to drop its case against him- assuming it has any respect whatsoever for the First Amendment.

""The Justice Department and the Obama administration are the ones who turned this really into a fundamental fight over press freedom in their appeal to the Fourth Circuit,"" Risen said. ""I'm happy to carry on the fight, but it wasn't really me who started it.""

A federal grand jury subpoenaed Risen in 2008, and then again in 2010, for allegedly incorporating classified information he received from former CIA officer Jeffrey Sterling into a chapter of his 2006 book, State of War.

Risen refused to testify, citing his right to protect his sources, also known as ""reporter's privilege."" A lower court initially sided with him, but the Justice Department won on appeal. The Supreme Court declined to hear Risen's case in June, and he will do time or endure heavy fines {for civil contempt of court}<hyperlink=“http://www.rcfp.org/category/glossary-terms/contempt-court-0”> if he continues to resist the subpoena.

After years of pursuing the case, the Obama administration is now faced with a dilemma of its own making: whether to continue its crackdown on unauthorized leaks and lose the respect of the press, or live up to its lip-service on press freedom and alienate the angry men who run the intelligence community.

Since President Obama took office, his White House has charged more people under the Espionage Act-{eight}<hyperlink=“http://america.aljazeera.com/articles/2013/12/5/obama-and-leakerswhoaretheeightchargedunderespionageact.html”>-than all previous administrations combined. But forcing a prominent journalist to confront jail time would be a different move altogether.

""I don't think the US wants to join Cuba in becoming the only countries in the western hemisphere to have a jailed journalist,"" Courtney Radsch, advocacy director for the Committee to Protect Journalists, said at the press conference.

Twenty Pulitzer-winning journalists {issued statements of support}<hyperlink=“https://pressfreedomfoundation.org/blog/2014/08/more-than-dozen-pulitzer-winners-call-justice-dept-end-its-pursuit-james-risen”> for Risen this week, pointing out that he was just doing his job.

""As Presidents George W. Bush and Barack Obama classified more and more of the government's actions over the last 14 years, denying the public critical information to judge how its democracy is faring, it has fallen to reporters like Risen to keep Americans informed and to question whether a gigantic government in the shadows is really even a good idea,"" Washington Post reporter Dana Priest said in a statement. ""We will all be worse off if this case proceeds.""

Risen's supporters also delivered a {petition}<hyperlink=“http://act.rootsaction.org/p/dia/action3/common/public/?action_KEY=9775”> Thursday morning to the Justice Department with 100,000 signatures.

""Your effort to compel New York Times reporter James Risen to reveal his sources is an assault on freedom of the press,"" the petition reads. ""Without confidentiality, journalism would be reduced to official stories-a situation antithetical to the First Amendment. We urge you in the strongest terms to halt all legal action against Mr. Risen and to safeguard the freedom of journalists to maintain the confidentiality of their sources.""

Whichever choice the Obama administration makes will leave a lasting mark on its legacy. It will also have implications for a federal ""shield law"" bill currently moving through the US Senate.

The {bill}<hyperlink=“http://thomas.loc.gov/cgi-bin/query/z?c113:S.987:”> was revived last year after revelations that the Justice Department {secretly}<hyperlink=“http://www.washingtonpost.com/world/national-security/under-sweeping-subpoenas-justice-department-obtained-ap-phone-records-in-leak-investigation/2013/05/13/11d1bb82-bc11-11e2-89c9-3be8095fe767_story.html”> subpoenaed phone records from the Associated Press in an attempt to root out leakers. It has {passed}<hyperlink=“http://www.usatoday.com/story/money/business/2013/09/12/senate-judiciary-committee-approves-media-shield-bill/2807045/”> through the Senate Judiciary Committee but has yet to make it to the floor for debate.

Facing intense backlash from the media after the AP scandal, the White House {came out in support}<hyperlink=“http://www.cnn.com/2013/05/15/politics/presidents-leakers/”> of the shield law bill, even as its Justice Department continued to press the Risen case.

Shield law advocates hope that, if Risen is held in contempt of court, it will at least give the Senate bill enough momentum to pass in the scant time before the current legislative session ends.

Although 48 states have enacted some kind of shield law protecting journalists from being compelled to reveal their sources in court, there is no such federal statute.

""My oldest son Tom is a journalist, and I want to make sure the same protections I had are still there for future journalists,"" Risen said.

The Justice Department did not respond to calls and emails from VICE seeking comment. However, spokesman Brian Fallon did tweet his support for the two reporters arrested Wednesday, The Huffington Post's Ryan Reilly and Washington Post's Wesley Lowery.

""DOJ is lucky to have a gutsy reporter like Ryan J. Reilly on our beat,"" Fallon {tweeted}<hyperlink=“https://twitter.com/brianefallon/status/499770404412882946”>. ""We knew that even before tonight. Glad he and Wesley Lowery are ok.""

""How do you distinguish between the 'gutsy' reporters and the one the administration is threatening to put in jail?"" CNN's Jake Tapper {shot back}<hyperlink=“https://twitter.com/jaketapper/status/499774406672277505”> in a tweet of his own.

Fallon did not respond.",7,NA,NA,NA
Vice,vice28,https://news.vice.com/article/how-dare-mayor-de-blasio-tell-new-yorkers-to-submit-to-the-nypd,How Dare Mayor de Blasio Tell New Yorkers To Submit to the NYPD,Natasha Lennard,08/17/14,09/30/16,"This week, Mayor Bill de Blasio asked New Yorkers to be entirely irrational. With some incredulity-provoking remarks, the mayor did the equivalent of asking well-reasoned atheists to get on their knees and pray anyway. He asked us to trust the police.

Specifically, de Blasio {advised that}<hyperlink=“http://gothamist.com/2014/08/14/dont_f_the_police.php”> New Yorkers should always submit to arrest when an NYPD officer decides to detain them. ""When a police officer comes to the decision that it's time to arrest someone, that individual is obligated to submit to arrest,"" he said during a press conference in Harlem. ""They will then have every opportunity for due process in our court system.""

The problems with his suggestion are myriad. Firstly, he delivered them in the midst of national furor over the police killing of Michael Brown, an unarmed black young man {in Ferguson}<hyperlink=“https://news.vice.com/article/the-ferguson-riots-are-not-a-shift-away-from-peace-theyre-a-challenge-to-violence”>, Missouri, and just a few weeks after NYPD cops strangled {Eric Garner to death}<hyperlink=“https://news.vice.com/article/after-eric-garners-death-cops-still-wont-do-the-right-thing”> on a Staten Island sidewalk. 

In the last ten days, cops in Los Angeles {killed two unarmed men}<hyperlink=“http://ktla.com/2014/08/14/lapd-officers-fatally-beat-father-during-traffic-stop-a-week-before-ezell-ford-shooting-family-says/”> — Ezell Ford, who suffered from mental illness, was reportedly lying on the ground when shot dead by the LAPD and, a week earlier, Omar Abrego was apparently fatally beaten by police during a traffic stop. With these deaths being just the latest incidents in a brutal pantheon, de Blasio's comments did the tacitly violent work of victim blaming. 

The suggestion is that if these young men had simply submitted to arrest, they might be alive. Perhaps de Blasio thinks Brown should have subjugated himself more. It is apparently not enough to raise one's hands and say, ""Don't Shoot."" Perhaps Oscar Grant could have been more prostrate on the Fruitvale Station platform in Oakland, to have avoided death by cop bullet. 

Furthermore, what counts as resistance to arrest in this country would be laughable if it weren't so tragic. ""Resisting"" charges are tacked on in the case of nearly any physical altercation. The mechanics of police impunity begin with their ability to liberally claim that they were faced with resistance. No activity is too docile to avoid charges of resisting arrest. Therein lies the rub: De Blasio's comments support a system in which citizens, particularly young black citizens, are forcible taught that any behavior except total docility and subjugation can and will be punished. 

De Blasio's suggestion that we should trust police judgment on arrests — or at the very least have faith that any bad cop decisions will be rectified in the courts — flies in the face of pretty much everything we see in the criminal justice system. De Blasio must know (his very mayoral campaign relied on touting such facts) that of the more than 5 million stops-and-frisks carried out under his predecessor Bloomberg, {88 percent}<hyperlink=“https://www.rutherford.org/publications_resources/freedom_watch/nypd_make_5_millionth_stop_and_frisk_under_bloomberg”> did not result in an arrest or a summons, let alone conviction. Yet his platform for mayor rested on agreeing with enraged New Yorkers that this police practice was discriminatory and ruinous to the lives of young black and brown men in the city. 

How dare the mayor of New York ask for our trust in ""due process"" while the officer that shot dead unarmed Bronx teen Ramarley Graham in his grandmother's bathroom walks free. That happened two years ago and the promise of a Justice Department investigation remains unfulfilled. Eric Garner's killers have not even been removed from the police force. And how dare he speak of ""due process"" when at least 94 percent of criminal cases in this country {don't even go to trial}<hyperlink=“http://www.nytimes.com/2012/03/23/us/stronger-hand-for-judges-after-rulings-on-plea-deals.html?_r=0”>, but end in guilty pleas as the threat of draconian mandatory minimum sentencing runs high. 

Of course, I don't expect a mayor to urge citizens to resist arrest. And I never had faith in de Blasio's lofty promises to cleanse the NYPD of its violent and racist tendencies — his choice of {Bill ""Broken Windows"" Bratton}<hyperlink=“https://news.vice.com/article/nypds-broken-windows-policing-is-the-same-old-stop-and-frisk”> confirmed that the police war on the poor and black would push on. But de Blasio's remarks about arrests give pause for thought on our authoritarian reality. To resist arrest at all can be a fatal game for young black people in this country; and anything at all can and will be construed as resisting. There's no hyperbole in seeing totalitarianism here — total subservience to authority, we have been told, is the least required.",54,NA,NA,NA
