Source,ArticleID,ArticleLink,Title,Author,DatePublished,DateRetrieved,ArticleText,NumberComments,NumberSocialMedia,TheShitBetween,Notes
Vice,vice20,http://motherboard.vice.com/read/we-need-dystopias-now-more-than-ever,We Need Dystopias Now More Than Ever,Brian Merchant,08/15/14,09/09/16,"It seems a strange time to implore authors to {“Stop Writing Dystopian Sci-Fi—It's Making Us All Fear Technology.”}<hyperlink=“http://www.wired.com/2014/08/stop-writing-dystopian-sci-fiits-making-us-all-fear-technology/”> That call, after all, was issued precisely when the nation was fixated on the highly dystopian spectacle of {heavily militarized police officers}<hyperlink=“http://motherboard.vice.com/read/reddits-gun-community-take-aim-at-novice-over-militarized-police-in-ferguson-0814?trk_source=popular”> storming streets lined with unarmed protestors in a suburb in middle America. 

Writing in Wired, Michael Solana argues that writers should be glorifying the potential of technology instead of issuing warnings of its perils: ""for their capacity to change the way people think and feel about technology, the stories we tell ourselves can save us—if we can just escape the cool veneer of our dystopian house of horrors."" 

That seems easier for someone to say when they aren't staring down the barrel of {a highly assault rifle}<hyperlink=“http://motherboard.vice.com/read/reddits-gun-community-take-aim-at-novice-over-militarized-police-in-ferguson-0814?trk_source=popular”> or fleeing {flash grenades}<hyperlink=“http://stlouis.cbslocal.com/2014/08/15/ferguson-police-chief-we-have-to-respond-to-deadly-force/”> or being blasted by an LRAD sound cannon, and instead work for a ""venture capital firm dedicated to the identification of and investment in highly scalable technology companies,"" as his bio states.

It certainly wasn't Solana's intent, but he has powerfully illustrated how differently the future is often viewed within the Silicon Valley bubble—and hasn't thought much about why the genre he is frustrated with is currently so popular.  

When I began reading the headline, I immediately figured its construction would end with 'Because {Dystopia's Already Here}<hyperlink=“http://motherboard.vice.com/en_ca/tag/Dystopia+Now”>’ or some such. Especially since one of Wired's top competitors, The Verge, was simultaneously featuring as their lead story a piece titled {‘Is This How Dystopia Begins?’}<hyperlink=“http://www.theverge.com/2014/8/14/6001243/ferguson...”> in reference to the events in Ferguson. 

Dystopian literature has, in other words, already provided a popular, obvious (yes, {perhaps too obvious}<hyperlink=“http://www.wired.com/2014/05/5-non-dystopian-works/”>), and {useful reference point}<hyperlink=“http://motherboard.vice.com/en_ca/tag/Dystopia+Now”> for many to understand and contextualize the ill tide of current technological trends. 

Many look at Ferguson and recognize the seeds of a society depicted in, say, {Elysium}<hyperlink=“http://motherboard.vice.com/blog/elysium-science-fiction-tricked-hollywood-into-making-the-years-most-radical-film”> or The Hunger Games. Those films offer a lens through which to consider {the wealth inequality}<hyperlink=“http://motherboard.vice.com/blog/the-1-percent-raked-20-percent-of-americas-cash-last-year-dystopia-looms”>, militarized policing, and prejudice against minorities that is informing those events—and where those trends might conclude if left unaddressed. Ferguson is a stark example of our cautionary fiction aligning, regrettably, with reality, right here in the richest country on earth. 

(A more valid gripe about dystopian lit is that it tends to describe what are commonplace woes in much of the world happening to wealthy white Americans, then bemoaning them as novel.) 

We need our dystopias more than ever. As Motherboard futures editor {Claire Evans often points out}<hyperlink=“http://motherboard.vice.com/blog/feminist-science-fiction-primer”>, our science fiction almost always tells us more about the present moment than it does about tomorrow. Films, TV shows, and books that portray the widening gap between the elites and the poor and the use of technology to subjugate the have nots are beyond apropos right now. 

So when Solana, an employee of a venture capital firm, writes that ""Our fears are demons in our fiction placing our utopia at risk, but we must not run from them,"" it isn't just myopic, it borders on ignorance. What utopia? There is no semblance of a utopia in sight for any save the richest techno-optimists. Structural inequities are placing society at risk, and no technology alone is going to fix them.

Furthermore, sci-fi is often best when it's subversive—from early classics like Edward Bellamy's utopian Looking Backward to H.G. Wells' capitalism-critiquing The Time Machine to, of course, 1984 and Brave New World to, most recently, {Snowpiercer}<hyperlink=“http://motherboard.vice.com/read/the-years-best-film-about-income-inequality-was-nearly-ruined-by-the-1-percent”> and, yes, The Hunger Games—not when it's an advertisement for technology invented by companies that Solana's firm might like to invest in.

Now, Solana's point is also that we need more Jules Verne's and Arthur C. Clarke's predicting new technologies (they're credited with dreaming up the submarine and satellite communications, respectively), and future societies for readers to become enamored by. 

In this call, he's not alone. Cyberpunk laureate Neal Stephenson, for instance, has beseeched writers to {stop being so pessimistic}<hyperlink=“http://www.smithsonianmag.com/ist/?next=/science-nature/dear-science-fiction-writers-stop-being-so-pessimistic-127226686/”> and ""get big stuff done""—that's why he helped found the Heiroglyph project, which is working to imagine {space elevators and massive towers}<hyperlink=“http://motherboard.vice.com/blog/the-twelve-mile-high-skyscraper-is-on-pause-thanks-to-the-jet-stream”>, and generally doing exactly that. 

But that's evidence that the two strains of speculative fiction aren't mutually exclusive—Stephenson himself imagined an astonishingly iPad-like 'Primer' in his very dystopian Diamond Age, and Kim Stanley Robinson thought up hollowed-out asteroid barges, roving mobile cities on Mercury, and empowering gender-bending biotech in his opus, 2312. By the way, in that book, Earth is still burning. 

In other words, these sci-fi writers are being pragmatic—they're envisioning a crumbling world and the fascinating technology that might help save or distract us from it. Yet there's still a reason that we can't wave off pure dystopias, either. They help diagnose our ills and suggest a few ways forward; Elysium, as ham-handed as it was, {ends with universal healthcare}<hyperlink=“http://motherboard.vice.com/blog/elysium-science-fiction-tricked-hollywood-into-making-the-years-most-radical-film”>. The Hunger Games, meanwhile, has actually {inspired real-world revolutionaries in Thailand}<hyperlink=“http://www.theguardian.com/world/2014/jun/03/hunger-games-salute-banned-thailand”>.

Films like those may be relatively sterile big-budget Hollywood entertainment, but they still convey a message that is eminently and unfortunately relatable to an increasingly large and diverse slice of the world: There's a sharpening divide between very comfortable elites, like people who run venture capital firms, and those whose labor the elites are profiting off of. Those who worry, in addition to how they're going to pay their bills, about persecution at the hands of militarized police and digital government surveillance.

The few who don't need to think about dystopia, and the vast majority who do.",NA,NA,NA,NA
Vice,vice21,http://www.vice.com/en_ca/read/theres-not-going-to-be-a-purge-in-your-town-817,There's Not Going to Be a Purge in Your Town,Mike Pearl,08/18/14,09/09/16,"The first time I went to {Snopes.com}<hyperlink=“http://www.snopes.com/crime/warnings/purge.asp”>, I thought the internet would become the miracle cure for urban legends. I especially hated the outright lies, like the one about {gang members going around with their car headlights off}<hyperlink=“http://www.snopes.com/crime/gangs/lightsout.asp”>, and shooting you if you flash them. I thought access to information would help the truth prevail. OK, you can stop laughing at me.

Now the kids think there are going to be real-life purges, and they’re spreading the notion via the {Giant Lie Factory}<hyperlink=“http://www.vice.com/read/the-internet-is-a-giant-lie-factory”>. Perhaps it's some last-minute marketing for The Purge: Anarchy, now playing in a theater near you. But it's almost certainly no coincidence that this hoax got started around the same time as the Ferguson protests. 

If you don’t read the taglines on movie billboards, a purge—as posited by the movie The Purge and its recent sequel—is a night on which everything is legal. The cops pack it in. Looters and murderers have a field day, and the audience has a good time. 

On Friday night, in real life, Louisville lost its mind when kids there started tweeting about a Louisville purge, and the grown-ups believed what the kids were telling them—something you should never do.

They started shutting down businesses and locking themselves in their homes. Police {went on high alert}<hyperlink=“http://www.courier-journal.com/story/news/local/2014/08/16/aftermath-louisville-purge/14169789/”>, because, according to the cops there, ""We have to err on the side of caution, to keep our city safe.” 

You have to? Really? Even when what you’re preparing for, on the taxpayer's dime, is based on internet rumors that don’t even make sense when taken at face value?  

Next, purge hysteria escalated because people started saying one had happened. A Redditor posted what they claimed was photographic evidence of {a Louisville purge}<hyperlink=“http://www.reddit.com/r/quityourbullshit/comments/2dqj77/op_claims_there_was_a_purge_in_louisville_ky_last/”>. According to the post, someone let a giraffe out of the Louisville zoo. This was—are you sitting down?—a lie. The image was taken from a different news story in a different city, eight months ago. 

[tweetbegin 500494533881516032 tweetend]

Next, a vortex of stupidity took hold. One Direction were gearing up for a performance in Detroit Sunday night, and either because of, or in spite of it, people started tweeting about a {Detroit Purge}<hyperlink=“http://hollywoodlife.com/2014/08/17/louisville-purge-one-direction-security-safety-detroit-concert/”>. Such an event might set the stage for a tragedy if One Direction were to be robbed and beheaded by a roving gang of masked psychopaths. 

By then the idea had caught fire, and it was everywhere. 

Before long, there were people making up all kinds of stories about purges in every major city in America. Everyone gave themselves the rhetorical authority to tweet sensational nonsense by couching it in concern for others. Most tweets about Purges have the refrain “Be safe” tacked onto the end. 

[tweetbegin 500482775745847296 tweetend]

Inevitably, with all these rumors swirling around, the idea of a {St. Louis purge}<hyperlink=“http://www.theepochtimes.com/n3/882672-ferguson-purge-twitter-rumors-spread-about-st-louis-ferguson-missouri/”> during the Ferguson protests was irresistible. It didn't happen. Ferguson got hit with a curfew, now in its second night. Looting wasn't exactly at LA-Riots levels Saturday night, but just being outside was illegal. It was the exact opposite of The Purge.

But look, kids, there’s no purge coming to your town anyway. You 100 percent cannot just have a Purge. Here's why:

Purges Are Impossible in the United States.

I'm going to take this seriously for a second.

No city or state in the US has the authority to declare a purge. If, hypothetically, the police intentionally backed off for a night, and the people who were the victims of crimes pressed charges afterward, but the bored receptionist at the police station was like, “Sorry your grandma was murdered, but nothing was illegal that night. Next!” they could just take their complaints to the state or federal level. It would be easy to argue, even though there’s no law that explicitly bans a jurisdiction from decriminalizing things like theft and murder. You would just use the always-handy ninth amendment, which says you have rights not explicitly outlined in the constitution. It wouldn’t be hard to get a judge to agree that you have the unalienable right not to be murdered or robbed with the tacit approval of the local authorities. 

The purge in the movie was made possible by amending the constitution. I feel like I would remember reading about it if there had been a 28th amendment that added purges to the fabric of our political system.

Rumors of Violent Flash Mobs Are Mostly Racist Hysteria.

If the people spreading this idea around don't actually think crime is going to be legal, and instead they think a ""purge"" is just the new name for one of those violent flash mobs they heard about on TV, I've got more good news: that shit doesn’t really happen. “Wilding,” isn’t really a thing, except when followed by ""out."" The Central Park 5 case, often cited as the quintessential example of young people running amok in huge crowds, {didn’t happen like you think}<hyperlink=“http://www.pbs.org/kenburns/centralparkfive/”>. Bad things happened that night, but accounts of events were tainted by racism and paranoia. 

People get in crowds sometimes, yes, and they lose their shit sometimes, yes. Ten unruly members of a peaceful crowd of 10,000 can cause the whole crowd to get blamed for a few stores being looted. Ferguson isn't the only case where something like this has happened. Cops tell stories to newscasters that further this ""the world is going to hell in a handbasket"" narrative because it keeps them in a job. Similarly, when a newscaster interviews Sylvester Stallone, he'll tell you it's a good idea to see The Expendables 3. That doesn't make it true. 

For instance, looking for an example of a ""violent flashmob,"" I found an often cited story from 2011 where {1,000 gang members}<hyperlink=“http://boston.cbslocal.com/2011/05/30/hundreds-of-teens-fighting-at-bostons-carson-beach/”> were supposedly fighting on a beach in Boston. It turns out there were just a few fights, and the vast majority of the people in that crowd were just guilty of hanging around while being black or Hispanic. 

The Purge Is Just a Movie.

When I was fourteen, and the Columbine shooting had just happened, there were whispers in my school that the vast and powerful Trenchcoat Mafia would carry out a coordinated assault on every high school in America the following Friday. It was a dumb rumor in retrospect, but a really scary, non-movie thing had just happened in real life. I stayed home that Friday because on one hand, yes I'm a coward, but there was an upside: I didn't want to go to school anyway, and I got a three-day weekend out of the deal. But as for the purge hoax, if you're a high schooler who responded to this movie-based rumor by locking yourself in your house during a weekend, that was dumb, and a waste of a weekend.

Kids have wild imaginations. If you'd told me there was going to be a real life {Thunderdome}<hyperlink=“https://www.youtube.com/watch?v=pHU6K47qgc8”>, a real life {Logan's Run}<hyperlink=“https://www.youtube.com/watch?v=LSUAAKFLoL0”>, or a real life {Battle Royale}<hyperlink=“https://www.youtube.com/watch?v=04bZIZDn0jo”>, I would have been too excited not to spread the rumors. Adults, though, are supposed to know the difference between science fiction movies, and stuff that can actually happen.

The {small but significant pockets of misbehavior}<hyperlink=“http://nypost.com/2014/08/11/st-louis-suburb-erupts-in-rioting-after-cops-shoot-dead-unarmed-man/”> in Ferguson and elsewhere last week were no match for the enormous shows of force the law enforcement machine demonstrated, and will apparently always demonstrate, when people start to get out of line. That's not to say we have law and order, just that, to compensate for the lack of law and order, there are sudden surges of violence from the cops that have become routine.

America has a lot of problems with violence in the streets, but the fact that much of that violence is committed by law enforcement should tell you that if you think there's a purge coming, you’re focusing your paranoia in the wrong direction.",NA,NA,NA,NA
Vice,vice22,http://noisey.vice.com/blog/punks-please-hate-the-police,"Punks: Please, Hate the Police",Noisey Staff,08/15/14,09/28/16,"Things are just as bad as they've ever been, so why are our punk bands more outraged?

Here’s a story: an openly gay man fronts a rights-minded punk band in Austin, Texas. That could be 50 different groups in 2014. But in 1979, before Austin needed to be kept weird, you could count the open rock groups on one hand. At the forefront of this change were Gary Floyd and his band of Dicks.

One of The Dicks’ crowning achievements was their first single, “Hate The Police”—a taut, balled fist of a song that raged with anger against a racist, trigger-happy cop. It’s unfathomably depressing that the track still resonates with such ferocity 34 years later. The too-true song takes the point of view of a prejudiced cop with anger to spare and power to abuse:

“Mommy, mommy, mommy / look at your son / you might have loved me / but now I’ve got a gun. / You better stay out of the way / I think I’ve had a bad day / … Daddy, daddy, daddy / proud of his son / he’s got him a good job / killing ni—ers and Mexicans / I’ll tell you something / and it’s true: / You can’t find justice / it’ll find you.”

A punk song or script from George Zimmerman’s inner monologue? It’s one of the first things I thought of when Trayvon Martin was murdered and, unfortunately again, two and a half years later, as the Ferguson PD killed another young black man, Mike Brown.

Clearly, there is blood in the streets. But where are our punk bands’ teeth?

Without getting into the granularity of what constitutes a punk band these days, I think it’s supremely safe to say that the majority of the “scene” has been inundated with an inward-looking slackerdom that, given the current state of affairs, feels downright empty. And at one point, and on some days still, there is definitely a place for that. Since The Replacements there’s been plenty reason to wake up with beer for breakfast. But do we need another FIDLAR song about doing coke at the Cha Cha? Another call to arms to meet at the bar with Deer Tick? It’s not like every punk band has to be political and every political punk band has to make every song about politics, but Christ, can we engage with the world, please?

While The Dicks were still green in Austin, Rollins and MacKaye were getting their hands on their first Ramones record just as the era of Reagan doom began to bloom. For the next eight years punk would fight the man and his politics. The Minutemen sang in opposition to Iran-Contra. Almost every band in the genre went at him, maybe most vocally The Dead Kennedys leading the charge. One of the best latter-era Ramones songs, the glittering “Bonzo Goes To Bitburg,” was written for their disgust at Reagan’s visit to a Nazi cemetery.

The women were also rearing their heads at the system that perpetuated rape culture, misogyny, homophobia, violence; culminating in the early 90s, most visibly by Bikini Kill. Riot grrrl, a classification some would buck, was a vocal, vibrant scene calling for change and equal rights. Even bands on the softer end of the spectrum were discussing the issues, like the brutally wonderful “Atta Girl” by tweecore champions Heavenly.

Then came Bush and a rash of liberty-spiked anti-Republicans, led largely by snarl-over-substance Billie Joe Armstrong. Looking back on the line-up for Rock Against Bush is unfortunately a bit embarrassing in 2014. Although Fat Mike’s Punkvoter drive did increase youth voting by ten percent it was technically a failure, and an example of shortsightedness. Instead of painting Bush as Target Numero Uno and pushing to tip the largest election in the country, with a more focused strategy and aligning closer with the DIY punks it’s possible they could have made some real change. They tried to win the war without going to any battles. Iraq went on and the scene faded. Now, the most prominent political punk band is probably Propagandhi, who have earned their position at the forefront simply by virtue of survival: they formed in 1986 and have been rocking against injustice ever since.

And here, now, America as boiling and brittle as ever, and we’ve got our muzzles on. Granted, I’m speaking on this from the point of view of the thematic elements unifying these pockets of the genre and their cultures. There will always be exceptions, outliers, unknowns. But here we still live with insane racism, a grotesque rape culture, outrageous police brutality and murder, leaked documents out the ass, wage disparity, a severe homelessness problem, inaccessible health care, mental disease still in the dark, a laughable minimum wage, and a constant struggle for equal human rights. Just to name a few.

As of Wednesday night the protests marched on in Ferguson while a militarized police force attempted to censor media coverage, teargas peaceful citizens and journalists, and war toward a grieving city yearning for justice and accountability. Does it even need to be said how important of an event this is? How more than ever punk bands should be politically, civilly, socially conscious?

If political activism in punk peaked with Reagan, then the punks of hip hop grabbed the baton at the same time. Public Enemy, N.W.A., Tupac, Ice-T, all scraping their lungs dry on police brutality, the fear of a black planet, bringing to light issues mainstream America surely wasn’t fucking privy to at the time. Immensely talented men and women with powerful statements continued through the 90s and aughts with countless artists in both the mainstream and the underground releasing mindcrushing tracks about the realities of being black in an ostensibly “post-racial” America. The snarl for a truly free country has continued to the current climate. Killer Mike and Tef Poe have both been highly vocal about the scene in Ferguson and who could forget Questlove’s heartbreaking essay, “Trayvon Martin and I Ain’t Shit”? Hell, Kanye West’s “Black Skinhead” might be the best punk song of the past ten years, and Killer Mike's R.A.P. Music the past decade's best punk album. (Secret: It’s never had to rock to be punk rock.)

Hip-hop has long been the voice of the streets, resonant to those familiar with the lifestyles often described, though for some time perceived as misplaced anger and needless descriptions of violence. But whose violence? Similar to “Hate The Police,” ten years ago Ghostface Killah released the single “Run” wherein he, Jadakiss, and Comp discuss the only alternative to facing a corrupt and biased police force. At the time of its release, however, the word “gun” was still being edited out of the radio and video versions. Surely not in country songs, surely no bleeped huntin’ rifles or six shooters. And the placement of that word is wildly important:

“Run! / If you ain’t do shit, you it / That next felony, ni—a, is like three zip / So run! / Hop fences, jump over benches / when you see me comin’ get the fuck out the entrance / Run! / Fuck that! / Run! / Cops got guns!”

There have been black punks pioneering their slice of the scene since the 70s—Bad Brains, DEATH, Living Colour—but in more recent years, when it comes to prominence and coverage, a strong black voice in the genre has been hard to find, and with the napkin-scrawled demise of anti-labelists Death Grips, it’s become even harder.

The punk bands who do get a chance to tell you about anything have often been picked by Mr. Checkbook—and they’ll never stop selling us four skinny white dudes whose biggest problem is having to think deeply about some truly shallow shit. Certainly not many of them have had to run from the cops. Certainly none of them have been shot for not running, for standing innocently with their hands in the air, unarmed. But that doesn’t mean they can’t talk about it. Black issues should be American issues. It’s still a fight for civil rights, and these are our countrymen. When Malcolm X was once asked why he was against whites joining the Black Panthers, he explained that it wasn’t their place to make change, that if whites wanted to help blacks in this country they should be trying to alter those who they can directly affect, with their access to aspects of white culture the Panthers would never be able to infiltrate. Which is why it’s important for punk bands with influence, with MTV spots and car commercials, with slots on Letterman, should be using their visibility to influence a culture that may not be as exposed to or understanding of the current situation, of the perspective that isn’t specifically theirs.

So this is my plea: if you’re a punk and you’re as angry as you should be, don't focus it inward. Existentialism is tough, and it’s fun as fuck to cope by partying, but people are being shot down in public, Ferguson was a fucking war zone this week, the police state has plenty of ammunition—maybe you should be using music to shoot back.",NA,NA,NA,NA
