Source,ArticleID,ArticleLink,Title,Author,DatePublished,DateRetrieved,ArticleText,NumberComments,NumberSocialMedia,TheShitBetween,Notes
Vice,vice1,https://news.vice.com/article/tension-is-mounting-in-ferguson-as-more-people-are-shot,Tension Is Mounting in Ferguson as More People Are Shot,Alice Speri,08/13/14,05/12/16,"""Protests over the police killing of an unarmed Ferguson, Missouri teenager turned violent overnight for the third night in a row, with two more people reportedly shot in the early hours today.

Police responding to reports of armed men and gunfire shot a man in Ferguson who they said had pointed a handgun at an officer early this morning. The unidentified man {was reportedly shot}<hyperlink=“http://www.latimes.com/nation/la-na-ferguson-police-shooting-08132014-story.html”> just blocks from the place where hours earlier civil rights activist Rev. Al Sharpton had addressed local residents.

In {a separate incident}<hyperlink=“http://legacy.ksdk.com/story/news/crime/2014/08/13/ferguson-woman-shot-in-head/13990051/”> approximately one mile away, an unidentified woman was reportedly shot in the head in a drive-by shooting, in an incident that authorities had not yet confirmed was related to the earlier protests. The woman is now in stable condition and is expected to survive. Police are still searching for the suspects.

At least seven people were also arrested overnight, as police told defiant protesters to ""go home"" or face arrest. Reporters on the scene described several protesters walking towards police lines in defiance of their orders, with their hands raised up.

Today police in Ferguson released their first statement since Brown's death, saying members of the department ""have heard the community's cries for justice"" and ""will continue to cooperate fully in the investigations"" by the FBI, the St. Louis County Police Department, and the Justice Department. 

""The City of Ferguson has been through tough situations in the past, albeit nothing to this magnitude, but will continue to display resilience and fortitude,"" the statement said.

[tweetbegin 499581876668227584 tweetend]

Residents of Ferguson, a primarily black suburb of St. Louis, have been taking to the streets since Sunday, a day after 18-year-old Michael Brown was shot and killed by a still unnamed police officer, following an altercation of which the details are still being disputed.

On Sunday, after a candlelight vigil for Brown, angry protesters were met by heavily armed police in riot gear, and the initially peaceful protests turned into riots. Some groups looted and burning local businesses — including the QuikTrip, a local gas station that has since become a flashpoint for protests.

[tweetbegin 499408682145574913 tweetend]

On Monday protests over Brown's shooting turned into clashes, as police met local residents with tear gas and rubber and wooden bullets. Tuesday evening was initially calmer, but protesters reportedly clashed with police as the night went on.

[tweetbegin 499219813575557121 tweetend]

Accounts of the events leading up to Brown's death differ widely, with police saying the teen had attacked an officer and attempted to take hold of his weapon. Dorian Johnson, 22, a friend of the victim who was with him at the time, has said that police shot at Brown after the two refused to immediately move from the middle of the street to the sidewalk.

Johnson and other witnesses {said that}<hyperlink=“http://www.huffingtonpost.com/2014/08/12/michael-brown-shooting-witness_n_5671156.html”> Brown was on his knees, with his hands raised up high, when he was killed.

The gesture — and the slogan ""hands up, don't shoot!"" — has become a symbol of the protests, adopted by demonstrators rallying peacefully but also by some more provocatively confronting police with their hands up high.

Johnson said police told him and Brown to ""get the fuck onto the sidewalk,"" and then proceeded to grab and choke the teen when he refused to follow orders. He said an officer shot him when he attempted to flee.

""We weren't causing no harm to nobody,"" Johnson {told CBS News on Sunday}<hyperlink=“http://www.cbsnews.com/news/michael-brown-shooting-some-ferguson-missouri-residents-do-not-believe-cops-story/”>. ""We had no weapons on us at all. He shot again and once my friend felt that shot he turned around and put his hands in the air and started to get down, and the officer still approached with his weapon drawn and fired several more shots.""

Johnson's lawyer, Freeman Bosley, a former mayor of St. Louis, said on Tuesday that police had declined to interview Johnson, who has taken his testimony to the media instead.

""They didn't even want to talk to him,"" Bosley {told MSNBC}<hyperlink=“http://www.msnbc.com/msnbc/eyewitness-michael-brown-fatal-shooting-missouri”>. ""They don't want the facts. What they want is to justify what happened.""

Police asked for calm and time to carry out an investigation into the incident and said on Tuesday that they would not publicly disclose the name of the officer involved in Brown's death, as previously announced, because of threats made on social media and fear for the officer's safety.

""The value of releasing the name is far outweighed by the risk of harm to the officer and his family,"" Thomas Jackson, the police chief in Ferguson, told reporters.

St. Louis police have since taken over control of the suburb from the Ferguson police department, also by instituting a no-fly zone over the neighborhood.

Also on Tuesday, the St. Louis County prosecutor said the autopsy of the teen's body won't be released.

Brown's family, local and national community leaders, and President Obama have appealed for calm.

""The death of Michael Brown is heartbreaking, and Michelle and I send our deepest condolences to his family and his community at this very difficult time,"" Obama said. ""As Attorney General Holder has indicated, the Department of Justice is investigating the situation along with local officials, and they will continue to direct resources to the case as needed.

""I know the events of the past few days have prompted strong passions, but as details unfold, I urge everyone in Ferguson, Missouri, and across the country, to remember this young man through reflection and understanding. We should comfort each other and talk with one another in a way that heals, not in a way that wounds. Along with our prayers, that's what Michael and his family, and our broader American community, deserve.

In Ferguson on Wednesday Rev. Sharpton also called for calm. ""Don't be a traitor to Michael Brown in the name of 'you mad,'"" he said.

Sharpton had recently rallied in New York over the death of another black man, Eric Garner, who died after police put him in a chokehold for resisting arrest.

Those calling for ""Justice for Michael Brown"" also took to social media to remember other unarmed black victims of police or vigilante violence — from Garner to Trayvon Martin, who was shot to death in 2012 in Sanford, Florida.

On Wednesday, {reports emerged}<hyperlink=“http://www.usatoday.com/story/news/nation/2014/08/12/lapd-shooting-ezell-ford/13985607/”> that another unarmed 24-year-old black man had been killed by police in South Los Angeles.

Following Brown's death in Ferguson, social media sites were abuzz with tributes to black men killed by police.

""One every 28 hours,"" some said, citing a statistic turned slogan begun by the {Malcolm X Grassroots Movement}<hyperlink=“https://mxgm.org/operation-ghetto-storm-2012-annual-report-on-the-extrajudicial-killing-of-313-black-people/”>, a group fighting racism. In a report named ""Operation Ghetto Storm"" the group found that, in 2012, a black man was killed by police every 28 hours.

LaQuanda Brown, 28, has spent her entire life in Ferguson, and lives in the same housing complex where Michael Brown — unrelated — lived. She struggled for words to describe the atmosphere of the last few days.

""Tension, anger. Everyone in this community has had enough,"" she told VICE News. ""People want to be heard and they want justice.""

""They are wondering why all this police is here, why they are coming to peaceful rallies,"" she added. ""Police come out with their helmets, vests and shields. They are so aggressive. They just make it worse.""

On Thursday, vigils for victims of police brutality and racism are set to take place across the country, including in St. Louis.

The NAACP also issued a statement following Brown's death. ""Even as we call for accountability by those charged with protecting the community, we call on the community to act — collectively and calmly,"" the statement said.

Despite some lootings, residents said that the protests over Brown's death had been largely peaceful, and that protesters had instead been met aggressively by police in a militarized response.

""It's messed up, they're suited for war against civilians,"" Miller Gardner, a young protester, told the Daily Beast on Monday, while standing, hands raised before a line of riot police officers. ""I'm not on that side, and I'm in the military. They need to come on this side of the line.""

Over the past few days, the suburb was heavily patrolled by officers in riot gear, with police lines all along West Florissant Avenue, a main strip in Ferguson. Journalists reported being denied access to some of the protests' sites — and residents compared the militarized police presence in the streets of their neighborhood to an ""occupation.""",130,NA,NA,NA
Vice,vice2,https://news.vice.com/article/state-of-emergency-and-curfew-in-ferguson-after-tensions-flare-again,State of Emergency and Curfew in Ferguson After Tensions Flare Again,Alice Speri,08/16/14,05/16/16,"At a press conference attended by angry members of the community, Missouri Governor Jay Nixon declared a state of emergency and curfew in Ferguson this afternoon after violence flared on the streets in the early hours of the morning.

The curfew will last from midnight Saturday through 5AM Sunday — and officials did not specify how long the emergency would last.

Protesters at the press conference met the announcement with anger and frustration, yelling at the governor that the people of Ferguson wanted ""justice"" not curfews, and complaining that the police officer who killed 18-year-old Michael Brown — the incident which sparked the week of protest — has not been arrested.

""The only reason people have been in the street for a week now is that they want justice,"" someone shouted.

[tweetbegin 500770285717450752 tweetend]

[tweetbegin 500772748755746816 tweetend]

Capt. Johnson, of Highway Patrol, said that officers would not enforce the curfew with tear gas but would ""talk to people"" instead — though breaking curfew would theoretically constitute enough grounds for arrest.

Johnson also said that FBI agents went door to door in the residential community where Brown was shot on August 9, ""trying to find other witnesses.""

[tweetbegin 500748840564445186 tweetend]

Speaking with VICE News, some Ferguson residents said they had no plans to stay at home on Saturday night.

""I don't think this is gonna be nice at all. Violence will be met with violence,"" one of them told VICE News after the conference. ""They shouldn't have shown the tape."" He was referring to the surveillance video released by police earlier today that allegedly shows Brown stealing $50-worth of cigars from a local convenience store

He also said protesters would likely come in, past curfew, from different parts of Saint Louis — ""just to tell the motherfucking government, 'Fuck you.'"" 

Another evening of large, peaceful protests on Friday took a turn for the worse early today as small groups of people confronted police and some individuals broke into several stores.

Tensions in the St. Louis suburb flared up again after an almost festive reaction to a shift in police response earlier. Highway Patrol officers took over control of the area on Thursday after widespread criticism of the local force's aggressive response to residents protesting Brown's fatal police shooting.

[tweetbegin 500520639376011265 tweetend]

Earlier on Friday, police identified Darren Wilson as the officer who killed Brown on August 9, but at the same time released the surveillance video.

That store was broken into and looted this morning — despite efforts by dozens of protesters to keep looters out.

Police cited Brown as a primary suspect in the robbery last Saturday, sparking angry protests from local residents who accused the department of running a ""smear campaign"" against the teenager to justify the killing.

People in Ferguson were skeptical of the video's authenticity and argued that petty theft is no excuse for ""execution.""

""Not only did you murder him but now you draw up this story?"" Mark Evans, a 43-year-old father of three teens, told VICE News. ""I'm sure they took a lot of time to contemplate and put the story together. We were waiting to see what they would come up with to justify this, and this doesn't justify anything anyway.""

Evans was one of several witnesses who heard the shots that killed Brown and came to the scene. He suggested that by moving the ""crime scene"" over to the convenience store, police were trying to steer attention away from witnesses' accounts of Brown dropping to his knees with his hands raised when he was shot.

""It's sad to say it wouldn't shock me if they let [Wilson] loose, because he's one of their own,"" Evans added. ""But remember, they slaughtered him. One, two shots maybe, but they slaughtered him.""

Many questioned the timing of the video's release — with some charging the Ferguson Police Department of sabotaging efforts to bring peace to the neighborhood. Others said the robbery was unrelated to the shooting.

The Department of Justice, which launched a separate investigation into Brown's death, had {reportedly}<hyperlink=“http://www.cnn.com/2014/08/16/us/missouri-teen-shooting/”> asked police not to release the video. 

Capt. Ron Johnson, of Highway Patrol — the face of police's de-escalation efforts in Ferguson — told VICE News on Friday that he had not known the details of the police report's release, and found out about it from the media.

""At this point I don't know the why… But I don't know if I'm gonna get an answer that's really going to satisfy the why,"" Johnson said about the release of the video. He said his officers would continue to show restraint but agreed the release would negatively impact efforts to keep the peace.

""Last night we were able to build a lot of things up, I think we've taken a couple steps back here and we need to talk about that,"" Johnson added.

Privately, other Highway Patrol officers said the release was poorly timed, and added that there had been ""bad feelings"" over authorities' decision to relieve St. Louis County Police of control of Ferguson.

As the Ferguson Market liquor store — where Brown allegedly stole the cigars — was broken into early today, protesters on the scene accused looters of being outsiders, taking advantage of the situation, but also criticized police for giving them an excuse to do so.

[tweetbegin 500527708925747200 tweetend]

""The police fucked this up by saying Mike Brown stole from here,"" one of several protesters (pictured below) that barricaded the liquor store in a failed attempt to keep looters out, told VICE News. ""What you see in here, they're rats. We don't steal people's shit, we work for it. That's what real black men do.""

[tweetbegin 500556853659463680 tweetend]

Tensions ran high throughout the night, as several groups faced off. Some protesters walked up to police lines and threw Molotov cocktails — to which police responded with tear gas at least once. Volunteers, including several members of the New Black Panthers, desperately attempted to push protesters back.

Later, as looters arrived — from outside Ferguson and alerted by social media of rising tensions, locals said — groups of young protesters attempted to stop them and keep them out of stores, despite being threatened with shooting.

A young woman, almost in tears, complained that the media had focused on the looting following Brown's death, rather than on {the community's efforts}<hyperlink=“https://twitter.com/ProjectTakeBck”> to keep looters and ""outside opportunists"" away.

""This is not us,"" she said after leaving a store she and others had tried to protect from looters — but stopped when threatened with shooting. ""Did you see how peaceful it was earlier?""",134,NA,NA,NA
Vice,vice3,http://www.vice.com/read/michael-brown-st-louis-suburb-ferguson-missouri-americas-latest-racial-hotspot-812,A St. Louis Suburb Is America's Latest Racial Hotspot,Justin Glawe,08/12/14,05/16/16,"Last night, I walked out of the Target in Ferguson, Missouri, to find my car behind police tape. Cops in riot gear were extending their security perimeter around West Florissant Avenue, where protests over the death of unarmed teenager Michael Brown turned into looting and riots Sunday night and clashes with police on Monday.

“You better hurry up and go get it,” a man in a group parked near me said. The cops let me retrieve my vehicle after a stern warning (complete with a rifle being waved around) to go left and not right when I reached the edge of the lot. Five minutes later I heard four tear gas canister volleys. Ten seconds after that a 20-something black man in a caravan of Ferguson residents came over.

“We going,” he said. “You coming?”

What followed was a raucous four-hour stretch marked by smoked out streets and rage. By midnight, West Florissant was littered with rocks, broken glass, spent tear gas canisters and pepper balls. As we approached the police line from the north, cops were flying everywhere and people were honking and and screaming. After hearing the canisters fly, people were angry enough to run stoplights, ignore cop cars and speed across town to make it to ground zero and figure out what was happening.

Brown, as you may have heard, was {killed Saturday by a St. Louis County police officer}<hyperlink=“http://www.vice.com/read/why-not-assume-the-worst-after-missouri-police-shot-unarmed-black-teen-michael-brown-811”>. One protestor told me his death was the “spark that lit the fire,” one that’s been long smoldering in this St. Louis suburb, where relations between residents and police aren’t so hot. The details surrounding the 18-year-old's death have been the subject of much contention, but whether Brown was shot between seven and ten times, as his cousin Sabrina Webb and many others claimed Monday, or whether it was less than that doesn't really matter here. Nor does the fact that police maintain Brown struggled with the as-of-yet unnamed officer. What is gnawing at emotions and bubbling up at protests where many chanted ""black power"" Monday is the fact that Brown was unarmed and was apparently approached by the officer for jaywalking.

""They thought he was somebody else,"" Webb told me after pleading through a bullhorn that protestors not resort to the looting that resulted in damage to several businesses Sunday night. ""It was racial profiling.""

Webb stood on a concrete barricade as she spoke Monday. In front of was her a crowd of mostly young, black men; behind her, a wall of police from multiple agencies, ostensibly there to protect the remnants of the QuikTrip station that had been gutted and torched the night before.

The looting was fairly contained, and the gas station that was decimated, not far from the apartment complex where Brown lived, was the only building actually destroyed as a result of Sunday’s initial uproar. It has become a gathering point for those who continue to express equal parts anger, sadness and disbelief over Brown's death. On a bridge over a creek nearby, tags read ""KILL COPS"" and ""FUCK THE POLICE."" “Fuck 12” and “Fuck the police” chants carried on throughout the night once the shit hit the fan.

But over and over again Monday I heard people deriding violence and looting, even if they had mixed feelings about its impact.

One man outside the gas station, sweating profusely under heavy dreadlocks drenched in 90 degree sunlight, spoke with a particularly enraged tone.

""If this shit didn't happen last night,"" he said of the looting, ""the whole world wouldn't know shit about that boy getting shot.""

But Carissa McGraw, standing not far from the makeshift memorial on Canfield Drive that marks the bloody section of asphalt where Brown went down, refuted the claim that looting was necessary to bring attention to this awful situation.

""It's got to do with the fact that his body stayed out here for 4.5 hours and (the pictures) went out on social media,"" McGraw said. ""It took the community to cover him up.""

McGraw, a 26-year-old with family in Ferguson who travelled from Colorado to join the protests, said in her mind the imagery of Brown's corpse laying in the street meant only one thing.

""The symbolism of that is a body hanging from a tree after a lynching,"" she said.

By the time I reached the protest zone just after 8 pm, smoke was filling the air. I hopped the curb behind a local TV news reporter and ran toward the police line. You couldn’t see the QuikTrip through the haze and beyond the wall of police, walking in lockstep with that apocalyptic riot gear and armored vehicles that have been made more available to law enforcement than ever before as they’ve become increasingly militarized. You also couldn’t see the street that leads to Brown’s memorial, where wax from candles burned in his memory stain the road (and where it was apparently too dangerous for reporters to go even after the last of the protestors went home). For hours cars approached the line, mainly to taunt police, before being turning away and flying north.

It was the reverse of what had been a mostly peaceful day, with gatherings at churches where Brown’s mother and step-father spoke to the press standing next to Benjamin Crump, the attorney who represented Trayvon Martin’s family. Crump and Anthony Gray, a St. Louis lawyer, are the parents’ counsel. At another church across town, elders in the black community met at a town hall event, where NAACP national director Cornell Williams Brooks spoke, among others. So many wished to attend that the doors had to be locked and a crowd carried on their own town hall on the steps of the Murchison Tabernacle CME Church. But there was a noticeable lack of young people inside.

As I left, a young man with a beret, black military vest and Black Panther pins was telling someone behind me, “They’ve got tanks over there. We need to be with our people!” He may have been referring to the tank-like SWAT team transports that the St. Louis Metro Police had sent to the area to assist local cops. In the smoky street, there was a noticeable lack of elders to talk people down from the ledge.

After midnight, I was stopped by police pointing flashlight and assault rifles. They asked for identification and credentials. “Hey, who the fuck is this?” an especially jacked and on-edge cop with cocaine eyes said to another. I answered, and told him I wanted to get through the line to lead a Reuters photographer to the memorial.

“You can’t get down Canfield. It’s blocked,” he told me with unblinking intensity.

“What do you mean, it’s blocked? It’s a public street.”

“There is no way to get down Canfield.”

Shoulder tick. Rifle adjustment.

“Got it?”

Prior to Sunday night's eye-stinging chaos, the anger of many protestors was explained, if not justified, by Justin Brown (of no relation to Michael). He said it was ""anger used in the wrong way. It was just people getting steamed up, but we're not going to be intimidated by police.""

Those statements reflect a pattern here in Ferguson. Protestors gather, police respond in significant number, and someone fires an insult or, in the case that seems to have initiated Sunday night's looting, a police flare. At this moment Ferguson is like a lot of hot spots around the world, this one with a specifically American brand of conflict between blacks and whites. And it appears the good intentions of peaceful protestors were overshadowed by Sunday's ominous turn.

If the older members of the black community who gathered to hear NAACP director Brooks speak represented Martin Luther King Jr.'s vision of civil dispbedience through non-violence, the crowds that jeered at police and defiantly breathed in tear gas smoke recall the approach of Malcolm X.

McGraw, the activist visiting from Colorado, told me, ""I came out here for a purpose, but I feel like that purpose is being diluted.""",14,NA,NA,NA
