Source,ArticleID,ArticleLink,Title,Author,DatePublished,DateRetrieved,ArticleText,NumberComments,NumberSocialMedia,TheShitBetween,Notes
Vice,vice9,https://news.vice.com/article/there-was-a-state-of-emergency-in-ferguson-long-before-saturday,There Was a State of Emergency in Ferguson Long Before Saturday,Natasha Lennard,08/18/14,05/19/16,"On {Saturday}<hyperlink=“https://news.vice.com/article/state-of-emergency-and-curfew-in-ferguson-after-tensions-flare-again”>, Missouri Governor Jay Nixon {declared a state of emergency in Ferguson}<hyperlink=“https://news.vice.com/article/missouri-governor-orders-national-guard-to-ferguson”>. The following day, Nixon confirmed emergency status by {calling in}<hyperlink=“https://news.vice.com/article/missouri-governor-orders-national-guard-to-ferguson”> the National Guard — the mark of a domestic crisis.

But what does it mean to declare a state of emergency? In practical terms, the invocation of ""emergency"" by a politician is not just a description — it does something. Specifically, emergency declarations enable the authorities to deploy extraordinary state powers and restrict ordinary rights and liberties. In Ferguson, Nixon's declaration of emergency was delivered with his (doomed) imposition of a nighttime curfew.

I see a lot of problems with what gets to be, officially, an emergency. The issue begins with unfinished sentences. We are not explicitly informed for whom, or for what, this is a state of emergency. It is not enough to answer “{Ferguson}<hyperlink=“https://news.vice.com/topic/ferguson”>.” A reality in which police officers shoot dead unarmed black teens with apparent impunity is already a state of emergency — for unarmed black teens. The people of Ferguson who took to the streets in response to Michael Brown's death declared as much.

But the governor did not proclaim that an ""emergency.""

Indeed, the ongoing state of emergency for black youth facing police violence in this country was not declared by state heads following the deaths of Oscar Grant in Oakland, New York's Ramarley Graham and Kimani Gray, LA's Ezell Ford — a mentally ill 25 year old killed by police days after Brown's death — or so many others.

The fact that protests are met with stun grenades, lungfuls of tear gas, and M4 rifles is an emergency for constitutional rights to free speech and assembly. But this emergency likewise was not declared by Nixon.

Instead, a number of other factors have earned Ferguson its official ""emergency"" status. For one, the authorities in Missouri are facing a crisis of reputation, which, following the failure to quell unrest with an ""operational shift"" at the end of last week, reached emergency levels over the weekend. The public relations disasters of arrested journalists, warrior cops, and tear gas did not provoke an immediate declaration of emergency. Rather, the ""emergency"" lies, I believe, in the realization that rightful rage in Ferguson will not be contained. The curfew was ignored. People did not go home. As was the case with the Los Angeles riots in 1992, the risk of calling in the National Guard — of admitting that authorities already on the ground did not have control — was deemed worth it.

Nixon explicitly attributed the calling of the National Guard to ""deliberate, coordinated, and intensifying violent attacks on lives and property in Ferguson."" Pause for a moment on the immediate juxtaposition, as if of equal import, of ""lives and property."" Consider too, that while property has been damaged and stores have been looted, claims of civilian-on-civilian shootings have not been confirmed. And so the difference now, what gets to be an ""emergency,"" is the intensified threat to property.

On this point, I agree with writer Raven Rakia, who {noted in the New Inquiry}<hyperlink=“http://thenewinquiry.com/essays/black-riot/”> long before the Ferguson unrest:

Nothing gets the attention of the elite like taking away or destroying what they value above all else: property. In America, property is racial. It always has been…. For 300 years, the very idea of a black person's freedom was a direct threat to white men's property…. When property is destroyed by black protesters, it must always be understood in the context of the historical racialization of property. When the same system that refuses to protect black children comes out to protect windows, what is valued over black people in America becomes very clear.

It seems relevant here that the word ""emergency"" derives from the Latin, emergere, to arise or bring to light. In fealty to original meaning, we can see that to talk about a state of emergency is to recognize an incontrovertible bringing to light in Ferguson. The underlying situation — the racism, the police violence and militarization, the fierce response to dissent, the government's treatment of black youth as threats, the government's fear of black anger — is not new. For those of us whose daily existence does not include reminders of these facts, attention on the streets of Ferguson over the passed week has brought them to them to light.

While Nixon's declared state of emergency has, I believe, to do with order and property, a more general state of emergency is worth more attention. Namely, that the worst violence we're seeing in Ferguson is not emergent, but constant. ",59,NA,NA,NA
Vice,vice10,http://motherboard.vice.com/read/reddits-gun-community-take-aim-at-novice-over-militarized-police-in-ferguson-0814,Reddit's Gun Community Takes Aim at 'Novice' Over-Militarized Police in Ferguson,Brian Merchant,08/14/14,05/19/16,"The photo above, which features a camouflaged police officer sitting atop a mine-resistant armored truck in Ferguson, Missouri, with a decked-out rifle, has been widely circulated {as evidence}<hyperlink=“https://firstlook.org/theintercept/2014/08/14/militarization-u-s-police-dragged-light-horrors-ferguson/”> of {how militarized}<hyperlink=“http://news.nationalpost.com/2014/08/14/mine-resistant-armoured-trucks-military-grade-rifles-why-are-police-treating-ferguson-missouri-like-its-a-war-zone/”> the American police force has become. To the trained eye, it's also suggestive of how poorly prepared those police are to be militarized. 

Reddit's gun aficionados are pointing out that the rifle is so loaded with conflicting gadgets—a flashlight, ""red dot"" sight, bipod—that it demonstrates that the officer probably isn't very familiar with using it. One user, who owns two similar weapons, called it a ""novice"" setup. Others called it ""goofy,"" ""HORRIBLE,"" and a ""waste of taxpayer dollars."" It's also part of a trend—many of the rifles being used in Ferguson have the same setup, which baffles the gun owners and enthusiasts over at r/Guns. 

""[I]t's a really goofy and impractical setup. If that is a standard configuration then they are wasting a lot of money for no other reason than to look like characters from Call of Duty,"" {thereddaikon}<hyperlink=“http://www.reddit.com/r/guns/comments/2djqd6/hey_all_im_a_reporter_trying_to_identify_as_many/cjq6iio”> wrote. 

Like countless other Americans, I've watched with awe and horror the events unfolding in the small St. Louis suburb of 21,000 people. I saw mine-proof vehicles, flash bang grenades, rifles, and tear gas being deployed against unarmed protestors, so I set out to write about the range of technology the civilians were up against. 

I'm not a gun expert, however, so {I turned to Reddit's r/guns forum}<hyperlink=“http://www.reddit.com/r/guns/comments/2djqd6/hey_all_im_a_reporter_trying_to_identify_as_many/”>, which has been very helpful in the past, for some background. I asked if they could tell me what kind of gun the officer in the photo was using. The response—on the thread, and in direct messages—was nearly immediate, and certainly unexpected. 

""Probably an AR10 style rifle in 308. It could be chambered in 5.56 NATO,"" user ToxDoc wrote. ""That set up would actually be kind of goofy, if the whole thing weren't so screwed up.""

Another, Prettyniceguytoo, chimed in soon after: ""That's actually hilarious. Reminds me of {this classic picture}<hyperlink=“https://www.tactical-officer.com/files/backward2.jpg”>.”


""He seems to be using high powered optics... for relatively short/medium range,"" Prettyniceguytoo wrote. ""He has a flashlight, a bipod but is using a tripod and has a red dot sight mounted at the front of his gun on a 45 mount on the wrong side of the gun. Also, it's usually best to shoot without wearing a helmet that gets in the way but that's forgivable.""

""All in all, this guy looks like a goof and I'd be amazed if he was even capable of aligning his scope and rifle,"" the user went on. ""Also, the fact he's wearing Marine camouflage (MARPAT) shows just how militarized their police force is."" 

In other words, it's evidence that many police in Ferguson have little idea how to use the weapons tech they've loaded onto their guns. They also referenced other officers carrying similar weapons as evidence that ""it seems it's a standard (HORRIBLE!) setup for them."" Perhaps this is part of the reason that {the FBI had to be called in}<hyperlink=“http://rt.com/usa/180360-police-louis-policing-ferguson/”>.

User IrishCherokee agreed: ""He has no justifiable need for at least half the stuff he has. It would be his prerogative to do this on his own time and dollar... and sure, we would still make fun of him.... but the fact that he is a public servant blatantly wasting tax dollars to mistreat his neighbors that adds to the tragedy of the setting. The word mallninja comes to mind.""

""I want to know how that cop can even see that red dot he has on that 45 [degree] mount,"" FubarFreak wrote.

""The gun is set up with equipment for vastly different roles, thus making it it heavy and unwieldy,"" ToxDoc said. 

""It looks like he can't decide if he will shoot multiple people quickly from 20 yards away in the dark or one person carefully from 500 yards away in the blindingly bright sunlight,"" IrishCherokee wrote.

You're getting the picture. The police officer appears to be in way over his head with a weapon he is, at best, not familiar with or fully prepared to use. It's the same phenomenon at play in the image that Prettyniceguytoo linked to above, which features an NYPD officer peering through a sight on his rifle that's on backwards. 

This, of course, is in keeping with what you'd expect when police departments are {handed down weapons from the Pentagon}<hyperlink=“http://www.usatoday.com/story/opinion/2014/08/13/ferguson-police-michael-brown-militarization-column/14006383/”>, as part of a program that redistributes military arms and tech across the country for domestic use. This is, in part, what makes the militarization of police forces so scary—not just the sheer quantity and advanced nature of the arms, but the fact that the departments aren't trained to use them properly. 

""A lot of new, inexperienced soldiers do that too,"" DBDude wrote, referring to the over-stuffed rifle. ""After a while of lugging around all that weight, the unnecessary stuff gets taken off."" 

Other redditors disagreed that the rig was goofy, and noted that the sight was on the wrong side was probably an optical illusion. Sausagedownatrain wrote that ""The reason it has a goofy set up may well be because he doesn't know what he's doing and he's shoved a few things too many on there or that is his rifle for everything... These things aren't there because he wants to have the best rifle and chance of killing as many ethnic minorities as possible. They're there to make him a better shooter so he can deal with any threats he needs to, whilst being less likely to accidentally hit something he's not meant to - ie a civilian.""

The whole exchange was illuminating, and it served as an opportunity to recognize how we in the media often oversimplify gun enthusiasts' ideas. Nobody on the ever-growing thread was overly eager to defend the PD, and no one was zealously pro-gun for pro-gun's sake. They were, by and large, critical of the way they saw the weapons being deployed. A few mocked me or were skeptical of my intent, which, fair enough—it's Reddit. And of course we should take the diagnoses of anonymous commenters with a grain of salt. 

But it was eye-opening nonetheless, and an important reminder that there likely were squads of police walking around Ferguson with weapons they don't know how to use—and that there will be again, next time demonstrations or protests are met with a militarized response.",NA,NA,NA,NA
Vice,vice11,https://news.vice.com/article/missouri-governor-orders-national-guard-to-ferguson,Missouri Governor Orders National Guard to Ferguson,VICE News,08/18/14,05/31/16,"Missouri Governor Jay Nixon has signed an executive order that will send the National Guard to Ferguson. The move comes following what he called ""coordinated and intensifying violent attacks on lives and property in Ferguson"" in a {statement}<hyperlink=“https://governor.mo.gov/news/archive/following-coordinated-attacks-civilians-and-law-enforcement-governor-nixon-signs”> posted to his official website this morning. 

Full text of statement by Gov. Nixon:

""Tonight, a day of hope, prayers, and peaceful protests was marred by the violent criminal acts of an organized and growing number of individuals, many from outside the community and state, whose actions are putting the residents and businesses of Ferguson at risk. I join the people of Ferguson, and all Missourians, in strongly condemning this criminal activity that included firing upon law enforcement officers, shooting a civilian, throwing Molotov cocktails, looting, and a coordinated attempt to block roads and overrun the Unified Command Center. These violent acts are a disservice to the family of Michael Brown and his memory, and to the people of this community who yearn for justice to be served, and to feel safe in their own homes. Given these deliberate, coordinated and intensifying violent attacks on lives and property in Ferguson, I am directing the highly capable men and women of the Missouri National Guard to assist Colonel Ron Replogle and the Unified Command in restoring peace and order to this community.""

{Executive Order}<hyperlink=“https://governor.mo.gov/sites/default/files/Executive%20Order%2014-09.pdf”> (PDF)",199,NA,NA,NA
Vice,vice12,https://news.vice.com/article/this-is-a-defining-moment-for-missouri-jesse-jackson-discusses-ferguson-with-vice-news,‘This Is a Defining Moment for Missouri’: Jesse Jackson Discusses Ferguson with VICE News,Alice Speri,08/19/14,05/31/16,"As protests in Ferguson, Missouri, over the police shooting of 18-year-old Michael Brown approach their tenth night, many wonder where events will go from here. On Monday, Governor Jay Nixon brought in the National Guard and ended the midnight curfew he imposed on the town over the weekend. The unrest may continue to escalate, but activists hope that protests in Ferguson will produce a greater movement and bring lasting change to the community.

Civil rights leader Rev. Jesse Jackson sat down with VICE News to discuss the deep roots of frustration in Ferguson, the present upheaval, and the lasting change that can come out of it.

VICE News: Why do you think the situation in Ferguson has gotten so out of hand?
Rev. Jesse Jackson: The police have handled this so badly. They have not been transparent. The officer who did the killing has not been interrogated yet. He's still being protected, he's in hiding. It took six days to reveal his name, and even now that we know his name, and on Google you see his picture, {on the video}<hyperlink=“http://www.cnn.com/video/data/2.0/video/us/2014/08/18/newday-intv-ferguson-shooting-crenshaw.cnn.html”> you see his picture, he's not yet been subjected to interrogation. It seems like a kind of cover up, so it creates a gap of alienation and distrust, and that's a big factor in this.

Police held a press conference on Sunday night in which they said that there was no plan to bring in the National Guard, then less than an hour later the governor announced that it would in fact be called in…
See, when the law become lawless and distrustful, they have no moral authority. There is chaos. And now with an extra layer of military, the National Guard, I'm not sure what they can do except maybe create a perimeter. But the National Guard is not trained to handle sensitive people relationships. It's not what they do.

What do you think is going to come out of this?
It's very difficult to say, in the sense that, at one level, we have a community that's on the occupation, about a 70 percent African-American community without anyone on the school board, 53 police, three are African-American, hardly any on the fire department — almost none of them live in Ferguson, for example. They don't have a fair share of the contracts, they're living under a kind of legal looting — their jobs have been looted. If you had a 50 percent black and white police force, 50 percent black and white fire department, in contrast, you'd have a much fairer distribution of resources and a sense of shared territory, a sense of shared responsibility. But right now, police are seen as very hostile, and at some point the cup ran over, and this thing is simply spiraling out of control. My main concern is that Ferguson is just a metaphor for urban America.... The infant mortality rate is high, life expectancy is short, unemployment three or four times the national average, kids dropping out of school — they've lost their sense of hope and vitality. And unless there's a kind of commitment by the White House and the Congress to urban policy, to reconstruction, to revitalize hope, we stand a real chance unfortunately of this being replicated.

Apart from the clashes and violence, what kind of opportunity does Ferguson present for renewed activism? Walking around during the day, I've seen many expressions of political action and commitment.
In the case of Ferguson, if 5,000 blacks register to vote, they can completely change the political construction of the city. They have that power. This community has 21,000 people. So if 5,000 register to vote, they can determine the mayor — who appoints the police and fire chiefs, who issues contracts — the city council… They have the capacity to have a renewed, multiracial, multicultural city. And there are a number of whites who are predisposed in that direction. It's not all hostile and anti-black, that's not true. There is a possibility of building a governing coalition in Ferguson.

Do you see that hope emerging from the anger and frustration gripping Ferguson?
There's a lot of anger, but it must be directed. When the iron is hot, you can really reshape the iron, but you shouldn't pour the heat on yourself. Riots have a way of self-destructing and self-degrading. There are elements that tend to care less about an outcome, they want to simply vent. Most people who are marching are very focused on non-violence and discipline…. They want to see a full autopsy and they want to see it done quickly. They want some changes in the construction of the city's governing makeup — these people are very focused. There's another element that simply could care less about order. They've exhausted their capacity to make sound judgment, and my fear is that if police feel on the tight, they're gonna fight back, and God forbid somebody gets hurt or killed in that process. We can just hope and pray that that does not happen. But with so many guns, and so many explosives, something is bound to happen.

Everyone in Ferguson is telling us that these tensions have been simmering for a long while before Michael Brown's shooting…
People have adjusted to the injustice. One thing worse than oppression is to adjust to it. And some people become maladjusted, in the sense that we share quietness. Quietness is the absence of noise, peace to presence of justice. There are relatively few people calling out for justice and fairness. If you have on a shoe that is too small for your foot, for a while you can make adjustments with your toes, but at some point blisters will set in, and pain, and now you see a lot of blisters, lots of pain, in that community.

And you think it's reached its breaking point?
In Ferguson, this is a defining moment for Missouri. It's a test for the governor's leadership. He has not done very well. It is a test for the police, the occupiers' leadership. They have botched it badly. Since it's so broadly covered by the media, you could have replications across the country. I hope that does not happen. But I do know that the sense of disgust, the sense of disappointment, is very prevalent.

What do you think about President Obama's response so far?
Well, when the journalists were arrested, he did respond at that time. He sent in the FBI, and the Department of Justice is investigating. So far that's about all he really can do at this stage, except to look at the implications of the gap between those who have surplus and those who have deficits, and begin to think through some kind of reconstruction, comprehensive urban policy, to remove these conditions of darkness around the country.",18,NA,NA,NA
Vice,vice13,http://motherboard.vice.com/read/how-twitter-helped-ferguson-learn-to-treat-tear-gas-victims-overnight,How Twitter Helped Ferguson Learn to Treat Tear Gas Victims Overnight,Jason Koebler,08/19/14,09/01/16,"How does an American community, a suburb, really, learn overnight how to deal with injuries sustained from tear gas, rubber bullets, pepper spray, and {a militarized police force}<hyperlink”http://motherboard.vice.com/read/reddits-gun-community-take-aim-at-novice-over-militarized-police-in-ferguson-0814”>? {Using the internet, of course}<hyperlink=“http://motherboard.vice.com/en_ca/read/to-fight-anonymous-opferguson-this-guy-is-harvesting-ip-addresses-for-the-cops”>.

Ten days ago, {the people of Ferguson, Missouri}<hyperlink=“https://news.vice.com/article/raw-coverage-ferguson-missouri”>, had no idea how to help someone who's having a panic attack because they've been pepper sprayed, how to flush a tear gas victim's eyes with a mixture of equal parts Maalox and water, or how to get the lingering effects of tear gas off their clothes. 

Now, they're old pros, in part thanks to a network of volunteers and organizations from as far away as Australia and Palestine who have dealt with police brutality and abuse in the past.

""I don't think any community, at least in the US, is equipped to deal with getting tear gassed by the people who are supposed to be helping them,"" Kalaya'an Mendoza, an activist with Amnesty International who has been in {Ferguson for much of the last week}<hyperlink=“http://motherboard.vice.com/read/when-will-someone-fly-a-drone-over-ferguson”>, told me. ""Palestinians have been emailing and sending tips for dealing with tear gas that they use in their own struggle. When people post on Twitter that they've been tear gassed, people are speaking up and saying 'do this, not that.' It's fascinating to see how fast Twitter has figured out how to help.""

[tweetbegin 501584131235799040 tweetend]

Last night, Mendoza helped a journalist who was having trouble breathing after he'd been tear gassed. In Ferguson, there isn't really a street medicine brigade, with duct-taped red crosses on their shirts, as there were during the civil rights protests of the 1960s and the Occupy protests of a couple years ago. 

Instead, the general population has really taken it upon themselves to learn how to treat each others' medical maladies, with the help of Twitter (and people who have learned what to do thanks to Twitter). Mendoza says that if he hadn't been around to help the journalist, someone else likely would have been able to help him eventually.

""Being a street medic has become normalized within the scope of being an activist,"" he said.
 
That's in part, he says, a testament to the way Ferguson residents have banded together in the last week or so (and an unfortunate consequence of having this protest, and the police response to it, spill over into a second week) but it's also thanks to organizations such as the {Melbourne Street Medic Collective}<hyperlink=“http://melbsmc.org/”>, which has been organizing people on the ground from the other side of the world.

The collective, which earned its stripes during the height of Occupy, has been instrumental in developing health material that can be printed out and handed out to residents of the city.

""Over the last few years, we've seen a lot of shit, talked a lot of shit, and learned a lot of shit,"" a medic with the collective, who goes by the pseudonym John Zoidberg, told me in an email. ""We're no stranded to international solidarity and support … even if we can't have a presence on the ground, we can share guides on basic first air techniques.""

The Melbourne collective has been tweeting information about how to deal with panic attacks, directing people on the ground to injured people, and are generally helping in any way it can.

""We mightn't be able to do much but if we can take some of the pressure off the medics on the ground so they can focus on the critical tasks then I'd like to think we've done something positive,"" Zoidberg added.

Social media and ever-present cell phone cameras has allowed the whole world to watch what's happening in Ferguson—but it's also allowed the whole world to offer its support right back.",NA,NA,NA,NA
