Source,ArticleID,ArticleLink,Title,Author,DatePublished,DateRetrieved,ArticleText,NumberComments,NumberSocialMedia,TheShitBetween,Notes
Independent,indep12,http://www.independent.co.uk/news/world/americas/michael-brown-shooting-missouri-governor-thunderstruck-by-images-of-riot-police-in-ferguson-9674773.html,Michael Brown shooting: Missouri governor ‘thunderstruck’ by images of riot police in Ferguson,Tim Walker,08/17/2014,03/23/2016,"The Governor of Missouri has criticised police in the town of Ferguson for their “over-militarised” response to protests following the death last week of Michael Brown, an unarmed black teenager fatally shot by a white officer.

Jay Nixon, a Democrat, told ABC News he was “thunderstruck” by the images emerging from the St Louis suburb. “The over-militarisation… The guns pointed at kids in the street. All of that I think instead of ratcheting down, brought emotion up,” he said.

His comments came on Sunday morning as a man was in critical condition at a Ferguson hospital, having being shot overnight when protests over Mr Brown’s killing again descended into violence. Officers used smoke bombs, tear gas and wooden rounds to clear the streets on Saturday night, after Mr Nixon had declared a state of emergency in the hope of ending the unrest.

Police said a crowd of about 150 people defied a curfew imposed in the city between midnight and 5am, despite the pleas of some community activists who urged them to go home. Most were soon put off by heavy rain, and there was no repeat of the looting on Friday night, but seven people were arrested for failure to disperse. The unnamed shooting victim, who was not shot by police, was taken to hospital by bystanders.

Highway Patrol Captain Ron Johnson, the black officer who has become the public face of the law enforcement response, said police moved in only after reports of a break-in at a local restaurant. “I was disappointed in the actions of tonight,” Capt Johnson told reporters yesterday. “We have a shooting victim in critical condition… We had a subject standing in the middle of the road with a handgun. We had a police car shot at.” He added: “I think that was a proper response tonight, to maintain officer safety and public safety.”

Mr Brown was shot dead on 9 August by an officer later named as Darren Wilson. The details of the incident are disputed: police said Mr Brown reached for the officer’s gun during an altercation inside a police car; witnesses insisted Mr Brown had his hands up when he was shot. The killing stoked anger in a community that is about two-thirds black, but patrolled by an overwhelmingly white police force. Public disquiet escalated when largely peaceful protests were met by officers in riot gear firing tear gas and rubber bullets.

Following four nights of clashes, the mood had cooled on Thursday as Mr Nixon turned over responsibility for security in the city from the local police to the State Highway Patrol, led by Capt Johnson, a former Ferguson resident.

But tensions flared again on Friday when local police issued a statement saying Mr Brown had been a suspect in a “strong-arm” robbery at a local convenience store. The authorities also released CCTV footage of the robbery, leading to accusations that they were trying to smear the victim. Mr Nixon criticised the release of the video, saying it “appeared to cast aspersions on a young man that was gunned down in the street.”

Ferguson police chief Tom Jackson later admitted at a news conference that Mr Wilson was not aware that Mr Brown was a suspect at the time of the shooting, and had in fact approached the teenager because “he was walking down the middle of the street blocking traffic”. The officer’s identity had been withheld for almost a week after the shooting despite widespread calls for transparency.

As he announced the curfew at a news conference on Saturday, Mr Nixon said: “The eyes of the world are watching. This is a test of whether a community, this community, any community, can break the cycle of fear, distrust and violence and replace them with peace, strength and ultimately justice… We cannot allow the ill will of the few to undermine the good will of the many.”

President Barack Obama has asked the Justice Department and the FBI to investigate Mr Brown’s death. Forty FBI agents reportedly went door-to-door at the weekend to collect information on the shooting.",NA,36,NA,NA
Independent,indep13,http://www.independent.co.uk/news/people/nelly-joins-ferguson-protests-rapper-appeals-for-crowd-calm-with-rousing-megaphone-speech-outside-a-9678391.html,Ferguson protests: Rapper Nelly appeals for crowd calm with rousing megaphone speech,NA,08/19/2014,03/23/2016,"The town of {Ferguson}<hyperlink=”http://www.independent.co.uk/news/world/americas/michael-brown-shooting-ferguson-police-come-under-heavy-gunfire-as-violence-flares-on-streets-again-9677683.html”> has been the scene of riots, baying crowds and clouds of tear gas for days, as police in Missouri struggle to restore calm.

They are angry because of the shooting dead of an unarmed black teenager, Michael Brown, by a law enforcement officer on 9 August.

There is an ongoing official FBI investigation into the killing, which many of the demonstrators believe to be completely unprovoked and a sign of existing racial inequality in the criminal justice system.

They are demonstrating for the officer that killed him, Darren Wilson, to be arrested and tried for murder.

President Obama has called for calm, insisting that he understands the ""passions and anger"" that have possessed the neighbourhood in recent days.

But his plea fell on deaf ears, and police – supported by the National Guard – arrested a further 31 people last night (18 August) as the protests once more erupted in violence.

So rapper Nelly, a St Louis native, thought he’d have a go at restoring order to the conflicted area. Armed with a #MichaelBrown T-shirt and a megaphone, he took to the streets to appeal to local residents and convince them that violence isn’t the way to approach the tragedy.

""We've got to understand that we have options and stop choosing the reaction option cause at the end of the day we gonna pay - our brothers are gonna be the ones in jail,"" he said.

.{@Nelly_Mo}<hyperlink=”https://twitter.com/Nelly_Mo”> marching with the community in {#Ferguson}<hyperlink=”https://twitter.com/hashtag/Ferguson?src=hash”> with his family {pic.twitter.com/ZEAxC1urYn}<hyperlink=”https://twitter.com/MarvinBing/status/501543814650425344/photo/1”

Marvin Bing (@MarvinBing) {August 19, 2014}<hyperlink=”https://twitter.com/MarvinBing/statuses/501543814650425344”>

The hip-hop star had come under heavy fire on social media over the past week, as critics accused him of being out of touch with the black American community and the situation in Ferguson by calling for calm.

Speaking to TMZ on Saturday, he said: ""I understand the frustration, but we have to strategize[sic] before we overreact.

""We don't get no do-over on s**t like this, so we have to do it right the first time.

""Ain't nothing happen no different that hasn't been happening... At the end of the day, we should have waited to strategize first and take all the right steps to organize.""

Other famous names who have spoken about the protest publicly include singer/songwriter {John Legend}<hyperlink=”http://www.independent.co.uk/news/people/john-legend-on-israel-gaza-so-sick-watching-our-secretary-of-state-grovel-to-tell-israel-how-much-he-9636858.html”> and actress Shonda Williams, who passed comment on reports that members of the {press were being moved on from areas of protest and threatened}<hyperlink=”http://www.independent.co.uk/news/world/americas/michael-brown-shooting-police-threatened-to-shoot-and-mace-reporters-in-ferguson-9676536.html”>.

Mad Men actor Jon Hamm, who lived in neighbouring Normandy and regularly used to visit Ferguson to see his friends, said:  “It's rough; it's a bad situation all of the way around.

""When all of the facts come out, and all of the light is shone on all sides of it, hopefully justice will be carried out. But it's hard. It's really hard. St. Louis had a rough couple of decades now. It would be nice to turn it around a little bit.''",0,0,The hip-hop star attempted where Obama had failed as he called for an end to unrest after the shooting of unarmed black teenager Michael Brown,NA
Independent,indep14,http://www.independent.co.uk/news/world/americas/michael-brown-shooting-amnesty-international-sends-team-within-us-for-first-time-as-national-guard-9675149.html,Michael Brown shooting: Amnesty International sends team within US for first time as National Guard deployed,Natasha Culzac,08/18/2014,03/23/2016,"As anger erupted again on the streets of Ferguson, Missouri, a human rights team from Amnesty International worked on the ground in the US for the first time ever.

Confrontation flared up after an autopsy found that Michael Brown, an unarmed teenager who was fatally shot by an officer on 9 August, had suffered at six bullet wounds including one in the top of his head.

Eye-witnesses report seeing police, with no visible ID badges, hurling tear gas and rubber bullets at protesters and threatening members of the press in another night of demonstrations.

Amnesty International, said it would be observing police and protester activity and gathering testimonies as well as training local activists “on methods of non-violent protest” in an “unprecedented” move by the campaigners.

Amnesty International USA's Executive Director, Steven W Hawkins said that the “people of Ferguson have the right to protest peacefully the lack of accountability for Michael Brown’s shooting”.

Jasmine Heiss, one of the 13-strong team sent by Amnesty, told Buzzfeed that the limits placed on the organisation’s access to post-curfew areas was indicative of “the overall lack of transparency in this investigation”.

[tweetbegin 500838813833637889 tweetend]

“Law enforcement, from the FBI to state and local police, are obligated to respect and uphold the human rights of our communities,” Mr Hawkins said in a statement on 14 August.

“The US cannot continue to allow those obligated and duty-bound to protect to become those who their community fears most,"" said Amnesty International USA's executive director, Steven W. Hawkins.”

The fresh dissidence has led to Jay Nixon, the Governor of the state of Missouri, ordering the deployment of National Guard troops to “protect life and property”, he said in a statement this morning.

The military will, he says, will “maintain peace and order” by closing streets and thoroughfares, if it must, after the events that have unfolded have “continued to create conditions of distress and hazard to the safety, welfare and property of the citizens of the community beyond the capacities of local jurisdiction”.

Relations between protesters and police quickly deteriorated yesterday as a second night under curfew began, following the State of Emergency that was declared on Saturday.

Officers say they were responding to gunfire, looting, vandalism and the hurling of Molotov cocktails at them, with at least two people wounded.

""Based on the conditions, I had no alternative but to elevate the level of response,"" said Captain Ron Johnson, from the Missouri Highway Patrol.

A number of journalists present at the clash in the early hours of this morning reported being threatened with tear gas if they didn’t move, as they were shepherded away from the media enclosure.
 
[tweetbegin 501207921381109763 tweetend]
[tweetbegin 501191923114459136 tweetend]
[tweetbegin 501236438994649090 tweetend]

Complex Magazine said that police had opened fire into the crowds without warning three hours before the midnight curfew began, causing some children and members of the media to be hit with tear gas and rubber bullets.
Two black journalists from Complex also said that they had been racially profiled, being refused re-entry into the press area whereas white members of the press had been.
 
 [tweetbegin 501195416206336000 tweetend]

While tensions ran high in Missouri, another demonstration in Los Angeles, 1,800 miles away, saw 500 people congregate outside police headquarters to protest the fatal shooting of another unarmed black man, who was killed 11 August.
Ezell Ford, 25, died in hospital after being shot by an LAPD officer – Ford’s family say he had been cooperating with police and was lying on the ground when hit, however police say that Ford was trying to grab one of their guns, according to Reuters.",0,0,The South Carolina faction of the KKK said officer Darren Wilson is a 'hero' ,NA
Independent,indep15,http://www.independent.co.uk/news/world/americas/ferguson-missouri-riots-state-governor-declares-state-of-emergency-after-fresh-violence-over-the-9673786.html,Michael Brown shooting: Ferguson 'state of emergency' declared after protests descend into violence,Tim Walker,08/16/2014,03/23/2016,"The Governor of Missouri has declared a state of emergency in the St Louis suburb of Ferguson, after protests over the police shooting of an unarmed black teenager descended into violence once more.

Governor Jay Nixon ordered a curfew to run from midnight to 5am beginning Saturday. “This is a test,” he told reporters, acknowledging that “the eyes of the world” were trained on Ferguson following the death of 18-year-old Michael Brown on 9 August. “We cannot allow the ill will of the few to undermine the good will of the many,” Nixon said.

UPDATE: {Ferguson man 'in critical condition' after shooting during curfew}<hyperlink=”http://www.independent.co.uk/news/world/americas/michael-brown-shooting-ferguson-man-in-critical-condition-after-shooting-during-curfew-9674004.html?origin=internalSearch”>

Tensions had eased on Thursday when Nixon turned over responsibility for security on the streets of the city from the local police to the state Highway Patrol, after four straight nights of clashes between largely peaceful demonstrators and officers in riot gear firing tear gas and rubber bullets. But on Friday public anger flared again when police issued a statement saying Brown had been a suspect in a “strong-arm” robbery at a local convenience store at the time of his death.

Ferguson police chief Tom Jackson later admitted at a news conference that the white officer who shot and killed Brown, whom he named as Darren Wilson, was not aware the teenager was a suspect, and had in fact approached Brown because “he was walking down the middle of the street blocking traffic.” Wilson's identity had been withheld for almost a week after the shooting despite widespread calls for transparency, which led to the unrest.

As President Barack Obama asked the US Justice Department and FBI to investigate Brown's death independently, the teenager's family appealed for calm in the community, which is approximately two-thirds black, but patrolled by an overwhelmingly white local police force. The protests remained peaceful until around midnight on Friday, when a crowd reportedly broke into the shop that Brown allegedly robbed on the day he was killed.

Community activists tried in vain to stop the looting as several other local shops were targeted, car windows broken and a bus stop smashed. Captain Ron Johnson, the commander of the Missouri State Highway Patrol, said rocks and other objects had been hurled at police, who once again wore riot gear and responded by firing tear gas into the crowd. No arrests were made.",0,0,Missouri Governor Jay Nixon sends reserve military force to help quell violence in Ferguson after fresh clashes erupted last night,NA
Independent,indep16,http://www.independent.co.uk/news/world/americas/ferguson-protests-90-year-old-holocaust-survivor-hedy-epstein-arrested-by-police-during-st-louis-9677729.html,Ferguson protests: 90-year-old Holocaust survivor Hedy Epstein ‘arrested’ by police during St Louis demonstrations,Heather Saul,08/19/2014,03/23/2016,"Hedy Epstein, a 90-year-old survivor of the Holocaust, was reportedly among those arrested during protests in downtown St Louis as tensions flared over the death of black teenager Michael Brown in Ferguson.

Eight protesters were arrested for “failure to disperse” on Monday after marching from the Kiener Plaza to the Wainwright building where Governor Jay Nixon has an office, St Louis police confirmed on Twitter. 

Ms Epstein was pictured being led away in handcuffs during demonstrations against the National Guard’s presence on the streets where clashes between protesters and authorities have been the most severe.

Update: {Hedy Epstein speaks after her arrest}<hyperlink=”http://www.independent.co.uk/news/world/americas/hedy-epstein-90-year-old-holocaust-survivor-speaks-after-her-arrest-ferguson-police-are-deliberately-9679232.html”>

Ms Epstein, a resident of St Louis, is a political activist and speaker widely known for her vocal support of the Free Gaza Movement.

""I've been doing this since I was a teenager. I didn't think I would have to do it when I was ninety,"" Ms {Epstein told The Nation}<hyperlink=”http://www.thenation.com/article/st-louis-police-arrest-nine-protesters-demanding-justice-michael-brown/”> as she was led away by police. ""We need to stand up today so that people won't have to do this when they're 90.""
[tweetbegin 501528201508950017 tweetend]

Jeff Ordower, an organiser with Missourians Organizing for Reform and Empowerment, told The Nation all but one have been released. This has not yet been officially confirmed by police.

Tensions rose again this week after an independent pathologist hired by the Brown family determined the teenager had been shot six times, including twice to the head. The family’s lawyer, Daryl Parks, suggested that he {was killed at the moment he was already in a position of surrendering}<hyperlink=”http://www.independent.co.uk/news/world/americas/michael-brown-shooting-family-lawyer-suggests-18yearold-was-surrendering-9677380.html?origin=internalSearch”> before the police officer.

Overnight, Getty photographer {Scott Olson was one of the latest journalists to be arrested}<hyperlink=”http://www.independent.co.uk/news/world/americas/michael-brown-shooting-getty-photographer-among-arrested-journalists-9677584.html”> during the protester-police standoff in Ferguson.

On Monday, Missouri Governor Jay Nixon announced the National Guard had been deployed to “maintain peace and order” on the streets, just days after the State of Emergency that was declared on Saturday.

Governor Nixon said the National Guard troops would be under the direction of the Missouri State Highway Patrol, which is overseeing security during protests.

President Barack Obama has told the governor the use of the National Guard should be limited and urged healing, instead of violence. Attorney General Eric Holder will travel to Ferguson on Wednesday, Mr Obama said.

Darren Wilson, 28, the officer who shot Brown as the teenager was walking through a Ferguson residential neighbourhood with a friend, has been placed on administrative leave. A grand jury will decide whether Wilson will be indicted this week.

Mr Brown's death has heightened racial tensions between the predominantly black community and the mostly white Ferguson Police Department.

Civil rights activists have compared the shooting to other racially charged cases, especially the 2012 death of Trayvon Martin, the unarmed black teenager shot by Florida neighbourhood watch organiser who was later acquitted of murder.",0,0,Eight protesters were arrested during demonstrations against National Guard,NA
Independent,indep17,http://www.independent.co.uk/news/world/americas/michael-brown-shooting-us-cannot-lecture-others-on-human-rights-amnesty-says-9677800.html,"Michael Brown shooting: US cannot lecture others on human rights, Amnesty says, as Egypt appeals for 'restraint'",Natasha Culzac,08/19/2014,03/23/2016,"The United States must sort out its own human rights abuses before lecturing others, Amnesty International has said, referring to the crackdown on the Ferguson demonstrations - sentiments astonishingly shared by Iran, Egypt and China.

The campaigners have criticised the over-militarised response to protests that erupted after unarmed black teenager Michael Brown was shot dead by police on 9 August.

Fierce clashes between residents and officers resulted in the deployment of the National Guard yesterday, while this past week has seen tear gas and flash grenades hurled by police as well as the arrest of a number of journalists.

In a tweet this morning, Amnesty International said: “US can't tell other countries to improve their records on policing and peaceful assembly if it won't clean up its own human rights record.”
 
Their comments come as Egypt's Foreign Ministry appeals for restraint and asks the US to ""respect the right of assembly and peaceful expression of opinion"".

According to Daily News Egypt, an Egyptian spokesman supported comments made UN Secretary General Ban Ki Moon yesterday, which called for the US authorities to deal with the situation as per ""international and American standards"".

UN spokesman Stephane Dujarric told reporters that Mr Ban ""calls on all to exercise restraint, for law enforcement officials to abide by US and international standards in dealing with demonstrators"".

{China's state-run news agency Xinhua also published a scathing commentary}<hyperlink=”http://news.xinhuanet.com/english/indepth/2014-08/18/c_133564928.htm”> yesterday, observing that while there is a mixed-raced President in power and though it has been 50 years since Martin Luther King's rousing speech, racial discrimination is still ubiquitous.

It said that the racial divide ""remains a deeply-rooted chronic disease that keeps tearing US society apart"", before the piece then censured the US for hacking into the telephones of ordinary citizens as shown by whistleblower Edward Snowden.

The article reads: ""The Ferguson incident once again demonstrates that even if in a country that has for years tried to play the role of an international human rights judge and defender, there is still much room for improvement at home.

""In its annual human rights report issued in February, the United States assaulted almost 200 countries across the world for their so-called poor human rights records.""

Amnesty International has also called for an investigation into the police tactics used during the unrest, as fresh violence continues to threaten the calm as developments occur.

“Our delegation travelled to Missouri to let the authorities in Ferguson know that the world is watching,” {said Steven W Hawkins, Executive Director}<hyperlink=”http://www.amnestyusa.org/news/press-releases/amnesty-international-usa-calls-for-investigation-of-police-tactics-in-ferguson”> of Amnesty International USA.

[tweetbegin 501600372847575040 tweetend]

“We want a thorough investigation into Michael Brown's death and the series of events that followed.”

Amnesty’s criticism is echoed by Iran’s Supreme Leader Ayatollah Ali Khamenei, strangely, who also laid into the US for “committing crimes against its own people”.

He has issued a series of tweets over the last week highlighting how “racial discrimination’s still a dilemma in US”, as well as denouncing the country’s support of the Israeli government despite the deaths happening in Palestine, and the “illegal prisons & massacred #prisoners” in Afghanistan under President George W Bush.

He tweeted: “Based on global statistics, US govt is the biggest violator of #HumanRights. Besides int’l crimes, it commits crimes against its ppl #Ferguson”.

[tweetbegin 501079491972964353 tweetend]

According to Human Rights Watch, Iranian authorities continue to subject political prisoners to abuse, while women still face “discrimination in many areas including personal status matters”.

“Authorities restricted political participation and employment of minority groups, who account for about 10 per cent of the population,” Human Rights Watch said of Iran, while the organisation has also called for US police to “stop intimidating Missouri protesters”.

An independent post-mortem yesterday found that Brown had been shot six times by the officer, including twice in the head.

Witnesses say his hands were above his head when he was shot, while the teenager’s mother, Lesley McSpadden, has called for criminal proceedings to be brought against policeman Darren Wilson.

A grand jury is expected to discuss whether charged will brought when it normally meets on Wednesday.",0,3000,"Criticism of police tactics and intimidation against Ferguson protesters have led to an outcry, including from Iran's Supreme Leader, Egypt and China",NA
