Source,ArticleID,ArticleLink,Title,Author,DatePublished,DateRetrieved,ArticleText,NumberComments,NumberSocialMedia,TheShitBetween,Notes
Independent,indep1,http://www.independent.co.uk/news/world/americas/this-is-why-people-are-angry-in-ferguson-missouri-after-michael-brown-shooting-9669203.html,"This is why people are angry in Ferguson, Missouri after Michael Brown shooting",Adam Withnall,08/14/2014,03/18/2016,"Angry protesters have gathered every night since the death of 18-year-old {Michael Brown}<hyperlink=”http://www.independent.co.uk/news/world/americas/michael-brown-shooting-angry-parents-demand-justice-for-teenage-son-gunned-down-by-police-9667382.html”> on Saturday, with increasingly shocking images emerging that make a small suburb of St Louis, Missouri look more like Gaza or Cairo’s Tahrir Square.

A hard-working young man, Mr Brown graduated from Normandy High School on 1 August, some months after he posed with around 100 or so others in his senior class.

Described as a “gentle giant” with a “football tackle build”, he was in an alternative learning programme at school and was far from the first in his class to get his diploma.

In glowing tributes, his teachers said he’d “accomplished it” in the end, and was due to start at a local technical college on Monday, 11 August.

But two days before that he was killed, shot in an incident involving a police officer that has sparked {widespread fury in what is rapidly descending towards a national crisis}<hyperlink=”http://www.independent.co.uk/news/world/americas/ferguson-missouri-riots-police-use-rubber-bullets-and-tear-gas-as-new-witness-says-michael-brown-9668278.html”>.

The anger in Missouri comes first and foremost from the fact that they have lost a member of the community, killed by those whose pledge it is “to protect and serve”.

The incident set off an immediate, spontaneous demonstration, and was initially called in to dispatchers at St Louis as a case requiring “crowd control”.

Though they have repeatedly called for only peaceful demonstrations, the Brown family have led protesters in their rage at what has happened.

Immediately after the incident, Desiree Harris said she was expecting Mr Brown, her grandson, to visit her that afternoon and discovered him dead after she heard a commotion outside her apartment complex.

“When I got up there, my grandson was lying on the pavement. I asked the police what happened. They didn't tell me nothing,” she said.

The teenager's mother, Lesley McSpadden, told an acquaintance the shooting was “wrong and it was cold-hearted,” the St Louis Post-Dispatch reported.

And according to the newspaper, Mr Brown's stepfather, Louis Head, held a sign that read: “Ferguson police just executed my unarmed son!!!”

Two witnesses to the incident say that the teenager was shot while he had his hands in the air in submission. The first, Dorian Johnson, was walking with his friend Mr Brown when there was a row with a police officer in a car.

Johnson has said in media interviews that the officer wanted the pair to move over onto the pavement, a request they refused. He says his friend was not struggling with the officer and had his hands in the air when he was shot multiple times in the head and chest.

Tiffany Mitchell, another witness, told CNN she saw Mr Brown “tussling through the window” of the police car with the officer. She said a shot was fired through the window, and then Mr Brown backed away with his hands in the air.
“The cop continued to fire until he just dropped down to the ground and his face just smacks the concrete,” she said.

Many are angry now at what they see as a lack of police transparency over the shooting. Their account of what happened remains vague, describing simply a struggle over a gun in a police car.

They have also refused to reveal the name of the officer involved, saying that he will become a “target” following threats received online – particularly after a number of hacking attempts from the group Anonymous. The officer was placed on administrative leave following the incident.

Perhaps what has angered people most since the shooting itself is the perceived disproportionate nature of the police response.

Images widely shared online show officers equipped with military-style fatigues, automatic rifles and using reinforced vehicles.

Since yesterday they have also deployed tear gas, smoke grenades and rubber bullets – but County Police Chief Jon Belmar insists his officers have acted with “an incredible amount of restraint” as they've been the targets of rocks, bottles and gunshots. He said two dozen patrol vehicles had been destroyed.

This has not been just a show of strength from the police, either. Around 10 people were arrested on Wednesday evening, including the highly-respected St Louis alderman Antonio French, who had been tweeting from the protests.

That same night two reporters, Wesley Lowery of the Washington Post and Ryan J Reilly of Huffington Post, were arrested when police shut down a McDonald’s restaurant from which they had been reporting.

In total, around 40 protesters have been arrested so far since Saturday.
“I've had enough of being pushed around because of the color of my skin. I'm sick of this police brutality,” said one protester, who gave only his first name, Terrell, 18. “I'm going to keep coming back here night after night until we get justice.”

The incident has highlighted the ongoing and serious issue of civil rights in the town, as well as across the rest of the US, and Ferguson Police Chief Thomas Jackson called improving race relations “the top priority right now”.

[tweetbegin 499714499688300545 tweetend]

The numbers are again getting people angry. Around 70 per cent of the town’s 21,000-strong population are black. But on the police force of 53, just three officers are black.

Mr Jackson said the protests involved “an undertow [of racial unrest] that has bubbled to the surface”.

Some civil rights leaders have drawn comparisons between Mr Brown's death and that of 17-year-old Trayvon Martin, who was shot dead by a Florida neighbourhood watch volunteer who was later acquitted of murder charges.

Meanwhile, police in California were investigating a separate incident of an officer fatally shooting an unarmed 25-year-old black man in Los Angeles.

With the scale of the protests having increased each night and Barack Obama now briefed on the Ferguson situation by the Attorney General Eric Holder, the fury is not expected to have abated before tonight.

There is also anger that the US President remains on holiday on the Massachusetts island of Martha’s Vineyard. Some feel his presence is what is needed to prevent the crisis deteriorating any further.",0,338,Police say 'an undertow [of racial unrest] has bubbled to the surface' - but they themselves are accused of behaving like a paramilitary force,Articles have a short abstract that could potentially be deemed subtitles
Independent,indep2,http://www.independent.co.uk/news/world/americas/ferguson-in-the-heartlands-of-america-a-descent-into-madness-9679479.html,"Ferguson: In the heartlands of America, a descent into madness",David Usborne,08/19/2014,03/19/2016,"“Relax, Relax!” The tall black gentleman in the lime green shirt pleads through a megaphone, though the raw urgency in his demeanour and voice tells you that even he is struggling to heed his own admonition. He knows more bad stuff could be seconds away. “Tonight it’s not going down, it’s not going down tonight.”

The leader of a group called Black Lawyers for Justice, Malik Shabazz isn’t alone in joining the throng once again protesting against the shooting of a black man here 10 days ago, urging the restless, nervy crowd to stay within the bounds of lawful protest, not to provoke the police into yet another night of conflagration. Local community leaders are trying the same as well as a contingent of pastors.

“I am whispering in their ears, telling them to move on, that we care and that we love them,” says the Rev Michael McBride of the Way Christian Centre in Oakland, California. He has come because he is horrified. “If only police departments across the country would do the same. Whisper in their ears, tell them they love them.”

Love, however, has for the time being taken its leave from Ferguson, a suburb on the north-western edge of St Louis. It flew away at about four minutes past noon on 9 August when a police officer, identified as Darren Wilson, 28, fired six bullets into the unarmed man, 18-year-old Michael Brown, and robbed him of his young life. It was gone when the police let his body lie on the street for hours before finally taking it away. Or perhaps it was gone long before that in a town where to be black is to feel disenfranchised, relegated to life’s lower divisions, oppressed.

Unrest in Ferguson over Michael Brown shooting
 
Love seems a quaint sort of sentiment. We see what’s happening here at the junction of Ferguson and West Florissant Avenues. A rag-tag line of police – some with gas masks, some without, all with riot shields – has blocked us off to the south and, some distance away to the north a second line is forming. We, protesters and journalists, have become penned in. A sonic cannon is beginning to pierce our ear drums. It gives out a percussive, high-pitch shrieking.

Video: Unrest continues in Ferguson
And we see also the hulking black vehicle – Captain Ron Johnson, the State Trooper assigned by Governor Jay Nixon at the end of last week to take charge, is later to call it a “Swat truck” – with its front turret. The turret has a man inside who pops out occasionally gripping a machine gun. He sweeps its muzzle left to right. For a second its barrel is pointed at me, just as the searchlight from the helicopter above every now then catches me in its gaze.

And love is not what they are asking for now. It’s justice. “We want justice, we want justice,” the protesters bellow. It’s what Mr Shabazz’s group is after. It’s what the rather young and occasionally terrified-looking band of observers from Amnesty International is here to protect. America thinks it can take justice for granted. But in Ferguson, that is being tested. Justice is looking slovenly, amateurish and slow. And it’s looking ugly.
Justice is the holy grail in Ferguson. President Barack Obama says he wants it. So does the Attorney General, Eric Holder, who will be here today and who has opened his own federal investigation into what happened on that Saturday to Mr Brown. The circumstances of it are still unclear. Justice is what his mother, Lesley McSpadden, says must happen before the trouble will stop. But the road to it is long and has many forks.

Ms McSpadden and most of the demonstrators wanted it yesterday. That they don’t see it is what enrages them. But in America justice is a deliberate and bureaucratic affair. Evidence surrounding the shooting that has been collected so far, most of which we haven’t seen, will be presented for the first time by the St Louis prosecutor, Robert McCulloch, to a special grand jury beginning today. But that process may take weeks to complete. American justice is a thing of cogs and they turn slowly, far too slowly for the family and its supporters.

Justice means allowing everyone out here on this sultry night to voice their anger, as the US Constitution requires. And it means listening. Captain Johnson tries hard to do that. Before this night’s mayhem breaks out – and how it does – he walks among the angry crowds, he tries to debate with everyone. Like Charles Reid, a 59-year-old computer technician, who has been here every night since last Wednesday with his “honey”, Renee. He holds a sign that says it precisely. “JUSTICE, LOVE, PEACE”. Why not get people like him to help the police, he asks, keep the order, clear the streets of fallen projectiles, move people onto the pavement?

And he tries to reason with the young man, who beats his own chest hard enough to break a rib, demanding that he be heard. “The kids are hurting, the kids are dying. We need your help, we need your help,” he rages, his face in the captain’s, sweat running down his neck. His scrawled sign says “2 Timothy. 1:7. Don’t Kill!” “If you want to hear my response, you have to listen too,” the captain attempts. The man doesn’t listen, though; he is almost crazed.

Justice on this night also means something else, says the captain. It means letting people like this man speak, but not letting those who break the laws of the land – breaking windows, looting and firing weapons – get away with it. It is getting those people who pollute peaceful protest out of the way. And it means giving the police their Swat trucks, smoke bombs, stun grenades and the gas. Or so insists the captain. Otherwise mayhem takes hold.

“The violent voices here are the ones who are here to get something,” he tries to explain, surrounded on the street in a scrum of reporters and angry residents. “You break into a meat store and the meat isn’t going to last. But the people who are here for change, that will last a lifetime. We have to take those elements out and let them know they are not going to win. I am not going to let those bent on ruining this community to succeed.”

But what does justice in America look like exactly when so suddenly a town like this can resemble less a suburb in the heartland than a battlefield in Gaza, a terrorist stronghold in Iraq or a Taliban redoubt in Afghanistan? For right here, in a just a moment, everything goes mad.

It happens at the other police line, to the north, where I and a small group of reporters wandered to. It’s where a far more determined knot of men have gathered. No pastors are here. A man tears a street sign out of the road and brandishes it before the police line, another Swat truck in place. Over a loudspeaker a disembodied voice appeals for them to disperse, “or you will be arrested”. Then another instruction: members of the media must separate themselves from the protesters “immediately”. I retreat into the bay of a scruffy car wash, watching, wondering if my not having a gas mask is something I might soon regret.

As I do. I am still not exactly clear how it started. But loud cracks ring out from a side street – the street where Michael Brown was felled. Then I see the rockets fly into the air, like fireworks. White smoke begins to billow and a colleague mentions smoke bombs. But it’s not that, it’s tear gas. We all run. Those unprotected clasp our hands to our faces. But nothing stops the grip of the gas on your eyes and then your lungs.

On Monday it did go down, startling and appalling all of America all over again. And maybe it will go down again tonight and for many more nights to come. Justice has revealed itself above all to be two things: a thing of violence and great noise and a thing of clay, unable to satisfy the demands for speed. It requires patience and it requires trust. Neither is in evidence on West Florissant Avenue right now, like love.",0,212,"David Usborne arrived in Ferguson, Missouri to be greeted by a scene more redolent of Gaza and Afghanistan. This is a country where those fighting for justice have given up on the law as a means of redress",Articles have a short abstract that could potentially be deemed subtitles
Independent,indep3,http://www.independent.co.uk/news/world/americas/michael-brown-shooting-ferguson-police-come-under-heavy-gunfire-as-violence-flares-on-streets-again-9677683.html,Michael Brown shooting: Ferguson police 'come under heavy gunfire' as violence flares on streets again,David Usborne,08/19/2014,03/20/2016,"A night that seemed set at first to be more peaceful than those that had come before it suddenly flared up once again into anger, chaos and confrontation on the streets of Ferguson, Missouri, as police fired tear gas and stun grenades into the air sending protesters fleeing for cover and gasping for breath.

Now in its second week, the protests triggered by the shooting of an unarmed black teenager by a police officer, Darren Wilson, show no sign of abating even after attempts by officials to use multiple tactics to stop the violence. 

While Governor Jay Nixon had ordered in the National Guard on Monday he had also lifted a nighttime curfew in hopes of easing tensions.

Captain Ron Johnson, the State Trooper appointed by Governor Nixon to restore order to the community, spent the first part of the evening walking along the stretch of West Florissant Avenue, the strip that has been the main flashpoint of the nightly eruptions, talking with protesters about his hopes that the worst might be over. “In my gut, in my soul, I feel that tonight is going to be better,” he commented.

By the end of the night Capt Johnson said that two people had been shot, 31 protesters arrested and that police had come under 'heavy gunfire"" during the course of the night.

Unrest in Ferguson over Michael Brown shooting

""These criminal acts came from a tiny minority of law-breakers,"" he said. ""It is criminals who throw Molotov cocktails, fire shots and endanger lives. These are not acts of protesters but acts of violence.""

""Not a single bullet was fired by officers despite coming under heavy attack. Our officers came under heavy gunfire,"" he added.

Earlier, the atmosphere was edgy as a line of police officers in gas masks and riot gear had formed a line at one end of the protest area. Soon, a second phalanx of police, now backed up by armoured vehicles topped with machine gun nests had also gathered at the other end of the street. Sound cannons released ear-piercing tones to discourage assembly. Sandwiched in between were hundreds and demonstrators and journalists.

Video: Police fire tear gas at protesters

While some degree of calm appeared to be holding at one end with the help of several community organisers and church pastors mixing with the crowds and urging restraint, at the other end, just off the street where the teenager, Michael Brown, was killed last Saturday, a far angrier knot of demonstrators had gathered, taunting police, ripping out a street and ignoring orders to disperse.

With a far smaller group of reporters at the same junction as witnesses, the stand-off abruptly dissolved into fresh chaos.  First some of the protesters scattered, as if spooked by something, which later was said to have been gunfire. Moments later, the police began firing tear gas, while protesters began hurling objects back, ranging from water bottles to at least one Molotov cocktail. The gas in the area spread fast, sparing only the few wearing gas masks.

Later a police officer ordered a CNN broadcast crew - and soon all other remaining reporters - to clear what had been a media ‘safe’ area outside the McDonald's. “There has been a gunshot victim, please leave,” one officer shouted. Meanwhile, riot police weaved through the air pointing automatic weapons indiscriminately at protesters and reporters.

Seemingly not involved directly in the street confrontations were the National Guard troops, who held back mostly to protect the police command centre in a nearby shopping centre.

Earlier, President Barack Obama had said during a White House press conference that he had urged Governor Nixon strictly to limit the involvement of the National Guard to avoid further inflaming community resentment.

President Obama, who said he had directed the Attorney General, Eric Holder, to visit Ferguson personally on Wednesday, urged all sides to work for calm. “While I understand the passions and the anger that arise over the death of Michael Brown, giving in to that anger by looting or carrying guns, and even attacking the police, only serves to raise tensions and stir chaos,” he said.  “It undermines, rather than advancing, justice.”

The fresh protests followed the release by lawyers for Mr Brown’s family of the preliminary results of a privately conducted autopsy of the victim suggesting he had been shot six times. The trajectory of one bullet, from the top of the head and out one eye, was seen by some to corroborate claims that the young man had been trying to surrender when hit by the fatal shot.  A wound to an arm may also fit with his having had his arms raised at the time, though the private pathologists said they could not say for certain.  Two more autopsies are pending from St Louis and also federal authorities.

The family meanwhile called for the arrest of the officer responsible for the shooting, who has been identified as 26-year-old Darren Wilson. The same call was echoed by many of those participating in the protests on Monday night.",0,80,Two shot and 31 arrested as Captain Ronald Johnson blames 'criminals throwing Molotov cocktails' for escalation of civil unrest,Articles have a short abstract that could potentially be deemed subtitles
Independent,indep4,http://www.independent.co.uk/news/world/americas/ferguson-protests-police-shoot-and-kill-second-young-black-man-9679801.html,Michael Brown shooting: Police shoot and kill second young black man near Ferguson,Kunal Dutta ,08/19/2014,03/18/2016,"The race-relations crisis engulfing America in the aftermath of the shooting of 18-year-old Michael Brown in Missouri intensified on Tuesday after police confirmed the shooting of a second African-American man from St Louis.

The unnamed suspect, identified only as a 23-year-old, was approached by officers after reports of a store robbery and a “man with a knife acting erratically,” St Louis Police Chief Sam Dotson said.

“As officers arrived, the suspect turned towards the officers and started to walk towards them, clutching his waistband. He then pulled out a knife in what we describe as an overhand grip, and told the officers: 'Shoot me now, kill me now'.”

Police said the ignored verbal commands to drop the knife and continued to approach the officers, coming “within three to four feet” before two policemen opened fire. The suspect was pronounced dead at the scene while the officers, whose identity has been withheld, have been suspended pending an investigation. Details of the incident were still emerging on Tuesday but it will invariably inflame tensions, coming 11 days after the police shooting of Michael Brown which has sparked days of violent protests in the town of Ferguson, prompting a heavy police crackdown.

Video: Another night of violence in Ferguson
 
Many of the reporters already in the area covering the shooting of Mr Brown flocked to the scene of the latest incident, east of Ferguson, as news permeated across America.

Unrest in Ferguson over Michael Brown shooting

It comes at a delicate moment in the first investigation. US Attorney General Eric Holder is already due to visit Ferguson today to meet officials investigating the shooting of Mr Brown, while the St Louis county prosecutor's office confirmed it present evidence against the officer who killed Mr Brown to a grand jury imminently. Meanwhile a new poll by the respected Pew Research Center has found US reaction to the police killing of Michael Brown falls along distinct racial lines.

Meanwhile protesters have thrown bottles and Molotov cocktails at lines of police put in place to quell looting and violence in Ferguson, a town of about 21,000 people that is overwhelmingly African-American. In Washington, President Barack Obama said the vast majority of protesters in Ferguson were peaceful, but warned that a small minority was undermining justice.

Mr Brown's funeral will take place on Monday.",0,570,"The unidentified 23-year-old approached officers while brandishing a knife
Kunal Dutta @kunaldutta Tuesday 19 August 20140 comment",NA
