Source,ArticleID,ArticleLink,Title,Author,DatePublished,DateRetrieved,ArticleText,NumberComments,NumberSocialMedia,TheShitBetween,Notes
Independent,indep18,http://www.independent.co.uk/news/world/americas/ferguson-missouri-riots-police-use-rubber-bullets-and-tear-gas-as-new-witness-says-michael-brown-9668278.html,Ferguson Missouri riots: Police use rubber bullets and tear gas as new witness says Michael Brown was shot while ‘backing away with hands up’,Adam Withnall,08/14/2014,03/23/2016,"Police have begun using tear gas, stun grenades and rubber bullets on those protesting the shooting of an unarmed black teenager in Ferguson, Missouri, as another witness said Michael Brown was backing away with his hands up as an officer repeatedly fired at him.

The situation in the suburb of St Louis has rapidly deteriorated following largely peaceful vigils on Tuesday night, and has led to calls for Barack Obama to cut short his golfing holiday to Martha’s Vineyard in Massachusetts.

Last night some protesters were seen hurling rocks at the heavily-armed and camouflage-wearing police units, while there were reports of young men preparing what appeared to be petrol bombs in a bus shelter.

Angry protests have taken place in Ferguson every night since Saturday, when the 18-year-old was shot to death in what police say was a struggle over a gun in a police car.

A new witness, Tiffany Mitchell, told CNN she was watching when Mr Brown and an officer, who has not been named, were “tussling through the window”.

Ms Mitchell said the officer was pulling the teen in as he struggled to get away, and then “a shot was fired through the window”.


“The kid finally gets away and he starts running. As he runs, the police get out of his vehicle and he follows behind him shooting,” Mitchell said, adding that Brown turned around and put his hands in the air.

“The cop continued to fire until he just dropped down to the ground and his face just smacks the concrete.”

Another witness, Dorian Johnson, has said that Brown was not struggling with the officer and had his hands in the air when he was shot multiple times in the head and chest.

Schools in the district around Ferguson have cancelled all classes until Monday, while national figures ranging from the civil rights activist Reverend Al Sharpton to the President himself have issued statements calling for calm.

Mr Obama was briefed on Wednesday night about the events unfolding in Ferguson by a team that included the US Attorney General, Eric Holder, the White House said.

While it has been said that the President could do more to calm the situation, an official at the White House came in for special criticism for tweeting about a party Mr Obama was attending as another night of unrest got underway in Missouri. The post has since been deleted.

A common theme among protesters has been the “brutality” of the heavily armoured police, who on Wednesday night also arrested two journalists while shutting down a McDonald’s branch from which they were reporting.

 Ferguson police chief Thomas Jackson said that the protests represented “an opportunity to fix what’s wrong” with race relations in the town. While around two-thirds of the 21,000 population are black, the vast majority of the 53=strong police force is white.

Meanwhile, police in California were investigating a separate incident of an officer fatally shooting an unarmed 25-year-old black man in Los Angeles.

On social media, groups claiming to be associated with the Anonymous hacker activist group called for nationwide protests and threatened to reveal personal information about Ferguson police officers.

The Ferguson police said there have been attempts to hack their website, which suffered a temporary disruption, and that the cyber-threats prompted their decision not to release the officer's name.",0,0,"As anger over black teenager’s death escalates, Barack Obama has been criticised for staying away on holiday",NA
Independent,indep19,http://www.independent.co.uk/voices/comment/ferguson-the-issue-obama-must-tackle-is-white-control-in-black-areas-9679470.html,Ferguson: The issue Obama must tackle is white control in black areas,Rupert Cornwall,08/19/2014,03/23/2016,"The violence in Ferguson is small beer compared to the 1965 conflagration in Watts, the rioting that swept US cities after the assassination of Dr Martin Luther King, and the Los Angeles riots of 1992 after the acquittal of white police officers charged with beating-up the black motorist Rodney King.

But the flare-up after the shooting of the unarmed student Michael Brown by a white police officer, constitutes the biggest race relations test for America’s first black president since he took power. And in contrast with his previous forays onto this treacherous terrain, Barack Obama is displaying a caution that is disappointing some black opinion here.

Why, these critics ask, is he not planning a visit to Ferguson himself? Instead he is dispatching Attorney General Eric Holder to the St Louis suburb today. And why has Mr Obama not condemned the behaviour of the police more forcefully?

Instead the President, in his most extensive remarks on the subject on Monday, urged all parties to “seek understanding, rather than just hollering at each other.”

He did criticise the police and said he understood the anger at Mr Brown’s death among African-Americans. But, Mr Obama added, “giving in to that anger by looting or carrying guns and even attacking the police, only serves to raise tensions and stir chaos”.

That dry, almost scripted, response contrasts with his reaction to other recent racial incidents that have made headlines – above all the 2013 acquittal of George Zimmerman, a neighbourhood watch officer, on murder and manslaughter charges after he shot Trayvon Martin, another unarmed black teenager, on a Florida estate in 2012.

“If I had a son, he’d look like that… Trayvon Martin could have been me 35 years ago,” Mr Obama said then, explaining the deep resentment at what had happened: “there are very few African American men in this country who haven’t had the experience of being followed when they were shopping in a department store. That includes me. There are very few African-American men who haven’t had the experience of walking across the street and hearing the locks click on the doors of cars.”

But in the case of Michael Brown, the President has injected no such personal feelings. There are of course major differences. Then, Mr Obama was speaking after the legal resolution of the Zimmerman case. This time, the Ferguson investigation is barely started, with the most basic facts in dispute. All the more reason therefore, why Mr Obama should be studiously even-handed.

Bear in mind too that this black president has been burnt before when he waded into a racial controversy. After the 2009 arrest of the black Harvard professor Henry Louis Gates, at his Cambridge, Massachusetts, home, Mr Obama criticised police handling of the affair - only to stir a firestorm among police organisations, who claimed he had misrepresented the facts.

This time the President is, above all, seeking not to inflame matters, and thus leave himself room to tackle the issue at the heart of the Ferguson confrontation: the enduring white control of politics and the police in a predominately black town.",0,18,NA,NA
Independent,indep20,http://www.independent.co.uk/news/world/americas/america-is-one-nation-still-divided-protests-over-the-shooting-of-a-black-teenager-could-have-9670106.html,"Michael Brown shooting: One nation, still divided by race – why Ferguson was a flashpoint that could have happened anywhere in America",David Usborne,08/14/2014,03/23/2016,"State and national leaders scrambled today to show they are sensitive to the grievances of African-Americans in urban communities like Ferguson near St Louis, which has seen successive nights of tumult and confrontation in the wake of a shooting of a black teenager by a white police officer last weekend.

Footage of the chaos on the streets of Ferguson has dominated newscasts, yet attempts to ease tensions have faltered as local police commanders have chosen to deploy overwhelming force to repel protesters and have declined to release the identity of the officer who opened fire on 18-year-old Michael Brown, days before he was to start college.

“Many Americans have been deeply disturbed by the images we have seen,” President Barack Obama said, reiterating that he had ordered the FBI and the Justice Department to independently investigate the shooting of Mr Brown. The President broke from his holiday on Martha’s Vineyard to address the ongoing violence.

Missouri Governor Jay Nixon, a Democrat, told a meeting of residents that “you will all see a different tone” in the police response, after announcing unspecified “operational shifts” in law enforcement tactics.
 
While the exact circumstances of the shooting remain in dispute and may not be officially determined for weeks, his death has become the latest symbol of the simmering racial frustration that still infects American society, 50 years after the Civil Rights Act and six years after Mr Obama became the first black president.

Senator Claire McCaskill, a Democrat, told a meeting in Ferguson that she was seeking a “demilitarisation” of the police response to the protests. Armoured vehicles and non-lethal ammunition such as stun grenades have been deployed, turning an American suburb into what has looked like a war zone.

Brian Schellman, a spokesman for the St Louis County police department, defended the use of tear gas and smoke bombs to disperse crowds on Wednesday night, which also saw the brief detention of two reporters for videotaping the events. They were released without charge.

“In talking to these guys, it is scary,” Mr Schellman said of officers on the front lines of the protest. “They hear gunshots going off, and they don’t know where they’re coming from.”

Mr Obama said there was no excuse for vandalism or unwarranted attacks against the police, but added pointedly that there was “also no excuse for police to use excessive force against citizens” engaged in legitimate protests. He also took direct aim at whoever arrested the two reporters, working for the Washington Post and the website Huffington Post. Police “should not be bullying or arresting journalists who are trying to do their jobs,” he declared.
While Ferguson is the latest flashpoint in America’s struggle to overcome a legacy of racial tension going back to slavery, it could just as easily have been somewhere else; Los Angeles, where 24-year-old Ezell Ford, also black, was shot and killed by a police officer on Monday, or perhaps New York, where the death of Eric Garner while in custody, after an officer held him in an illegal chokehold last month, is still fuelling anger.

The grievances still felt by many African-Americans are rooted in the life experiences of many of them, particularly young men, which are also reflected in the sometimes shocking statistics. Statistics just from Ferguson are startling but by no means unique to the town, which, on the edge of downtown St Louis, became majority black after whites fled decades ago to escape rising violence and sinking schools.

Until last weekend, few beyond Ferguson will have known that only three of its 53 police officers are black, even if the community is overwhelmingly more black than white. Or that 483 blacks were arrested in town last year but only 36 whites. Or that blacks, who make up less than two thirds of the driving-age population, account for 86 per cent of all traffic stops by police.

Nationally, similar instances of unequal lives abound. Median income levels for African-Americans remain about two thirds of what they are for whites, and black unemployment is twice as high. These are disparities that are not always ignored, of course. Hence a current campaign to change sentencing rules for narcotics crimes and enable early release for drug offenders, to try to reduce madly elevated rates of incarceration for black males.

But progress can be offset by reverse steps. A campaign inside the white half of Baton Rouge, Louisiana, known as St George, to secede from the rest of the city has widely been condemned, for instance, as a barely disguised return to segregation, where whites will get the best schools and blacks will be left out. A Supreme Court ruling last year gutting the 1965 Voting Rights Act has also been deplored as a betrayal of the civil rights movement.",0,0,"It is still a deeply unequal society 50 years after the Civil Rights Act was passed - as the unrest seen in Ferguson, Missouri, this week shows",NA
Independent,indep21,http://www.independent.co.uk/news/world/americas/michael-brown-shooting-chaos-erupts-on-the-streets-of-ferguson-after-autopsy-report-shows-teenager-9675118.html,Michael Brown shooting: Chaos erupts on the streets of Ferguson after autopsy shows teenager was shot six times – twice in the head,Tim Walker,08/18/2014,03/23/2016,"Chaos erupted on the streets of Ferguson, Missouri again last night as police unexpectedly fired tear gas into a crowd of demonstrators, including children and members of the media, almost two hours before the start of an official curfew.

The renewed violence began as a private autopsy report was released showing that Michael Brown, the unarmed black teenager killed by a white police officer in the St Louis suburb last weekend, had been shot six times – twice in the head.

The fresh dissidence has led to Jay Nixon, the Governor of the state of Missouri, ordering the deployment of National Guard troops to “protect life and property”, he said in a statement this morning.

The military will, he says, will “maintain peace and order” by closing streets and thoroughfares, if it must, after the events that have unfolded have “continued to create conditions of distress and hazard to the safety, welfare and property of the citizens of the community beyond the capacities of local jurisdiction”.

In the midst of what appeared to be a peaceful protest last night, the St Louis County Police Department tweeted reports that Molotov cocktails were being thrown at officers, and that shots had been fired in the area. Police launched smoke canisters and tear gas into the crowds, which sent hundreds fleeing, with many reportedly covering their faces to escape the gas.

Earlier yesterday, it seemed tensions might finally have been quelled in Ferguson, where police and protesters have clashed almost nightly since Mr Brown’s death on 9 August. Captain Ron Johnson of the Missouri State Highway Patrol, the black officer who has become the public face of the law enforcement response, received a standing ovation when he addressed the Brown family and other community members on Sunday at the town’s Greater Grace Church.

Capt. Johnson reminded the crowd that he, too, was from Ferguson, and that he had much in common with many families there, including a son whom he said wears baggy trousers and sports tattoos. “We all ought to be thanking the Browns for Michael, because Michael's going to make it better for our sons, so they can be better black men,” he said.

Missouri Governor Jay Nixon last week asked the Highway Patrol to take over responsibility for security in Ferguson, after four nights in which local police had met largely peaceful protests with riot gear, tear gas and rubber bullets. Speaking to ABC News on Sunday, Mr Nixon said he had been “thunderstruck” by the police response. “The over-militarisation… The guns pointed at kids in the street. All of that I think instead of ratcheting down, brought emotion up,” he said.

Yet while the arrival of Capt. Johnson and his officers brought about a brief calm, by Friday night public anger flared again after police issued a statement saying Mr Brown had been a suspect in a robbery at a local convenience store. Ferguson police chief Tom Jackson later admitted that Darren Wilson, the officer who shot Mr Brown, was not aware he was a suspect at the time.
The authorities also released CCTV footage of the robbery, leading to accusations that they were trying to smear the victim. On Saturday Mr Nixon declared a state of emergency and ordered the nightly curfew from midnight to 5am; the Governor also criticised the release of the video, saying it “appeared to cast aspersions on a young man that was gunned down in the street.”

The details of Mr Brown’s shooting are still disputed: police said he reached for Wilson’s gun during an altercation inside a police car; witnesses insisted Mr Brown had his hands up when he was shot. A preliminary private autopsy was conducted on Sunday at the Brown family’s request by Dr Michael Baden, the former chief medical examiner for the City of New York.

Anthony Gray, a lawyer representing the family, said the trajectory of one of the two bullets that struck Mr Brown in the head was particularly noteworthy. “To have a shot that’s at a 90-degree angle from the top of his skull to the bottom of his chin, almost vertical, that sounds like an officer standing over him,” Gray said.

On Sunday US Attorney General Eric Holder announced that the Justice Department would also conduct its own autopsy on Mr Brown’s body due to “the extraordinary circumstances involved in this case”. President Barack Obama has directed the FBI to investigate  Mr Brown’s death; 40 FBI agents reportedly went door-to-door at the weekend to collect information on the shooting.",0,0,St Louis County Police Department tweeted reports that Molotov cocktails were being thrown at officers,NA
Independent,indep22,http://indy100.independent.co.uk/article/this-is-what-police-officers-now-look-like-in-ferguson-missouri--gyr5dkM1Qg,"This is what police officers now look like in Ferguson, Missouri",Evan Bartlett,08/13/14,03/23/2016,"The death of Michael Brown, an unarmed teenager who was shot by police, on Saturday has caused a {wave of unrest}<hyperlink=”http://indy100.independent.co.uk/article/why-the-shooting-of-michael-brown-has-caused-so-much-anger-in-the-us--ly5RBFDAMg”> in his home town of Ferguson, Missouri.

There are still conflicting reports as to what exactly happened - eyewitnesses claim the teenager was shot while trying to surrender while the police claim he assaulted an officer.

A second man was also {reportedly shot by police}<hyperlink=”http://www.theguardian.com/world/2014/aug/13/missouri-police-shoot-man-city-teenager-killed”> on Tuesday night after allegedly pointing a gun at an officer - he is now thought to be in a critical condition in hospital.

Michael's shooting has caused a {renewed crisis over civil rights}<hyperlink=”http://www.theguardian.com/world/2014/aug/13/missouri-police-shoot-man-city-teenager-killed”> and police brutality in the United States.

With pictures of police officers in heavily-armoured vehicles, decked out in camouflage, firing rounds of tear gas and {using wooden bullets}<hyperlink=”https://twitter.com/jonswaine/statuses/499219813575557121”> - it is easy to see how their tactics have been criticised.






The police officer who shot Michael has not been named owing to concerns over his safety but the FBI has confirmed it has launched an investigation into the shooting.

President Barack Obama and the teenager's father, Michael Snr (below, left), have {both called for calm}<hyperlink=”http://www.independent.co.uk/news/world/americas/michael-brown-shooting-barack-obama-calls-for-calm-from-missouri-rioters-as-police-refuse-to-name-9665394.html”> in a bid to stop the violence that has tarnished the mourning of this 18-year-old's death.",0,NA,NA,NA
Independent,indep23,http://www.independent.co.uk/news/world/americas/ferguson-protest-president-barack-obama-calls-for-peace-and-calm-following-violent-protests-in-9669930.html,"Michael Brown shooting: President Barack Obama calls for 'peace and calm' following violent protests in Ferguson, Missouri",Julie Pace,08/14/2014,03/23/2016,"President Barack Obama on Thursday appealed for “peace and calm” on the streets of a St. Louis suburb b{esieged by violent clashes}<hyperlink=”http://www.independent.co.uk/news/world/americas/this-is-why-people-are-angry-in-ferguson-missouri-after-michael-brown-shooting-9669203.html?origin=internalSearch”> between police and crowds protesting the shooting death of an unarmed teenager.

“I know emotions are raw right now in Ferguson and there are certainly passionate differences about what has happened,” Obama said in his first in-person remarks about the tense standoff in the Missouri suburb.

“But let's remember that we're all part of one American family, we are united in common values and that includes the belief in equality under the law, respect for public order and the right to peaceful public protests.”

Obama, speaking from the Massachusetts island where he's on a two-week vacation, said there was no excuse for excessive force by police in the aftermath of Saturday's shooting of 18-year-old Michael Brown.

He said he had asked the Justice Department and FBI to investigate the incident.

The president said he had also spoken Thursday morning with Missouri Gov. Jay Nixon, who has faced criticism for not doing more to control the violence. Obama defended the Democratic governor calling him “a good man, a fine governor.”

Police have defended their use of tear gas and smoke bombs to repel protesters, saying they took those actions to disperse a large crowd after some people threw Molotov cocktails and rocks at officers.",0,0,"""Let's remember that we're all part of one American family,"" he said ",NA
