Source,ArticleID,ArticleLink,Title,Author,DatePublished,DateRetrieved,ArticleText,NumberComments,NumberSocialMedia,TheShitBetween,Notes
Independent,indep24,http://www.independent.co.uk/news/world/americas/hedy-epstein-90-year-old-holocaust-survivor-speaks-after-her-arrest-ferguson-police-are-deliberately-9679232.html,"Hedy Epstein, 90-year-old Holocaust survivor speaks after her arrest: 'Ferguson police are deliberately inciting violence'",Heather Saul,08/19/2014,03/23/2016,"{Hedy Epstein}<hyperlink=”http://www.independent.co.uk/news/world/americas/ferguson-protests-90-year-old-holocaust-survivor-hedy-epstein-arrested-by-police-during-st-louis-9677729.html”>, the 90-year-old Holocaust survivor who was arrested on Monday in St Louis has accused police in Ferguson of deliberately inciting violence as protests over the death of unarmed black teenager Michael Brown continue across Ferguson.

Ms Epstein was one of eight people arrested and charged with “failure to disperse” during a demonstration outside of the Wainwright building, where Governor Jay Nixon has an office. She is due to appear in court on 21 October.

Ms Epstein, a resident of St Louis, is a political activist and speaker widely known for her vocal support of the Free Gaza Movement. Pictures of her in handcuffs and flanked by police were widely shared across social media, sparking wide-spread outrage.

Ms Epstein said protesters were there demanding to speak with Governor Nixon during a demonstration calling for him to de-escalate his response to riots in Ferguson, which has seen the area placed under a state of emergency and the National Guard deployed.

After refusing to move away from the door, Ms Epstein said St Louis police “arrested us without further ado, handcuffed us, put us in paddy wagons to the station, booked us, released us, and charged us and gave us a court date.”

The increasing militarisation and the presence of the National Guard has seen tensions between protesters and authorities flare in Ferguson, leading President Obama to warn: ""There is no excuse for excessive force by police.""

Ms Epstein told The Independent that one of the main issues involved it the riots is the police in Ferguson, who have used tear gas and rubber bullets during the unrest.

""From the beginning, they were inciting the demonstrators who were demonstrating peacefully to become violent so that the police can become more violent in return,"" she said.

“The police and the guards need to be pulled out and they need to leave it to the people there to sort out. As long as you have riot police and riot gear and military equipment and lethal weapons - that is not going to lead to peace.

""It has to stop, because more lives are going to be lost, more people will be injured and more property will be damaged. It accomplishes nothing""

Anger rose again this week after an independent pathologist hired by the Brown family determined the teenager had been shot six times, including twice to the head. The family’s lawyer, Daryl Parks, suggested that the 18-year-old was killed at the moment he was already in a position of surrendering before the police officer.

“Michael Brown was walking down the street with his friend and police said get off the street and get onto the sidewalk,” said Ms Epstein. “They said they would continue walking and then that’s when the violence started.

“You don’t have to shoot to kill because someone was walking down the street. The officer didn’t know that Michael Brown was a suspect in an alleged robbery, he was merely shot because he was not obeying and walking on the sidewalk.”

Mr Brown was shot and fatally wounded on 9 August by police officer Darren Wilson, who is currently suspended with full pay. His death has heightened racial tensions between the predominantly black community and the mostly white Ferguson Police Department.

Ms Epstein added: “There are certain stereotypes with male African Americans walking down the street, who immediately become a suspect just by walking. When I walk down with my white skin I am privileged and no one questions me.

“I hope there will be change, change not only in Ferguson because what is happening there is happening all over the country – racism is alive and well and I think we need as a nation to look at ourselves and we need to change our ways. Violence only begets violence.

“People in Ferguson have the right to live in peace and calm – there has been enough tragedy in Ferguson already. We need peace, justice and equality.”",0,36,"Ms Epstein has called for 'peace, justice and equality'",NA
Independent,indep25,http://www.independent.co.uk/news/world/americas/michael-brown-shooting-angry-parents-demand-justice-for-teenage-son-gunned-down-by-police-9667382.html,Michael Brown shooting: Angry parents demand justice for their teenage son gunned down by police in Ferguson,Wesley Lowery,08/13/2014,03/23/2016,"When he posed for his graduation picture in March, Mike Brown was still just Mike Brown. A student with a football tackle build. Just one of the 100 or so in his senior class at Normandy High, a struggling school that had lost its state accreditation and, along with it, a measure of its pride, in an area already beset by challenges.

In his photo, Brown barely smiled, his green mortarboard tilted back on his large head, a red sash around his shoulders – a slight bravado that, his teacher noted, might have obscured how difficult reaching this moment had been.

Michael Brown officially graduated on 1 August, later than some and months after the photo was taken. He still had credits to earn then. He was in an alternative learning programme, a way to help the students facing the longest academic odds.

But he got his diploma. And 10 days after that, he was to start at a local technical school to learn how to fix furnaces and air conditioners.

“He’d accomplished it,” teacher John Kennedy said. “In the last two months, Mike was there every doggone day and giving it his full effort.” “He was a gentle giant,” said Charles Ewing, Brown’s uncle.

Last Saturday, as Brown walked down a street with a friend, the 18-year-old was fatally shot by a police officer in Ferguson, a working-class suburb north of St Louis. Brown was unarmed.

What happened during the unidentified police officer’s a confrontation with Brown and his friend remains unclear.

County police and the FBI have announced separate investigations. But doubts in the local community about whether the shooting was justified quickly boiled over, leading to days of rallies and unrest, including angry confrontations between protesters and police, nighttime scenes made hazy by tear gas and shouted slogans.

Now Brown is part of a renewed national discussion about how police treat minorities, especially young black men.

President Obama on Tuesday offered his “deepest condolences” to Brown’s family, who is now represented by the same attorney used by the family of Trayvon Martin, the Florida teenager gunned down by a Neighbourhood Watch volunteer in 2012.

The Rev Al Sharpton came to St Louis; social media and talk shows swirled with anger aimed at both Brown’s death and the violent demonstrations that followed.

On Tuesday night, the authorities in Ferguson braced themselves for another round of violence. Flights were banned from operating below 3,000 feet over the city, at the request of county police. A police spokesman said a helicopter had been shot at multiple times and that the flight ban is “to provide a safe environment for law enforcement activities”. The ban may also preclude the hovering of news helicopters.

The official police investigation, a standard reaction to any officer-involved shooting, was moving slowly, said Brian Schellman, a county police spokesman. Three days after the incident, detectives still had not talked with many “critical witnesses”.

“They’ve reached out to numerous people who have been unwilling or unable to talk with them,” Mr Schellman said.

Police detectives have tried “numerous times” to talk with Dorian Johnson, Brown’s friend who was with him when the shooting occurred and who, since then, has given several press interviews.

While Ferguson police have said Brown pushed the officer as the patrolman was trying to exit his car and then struggled with him over his gun, Johnson has said the officer was the aggressor. The officer, according to Johnson, shot Brown while still inside the vehicle, then emerged and fired multiple times.

“We want to talk to him,” Mr Schellman said. “We have to talk to him.”

Ferguson police had planned to release the name of the officer who shot Brown, but they reversed this decision on Tuesday as “threats [were] being made against all Ferguson officers on social media sites”, the city’s police spokesman, Timothy Zoll, said in an email. There is no timetable for when the officer’s name could be released, he said.

Benjamin Crump, an attorney for Michael Brown’s family, said releasing the officer’s name could help ensure peace on the streets of Ferguson.

In Ferguson, residents with signs gathered at the site of the shooting in the early afternoon, prompting honking horns and cheers of “hands up, don’t shoot”.

In nearby Clayton, several hundred people marched downtown and descended on the county prosecutor’s office. “I need justice for my son,” Michael Brown Sr said to the press on Tuesday.

The town where Brown died has 21,000 residents. The poverty rate is about twice Missouri’s average. There are challenges. But it is also home to the world headquarters of Emerson Electronics, a $24bn company, and Express Scripts, which employs thousands in the St Louis area.

Black residents make up about two-thirds of Ferguson’s population. In the 2000 census, whites held a slim majority. Meanwhile, the city’s police force remains overwhelmingly white.",0,150,"The gentle giant was walking down a street as a white officer fired from a police car, says his friend",NA
Independent,indep26,http://indy100.independent.co.uk/article/what-happened-in-ferguson-last-night-in-11-pictures--xJR6TSSmXx,What happened in Ferguson last night in 11 pictures,Evan Bartlett,08/18/14,03/23/2016,"Last night saw more unrest {in Ferguson}<hyperlink=”http://www.independent.co.uk/news/world/americas/michael-brown-shooting-chaos-erupts-on-the-streets-of-ferguson-after-autopsy-report-shows-teenager-9675118.html”> in the wake of the shooting of unarmed teenager Michael Brown last week. A preliminary, private autopsy report on Brown released yesterday showed that he had been shot six times – twice in the head.
While protests were peaceful for the most part, the St Louis County Police Department reported that Molotov cocktails were being thrown at officers, and that shots had been fired in the area.",0,NA,NA,NA
Independent,indep27,http://indy100.independent.co.uk/article/this-is-why-a-midwest-town-in-the-us-looks-like-a-warzone--lkBTty1emg,This is why a midwest town in the US looks like a warzone,Matthew Champion,08/14/14,03/23/2016,"Since the shooting of an unarmed black teenager by an, as-yet, unnamed police officer, the St Louis suburb of Ferguson in Missouri has resembled nothing short of a battleground.

Pictures of heavily armed police advancing on unarmed demonstrators, officers dismounting from armoured vehicles and residents fleeing tear gas have been seen around the world.

This military-grade equipment was not made available to the Ferguson police department at the start of the unrest following 18-year-old Michael Brown's death on Saturday, however, it was in fact gathering dust at St Louis county HQ.

Officers in the town are just one of hundreds of law enforcement agencies to have taken advantage of a federal programme called 1033, which stems from a 1990 law (the National Defence Authorisation Act) passed by Congress to help law enforcement agencies combat drug-related activities.

It is now mainly used by the Department of Defence to pass on surplus military equipment, and in total $4.3billion worth of arms and vehicles have been acquired by 8,000 police forces and other departments in the US, including $449million in 2013 alone.

The {Defence Logistics Agency}<hyperlink=”http://www.dispositionservices.dla.mil/leso/Pages/default.aspx”> is responsible for these ""disposition services"" but does not reveal precisely which forces have acquired what equipment.

But, for example, Fairmont police department, which serves a population of 7,000 in northern Georgia, has bought - at a greatly reduced rate - 17,145 items from the Pentagon, while 50 officers in Oxford, Alabama, have $3million worth of military equipment at their disposal, including M-16s and an armoured vehicle.

The state patrol in landlocked Nebraska meanwhile has three amphibious eight-wheeled tanks.

The gradual militarisation of police in the US is something to be extremely concerned about, claims Radley Balko, Washington Post reporter and author of Rise of the Warrior Cop.

""It is a mentality that sees the people they are supposed to be serving not as citizens with rights but as potential threats,"" he told NBC News.

""If you look at the racial makeup of Ferguson, Missouri, it is about 67 per cent black. 52 of the 55 police officers at the Ferguson police department are white.""

{More: This is what police officers now look like in Ferguson, Missouri}<hyperlink=”http://indy100.independent.co.uk/article/this-is-what-police-officers-now-look-like-in-ferguson-missouri--gyr5dkM1Qg”>",0,NA,NA,NA
Independent,indep28,http://www.independent.co.uk/news/world/americas/michael-brown-shot-while-surrendering-to-the-police-say-eyewitnesses-9663332.html,"Michael Brown shooting: 'Unarmed teenager was shot repeatedly while surrendering to the police', claim eyewitnesses",James Vincent,08/12/2014,03/23/2016,"Eyewitnesses to the death of 18-year-old Michael Brown have claimed the unarmed teenager was shot repeatedly while surrendering to the police.

Dorian Johnson, 22, who was with Brown at the time of his death, said the pair had been walking in the middle of the street when a police officer in a car reportedly told them to “get the f**k on the sidewalk”. 

A struggle near the officer’s car followed, with Johnson reporting that Brown was shot at close range. “The whole time [the officer] was holding my friend until the gun went off,” Johnson told {MSNBC}<hyperlink=”http://www.msnbc.com/msnbc/eyewitness-michael-brown-fatal-shooting-missouri”>.

Johnson and Brown started running away when Brown was shot a second time in the back. Following this Johnson says Brown turned around with his hands up and said “I don’t have a gun, stop shooting!” after which the office reportedly shot him several more times.

This version of events has been corroborated by several other eyewitness accounts, although police from Ferguson - the working class, mostly black St. Louis suburb where the incident took place – maintain that Brown was killed following a struggle for the officer’s gun.

The police have also confirmed that Brown was shot multiple times, with St. Louis County police chief Jon Belmar reporting that the teenager, who was in the area visiting his grandmother, was hit “more than just a couple but I don’t think it was many more than that.”

The identity of the officer involved has not been revealed and is currently on paid leave for the investigation into Brown’s death.

Protests sparked by the killing {continued from the weekend}<hyperlink=”http://www.independent.co.uk/news/world/americas/michael-brown-shooting-shops-looted-and-vandalised-after-vigil-for-unarmed-black-teenager-shot-dead-9660626.html”> into Monday night, with groups gathering in the street chanting “Don’t shoot” at the police and holding their hands up.

Police in the area have been using tear gas and rubber bullets to disperse crowds, with journalists in the area reporting being threatened with arrest if they don’t leave the scene.

Brown’s death follows close on the death of New York resident {Eric Garner}<hyperlink=”http://cms-ind.prod.indes.firstclarity.com/news/people/news/eric-garner-death-examiner-rules-police-chokehold-was-the-cause-of-father-of-sixs-death-9644428.html?origin=internalSearch”>, who was killed by police after being placed in a chokehold. The incident was caught on video and Garner can be heard saying “I can’t breathe” repeatedly.",0,333,"The killing has sparked protests in Missouri, as well as raising questions in the US about the continuing pattern of police violence against young black men",NA
Independent,indep29,http://indy100.independent.co.uk/article/getty-photographer-arrested-in-fergusonthese-are-his-pictures--lyqxsdgEQl,Getty photographer arrested in Ferguson - these are his pictures,Matthew Champion,08/19/14,03/23/2016,"Last night veteran Getty photographer Scott Olson became the third journalist to be arrested while covering protests and unrest in Ferguson, Missouri, where earlier this month unarmed black teenager Michael Brown was fatally shot by police.

Getty's vice-president for news, Pancho Bernasconi, said the photo agency stood ""firmly behind"" Olson.

The Missouri state highway patrol said the photographer was arrested after straying out of a designated media zone.

Olson has taken some of ",0,NA,NA,NA
Independent,indep30,http://www.independent.co.uk/voices/comment/the-shooting-of-michael-brown-proves-once-again-how-racial-stereotyping-can-lead-to-murder-9674305.html,The shooting of Michael Brown proves (once again) how racial stereotyping can lead to murder,Lee Pinkerton,08/17/2014,03/23/2016,"So another unarmed Black teenager has been murdered by a white Police officer. The latest is 18 year old Michael Brown, in Ferguson, Missouri. He is the fourth Black man to be killed by law enforcement officers in the US this month.

The case brings to mind the shooting of that other unarmed Black teenager Trayvon Martin, by {neighbourhood watch officer George Zimmerman}<hyperlink=”http://www.independent.co.uk/news/world/americas/george-zimmerman-found-not-guilty-of-murdering-unarmed-black-teenager-trayvon-martin-8707943.html”> in 2012.

And that of 22 year old {California resident Oscar Grant}<hyperlink=”http://www.theguardian.com/world/2010/jul/09/oscar-grant-oakland-police-shooting”> in 2008, who was lying face down on the platform of Fruitvale train station when a Transit Police officer shot him in the back.

And just so we in Britain don’t allow ourselves to feel smug and complacent, it is also reminiscent of the shootings of {Azelle Rodney}<hyperlink=”http://www.independent.co.uk/news/uk/crime/armed-police-officer-charged-with-murder-over-azelle-rodney-shooting-9638777.html”> in 2005, and {Mark Duggan in 2011}<hyperlink=”http://www.bbc.com/news/uk-england-london-14842416”> by members of our own Metropolitan police. In the cases of Rodney and Duggan the police officers in question incorrectly thought that the suspects were going for their guns. The officer who shot Michael Brown claims he thought that Brown was attempting to grab his firearm.  Zimmerman knew that Martin didn’t have a gun.  He just feared he was going to beat him up.

But what is common throughout all of these cases is that the officers all felt they used justifiable force because either their own lives or those of the public were in danger, even though it later transpired that the Black suspects were unarmed.

Usually when these stories come out, the Police issue a statement saying that the deceased had been previously {suspended from school for smoking weed}<hyperlink=”http://www.cbsnews.com/news/trayvon-martin-update-school-marijuana-suspension-no-criminal-record/”>, or was a {member of a notorious gang}<hyperlink=”http://www.bbc.com/news/uk-25363828”>, or had been {resisting arrest}<hyperlink=”http://www.examiner.com/article/putting-the-shooting-of-oscar-grant-into-perspective”>, or exchanged fire with officers. Quite often, as the details of the case reveal themselves, and the families of the victims campaign for justice, some of these ""facts"" seem more like part of a larger smear campaign to justify the Police's actions.

But whether the suspects are criminals or not, is not the point.  The important fact here is that unarmed men are being executed in the streets, by those entrusted to enforce the law.

Why is this happening? I don’t think it is simply a case that all of these white officers are racist and want to put as many Black men in the ground as possible. They may have genuinely felt that that the suspects were a deadly threat.  But that has less to do with the individual circumstances, and more to do with their own preconceptions.

All too often, what these cops are reacting to is not the black man they see in front of them, but rather the stereotypical image of Black men that they carry in their heads.  An image formed from an amalgam of vicious heavyweight boxer and convicted rapist Mike Tyson, gangster rapper and self-confessed former drug dealer 50 Cent, and photo-fit pictures of various Black muggers and rapists that used to regularly feature in tabloid newspapers not so long ago.  In other words, the Bogey Man. 

Hence the heavy handed, militarised response of the Ferguson police, to the public demonstrations that followed Brown’s death. The (majority white) local police saw this, not as (majority African-American)  local residents exercising their democratic right to protest, but as marauding Blacks on the rampage, that needed to be pacified with tear gas and rubber bullets.
 
If you came face to face with the bogey man, of course you’d be scared. If you had a gun, naturally you’d reach for it.  And it’s only after the ambulance has taken the body away, and the mother has given a tearful interview to the news cameras, that it’s revealed that the suspect did not in fact have a gun on him.  And what you thought was a hardened killer about to embark on another murderous rampage, was in fact just an innocent college kid on his way back partying with his friends, or from visiting the corner store for a pack of Skittles.

When split second decisions need to be made in unfamiliar situations, you fall back on preconceptions – on stereotypes. We all do it.  We all judge books by their covers.  But when armed police officers fall into this cognitive trap, Black men often end up dead.",0,195,"The police who shoot unarmed black men might genuinely feel threatened, but that's down to their own preconceptions",NA
Independent,indep31,http://www.independent.co.uk/voices/editorials/disunited-states-racial-equality-in-america-suffers-another-violent-setback-9667587.html,Disunited States: Racial equality in America suffers another violent setback,Editorial,08/13/2014,03/23/2016,"The precise facts surrounding the death of Michael Brown, the unarmed black student shot and killed by a white police officer last Saturday afternoon in a poor suburb of the Midwestern US city of St Louis, are inevitably in dispute. But the broader lessons of the incident, which has sparked three nights of rioting and disorder, are not. The residual poison of racial segregation and discrimination has still not been purged from American society.

Only three decades ago, Ferguson, the suburb in question, was overwhelmingly white in population. Today, black people outnumber white people by almost three to one. Yet the local political and law-enforcement structure remains dominated by whites, to the point that of the suburb’s 53 police officers, only three are black. Stir in the habit of police (not only in Ferguson but in towns and cities across the US) to stop and arrest black citizens disproportionately, and throw in the pent-up resentment in the black community at this practice, and the events in Ferguson were an explosion waiting to happen.

Sadly, moreover, they are all too familiar. The arrest and beating of the black construction worker Rodney King by Los Angeles police officers in 1991 led ultimately to the California city’s worst riots in half a century. Over the years, similar incidents have generated racial tension and anger, most recently the 2012 killing of Trayvon Martin, an unarmed black teenager, by a neighbourhood-watch guard at a gated community in Florida. The name of Michael Brown must now be added to this list.

Indubitably – and as the election of a black president testifies – the US has made great strides in the past half-century towards achieving racial equality. Less so, however, in the field of policing. The looting and vandalism that occurred in Ferguson are plainly wrong. But as Martin Luther King also observed, “a riot is the language of the unheard”.",0,17,NA,Author just listed as editorial
