Source,ArticleID,ArticleLink,Title,Author,DatePublished,DateRetrieved,ArticleText,NumberComments,NumberSocialMedia,TheShitBetween,Notes
USAToday,usa1,http://www.usatoday.com/story/news/nation/2014/08/14/ferguson-militarized-police/14064675/,Police in Ferguson ignite debate about military tactics,Marisol Bello; Yamiche Alcindor,08/19/2014,10/23/2015,"FERGUSON, Mo. — The scene harkened to familiar images of the Iraq war: men in black helmets and body armor sitting on top of armored personnel carriers, rifles at the ready, surveying the civilian population.

Except this was in Middle America and the civilian population was made up of people demonstrating with their hands up to protest the police shooting of an unarmed black teen.

A day after St. Louis County Police clashed with protesters here, throwing tear gas canisters, shooting rubber bullets and using long-range acoustic weapons meant to cause ear-splitting pain, Ferguson has ignited a national debate over local police use of military-style tactics and equipment. Is it effective policing or an excessive display of force?

The St. Louis County police department, which has been patrolling Ferguson during the unrest following the death of {18-year-old Michael Brown}<hyperlink=""http://www.usatoday.com/story/news/nation/2014/08/14/michael-brown-ferguson-missouri-timeline/14051827"">, has been criticized for heavy-handed tactics that include intimidating peaceful protesters.

""At a time when we must seek to rebuild trust between law enforcement and the local community, I am deeply concerned that the deployment of military equipment and vehicles sends a conflicting message,"" Attorney General Eric Holder said in a written statement Thursday. ""The law enforcement response to these demonstrations must seek to reduce tensions, not heighten them."" ""

Democratic Gov. Jay Nixon promised Thursday a ""different tone"" and an ""operational shift"" by police on the protest-wracked streets of Ferguson. He directed the State Highway Patrol to take over supervision of security.

Some critics say the military-style policing has worsened an already volatile situation.

""The police response needs to be demilitarized,"" said Sen. Claire McCaskill, a Democrat. ""I think the police response has become part of the problem as opposed to being part of the solution. We've all got to take a deep breath and realize that the vast majority of people protesting have a constitutional right.""

Francis Slay, mayor of St. Louis, said the situation has been mishandled. ""It creates a higher level of anxiety and higher level of anger,"" he said. His city's government and police force are separate from neighboring St. Louis County, where Ferguson is located.

Anxiety was evident in Ferguson. Since the shooting Saturday afternoon, the St. Louis County Police SWAT unit patrolled the town dressed in fatigues, carrying automatic assault rifles and driving tanks.

The effect was a city turned war zone.

Officers faced angry protesters, some of whom destroyed parts of the city. They pointed rifles at vehicles that got too close. They yelled at reporters to duck behind their cars or risk being shot in the crossfire.

The tension reached a breaking point Wednesday when St. Louis County Police arrived with four armored trucks. Officers in gas masks and fatigues yelled at protesters to leave.

""We won't tolerate non-peaceful actions,"" an officer yelled through a loudspeaker Wednesday night. He told protesters to put down their rocks and weapons, though no rocks had been thrown and no weapons were visible. People who had been singing and playing drums grew angry and yelled back.

Sierra Smith, who lives in the apartment complex at the center of the protests, told the governor on Thursday that her neighborhood has been under police siege since Brown's death.

""Every night we're tormented,"" she said. ""The police have no respect at all for the community.""

But Chuck Canterbury, president of the Fraternal Order of Police, a union that represents more than 325,000 officers nationwide, defended the actions of the Ferguson and St. Louis County police. He said he had spoken with officers there who told him they have been responding to violence from people who have looted, started fires and thrown rocks and bottles at them.

He said the police here have used as much restraint as possible, including verbal commands and non-lethal weapons such as tear gas and bean bag rounds, to break up crowds. Canterbury said a large crowd that is unruly, or appears likely to become unruly, requires a strong show of force to control it.

""You don't retreat,"" said Canterbury, a 26-year veteran of the Horry County Police Department in Conway, S.C. ""We have to protect property and we have to protect people.""

Much of the high-tech gear seen in Ferguson is to protect police, he said.

The military appearance is ""more a perception than reality,"" he said. ""They are two different things. The military is trained to engage and law enforcement is trained to defuse.""

Thomas Nolan, a 27-year veteran of the Boston Police Department who heads the criminal justice department at the State University of New York at Plattsburgh, calls the pictures coming out of Ferguson a ""black mark on contemporary policing practices.

""We are are absolutely seeing the most visible manifestation possible of the militarization of police,"" he said.

The trend grew nationwide after 9/11, when police work expanded from community policing to include homeland security, but it is overkill to use armored personnel carriers, long-range acoustic weapons and other military weapons on civilians in the USA, he said.

""I predict that future law enforcement training will include this episode as how not to engage a crowd,"" Nolan said. ""This will be in every police academy in the country.""",75,1178,NA,ferguson site:usatoday.com daterange:2456878-2456889.5                           
USAToday,usa2,http://www.usatoday.com/story/news/crime/2014/08/10/ferguson-police-news-conference-michael-brown/13860601/,Belmar: Struggle over gun led to teen's shooting,Brandie Piper ,08/19/2014,10/29/2015,"FERGUSON, Mo. – Chief Jon Belmar with the St. Louis County Police Department held a news conference Sunday morning and released new information about the shooting death of 18-year-old Michael Brown.

Brown was {shot and killed}<hyperlink=""http://www.usatoday.com/story/news/crime/2014/08/09/police-shooting-ferguson/13832083/""> Saturday afternoon by a Ferguson police officer.

Belmar said the incident started when Brown physically assaulted the police officer, pushing him into the officer's vehicle. He said there was a struggle inside the car, and at some point Brown reached for the officer's weapon. One shot was fired inside the vehicle.

Brown suffered fatal gunshot wounds outside of the vehicle, approximately 35 feet from the car. Belmar said multiple shell casings were found at the scene, and that Brown was shot more than once, but an exact number of shots fired has not yet been determined. All the shell casings came from the officer's weapon.

Belmar confirmed Brown was unarmed at the time of the shooting. He did not say what led to the struggle inside the officer's car.

Ferguson police cars do not have dash cameras, so there is no police video of the incident available for review, according to Officer Brian Schellman, a county police spokesman.

""There is no video in the apartment complex,"" Schellman added. ""We are still trying to determine if any witnesses recorded the incident.""

[tweetbegin 498253652755111937 tweetend]

The medical examiner is conducting an investigation to determine how many times Brown was shot. It will take several weeks before toxicology results are available.

After the shooting, Belmar said Ferguson Chief Tom Jackson called him and asked the county to take over the investigation.

Belmar said when the investigation is complete the findings will be turned over to the St. Louis County Prosecuting Attorney's Office. They will determine if charges should be filed.

On Saturday afternoon the St. Louis County NAACP {called for the FBI to investigate}<hyperlink=""http://www.usatoday.com/story/news/local/2014/08/09/naacp-fbi-investigate-police-shooting/13845591/""> the shooting. Belmar said the FBI could become involved later, and that it's not unusual for the FBI to become involved in cases like this.

""My son just turned 18 and graduated from high school, and he don't bother nobody,"" Brown's mother, Lesley McSpadden, told NewsChannel 5 Saturday night. She said he was looking forward to starting school at Vatterott College next week.

""They told me how many times my son was shot. Eight,"" said McSpadden. She said he was visiting his grandmother, who lives in the complex, and was returning from the store.

Fifteen police agencies responded to the scene Saturday afternoon as members of the community started gathering.

The officer who shot Brown has been with the Ferguson Police Department for about six years. He is on paid administrative leave. The officer was interviewed Saturday, and will be interviewed more extensively Sunday. Jackson told Belmar the officer will undergo two psychological evaluations if it is determined he can return to active duty.

St. Louis Mayor Francis Slay {tweeted Sunday}<hyperlink=""https://twitter.com/MayorSlay/status/498520631479005189"">, saying he stands with County Executive Charlie Dooley in his call ""for a full and open inquiry into yesterday's shooting in Ferguson.""

Outside the Ferguson Police Department's headquarters Sunday morning protesters raised their hands in the air and chanted ""Don't shoot."" Those protesters could be heard in the background during the news conference.

[tweetbegin 498491465841254401 tweetend]

On Saturday, witnesses told NewsChannel 5 Brown had raised his hands in the air before he was shot, but that information was not confirmed by Belmar.

The protesters are calling for 10,000 people to join them in protesting at 10 a.m. Monday at the Ferguson Police Department. The crowd marched through the streets Sunday morning and afternoon, calling for justice.

[tweetbegin 498491981988122625 tweetend]

Brown's family is asking for the crowd to gather at the crime scene Sunday at 8 p.m. for a candlelight vigil. A peaceful prayer vigil outside the police department was scheduled for 3 p.m.

On Sunday morning, {#Mike Brown}<hyperlink=""https://twitter.com/hashtag/MikeBrown?src=tren""> was trending on Twitter, along with {#Ferguson}<hyperlink=""https://twitter.com/hashtag/Ferguson?src=tren""> and {St. Louis}<hyperlink=""https://twitter.com/search?q=%22St.%20Louis%22&src=tren"">. {Travyon Martin}<hyperlink=""https://twitter.com/search?q=%22Trayvon%20Martin%22&src=tren""> also started trending, with many comparing Brown's death to Martin's.

[tweetbegin 498487930935967744 tweetend]

Attorney General Chris Koster tweeted his condolences to Brown's family Sunday afternoon.

[tweetbegin 498522157417525248 tweetend]

Esther Haywood, president of the St. Louis County NAACP, released this statement following the news conference:

""We are hurt to hear that yet another teenaged boy has been slaughtered by law enforcement especially in light of the recent death of Eric Garner in New York who was killed for selling cigarettes. We plan to do everything within our power to ensure that the Ferguson Police Department as well as the St. Louis County Police Department releases all details pertinent to the shooting. We strongly encourage residents to stay away from the crime scene so that no additional citizens are injured. I have spoken directly with St. Louis County Police Chief Jon Belmar, and I am confident that both he and his department will ensure that the investigation is conducted properly and that all details are kept transparent.""
The St. Louis County Police Department released this statement Sunday afternoon:

""In reference to the Ferguson Police Department shooting which occurred yesterday, we are investigating the incident like any other criminal investigation. There is no conflict of interest as none of our officers were involved and we have been asked to handle this investigation by Ferguson Police Department for that very reason.
""Chief Belmar and the St. Louis County Police will be conducting a full investigation. The results of our investigation will be forwarded to the St. Louis County Prosecuting Attorney's Office who will decide on criminal charges.
""The FBI will be contacted today and notified of the incident. If they choose, they may conduct a separate use-of-force investigation on this incident directly with the Ferguson Police Department.
""We understand the response this incident has garnered and would like everyone to understand a lot of articles and replies have a lot of sensationalism spread throughout. We, like you, were not present when the incident occurred. We are investigating it and that is our only involvement with the shooting.
""We are sorry that a young man lost his life and ask all to give their condolences to the family along with their thoughts and prayers. We are investigating this incident as we would any other shooting. There is no bias or favoritism applied as we are an outside agency and were not involved.""",34,3095,NA,two separate galleries
USAToday,usa3,http://www.usatoday.com/story/news/nation/2014/08/13/reporters-arrested-ferguson/14038067/,"Two reporters arrested in Ferguson, Mo.",Melanie Eversley,08/19/2014,10/29/2015,"Ferguson, Mo., police fired tear gas at demonstrators and arrested two reporters as the St. Louis suburb erupted for a fourth night after a police officer fatally shot an unarmed teen Saturday.

City officials had asked for calm, but police set up barricades and were out in force as the sun went down.

As a protest escalated, officers in riot gear moved in to close a McDonald's restaurant where reporters were writing and charging cellphones.

Reporters Wesley Lowery of {Wesley Lowery of The Washington Post}<hyperlink=""https://www.washingtonpost.com/politics/in-ferguson-washington-post-reporter-wesley-lowery-gives-account-of-his-arrest/2014/08/13/0fe25c0e-2359-11e4-86ca-6f03cbd15c1a_story.html""> and Ryan Reilly of The Huffington Post said on Twitter that police told them to stop recording the events, then took them into custody.

Reilly tweeted that police asked him for his ID when he took a photo. He said he and Lowery were arrested for ""not packing their bags quick enough.""

Lowery tweeted, ""Officers slammed me into a fountain soda machine because I was confused about which door they were asking me to walk out of.""

Los Angeles Times reporter Matt Pearce tweeted that when he contacted Ferguson police Chief Thomas Jackson and asked about the arrests of the reporters, Jackson responded, ""Oh God.""

Pearce said he spoke to the chief a second time and Jackson said he asked the riot command to release the reporters.

The Post is ""relieved that Wesley is going to be OK"" and ""appalled by the conduct of police officers involved,"" Washington Post editor Martin Baron said. ""That behavior was wholly unwarranted and an assault on the freedom of the press to cover the news.""

Lowery won the Emerging Journalist of the Year award at the annual convention of the National Association of Black Journalists this month. NABJ President Bob Butler released a statement Wednesday night regarding the arrests.

""Journalists have a constitutionally protected right to work without the government interference,"" Butler said. ""We call on -- and fully expect -- the authorities to investigate what appears to be a violation of the First Amendment and to hold the officers involved to account, if necessary.""

Ryan Grin, Washington bureau chief of The Huffington Post, released a statement: ""Compared to some others who have come into contact with the police, they came out relatively unscathed, but that in no way excuses the false arrest or the militant aggression toward these journalists. Ryan, who has reported multiple times from Guantanamo Bay, said that the police resembled soldiers more than officers, and treated those inside the McDonald's as 'enemy combatants.' ""

Ferguson police could not immediately be reached Tuesday night.",37,6737,NA,NA
USAToday,usa4,http://www.usatoday.com/story/news/crime/2014/08/09/police-shooting-ferguson/13832083/,"Ferguson police shoot, kill teen",Jimmy Bernhard; Grant Bissell,08/18/2014,10/30/2015,"FERGUSON, Mo. - A St. Louis County teen is dead and the community is outraged after a Ferguson police officer opened fire Saturday afternoon.

The shooting happened around 12 p.m. at the Canfield Green apartment complex. Police have not released a reason for the shooting.

Family confirmed the victim was 18-year-old Michael Brown. Officers from 15 other departments responded to the scene after a second round of gunfire rang out.

There was an uproar from bystanders around 2 p.m., and five gunshots were heard minutes later. Police have not said who fired the shots or why.

The St. Louis County NAACP has {launched an investigation}<""http://www.usatoday.com/story/news/local/2014/08/09/naacp-fbi-investigate-police-shooting/13845591/""> and asked the Federal Bureau of Investigation to intervene.

St. Louis County police are now handling the investigation.

Ferguson police will hold a news conference about the shooting at 10 a.m. Sunday.",6,237,NA,NA
USAToday,usa5,http://www.usatoday.com/story/news/nation/2014/08/13/ferguson-protests-continue/13989945/,Witness says teen friend shot by cop 'like an animal',Yamiche Alcindor; Doug Stanglin,08/13/2014,11/02/2015,"FERGUSON, Mo. — A friend who was walking beside black teenager Michael Brown when he was killed by a white police officer says the unarmed 18-year-old victim was shot ""like an animal.""

Dorian Johnson recalled Brown turning and putting his hands in the air before he was shot in the head and chest.

The shooting has angered the predominantly African-American community and sparked three nights of protests. Tensions were increased early Wednesday when police shot and wounded an armed man not far from the site of a community protest meeting.

""Race relations is a top priority right now,"" says Ferguson Police Chief Thomas Jackson. He says the police are working with the Justice Department's community relations experts to help address the racial discord that has erupted into three nights of protests — one of which ended with tear gas.

On previous nights, crowds have gathered to protest Brown's death, sometimes looting stores, setting fire to buildings and vandalizing property. They also taunted police and assaulted journalists. More than three dozen people have been arrested. Brown's family and civil-rights groups have pleaded for the community to stay calm.

Jackson said that protesters Monday night threw rocks at police and that gunfire came from the crowd, so officers used tear gas and shot ""beanbag rounds,"" meant to stun them. A Missouri state senator was among those gassed.

""I just wanted to know if I was going to be gassed again like I was on Monday night,"" Sen. Maria Chappelle-Nadal said to Jackson at a press conference. ""I was peaceful and I am your state senator.""

Police in Ferguson are asking that protesters stop when the sun goes down, a request met with criticism on social media.

Demonstrators are demanding that the Ferguson Police Department identify the name of the officer who shot Brown.

Police, who had promised to make the officer's name public on Tuesday, cited threats against the officer on social media for the delay.

""An officer's name was released as being the one involved in the shooting. He was not the one involved in the shooting, however there were threats against his life,"" Jackson says. ""Out of an abundance of caution, we weighed the value of releasing the name right now against the safety factor to both him, his family and his neighborhood.""

Authorities have said the officer has been placed on paid administrative leave.

Johnson, Brown's friend and witness to the shooting, was summoned by police and FBI on Wednesday to give his account. He said has moved from his apartment with his girlfriend and young daughter because he fears retaliation from police.

""I left because I feared that if I stayed, something would happen to me. I felt like if they would have gotten me, they would have done anything possible to make sure I couldn't come forth and give my side of what happened,"" Johnson told KSDK.

Johnson said the incident started around 1:40 p.m. Saturday when the officer pulled up beside the pair as they were walking down the street near his grandmother's house.

""He didn't say freeze, halt or anything like we were committing a crime,"" Johnson told KSDK. ""He said, 'Get the 'F' on the sidewalk.'""

He said the officer, whose name has not been released, shoved open the car door, grabbed Brown around the neck and tried to pull him through the window. He said Brown never tried to reach for the officer's weapon.

""The second time he says, 'I'll shoot.' A second later the gun went off and he let go,"" Johnson said. ""That's how we were able to run at the same time.""

Johnson said he ducked behind a car as the officer continued shooting at them, hitting Brown in the back.

""His (Brown's) hands immediately went into the air and he turned around to the officer,"" Johnson recalled. ""My friend started to tell the officer that he was unarmed and that he could stop shooting (him). Before he could get his second sentence out, the officer fired several more shots into his head and chest area. He fell dramatically into the fatal position. I did not hear once he yell freeze, stop or halt. it was just horrible to watch.""

Johnson, who began to sob during the interview, said he could tell Brown was in pain: ""It hurt him a lot. Could see it in his eyes. It was definitely like being shot like an animal.

""I definitely think (the officer) is guilty of murder,"" Johnson said.

Police have said that a scuffle broke out after the officer asked the teens to move. Police have not confirmed witness accounts that Brown had raised his hands to surrender when the shots were fired.

A second witness, who will be interviewed by the FBI, told the St. Louis NAACP that Brown did not struggle with the officer inside his patrol car.

The protests triggered by the shooting have rocked the city, prompting police to fire tear gas during some of the street confrontations.

At one church gathering Tuesday with dozens of clergy members and elected officials, Missouri Gov. Jay Nixon urged calm ""in the face of crisis.""

""We stand together tonight, reeling from what feels like an old wound torn open afresh,"" Nixon said. ""A wound that hadn't quite healed right in the first place, and now the pain is just as searing as when the injury first occurred.""

Tensions over the shooting were further heightened Tuesday after authorities backed down on an earlier promise to release the name of the police officer who killed the unarmed Brown. All but three of the police department's 53 officers are white.

The National Bar Association, whose membership is predominantly African-American, filed a records request Wednesday morning demanding the name, gender, rank, race, age and seniority of the officer who shot Brown.

The organization also asked for information about the past conduct of the officer and any information about his or her alleged use of force against any suspects while with the Ferguson Police Department.

""We believe, for the sake of transparency and for the sake of bringing calmness to the community, it is imperative that they release the name,"" said the association's president, Pamela Meanes. ""I think a lot of the frustration and a lot of the disruption is because people don't trust the process.""

Meanes said releasing the name of the officer who killed Brown would help reassure people that the investigation into Brown's death will be fair and independent.

The group is also asking for other information. The requested records include any incident reports, investigative reports, notes and memorandums prepared by officers, in-dash camera video, photographs, cellphone video and recordings, and the names and seniority of the officer or officers involved in the Aug. 9 shooting

Meanes said if the officer's name isn't disclosed by Monday, her group would ask a county judge to order police to release it.

",520,9298,NA,NA
