Source,ArticleID,ArticleLink,Title,Author,DatePublished,DateRetrieved,ArticleText,NumberComments,NumberSocialMedia,TheShitBetween,Notes
USAToday,usa78,http://www.usatoday.com/story/sports/nba/pacers/2014/08/17/pacers-rasual-butler-talks-ferguson-on-twitter/14203067/,Pacers' Rasual Butler talks Ferguson on Twitter,Jordan Heck ,08/17/2014,12/14/2015,"Over the last week a lot of attention has been placed on Ferguson, Mo.
The attention is due to the fact police shot, and killed, unarmed 18-year-old Mike Brown multiple times after he was involved in a scuffle with an officer. The community, and the nation, has been outspoken about the incident.

Indiana Pacers' Rasual Butler was just one of many people who decided to comment on the event. His first statement came via a post {on his Instagram account}<hyperlink=""http://instagram.com/p/rxelZ6gdcu/"">.

It simply has to stop! No more excuses man it's sickening! Now it's a curfew enforced which can escalate the situation even more! We have to stop allowing this as a people! This type of force is inexcusable #ripmikebrown #rip to all wrongfully murdered!
A few hours later he sent out a series of tweets in response the comments he received following his first post. The following is copied and pasted from {Butler's Twitter account}<hyperlink=""https://twitter.com/RasualButler45"">.

People want to talk about me being bias and ranting when all i said was unlawful killing needs to stop that type of force was wrong period. No one is speaking about looting or rioting being ok the protesters did what was right they stood in front of the rioters. Peaceful protest is absolutely the right thing to do I said curfew can escalate the situation where more people could potentially rebel. If that happens now law enforcement would be forced to use force if necessary I feel the community did a good job by standing their ground & saying no this isn't the way destroy private property I don't condone that neither do I condone black kids being murdered for a petty crime. I have a 16 year old daughter and nieces,nephews and cousins and if they made a foolish mistake and stole cigars I don't want them shot!!!!! No race or family deserves to deal with that let's talk about why the riots happen not saying it's right but let's look at the big picture.
I'm not just a ball player I'm a person and I'm speaking my opinion on My page if you don't like it then get off My page period! The killing has to stop the to piton has to stop and we need to find away to live together in this great country to many have died here. Hoping that one day we all could live in peace together Great men and woman right is right and wrong is wrong being murdered 4 stealing tho.
2 the officers who do their jobs correctly you are appreciated! Those who understand how to use authority and do your best everyday.
Butler isn't the first Pacer to comment on social issues. {David West spoke out about police brutality}<hyperlink=""http://www.indystar.com/story/insider/2014/07/18/david-west-police-brutality-twitter/12843109/""> earlier this year. West's comments were made after the death of Eric Garner in New York. Garner was placed in a chokehold while under arrest for selling individual cigarettes.",4,33,NA,NA
USAToday,usa79,http://www.usatoday.com/story/news/nation-now/2014/08/15/ferguson-michael-brown-journalists-media/14096699/,"Crowd-funding start-up pays journalists in Ferguson, Mo.",Laura Mandaro ,08/19/2014,12/14/2015,"A crowd-funding campaign at a tech start-up is pay journalists to cover what's happening in Ferguson, Mo.

Beacon, an Oakland, Calif. company funded by venture capital firm Y Combinator, has been hosting a campaign that aims to raise $3,500 by August 26. As of August 14, it had raised $3,330. {Tech Crunch}<hyperlink=""http://techcrunch.com/2014/08/14/beacon-crowdfunding-journalism-in-ferguson/""> earlier reported on the Beacon campaign.

The site is a smaller, more narrowly focused version of crowd-funding sites such as Kickstarter. The campaigns raise money for writers and journalists, period. In exchange, a contributor gets access to every story on the site.

""You decide what ideas get funded and what stories get told,"" says the tagline of Beacon, which was co-founded by former Facebook managing editor Dan Fletcher. Other ongoing crowd-funding journalistic campaigns include ""debunking Earth 2.0"" and ""discovering South Korea.""

The journalists who participate are by invitation only; in this instance, Beacon tweeted that it was interested in independent journalists who wanted to cover Ferguson. {Read the blog post describing what happened}<hyperlink=""https://www.beaconreader.com/blog/can-we-crowdfund-breaking-news?ref=profile"">.

The national press, including USA Today, has sent representatives to Ferguson, the St. Louis suburb that experienced riots, looting and a military-styled police presence after the shooting of unarmed black teenager Michael Brown in Ferguson Saturday.

There's already plenty of multi-media savvy journalists in Ferguson. Many of these are providing frequent updates via Twitter and Vine accounts, as well as filing news stories. In fact, some argue that most of America didn't start paying attention to Ferguson until two national reporters — one from the Washington Post, the other from the Huffington Post — {were arrested while using a McDonald's near the protests}<hyperlink=""http://www.usatoday.com/story/news/usanow/2014/08/13/ferguson-police-race-brown-killing/14030889/"">.

But reports and images that ordinary {people shared on social media}<hyperlink=""http://www.usatoday.com/story/news/nation-now/2014/08/14/social-media-ferguson-effect/14052495/> have played a huge role in widening outrage and calls for action, particularly among young African-Americans who say Brown's killing is representative of their position in American society.

Beacon says the campaign can keep journalists on the ground — even after the national media have packed up and go home.

""There are eyewitnesses on the ground who can share their experiences, and people who can trace the shooting's aftermath and impact on the community,"" says the site.

The campaign is currently funding three journalists, including freelancer Peter Tinti, a journalist who has written frequently about Africa for the Wall Street Journal, the New York Times, and others.
",2,78,NA,NA
USAToday,usa80,http://www.usatoday.com/story/news/nation-now/2014/08/18/trayvon-martin-mom-letter-michael-brown-ferguson/14270421/,Trayvon Martin's mom writes heartbreaking letter to Michael Brown's family,Jessica Durando ,08/19/2014,12/14/2015,"Trayvon Martin's mom, Sybrina Fulton, wrote {a heartbreaking letter}<hyperlink=""http://time.com/3136685/travyon-sybrina-fulton-ferguson/""> published in Time magazine to the family of Michael Brown, the unarmed 18-year-old recently shot and killed by a police officer in Ferguson, Mo.

Fulton says she wishes she could say ""it will be alright"" but the truth is she can only ""pray"" as their ""lives are forever changed.""Fulton explains the dichotomy of detractors and supporters family members will face since they've sadly joined ""this exclusive yet growing group of parents and relatives who have lost loved ones to senseless gun violence.""

For Fulton, the loss meant devoting her life to the missions of The Trayvon Martin Foundation. She lends her support to Brown's family and ""to seek justice for your Michael and the countless other Michaels & Trayvons of our country.""

Fulton offers hope in perhaps the most touching line of the letter. ""But know this: neither of their lives shall be in vain. The galvanizations of our communities must be continued beyond the tragedies.""

African Americans are killed by white police officers nearly twice a week in the United States, according to the most recent accounts of justifiable homicide reported to the FBI during a seven-year period ending in 2012.

On average, there were 96 incidents among at least 400 police killings each year that were reported to the FBI by local police, USA TODAY found. The reports show that 18% of blacks killed during those seven years were under age 21, compared to 8.7% of whites.

The letter, published Monday, comes from Fulton's experience in 2012 when her 17-year-old son Trayvon was shot by neighborhood watch volunteer George Zimmerman, 28, in Florida.

Zimmerman was {found not guilty of second-degree murder}<hyperlink=""http://www.usatoday.com/story/news/nation/2013/07/13/george-zimmerman-found-not-guilty/2514163/""> and manslaughter.

""Our children are our future so whenever any of our children – black, white, brown, yellow, or red – are taken from us unnecessarily, it causes a never-ending pain that is unlike anything I could have imagined experiencing,"" Fulton writes.

Fulton explains the dichotomy of detractors and supporters family members will face since they've sadly joined ""this exclusive yet growing group of parents and relatives who have lost loved ones to senseless gun violence.""

For Fulton, the loss meant devoting her life to the missions of {The Trayvon Martin Foundation}<hyperlink=""http://trayvonmartinfoundation.org/"">. She lends her support to Brown's family and ""to seek justice for your Michael and the countless other Michaels & Trayvons of our country.""

Fulton offers hope in perhaps the most touching line of the letter. ""But know this: neither of their lives shall be in vain. The galvanizations of our communities must be continued beyond the tragedies.""

African Americans are killed by white police officers nearly twice a week in the United States, according to the most {recent accounts of justifiable homicide}<hyperlink=""http://www.usatoday.com/story/news/nation/2014/08/14/police-killings-data/14060357/""> reported to the FBI during a seven-year period ending in 2012.

On average, there were 96 incidents among at least 400 police killings each year that were reported to the FBI by local police, USA TODAY found. The reports show that 18% of blacks killed during those seven years were under age 21, compared to 8.7% of whites.",197,3229,NA,Gallery 1
USAToday,usa81,http://www.usatoday.com/story/opinion/editorials/2014/08/16/can-learn-ferguson/14129687/,Can we learn from Ferguson?,The Courier-Journal ,08/16/2014,12/14/2015,"Speaking on National Public Radio Thursday, Rev. Willis Johnson, a young pastor from Ferguson, Mo., became tearful as he attempted to describe his feelings as an African-American male about police.

“When I get pulled over ... I revert back to that 18-year-old and the things my father told me about what to do when the police stop you,” he said in the {interview on All Things Considered}<hyperlink=""http://www.npr.org/templates/transcript/transcript.php?storyId=340422502"">. “It’s an intergenerational thing to know my father fears for me at 39 the same way he feared for me at 18. He texts me every morning and says, I’m praying for you, do what you got to do — but you know, be careful.”

It is a fear civil rights advocates have long described.

Here in Louisville, Metro Council member Attica Scott, {in a Courier-Journal opinion piece Tuesday}<hyperlink=""http://www.usatoday.com/story/opinion/contributors/2014/08/11/mothers-fear-black-son/13905957/"">, described her fears for her teenage son and the “talk” so many African-American parents must give their children about interaction with police.

Such comments are met with skepticism or outright disbelief in a country where most of us have no reason to fear law enforcement.

But the explosion of outrage and violence in the predominantly black St. Louis suburb of Ferguson following the fatal police shooting on Aug. 9 of Michael Brown, 18, an unarmed youth, demand that the nation examine the tensions between law enforcement and African-American communities.

In time, investigators will establish the details — did the youth have his hands up, as some witnesses claim, or did the youth strike the officer and go for his gun, as police have said?

But the event has rekindled fears and provided an astonishing glimpse of policing in a town of 21,000 where 70 percent of residents are black but all but three of the 53 police officers are white. For example:

• Police met protests with a stunning display of military might — armored vehicles, body armor, assault rifles — firing rubber bullets and saturating neighborhoods with tear gas. Much of the gear came from federal anti-terrorism money that flowed to communities after the Sept. 11, 2001, attacks.

“Lately, it’s looked a little bit more like a war zone and that’s not acceptable,” said Missouri Gov. Jay Nixon, who Thursday relieved local police and put state police in charge of security.

• Local police further ignited public outrage by {arresting two national reporters}<hyperlink=""http://www.politico.com/blogs/media/2014/08/reporters-arrested-in-ferguson-193914.html""> Wednesday working at a McDonald’s restaurant, apparently for not exiting fast enough when officers burst in and ordered everyone out. Also arrested Wednesday was {St. Louis Alderman Antonio French}<hyperlink=""http://www.usatoday.com/story/news/nation-now/2014/08/14/antonio-french-ferguson-arrest-released-police/14064687/"">, whose offense appeared to be covering the protests on social media.

“A heavy-handed police approach is actually making the situation worse,” Mr. French told USA Today.

• Ferguson police deepened suspicion by withholding information, including the name of the officer who shot Mr. Brown. Friday, they released the officer’s name and limited details —alleging Mr. Brown shoved a store clerk and stole a $50 box of cigars before police stopped him on the street.

Calm appears to have returned under the influence of Capt. Ronald S. Johnson, an African- American from the community leading the state highway patrol.

But the events raise critical questions about policing and civil rights. And it shows that the fears of African-American parents and their children are real and must be addressed. As Rev. Johnson said of his father’s daily warning to be careful:

“He shouldn’t have to say that. I shouldn’t have to say that ...We want the cycle to stop.”",11,17,NA,NA
USAToday,usa82,http://www.usatoday.com/story/news/nation-now/2014/08/15/darren-wilson-ferguson-ethical-society-of-police/14122637/,The other Darren Wilson: Officer in Brown shooting not the head of Ethical Society of Police,Jolie Lee,08/15/2014,12/14/2015,"There is another St. Louis-area police officer named Darren Wilson, but he has nothing to do with the Michael Brown shooting.

Darren R. Wilson is a sergeant with the St. Louis Police Department and the head of the Ethical Society of Police.

Ferguson Police Chief Thomas Jackson announced today that the officer who shot and killed Michael Brown on Saturday is named Darren Wilson.

Wilson of the Ferguson Police Department is white. Wilson the St. Louis sergeant is black.

Darren R. Wilson said people started posting his photo to social media when the name was announced.

""I was getting hate messages. My children were getting hate messages,"" Wilson said in an interview USA TODAY Network.

In a {Facebook post}<hyperlink=""https://www.facebook.com/pages/Ethical-Society-of-Police/436831003071448"">, the Ethical Society of Police wrote, ""May I assure the world that this is not the President of the Ethical Society of Police's Sergeant Darren R. Wilson who is African-American, and happens to be an 18-year veteran of the St. Louis Police Department. I'm sure additional clarification statements will be released immediately.""

The society is an African-American organization that aims to ""monitor and rectify the racial and ethical challenges that confront the St. Louis Police Department,"" according to its {Facebook page}<hyperlink=""https://www.facebook.com/pages/Ethical-Society-of-Police/436831003071448?sk=info"">.

The Darren Wilson named in the Brown shooting is a six-year veteran of the police force and has never had disciplinary action.",32,484,NA,NA
USAToday,usa83,http://college.usatoday.com/2014/08/17/black-college-students-react-to-michael-browns-killing-ferguson-violence/,"Black college students react to Michael Brown's killing, Ferguson violence",Khorri Atkinson ,08/17/2014,12/14/2015,"Ferguson Police Chief Thomas Jackson releases the name of the the officer accused of fatally shooting Michael Brown, an unarmed black teenager. Jackson announced that the officer’s name is Darren Wilson. ",0,155,NA,NA
USAToday,usa84,http://www.usatoday.com/story/news/local/2014/08/15/attorney-dorian-johnson-michael-brown-robbery/14118769/,Attorney: Dorian Johnson confirms he was with Brown at store robbery,Associated Press ,08/18/2014,12/14/2015,"FERGUSON, Mo. (AP) - The friend who was with Michael Brown when he was shot and killed by a police officer near St. Louis over the weekend is reportedly confirming that he and Brown had taken part in the theft of cigars from a convenience store that day.

That word comes from the attorney for Dorian Johnson, speaking to MSNBC. Police in Ferguson had earlier announced that Brown was suspected of taking cigars from the convenience store in what was described as a ""strong-arm robbery.""

Brown's family is accusing police of trying to draw attention away from the shooting.

Ferguson Police Chief Thomas Jackson said the officer involved in the shooting -- identified as Darren Wilson -- had gone to the area after a 911 call reporting the robbery. He says a dispatcher gave a description of the suspect, and that Wilson encountered Brown a few minutes before another officer arrived.

The announcement was met with immediate disbelief and anger by community members who insisted Brown wasn't the man seen in a security camera video of the robbery.

Brown's uncle says if Wilson really had believed Brown was a suspect, he wouldn't have just told him to get out of the street. Either way, he says, it doesn't justify the shooting.",298,34317,NA,NA
USAToday,usa85,http://www.usatoday.com/story/opinion/2014/08/14/ferguson-mo-police-chief-thomas-jackson-editorials-debates/14087241/,Ferguson police chief: 'We want to build trust',Thomas Jackson ,08/19/2014,12/14/2015,"The Ferguson, Mo., Police Department did not respond to a request for an opposing view. Excerpts from CNN interviews with Chief Thomas Jackson:

This is a terrible tragedy. Nobody wanted this to happen. But what we want to do is we want to heal. We want to build trust with the community. And part of that is to have a transparent, open investigation conducted by an outside party and then for me to engage, and the police department to engage with community leaders, which has already started.

We've promised to engage each other and we've already got meetings set up for the future. So what really needs to happen is communication. We need to understand each other's frustrations and each other's concerns and try to see things from each other's point of view. And when we can do that, we're going to be able to better provide safety and security for the community.

We continuously readdress our practices and our procedures, our weapons, our less lethal weapons, our hand-to-hand tactics. But things happen. And this case, I know it seems like it's similar to other cases, but what I would really hope is that we can allow the investigation to play out because there's lots of physical evidence, there's lots of witness testimony and there's a lot of information that can be pulled together. And I really believe that we can get to the truth of what happened here. And, of course, we will learn from that.

There are so many witnesses that are coming forward and we're trying to get them to come in and be interviewed, so that we can actually get that clear picture. And that's really what is holding things up is the witness testimony.

We're not going to release any information about (the officer involved in the shooting) until we've determined that it's safe and that the prosecuting attorney determines that it's OK to do.

Since I got here, increasing the diversity of the police department has been one of my top priorities. I promoted the first two African-American supervisors in the history of the department and we've been recruiting African Americans.

We tend to lose people sometimes if they are able to find a higher paying position, so because of the retention problem, what we're trying to do and what we've tried to do over the last few years is to increase the quality of life in the police department so that people want to stay here.

We're going to redouble our efforts to increase the diversity in the police department. It's always been a goal of mine, and it will continue to be. We're going to work really hard at that.",14,74,NA,NA
USAToday,usa86,http://www.usatoday.com/story/news/nation/2014/08/14/michael-brown-no-record/14041457/,"Michael Brown had no criminal record, police say","Aja J. Williams, KSDK-TV, St. Louis ",08/14/2014,12/14/2015,"ST. LOUIS COUNTY, Mo. — An 18-year-old shot and killed near a Ferguson apartment complex Saturday afternoon had no criminal record, according to the St. Louis County Prosecuting Attorney's office.

According to police, Brown pushed a Ferguson Police Department officer into his car. Then, both struggled and at some point, Brown reached for the officer's weapon before a shot fired inside of the car followed by a number of other shots. Brown was not armed.a

St. Louis County Prosecutor's office confirmed that Brown had no prior misdemeanors or felonies against him.

A preliminary autopsy showed Brown died from gunshot wounds. An official autopsy will be released later.

Wednesday afternoon, Brown's body was turned over to his family. Wednesday evening, police again used tear gas to disperse crowds that gathered in the predominantly black suburb of St. Louis.",5535,107,NA,NA
