Source,ArticleID,ArticleLink,Title,Author,DatePublished,DateRetrieved,ArticleText,NumberComments,NumberSocialMedia,TheShitBetween,Notes
USAToday,usa27,http://www.usatoday.com/story/news/nation-now/2014/08/19/ku-klux-klan-ferguson-police-michael-brown/14275115/,KKK raising money for Ferguson police officer,Jolie Lee,08/19/2014,11/17/2015,"A Missouri chapter of the Ku Klux Klan is planning a fundraiser this weekend for the Ferguson police officer who shot and killed Michael Brown, an unarmed black teen.

""All money will go to the cop who did his job against the Negro criminal,"" according to New Empire Knights of the KKK.Darren Wilson, the officer involved in the Aug. 9 shooting, has been a police officer for six years, four with Ferguson Police Department, and has never had any disciplinary action taken against him. There's no indication Wilson supports the KKK's efforts.

According to the Southern Poverty Law Center, the New Empire Knights is based in South Carolina and led by Chuck Murray.

In an e-mail, Murray confirmed his chapter was raising money but did not respond to further questions.

Unrelated to the KKK efforts, supporters of Wilson have set up Facebook pages. One {page called ""Support Darren Wilson""}<hyperlink=""https://www.facebook.com/pages/Support-Darren-Wilson/1464514543811507""> has 30,000 likes.

There is also a {GoFundMe campaign}<hyperlink=""https://www.gofundme.com/SupportOfficerWilson""> to raise money for his legal fees. As of Tuesday morning, the campaign had raised more than $19,000.",127,11914,NA,hyperlinks expired and skips pics 2 and 3
USAToday,usa28,http://www.usatoday.com/story/homepage/2014/08/10/rioting-breaks-out-in-ferguson/13880305/,Riots erupt during Ferguson protests,NA,08/18/2014,11/19/2015,"FERGUSON, Mo. - Tensions reached a boiling point Sunday night following an officer involved shooting that left a teenager dead. The violence began after a planned rally and vigil in the wake of the death of 18-year-old Michael Brown.

Brown was the unarmed teenager {shot to death}<hyperlink=""http://www.usatoday.com/story/news/crime/2014/08/09/police-shooting-ferguson/13832083/""> by an Ferguson police officer on Saturday afternoon.

Police officers from every jurisdiction in the St. Louis area were called into Ferguson Sunday evening. The strong police presence became necessary after {violence and looting}<hyperlink=""http://www.usatoday.com/story/news/local/2014/08/10/rioting-breaks-out-in-ferguson/13880305/""> were reported in the area. Witnesses say tensions began rising at the intersection of West Florissant and Ferguson around 8:30 p.m. In response Ferguson police called in an extra 60 officers as well as officers from all surrounding jurisdictions.

Officer Brian Schellman with the St. Louis County Police Department says 200 officers were called to the area from at least two dozen departments, but approximately 300 total officers were in the area. Many officers who were not called in responded anyway.

Two police officers were injured Sunday night during the unrest. One of those officers was hit by a brick, the other suffered a knee injury. They are both expected to be okay. One St. Louis County police officer was shot at, but was not injured.

Police say 32 arrests were made during the chaos. At least 12 businesses were looted. At least one shot was fired at a police helicopter. Rocks, bricks, and bottles were thrown at police officers throughout the night. There's no word on how many patrol cars were damaged.

A focal point of the violent actions by some was the Quiktrip store in the 9400 block of West Florissant. Video obtained by NewsChannel 5 showed the store being actively looted and later, {someone set the store on fire}<hyperlink=""http://www.usatoday.com/story/news/crime/2014/08/11/ferguson-quiktrip-burned-down/13884675/"">.Additional looting was also reported at a liquor store near the Ferguson Quiktrip, as well as fire reported behind the building where the liquor store is located.

Zisser Tire & Auto in Dellwood was vandalized during the unrest. Windows were smashed in, tires and rims were stolen, tires were thrown through windows, and glass is lining the streets.

Police are staging across the street from the store and watching the area.

TEAR GAS DISPERSED
A NewsChannel 5 crew reported that tear gas has been dispensed as rioting and looting continued into the early Monday morning hours. Reporter Elizabeth Matthews was preparing for a report from the corner of West Florissant and Highmont Drive, when she began feeling the affects of the tear gas in the area.

""My nose is burning, my eyes are burning, my throat is burning and officers near by are dealing with this too,"" said Matthews in a live report.

All of this is unfolding along Florissant Avenue, where NewsChannel 5 reporter Elizabeth Matthews and photojournalist Don Galloway were working. Matthews reports seeing more then half a dozen individuals breaking into the store, followed by dozens of others as the looting began.

The day began with Chief Jon Belmar with the St. Louis County Police Department {holding a news conference}<hyperlink=""http://www.usatoday.com/story/news/crime/2014/08/10/ferguson-police-news-conference-michael-brown/13860601/""> Sunday morning and releasing new information about the shooting death of 18-year-old Michael Brown.

Belmar said the incident started when Brown physically assaulted the police officer, pushing him into the officer's vehicle. He said there was a struggle inside the car, and at some point Brown reached for the officer's weapon. One shot was fired inside the vehicle.

Brown suffered fatal gunshot wounds outside of the vehicle, approximately 35 feet from the car. Belmar said multiple shell casings were found at the scene, and that Brown was shot more than once, but an exact number of shots fired has not yet been determined. All the shell casings came from the officer's weapon.

Belmar confirmed Brown was unarmed at the time of the shooting. He did not say what led to the struggle inside the officer's car.

The medical examiner is conducting an investigation to determine how many times Brown was shot. It will take several weeks before toxicology results are available.

After the shooting, Belmar said Ferguson Chief Tom Jackson called him and asked the county to take over the investigation.

Belmar said when the investigation is complete the findings will be turned over to the St. Louis County Prosecuting Attorney's Office. They will determine if charges should be filed.

On Saturday afternoon the St. Louis County NAACP {called for the FBI to investigate}<hyperlink=""http://www.usatoday.com/story/news/local/2014/08/09/naacp-fbi-investigate-police-shooting/13845591/""> the shooting. Belmar said the FBI could become involved later, and that it's not unusual for the FBI to become involved in cases like this.

""My son just turned 18 and graduated from high school, and he don't bother nobody,"" Brown's mother, Lesley McSpadden, told NewsChannel 5 Saturday night. She said he was looking forward to starting school at Vatterott College next week.

""They told me how many times my son was shot. Eight,"" said McSpadden. She said he was visiting his grandmother, who lives in the complex, and was returning from the store.

Sen. Claire McCaskill has released this statement in response to Michael Brown's death:

""As a mother, I grieve for this child and his family. I pray that the wonderful, hardworking, and God-loving people of Ferguson will find peace and patience as we wait for the results of what will be numerous and thorough investigations of what happened. I, like so many other Missourians, will not be satisfied until we have a complete and transparent understanding of all the facts and circumstances that led to this young man's death.""
Cornell Williams Brooks, president and CEO of NAACP, released this statement:

""Our prayers go out to the family and friends of 18-year-old Michael Brown of Ferguson, Missouri. The death of yet another African-American at the hands of those sworn to protect and serve the community where he lived is heartbreaking. Michael Brown was preparing to begin college, and now his family is preparing to bury their child – his life cut short in a tragic encounter with the police.
""As the NAACP's Missouri State Conference and St. Louis Branches seek answers about the circumstances surrounding Michael Brown's death, the National office will remain vigilant until accountability and justice are served for the countless individuals who lose their lives to misguided police practices throughout the country. Even as we call for accountability by those charged with protecting the community, we call on the community to act--collectively and calmly until we secure justice for the family of Michael Brown.""",81,9620,NA,NA
USAToday,usa29,http://www.usatoday.com/story/news/nation/2014/08/17/missouri-brown-curfew-protests/14207423/,Clashes on second night of Ferguson curfew - USA Today,Yamiche Alcindor; Brandie Piper,08/18/2014,11/23/2015,"FERGUSON, Mo. — Protests in the shooting death of 18-year-old Michael Brown continued Sunday as police for the second night imposed a curfew on this St. Louis suburb. Meanwhile, a preliminary autopsy found that Brown was shot at least six times, but the circumstances of his death remained unclear.

Late Sunday, more than two hours before a second midnight curfew was set to begin, police fired tear gas at hundreds of angry protesters who were marching down the town's main thoroughfare toward a police command center.

County police tweeted that protesters were throwing ""Molotov cocktails"" at police, but protesters, including Renita Lamkin, a pastor who has been acting as a peacekeeper, said no one threw Molotov cocktails. ""That is not true,"" she said. Meanwhile, a police announcer told the crowd, ""This is no longer a peaceful protest. You must leave the area.""

But protesters moving away from police faced a greater threat: gunshots coming from the other direction. It is unclear who fired the reported gunshots.

One protester, Keshonda James, 35, was driving away from police when a canister of tear gas shattered her windshield. The exploding glass hit her left arm, which was later bandaged by a fellow protester.

""Glass exploded everywhere. This isn't cool. I'm not down here looting,"" James said.

Late Sunday, The New York Times reported that a private autopsy requested by Brown's family found that he was shot at least six times, including four times in the right arm and twice in the head. All of the shots, the Times reported, were fired from Brown's front — a finding that could contradict a witness statement indicating that Brown was hit as he ran away from police.

Dr. Michael M. Baden, the former chief medical examiner for the City of New York, flew to Missouri on Sunday at the family's request, the Times said. In an interview, he noted that one of the shots appeared to have struck Brown on the top of his head, but that it wasn't immediately clear what that signified. ""It can be because he's giving up, or because he's charging forward at the officer,"" Baden said.

Missouri Gov. Jay Nixon declined Sunday to say when he expects the curfew to end or whether it would be extended further. ""We'd like to see it ratcheted down,"" Nixon said. ""What we'd like to see, that will be judged by the community."" Speaking on CNN, Nixon said he was ""heartened"" by the response to the curfew early Sunday.

At a rally Sunday afternoon, the civil rights attorney who represented the family of Trayvon Martin, the unarmed 17-year-old shot to death in Sanford, Fla., in 2012., told a crowd that police are trying to assassinate Brown's character. On Friday, when police named Officer Darren Wilson as the officer who shot Brown, they also released a surveillance video that appears to show Brown stealing cigars from a convenience store and roughing up the clerk a few minutes before the fatal confrontation.

""They tried it with Trayvon, and now they are trying it with Michael,"" Benjamin Crump said. ""We know that this was an execution."" He noted that when the officer fired, witnesses say, Brown had his hands raised above his head. ""This means 'Surrender! Don't shoot!' And the most hardened criminals in history, when they put their hands up, we didn't execute them,"" Crump said.

Civil rights activist Al Sharpton told the crowd that protests would continue.

""We are not going to shut up,"" he said. ""We are going to come together and have a real peace.""

He told protesters not to loot in Brown's name. ""There's a difference between an activist and a thug,"" Sharpton said.

Donations for Brown's family poured in at the rally. Speakers announced that all three of Brown's siblings would receive full college scholarships. TV's Judge Greg Mathis announced that he would give the family $10,000. Sharpton said his National Action Network would pay for Brown's funeral. He encouraged others to give the family money. Donors filled several large baskets with cash. Sharpton said the money would go directly to the family.

He announced that a class-action lawsuit would be filed on behalf of Ferguson protesters who were tear-gassed while demonstrating and others who were injured. Malik Shabazz of Black Lawyers for Justice and members of the New Black Panther Party have said they would file a lawsuit because they believe protesters' civil rights had been violated.

At the rally, Ron Johnson, the Missouri Highway Patrol captain at the head of security here, said protesters ""need to pray. We need to thank Mike for his life. We need to thank him for the change that he is going to make.""

Johnson told an animated crowd that Brown's violent death at the hands of police on Aug. 9 ""is going to make it for our sons so that they can be better black men. He's going to make it better for our daughters so they can be better black women, better for me so I can be a better black father. And we know they're going to make our mamas even better than they are today.""

Johnson, who is African-American and lives in nearby Florissant, told the crowd, ""This is my neighborhood. You are my family, you are my friends, and I am you. And I will stand and protect you. I will protect your right to protest.""

He said that when the protests are over, ""I'm going to go in my son's room — my black son, who wears his pants sagging, wears his hat cocked to the side, got tattoos on his arms — but that's my baby."" The crowd cheered loudly.

About 150 people rallied in downtown St. Louis on Sunday evening in support of Wilson, the officer who shot Brown. Passersby honked and cheered in support.

The Justice Department said Sunday that it would arrange for an independent autopsy of Brown's body ""due to the extraordinary circumstances involved in this case and at the request of the Brown family.""

The St. Louis County medical examiner's autopsy concluded that Brown died of gunshot wounds, but other details have not been released.

During protests after the rally, 44-year-old LaDonna Hurd said she brought her two daughters Layla Green, 7, and Kentavia Taylor, 16, from their home in Belleville, Ill., about 25 minutes away.

""I feel like they need to be part of this,"" Hurd said. ""They need to know prejudices are still there.""

She said she brought her daughters to experience the protests firsthand because she wanted them to know that the struggles and issues that motivated Martin Luther King remain and must be challenged.

""I feel like in numbers we can get things done,"" she said. ""This is history.""",303,5984,NA,usa1gallery (same picture numbers)
USAToday,usa30,http://www.usatoday.com/story/news/local/2014/08/11/looting-reported-at-ferguson-walmart/13884055/,Ferguson Walmart looted amid riots,NA,08/18/2014,11/23/2015,"FERGUSON, Mo. - Between 20 and 25 Walmart employees took shelter inside their Ferguson store Sunday night as {rioting and looting}<hyperlink=""http://www.usatoday.com/story/news/local/2014/08/10/rioting-breaks-out-in-ferguson/13880305/""> ran rampant in the area around them.

A Walmart store employee told NewsChannel 5 the store was overrun by looters.

Officers barricaded the front of the store, but many looters had already made their way inside the store. The employee said they smashed glass cases containing electronics, and stole all of the televisions.

Photos taken by NewsChannel 5 photographers show toilet paper strewn across sections of the parking lot.

By the time our crews arrived at the Walmart, the store was empty and police had established a presence outside to prevent further looting.

Early Monday morning officers were still patrolling the store.

The store did not reopen Monday morning; employees are cleaning up the inside of the store.",14,1244,NA,NA
USAToday,usa31,http://www.usatoday.com/story/news/nation/2014/08/18/getty-photographer-arrested-scott-olson/14265155/,"Getty photographer arrested in Ferguson, Mo., unrest",Melanie Eversley,08/19/2014,11/23/2015,"Getty Images photographer Scott Olson now joins the lists of journalists arrested in the unrest in Ferguson, Mo., following the Aug. 9 shooting death of 18-year-old Michael Brown by police officer Darren Wilson.

Olson was arrested Monday afternoon and later released, according to a statement from Getty Images.

A photograph captured by Olson's colleague, Joe Raedle, shows Olson being directed toward the back of a police van with his hands behind his back in zip cuffs. Olson, in baseball cap with equipment draped over a shoulder, is smiling.

Rob Crilly, a journalist for The Telegraph who was arrested on Sunday, told The Poynter Institute that police arrested Olson for ""not getting out of the way fast enough.""

A video released on the Instagram social media image network and played on MSNBC showed Olson's arrest, during which he can be heard saying, ""I'm being arrested because they said the media is required to be in a certain area.""

""I want to be able to do my job as a member of the media and not be arrested for just doing my job,"" Olson told Pancho Bernasconi, vice president of news at Getty Images.

Getty Images condemns Scott's arrest and is committed to ensuring that he and our other photographer colleagues are able to report this important story,"" Bernasconi said in statement.

Bernasconi had earlier released a statement via Twitter, prior to Olson's arrest:

[tweetbegin 501528433197719553 tweetend]

""Getty Images staff photographer Scott Olson was arrested this afternoon in Ferguson, Missouri, while on assignment documenting the events there,"" the statement read. ""We at Getty Images stand firmly behind our colleague Scott Olson and the right to report from Ferguson. Getty Images is working to support his release as soon as possible. We strongly object to his arrest and are committed to ensuring he is able to resume his important work of capturing some of the most iconic images of this news story.""

At least five journalists have been arrested in the wake of nightly demonstrations following the death of Brown.",26,1090,NA,NA
USAToday,usa32,http://experience.usatoday.com/story/news/local/2014/08/12/nine-people-charged-ferguson-looting/13965957/,Nine charged for alleged Ferguson looting,Aja J. Williams,08/18/2014,11/23/2015,"ST. LOUIS COUNTY – Nine people face charges for looting in Ferguson that followed the fatal shooting of Michael Brown Sunday night into Monday morning, according to St. Louis County Prosecuting Attorney Bob McCulloch.

The nine face varying felony charges relating to burglary and theft along West Florissant.

Charges have been issued against the following so far:

Stephon Thompson, 19, of St. Louis, faces a second-degree burglary charge for breaking into a Foot Locker in the 8000 block of West Florissant.
Robert Stephenson, 28, of St. Louis, faces a second-degree burglary charge for breaking into a Princess Beauty Supply in the 6900 block of West Florissant.
Beonca McRath, 19, of St. Louis County, faces a second-degree burglary charge and stealing under $500 for breaking into a Princess Beauty Supply in the 6900 block of West Florissant. According to court records, McRath stole hair weave from a business.
Steven Martin, 27, of St. Louis County, faces a second-degree burglary charge for breaking into a Foot Locker in the 8000 block of West Florissant.
Andrew Henry, 30, of St. Louis, faces a second-degree burglary charge for breaking into a Foot Locker in the 8000 block of West Florissant.
Demarco Harris, 38, of St. Louis County, faces a second-degree burglary charge and charge of stealing under $500 from Nu Fashion Beauty Supply in the 7500 block of West Florissant.
Nikko Fiertag, 23, of St. Louis County, faces a second-degree burglary charge and charge for stealing under $500 worth of shoes from a Foot Locker in the 8000 block of West Florissant.
Michael Davis, 27, of St. Louis County, faces a second-degree burglary charge for breaking into Princess Beauty Supply in the 6900 block of West Florissant.
Trey Brewer, 18, of Dallas, Texas faces a second-degree burglary charge for breaking into Princess Beauty Supply in the 6900 block of West Florissant.
McCulloch said more charges could be issued in other cases.",10,604,NA,NA
USAToday,usa33,http://www.usatoday.com/story/news/nation/2014/08/16/ferguson-unrest-takes-toll-on-small-business/14167945/,Ferguson unrest takes toll on small business,NA,08/19/2014,11/23/2015,"FERGUSON, Mo. — Looting and vandalism is {exacting a high price}<hyperlink=""http://www.usatoday.com/story/news/local/2014/08/16/looters-force-beauty-supply-store-to-close/14156089/""> for some local businesses and their employees here.

The owners and employees at a Ferguson beauty supply store are preparing to close, at least temporarily, after the store was ransacked overnight in the unrest that has followed the shooting death of an unarmed black teen by a white police officer.

""It's not worth it,"" Tanya Littleton, manager of Feel Beauty Supply, said Saturday. ""Right now our safety is more important than anything.'

Benny Billups, who does small repairs for the store, said looters entered by shattering a glass door.

""They tried to get into the cash register, stole hair items and some jewelry,"" Billups said. ""I'm just frustrated because these people are not understanding how this affects others when they come with this foolishness. There was a tragedy, yes, but this not how you deal with a tragedy.""

Employees at the store said their jobs are mostly part time.

""I'm crushed,"" said one employee. ""This is my living. I have to take care of my family. This is not good. It's not fair.""

Littleton said she doesn't know if Feel Beauty Supply will open again. She said the owners are scared and simply want out.",3,52,NA,NA
USAToday,usa35,http://onpolitics.usatoday.com/2014/08/14/jay-nixon-ferguson-race-police-shooting/,Missouri Gov. Jay Nixon criticized for slow Ferguson response,Catalina Camia  ,08/14/2014,11/23/2015,"Missouri Gov. Jay Nixon asked for patience and calm as another night of rioting following the shooting death in Ferguson of an unarmed black teenager descended into chaos.

The St. Louis suburb has been in turmoil since 18-year-old Michael Brown was shot to death by a police officer on Saturday.  Nixon’s statement and announcement that he will be in North St. Louis County on Thursday came after the Democrat was criticized as missing in action as tensions escalated between protesters and Ferguson police.

The denunciation of Nixon comes as he is being mentioned as a possible presidential or vice presidential candidate on the 2016 Democratic ticket.

[tweetbegin 49972804533146419 tweetend]

[tweetbegin 499697652322541568 tweetend]

[tweetbegin 499732967464644609 tweetend]

Nixon was elected to a second term in 2012 by 12 percentage points, even as President Obama lost Missouri — which has long been a bellwether in national politics.

Nixon helped fuel the speculation about 2016 when he said the Democratic field needs “a voice in the Heartland.” When Politico asked whether he could be that voice, the Missouri governor sidestepped. Earlier in the year, Nixon said he wouldn’t rule anything out.

The Missouri governor issued a statement as  tweets about Ferguson police responding to protesters with smoke bombs and tear gas went viral on Wednesday night. He called the situation “deeply troubling and does not represent who we are as Missourians or as Americans.”

[tweetbegin 499785321400111104 tweetend]

[tweetbegin 499788091654029313 tweetend]

[tweetbegin 499792335556071425 tweetend]",NA,468,NA,couldn't see number of comments
